Title,Star Rating,Review,Helpfulness
 Almost bought it until I saw it has caffeine,1,"I thought that this was natural energy from the vegetables, but it has green tea in it. Anytime something has green tea, that means that it's loaded with caffeine. They almost got me but thank god that I read the ingredient cafefully. The energy is not coming from the vegetables. The energy is coming from the caffeine. What a waste! I want natural energy. I'll just stick to my alkalized raw food diet. …",12 out of 30 users found this review helpful
 Urinary problems,2,"I feed my puppy this from age 2 months till 9 months and she began having urinary track problems. I spent a lot of money at the vet to figure it out but still have no answers other then switch her on Hills... What a joke I bought into it and when I opened the bag of hills it smelled so bad. Feed her that for 2 weeks (poor girl) then I got her on a raw diet that I make myself. Everything is great now and she loves it. I recommend looking into a raw diet for your animals. Google ""raw diets for dogs"" you and your pets will be much happier!! Let's put all dog food companies out of business... …",1 out of 17 users found this review helpful
 Perfect for celiacs and cake lovers alike,5,"I recently tried this mix for my stepson's birthday party. At first, I was also put off by the 'beany' smell to the batter. But that flavor and smell disappears once the cake is baked. Not only is it a delicious treat for someone with celiac, but all of my (non celiac) family members tested and devoured this cake. They couldn't tell the difference between it and any other pre-packaged mix from the store. Don't be intimidated by the bean flours! They make for a moist, soft, fantastic chocolate cake! (Not at all dry like some mixes made with rice flour.) And unless you plan on sitting back to chow down a big bowl of raw cake batter, you won't even know the beans are there. Bob's Red Mill has yet to let me down in the gluten free department, and this cake mix is no exception! …",12 out of 15 users found this review helpful
 Really Good Sugar Substitute - Highly Recommended!,4,"""Erythritol"" has become our sugar substitute of choice since I became diabetic a few months ago. In crystal form, it seems about 70% as sweet as regular sugar. My wife uses a little bit of added sugar to bring the sweetness up for the rest of the family in things that need it, but I am happy with it as a one-to-one replacement for sugar in most things. I have not noticed any glycemic impact to my blood sugar or ""laxative"" effects seen with other sugar alcohol sweeteners (which is a very important consideration :-) Highly recommended! …",17 out of 18 users found this review helpful
" Delicious, Quality Popcorn",4,"I bought this popcorn to use with the Whirley Popper (a highly recommended purchase) I purchased on Superstore. This popcorn is great-tasting with an ever-so-slight hint of coconut ... yes that is the extra something you taste in movie-theater corn! It's better than the popcorn from Wabash Valley Farms (the brand that comes with the Whirley Popper), in my opinion. It tastes just like the kind you get at the movie theater or a carnival and the smell is just fantastic. When using my WhirleyPop I usually only get about 10-12 unpopped kernels. The more comfortable I get using the popper I'm sure that number will decrease. The corn pops up nice and crispy without any greasiness (as sometimes movie theater popcorn can be). However, I do think that the popcorn is a bit too salty (thus giving it 4 stars instead of 5) for my family's taste so I use only 1/2 - 3/4 of the seasoning versus using the entire packet. I think I got a great deal being that I recieved the popcorn, oil, and seasoning all for $39.99 and free shipping. It couldn't be easier because all I do is dump it all in the popper and 'turn the crank! A minor complaint I do have, and I'm wondering if this has happened to anyone else, is that a few of the packets do leak a little bit; nothing major but enough to notice. I will continue to purchase this brand because of the great taste and ease of use! UPDATE***In retrospect $39.99 wasn't that great of a deal being that now, the price has gone down by $10+! :o) I have been using my popper with this popcorn for quite some time now and rarely get any more than 5-10 unpopped kernels. I have tried other brands as well, buying bulk popcorn kernels with Orvil Reddenbocker's popcorn oil and they do not even compare. I did it to try and save a bit more money and not only did my popcorn not come out to my liking, it was quite a pain measuring the ingredients. I will be sticking to Great American! …",29 out of 30 users found this review helpful
 Verified Purchaser of Cyclone Blend ~ By a Coffee Snob,5,"I purchased this on Superstore and have no association or affiliation with this company. I was skeptical because of reviews but decided to give it a try since I LOVE my Keurig! And we LOVE it! I like a nice bold cup but that is smooth... this is it! I always put it on the 2nd cup setting (above the espresso size) for all of the K-cups for myself.. my husb puts it on the third setting. I made this coffee first for my husband on the 3rd setting and took a sip .... YUMMMY!!!!!! It was PERFECT... bold and smooth! I was so excited! My husband took a sip and loved it too! I am glad that I can have one good full cup on the third setting and not two cups of Emeril's Bold (which I love too) or Green Mountain Italian Blend (which I LOVE too). I did have one cup where some grounds were found on the top of the coffee... I was like ""Oh man... this is not good!!"" I just took a paper towel and skimmed it and they came right out and it hasn't happened since. And we've had about 8 cups of it all together. I'm thinking that maybe with these cups you really do need to line them up right? Prob not... maybe just growing pains for these guys. Seems like a neat company and I will be buying the Cyclone again when we get close to running out! Please keep the price the way it is...! Lisa …",7 out of 12 users found this review helpful
 Honey Nut Cheerios #1 for sure,5,"Alright, I'll preface by saying that I have not had the pricing or expiration (not that I would notice) issues that some of the other reviewers have faced. The humanity. I get them every 3 months and the price has always been between 6.50 and 8.50. This is a tremendous bargain. One of these boxes at Duane Reade costs $4.99+. I would probably get it delivered more than once every 3 months if I ate breakfast more. This is by far my favorite cereal, and while I may sound like a child, I'm 27. Since you're curious, the other members of the Cereal Rushmore are: Cinnamon Toast Crunch Frosted Flakes Corn Pops Honorable Mention: Lucky Charms Boom, done. Update 9/20/12: Now that they got rid of the 3pack, and replaced it with the 4pack, they also jacked the price. S+S is $18 currently ($4.25 per box). While I will still buy them, the savings is noticeably less. Maybe the other reviewers were right all along. …",11 out of 13 users found this review helpful
 My favorite Almond butter!,5,"Okay, I never leave reviews, but I have to say that this was my favorite almond butter. It tasted a lot like non-raw almond butter. And I love the big chunks of almonds in it. I have bought artisana and living tree community, and their's is sweet, but this one was just, right down my alley, LOVE IT! …",12 out of 13 users found this review helpful
 The best of the almond flours,5,"I have tried several brands of almond flour in the last year, and they are languishing in my freezer. The others are more coarse and good for a non-flour, or non-gluten pie crust, (as in a pie crust that would call for crushed nuts anyway) or something not needing a refined, soft texture, like a granola bar perhaps. But if you want success in your baking, especially for cakes, pancakes, muffins, biscuits,(oh so good and tender!), then this is the almond flour to use. The texture is very fine, so it incorporates well in beaten batters. As it is not as heavy, whatever you are baking will rise higher, be lighter, and have a soft, nice texture, than when using more coarse almond flour. I have used it alone for low carb, or non-wheat baking, and have mixed it with non-gluten, and non-wheat, (but with gluten) flours, with complete success. Some flours are so strong in taste, they overpower anything else one puts in the batter. The soft flavor allows your other flavors, like sweetener, flavoring, extracts, nuts, or fruits, to be more flavorful, and balanced in the baked goods. what I received was slightly sweet, almost no nutty flavor, without any trace of oxidation or spoiling. I keep a recipe or two worth in my refrigerator, and the bulk of it in my freezer. Depending on what I am making , I may let it come to room temperature, or just use it cold. Your recipe will guide you. To use, just stir gently, measure lightly, and continue with your recipe. The flour costs a bit more, but can be purchased in bulk quantities. See the box for information if you cannot get the size you want on Superstore. I think you will be happy using this flour. This flour is a great answer to low carb, non-wheat, or non-gluten baking! And no, I do not work for the company or Superstore, but am happy to have found such an excellent product for my low carb, non-wheat baking! …",58 out of 58 users found this review helpful
 disappointed,3,"i ordered this gift box as a ""gift"" but was not given the opportunity to include the personalized greeting. recieved alot of bubble gum and small hard candy, very few larger ""retro"" pieces of candy:( …",25 out of 40 users found this review helpful
 Yuck,2,"Unless you're some sort of raw food eating hippie, you'd be better off getting your protein elsewhere. This stuff tastes like and has the consistency of grass / dirt. It's pretty hard to stomach, unless you try mixing it with several things. Definitely not worth the trouble or inconvenience. I bought some based on the good reviews posted here and boy do I regret it. …",5 out of 14 users found this review helpful
" Filler food is empty, leaves your cat always needing more",1,"This review will make me sound really stupid, but whatever. I don't really care as long as people find out what's real and can avoid my mistakes. I got my wonderful little sweet Bella Bean when she was a few days shy of three years old. She had been bounced around from house to house and eating whatever was cheap. I have had cats around me my entire life, for about twenty-five years now. My mother always just fed them whatever, the kinds of food you buy in the supermarket - Friskies, Nine Lives, Kit & Kaboodle, stuff like that. And our cats were always fine, at least in terms of their eating habits. They would eat in the morning, stop when they were done, come back, and eat some more when they got hungry. My housemate at the time was working for Hill's and assured me that this was the best food ever made, so great, so on and so forth. I now know that she is an utter buffoon, but I initially trusted her judgment, which is so unfortunate because she doesn't think. She also had plenty of coupons for free or deeply discounted bags, which made it a much more attractive choice. I first tried feeding the little Bean an unmeasured amount of Science Diet in a bowl, but that didn't work, as she would devour it in one sitting. So then I took to measuring it, and she did the same thing. Then I started parsing it out to twice a day. That didn't work either, because she would start going crazy in the middle of the day, running around, intentionally destroying things, deliberately spilling her water, crying, etc., until she got more food. So then I split it into three servings. Same thing. Then it got to be four servings. That was a little better, but it was too much maintenance and unrealistic to be around every day to feed her four times. So then it went back to three. All the while, I was trying to reduce the amount of food I was feeding her to less than 3/4 of a cup because she was a little chubby. Reducing was hell. She became even more hungry, but I figured she would get used to it. Not really. For over a year, she would wake me up every morning looking for food in a serious way, knocking things off my desk, ripping up any paper she could find, scratching at the door and committing general acts of mischief. As soon as she got food, she was back to her sweet self, but only for three or four hours. We thought she was bored, we thought she was a little nutty, and maybe even had a kitty eating disorder. She always wanted food. It was kind of funny but in the end it was just sad. A few weeks back, we took her to a new (good, non-money factory) vet for her second checkup since I've had her. I talked with him about her being always hungry. He asked what she ate, and I told him the adult indoor Science Diet. Without saying as much, he basically told me that this food is garbage and I should look for something else. He said cat food should have a protein followed by a carbohydrate as the first two ingredients. Science Diet does, in a very loose, by-product kind of way - ground up slaughterhouse leftovers and corn dust. Then they put a bunch of vitamins in it to make it ""healthy,"" instead of just using good ingredients from the beginning. Not that I care about spending money on the Bean, but this food is way too expensive for what it is. So we began transitioning her onto Wellness indoor formula about two weeks ago. She is still eating 50 percent Science Diet with 50 percent Wellness (you really shouldn't just give a cat different food one day out of the blue) but SHE NEVER FREAKS OUT ANYMORE. It's amazing. And it's 100 percent because she is eating real food now, along with that sawdust and chicken hearts I still regrettable have to feed her. We have her down to eating twice a day, only 1/3 cup in TOTAL. She was eating three times a day, 5/8 of a cup in total. Now she eats some in the morning, walks away, eats some more a few hours later, and then looks for dinner about twelve hours after her initial feeding. No more knocking things over, no more trashing Dad's papers on the desk, no more howling, no more deliberately spilled water on the floor. It's incredible. I feel so bad that I was doing this to her for so long. We really thought she was just being dramatic or whatever. But no, she was genuinely hungry because she wasn't eating any real food. Do your cat a favor - buy her or him so food made with real ingredients, things you would eat - Wellness, Halo, Innova, Evo, whatever. Figure it out for yourself, but please don't feed your cat this. It's garbage. …",18 out of 24 users found this review helpful
" Package Says, ""Processed on Equipment that Handles Wheat.""",4,"....ergo, it may not be gluten-free. However, if they clean the lines in between, it might be safe: I'm not sure if they're gluten-free. They don't seem like they're really contaminated, but I can't say for sure because I didn't eat more than one serving. This is a neat idea, but to really cook them so they don't fall apart, you have to cook them in hot water, then ""shock"" them with cold water, and repeat a couple of times, which is a fair amount of effort. They also taste more like plants than noodles. They're interesting, but I wouldn't buy them again, and the rest of the box went to a food bank. …",11 out of 13 users found this review helpful
" Good product, but...",4,"I've yet to find any of the dogs I know that love it. I still have my allergic dog eating it, but she has to be hungry to eat this without doctoring. My vet doesn't want me feeding her people food so I add some of Newman's or Happy Hips canned to it. I've talked to a couple of vets about prescription diet and they all push the big company brand names. The common objection appears to be the soy used in Newman's to increase the protein count. I am willing to put a little flavor in this to feed may dog high quality, social responsible food. I may be the only person who has made the following mistake but, assuming you catch the Superstore sales, make sure you are ordering the bag size you want. I thought I was getting a good price on one order until the food came and it was the seven instead of twelve pound bag. …",17 out of 18 users found this review helpful
 Great taste when cold brewed!,5,"I have been drinking this tea for months now along with the Tazo Zen green tea. I love both flavors and have found that they make a wonderful iced tea (the only way I like to drink tea). I have found that if you cold brew this tea and the Zen green tea, they do have the flavor undertones that the box states. It almost seems to have a ""solidness"" to the flavor that seems to fit the breakfast concept well. I definitely recommend it if you like a nice smooth flavor to your black tea. I use the Starbucks Classic syrup in this tea and the flavor is perfect together (you can buy classic syrup in a bottle from almost any Starbucks location). Just as a side for those who are interested. Cold brewing just means that you place the tea bags in the fridge in water and let it set, usually at least 3 hours. It's that simple! It maintains the full subtle flavor of the tea much better and is almost impossible to turn bitter or mess it up unless you use too many tea bags. This only works if you plan to have iced tea of course. I use 4 ""Awake"" tea bags in 2 quarts of water and let it set overnight. I don't remove the tea bags until I have drank all the tea. It's delicious and super easy. I would recommend trying it to anyone who likes iced tea! …",14 out of 14 users found this review helpful
 MISLEADING,1,"Although the marshmallows were very good, the pictures shown are of a 20 lb bag not the 8 lb bag you are buying. This is very misleading. …",16 out of 100 users found this review helpful
 wondrous water,5,"I am thrilled to be able to purchase and have the Trivedi Water delivered to my door! I drink...A LOT of water...My dad taught me the appreciation for water a long time ago, and growing up in athletics, water was and continues to be my preferred source for hydration survival! I consider The DIVINE, to be my primary source of survival in all ways! This water fits perfectly into that equation, as IT is infused with energy from the DIVINE source! I am an overall healthy 55 y/o female and experience close to peak, optimum health in most areas...The water provides for my thirst requirements in tasteless, odorless perfection and is very refreshing! My 26 y/o daughter swears that her skin 'cleared up', she 'feels better', and she has less emotional stress associated with her menstrual cycle. My 6 y/o granddaughter drinks a lot more water when we have Trivedi energy infused water. She said she 'likes the blessed water', 'it's good!' I have photographs from my most amazing testimonial. I dropped a cap full of the water into an almost empty bud vase where a dying red rose had made her home for the previous 2 weeks. Her petals were crispy and all of her leaves had dropped...her stem was brown half the way down and only half of the stem remained green. I watched for several days with the expectation of a miracle. Perhaps, her petals would come back to life! That didn't happen, but what did happen is a tiny shoot with 3 little leaves of bright lime green grew from the spot where one of the dried leaves had dropped!!! My daughter and granddaughter witnessed this with me and I took photographs...Miraculous happening on a cellular level! My dad taught me something else in his efforts to expose me to everything at the dinner table... He said, 'how do you know, if you don't try it?'....what I learned is ... When I didn't try it, he laughed and said, ""MORE for ME!"" I AM of the humble opinion that we ALL should be provided with this water through our political resources as part of a preventative health care maintenance plan!Thank you …",12 out of 14 users found this review helpful
 Wasting Money with this product...!!!,1,"Since Costco don't have this product, I decided to buy from Superstore in order to ship to the military. This cooked quinoa tasted TERRIBLE (sour & salty or something....!), why using 10% salt...? I prefer to cook the fresh quinoa made by ""Bob's Red Mill Organic Grain Quinoa"" from Costco, it is very delicious. Costco Cooked Brown Rice (6 packs) made by [...] is very delicious and cost only $6.99. This cooked quinoa(12 packs) from the same company cost $20.31...!!! I NEVER take a chance buying the grocery online again...What is the RETURN POLICY..??? Well, this cooked quinoa has to donate to Waste Management Landfill... rice Organic Quinoa, 4.2-Ounce Containers (Pack of 12) …",7 out of 13 users found this review helpful
 Bob's Gluten Free Chocolate Cake,5,"This product is every bit the rave of other reviewers. With the stand alone recipe the product is relatively dense and rich in flavor. I have found the following additions to the mix, make this cake EXCEPTIONAL. 1/4-1/3 cup ground almonds/walnuts/mixed; 3-4 tablespoons of good quality Coco Mix; 1-2 extra tablespoons of water; and turn down the oven temperature to 335 F. after 15 minutes and extend the bake time 10 minutes [40 total min.]. The basic mix has great potential for nut and berry combinations that are compatible with rich chocolate. Ice with Coco-whipped cream, refrigerate. …",16 out of 17 users found this review helpful
 A solid replacement for certain kinds of dishes,4,"Like other reviewers I heard about the miracle noodles through Dr. Oz (Second hand as we don't have TV in our household) and decided to give them a shot. I got the multipack of the 7oz bags of the Fettucini style noodles. I prepared a test pack for my wife and I of the noodles exactly as described on the bag. (No microwaving them for me.) Opening: First, I will say the noodles didn't have a pleasant aroma upon opening the pouch, but neither was really off putting. It wasn't especially strong or extremely fishy. The best I can do to describe the odor was close to that of a can of regular chunk tuna. But unlike opening that can of tuna and getting packing water on your hands the odor did all but disappear with the rinse, blanch, and a final rinse before drying on towels. Trying a single dried noodle was like eating the number zero if you can imagine it. It just didn't even register other than something had been in the mouth, chewed, and swallowed. There was minimal remaining odor from the fermenting and I had to really try to pick it up. Cooking: While the noodles dried I heated a pan on medium heat with a half tsp of butter and added two or three cloves of minced garlic and cooked it until it was just browning and then tossed in the noodles. I followed this shortly with 1 1/2 Tbsp. or so of a teriyaki sauce. My wife is Korean so there is always crushed red pepper in the house, which I added three good pinches of to the mix and cooked while mixing for another couple minutes. I noted when the noodles hit the pan how they immediately took up the remaining butter and also a good portion of the teriyaki sauce when added. The color of the noodle went from white/semi transparent to more brown and reminded me of rice noodles in Phad Thai. There was no trace of the slight odor from their raw state at this point. Taste verdict: Both my wife and I enjoyed them and plan to add them to other dishes as a substitute for other asian noodles. They picked up the flavor of garlic, salt, and pepper just how I wanted and expected. The next time I made them I added chicken to the mix for protein and some veggies which I felt the lack of made for a tasty but not entirely satisfying dish. (Though I did want to try them without the noodles competing with any other primary ingredients.) The next time I have left over kimchi jigae from a dinner out it will be getting a pack added to it rather than rice for my lunch. As a snack food or small meal I think they are good and even with my preparation here they are better across the whole nutrition label than going for a package of the Nongshim Kimchi Ramyun my wife likes sometimes. (We usually add fresh kimchi, egg, and whatever else to bulk it up a bit though. I can easily imagine doing the same with the Shirataki noodles.) Texture: Ever had the Korean dish jabchae? The noodles give less resistance to biting than those cellophane noodles and so don't need the extra cutting with scissors before eating. Importantly it is not at all like wheat pasta. They also squeak a bit when you bite through which was unexpected but not unpleasant. Would I recommend them: Yes, for certain dishes. I took two packages to my parents to try since my Mom was the one who told me about them but I am waiting to hear back what she thought. I am going to order some of the other shape varieties and do a test with marinara but I am not expecting a great result. The texture of the noodle is substantially different from wheat pastas and this leads me to think it won't work well, but hey I could be wrong. …",87 out of 91 users found this review helpful
 You will never use dehydrated bouillon again!,5,"I discovered this product about a year ago and have not used dehydrated boullion since. It's so convenient to make -- just boil the amount of water you need and add the appropriate amount of base. It blends quickly too. No more undissolved bouillon pebbles in the bottom of the broth! We're a family of 2 so I was worried that they'd go bad on me before I had a chance to use it all, but I've had open jars stored in the fridge for a few months at a time and have never had a problem. I've also purchased the chicken base and am just as pleased. Wonderful products! …",15 out of 15 users found this review helpful
