Title,Star Rating,Review,Helpfulness
" no synthetic DHA, no cane sugar, the only true organic formula...",5,"My 8 month old son gets 50% breast milk, 50% formula. Of course breast is best, but we all know how that goes when returning to work...supply was not possible to be met for my son. The week I went back to work, be it stress, lack of time with baby latching on, etc...I couldn't pump nearly enough..If you're like me, and need to supplement, even if you don't want to, consider this about Baby's Only Organic formula: 1. No synthetic DHA added. Recent findings show that DHA added to infant formula (in all cases of organic formulas including Earth's Best, except Baby's Only) is extracted from fungus and algae, using hexane solvents, bleach etc - As a biochemist, this is disconcerting. Hexane is a human neurotoxin and narcotic agent. Organic ingredient? Not in the slightest. It will damage nerves, brain, heart and who knows what else. Believe it or not, the FDA doesn't have a regulation on hexane extractions in food.. . The best source of DHA are natural sources, not synthetic. Good DHA sources are animal-based (eggs, fish, meat, etc) and of course are found in breast milk. The fact that no synthetic DHA is included was the #1 seller for me on this formula. Also, Baby's Only manufacturer sells a separate supplement of DHA that you can add to the formula, which is egg-yolk based - all natural. Some might be concerned about egg allergies - Most egg allergies come from the proteins in the egg white, not the yolk, but in the very rare chance that the egg yolk could cause an allergy, it's nice that they sell it separately and not mixed in the formula. 2. Only 60% lactose may be a good thing...in response to ahbnyc's comment ""Earth's Best uses Lactose as their primary sugar (carb source). In human breast milk, lactose is almost the exclusive source for carbs...exactly the same as Earth's Best. Again on the Baby's Only website they claim lactose to be inferior to their brown rice syrup. How can they do this?? They show no evidence to support their claim, especially when Lactose is what's in breast milk!!"" According to the American Pregnancy Association, lactose accounts for approximately 40% of the total calories provided by breast milk. Why is it that when infants are started on lactose-based formula, so many have problems digesting it and then many assume they are lactose intolerant and are given soy or lactose-free formulas?? Isn't this counter intuative if human milk is lactose based? True lactose intolerance in babies is extremely rare - Did anyone ever wonder if the commercial formulas contain WAY more lactose than a baby's sensitive system can handle and way more than is found in breast milk? It is possible to have too much lactose in a baby's diet and this may be why they have problems when switched to formula while the same baby may be fine with breast milk. Also, lactose is a simple sugar which easily spikes insulin levels, contributing to overly plump babies that have a higher risk of obesity later in life. Just look at the growth chart differences of formula-fed vs. breast-fed babies. Rice syrup takes longer to break-down as it's more complex, and won't spike insulin levels like lactose. Rice syrup may not be suitable for a newborn - true. But Nature's One - Baby's Only manufacturer clearly recommends breast is best for newborns...There may be no perfect formula for a newborn. 3. No cane sugar. Similac Organic is garbage because they add cane sugar as a source of carbs. Way to add to the child diabetic epidemic. 4. It's way less expensive than Earth's Best. I recommend this formula - my son has had no problems with it and I feel good knowing he's getting ALL organic ingredients. …",51 out of 53 users found this review helpful
 This popcorn is perfect for little ones!,5,"Our 5 year old son loves popcorn but we are always concerned about the hulls in most popcorn's and the potential choking hazard with little ones. This popcorn is perfect! Although there is no true ""hull free"" popcorn, this one comes as close as it gets! It tastes great and, in our opinion, is very ""kid friendly"". This is the only brand of popcorn we use in our popcorn machine at home! …",19 out of 22 users found this review helpful
" NOT ""Pure Cane Syrup""",1,"This is not pure cane syrup, like Lyle's product. This, instead, is simple syrup (equal parts sugar and water, heated so as to dissolve the sugar) with some preservatives. Pure cane syrup is something else entirely. Don't be fooled as I was. …",5 out of 12 users found this review helpful
" ANIMAL LOVERS, VEGETARIANS AND VEGANS BEWARE!",1,"I did a search for vegan candy and this was near top of list. But the product contains gelatin, which is made from animal bones, pigs and horses' hooves. Very deceiving for Superstore, and potentially a legal suit in the making! …",7 out of 14 users found this review helpful
 Wow!!,5,"Me and my husband are always looking for responsible, healthy, by-product free treats for our sweet dog, but the problem we usually come across it lack of flavor and lack of excitement on our dogs part. These treats REALLY shocked us! The first time we gave it to her, she took it and bolted under the bed. The second time we gave one to her, she knew exactly what the treat was and did literally EVERY trick she knew, frantically one right after another! She is crazy about these things, so we will definitely be buying more! I would highly recommend these treats. …",15 out of 15 users found this review helpful
 Baker's yeast,5,"As far as I am concerned, bulk is the only way to buy yeast. These little packets and tiny jars are ridiculously priced for what you are getting, and beside that most people arent using enough yeast in their baking either. I use yeast for everything from bread to pancakes to corn bread. I use more than most people do. Unlike baking powder and soda, yeast is actually nutritional (as long as it is cooked, never eat it uncooked). Yeast adds a nice flavor and aroma not found in these 'powders'. I don't know where some of the common practices for using yeast came from, but I've found that you don't need to let things rise two or three times unless, that is, you are looking for a way to pass time. Also like in pancakes, just mix up the batter and throw it on the griddle, it rises for me. But don't be so stingy with the yeast. Yeast is not some rare thing that needs to be conserved, actually it is cheaply made, yet yeast boasts rather high nutritional value. I may be biased, I rarely if ever bake with white flour, I use whole wheat, corm meal or perhaps rye, mostly whole wheat. I use egg in my dough, batter etc., rather than the added white flour for gluten. Again the egg adds flavor, nutrition and RISE POWER without damaging the texture or character of the whole wheat or cornmeal product. Red Star is offering a great deal here, and the price is right. …",35 out of 37 users found this review helpful
 NECTAR OF THE GODS,5,"This is IT. The most divine food ever. If you like coconut and you haven't tried Artisana's Raw Organic Coconut Butter, you are in for the most sublime treat. You can eat it right out of the jar, put it in smoothies, spread it on toast, put it on veggies instead of butter, make frosting, put it in your curry, mix it up in raw food bars--perfect for kids' breakfasts or lunch boxes...there are so many things you can do with this stuff. It's the perfect food. I love coconut in any form, so I am going to be partial to this. But I've tried other coconut butters and this is the best I've had. This is not to be confused with coconut oil, it's thick, fibrous and has a sweet flavor and you don't cook with it like you do the oil. Coconut oil is great too, but I would not eat it with a spoon. Artisanas coconut butter is nutritious and deeply satisfying. It's one of my top favorite foods on earth. Premier Organics, the makers of Artisana, is an environmentally responsible company, so you can also feel great about supporting them. …",81 out of 83 users found this review helpful
 Wow!,5,"If you like honey, you are going to love this one. It is incredible, awesome and gorgeous. It is so good, you are not going to want to 'waste' this honey over toast bread. I eat it with teaspoon ever day and night, sometimes put a tiny bit of it in my home-made oatmeal reduced in organic milk and stir it together. Oh my god, it turns my oatmeal to the best recipe on Earth! I have not yet received a single negative or even a so-so reference from any of the people around me who has tasted this honey. A shopping tip: Due to its unique and wonderful taste, and the pretty package, it makes one of the best gifts for honey lovers. Two of these together makes a better Christmas gift than useless & cheap electronics or textiles. …",12 out of 12 users found this review helpful
 wish i could like it,2,"my shipment arrived with a lot of the plastic bottles dented up. customer service was so wonderful to deal with-a plus. i took a taste from one though and it's so strong of a flavor. i buy raw honey all the time and they're always firm to the touch, but this one is flowing, like regular store bought honey. my kids don't like this type of raw honey at all, the taste is too strong. maybe it's just our taste, but if you're into the normal flavor of honey, this brand is definitely going to throw your tastebuds off. if you're into different flavors, then this is the one for you. …",25 out of 28 users found this review helpful
 Very disapointing!!,1,"I received my order of Grove Square hot cocoa mix today, and was very shocked to see that hydrogenated oil was one of the ingredients in the mix. I have avoided using any products that contains trans fats because of the negative effects on blood lipid levels. I would urge Superstore to require an itemized list of ingredients for all food items listed for sale. If the ingredients had been listed, those of us who have concerns about our health can avoid these products. …",9 out of 14 users found this review helpful
 What's the Catch?,3,This food coloring kit sounds great except that they do not give the ounce sizes of the bottles. What's up with that? It would be nice to know how much product you are getting for your dollar. …,8 out of 58 users found this review helpful
 Be Careful Here!,3,"I am doing this review simply as a 'heads-up' for those who may think this is coconut oil for cooking - it is not! I use coconut oil in my kitchen for cooking - this came up on an Superstore search for coconut oil, but it's not for cooking, it's a hair oil. Yes, that's clearly stated in the Product Features, but some folks may not see that. It may not be eatable, for there's something in it that is keeping it from solidifying at room temp as normal coconut oil does - perhaps a chemical. But as you can see, Superstore is treating it as a 'Grocery' item, and that alone will cause some to order it as a food item. In my opinion, it should be labeled as a hair oil, and more clearly stated in Superstore's description. Be careful. …",15 out of 18 users found this review helpful
" Try these, especially the jalapeno ones. Sniff deeply and revel in the glorious scent",4,"I am an avid buyer of these chips because they taste like someone's ****. I love it. Everytime I bite into one of these chips, especially the jalapeno ones, I feel like I am tasting ****. Sometimes I just take a deep whiff of the aroma and imagine where my nose yearns to be. I highly recommend them, especially the jalapeno ones, which has that nice fresh ska--tee--boy rear end smell. …",2 out of 25 users found this review helpful
 quality product,5,"This product is amazing. It works great, smells great, is all organic and is about 4x cheaper than any other enzyme peel on the market (because it is half the price and twice the size). You can also get it almost anywhere. It made a huge difference on my skin and I would recommend it to anyone who has acne or a dull, bumpy complexion. The one down side is that it stings quite a bit, but it's supposed to do that. And afterward it feels great. …",18 out of 21 users found this review helpful
 Best rose water by far,5,"I've tried many brands of rose water, and this is far and away the best. The taste is full, and I end up using much less of it (saving money) than any other. I love to add it to iced tea... Yummy! …",25 out of 26 users found this review helpful
 Not what it claims or a bit deceptive,1,"We tried this product, a bunch of us. And we are all vegetarian. We also do not like onion or garlic; one of the friends esp. is sensitive to this. Well, even calling the company, they are not forthcoming, because we could taste garlic in it, and compared to ""tasty eats"" soy jerky, this does not even compare. So first, the ingredient ""vegetarian spices"" includes granulated garlic powder, possibly onion. In ayurvedic terms, this is not Sathwic for one's body. We totally recommend the soy jerky by tasty eats. We ordered six cases of the ginger. They use no onion or garlic in any of their products. Most companies do list ""spices"" but they will almost always label garlic or onion powder separately. This company who makes the primal strips does not. After all the comparisons, we found tasty eats soy jerky to be the best taste, quality and texture. In fact, they are out of Teriyaki, their best selling jerky, the original flavor, peppered and hot n' spicy. But we will order cases of them when they become available. They provide a first class jerky that is healthy and proper for everyone; esp. vegans and vegetarians. …",0 out of 13 users found this review helpful
 ICKKKK!,1,"THE TASTE WAS TINNY AND THICK-LIKE, EVEN THE COLOR WAS DISGUSTING. DON'T WASTE YOUR MONEY ON THIS PRODUCT, THERE ARE MANY OTHER MINERAL BASED WATERS OUT THERE THAT ARE SO MUCH MORE ENJOYABLE! …",10 out of 12 users found this review helpful
 Healthy and great tasting,4,"Bragg's Liquid Aminos are a great soy sauce alternative for the health conscious. No msg, not high in sodium. Great tasting. I use it for a meat marinade, and it's fantastic. Amino acids are the building blocks of proteins and are great for low-carb dieters or anyone who has weight issues but still wants tasty food. Two of the bottles leaked in shipping, messing up the labels, so if you are purchasing for resale keep this in mind. I contacted Superstore and the customer service was fantastic, as always, but new product could not be shipped out to replace the damaged ones, so a refund was immediately credited, and they allowed me to keep the product. Superstore's customer service could teach a thing or two to the rest of the retailers in the country....I've always been pleased and will never hesitate to order anything I am looking to buy...I search Superstore before Wal-Mart....no crowds and better service and good prices. I'm a happy camper. …",26 out of 27 users found this review helpful
 Expired K-Cups !!,1,"20 capsule were expired (some expired 8 months ago !!) 4 will expire in 10 days. The rest are good to be used for 1-2 months only. Poorly packaged, two capsules were damaged. UPDATE: I have noticed that my package was sold by Liquid Nation not Burley Brew, as listed here. …",12 out of 15 users found this review helpful
 If you ever wondered what it must be like to be a cannibal...,3,"... then these strips are for you. A friend of mine introduced me to them, and admittedly, they taste pretty good, but the seitan has a color and texture that will make you think you are eating human flesh. It's horrifying, and yet afterwards you'll be craving more, which is all the more horrifying. So, 5 stars for taste, 1 star for cannibalism... 3 stars overall. …",5 out of 12 users found this review helpful
 Works great! But how does it compare to Solofill?.... Read on,5,"This Ecobrew reusable Keurig K-cup is great for brewing your own coffee. It seems to have been very well designed and is easy to use. One of the things I felt bad about when I bought my Keurig coffee maker was the fact that although it was a great convenient coffee maker... it does tend to produce lots of waste when you buy the disposable k-cups. I think this product also ends up saving you lots of money in the long run too. K-cups can be quite expensive. I really love this product and I really can't find anything bad to say about it. There is another product called the Solofill that essentially does the same thing but is made from another company. I own both products and if you're curious to how they stack up against one another, check out the paragraph below. You may want to do research to make sure that your Keurig coffee maker is compatible with the EcoBrew or Solofill. I know that some K-cup coffee makers are not compatible with these products. I own the MR. Coffee single K-cup coffee maker and can say that it's compatible with both of these products. If you want to know more about the Mr. Coffee Keurig coffee maker, feel free to read my review on that as well :) EcoBrew VS Solofill First off, I'd like to state that I purchased both the Solofill and the Ecobrew. Both of these products are really great reusable Keurig filters that let you brew your own coffee in a Keurig coffee maker. These essentially let you make your own K-cups with your own coffee... and they're reusable! I would rate the Solofill as 4.5 Stars out of 5 and the Ecobrew as a 5 out of 5 Star Product. The Ecobrew is a bit better than the Solofill because it is easier to rinse out. The Solofill tends to collect grinds at the very bottom and it's very hard to get the few last grinds out. The Ecobrew also fits better in my Mr Coffee single cup K-cup brewer. The Ecobrew seems to have a slightly larger capacity for coffee grinds too, which may mean it's capable of brewing slightly stronger coffee. And lastly, the Ecobrew has a flat bottom that can sit on a counter top by itself. This makes it much easier to fill than the Solofill. With the Solofill, it couldn't be balanced on a table-top so I had to cut out the bottom of a small dixie cup to make my own ""stand"" in order to fill it properly. …",559 out of 562 users found this review helpful
 this stuff is IT,5,"It makes hospital food taste good! Good on meat, eggs, vegetables, phone books, this is a medium sauce with a lot of flavor to it. Also good on peanut butter sandwiches. …",29 out of 30 users found this review helpful
 Slight Cinnamon Flavor,3,"This is a Light Roast coffee with only a faint cinnamon like flavor. I brewed this In my B40 at the 7.20oz mug size. Adding a sugar substitute and liquid creamer and it created a mellow flavor with at best a very slight cinnamon flavor. I was expecting more. I will try this coffee at the larger 9.25 mug size and report back. I brewed a cup at the larger 9.25oz lever and still no real desirable cinnamon flavor. But as a light roast coffee alone, it has a nice smooth flavor with low acidity; just wished they'd would have put just a tad more cinnamon in it …",14 out of 15 users found this review helpful
 Bought 32 Pounds,4,"I bought 32 pounds. Bob's Red Mill doesn't have the occasional gritty and sandy shell specks like another brand. Coconut flour, which is fairly mild in flavor, is gluten-free, high-fiber, and high-protein. It naturally sweetens dishes even though it's low in carbohydrates - glycemic load of zero. I use this versatile fiber for smoothies, pancakes, muffins, brownies, and pizza crusts. You can also use it to thicken soups and sauces. Because coconut flour lacks gluten, you have to use many eggs to bind ingredients. However, I reduce the overpowering flavor of the eggs and increase the fat (coconut oil) and fluids because the flour absorbs large amounts of moisture and dries out the products. Blueberry coconut flour muffins taste great and mimic cornbread with a slightly fibrous texture. Whether you are eating low-carb, diabetic-friendly, gluten-free, or any other diet, you can still use this versatile, virtually non-allergenic coconut flour to boost your fiber intake and add variety to your dishes. My digestive system feels much better with all this coconut flour! I just wish that it was sold in 50-pound sacks! …",77 out of 77 users found this review helpful
 Wish it was as pretty as the picture,4,I purchased this item for my grandma this last Christmas. She thought it was pretty neat and it brought back some memories for her. Overall it's a great concept and for the right person it's a great gift. I was a bit frustrated with the contents being a mess and some of the candy packages were opened or the candy was smashed to powder. A little packaging improvement (and some bubble wrap or foam) would go a long way! …,12 out of 13 users found this review helpful
 Fantastic.,5,"Exactly how I always pictured Bertie Bott's beans would be. I have the generation before these and they've been spot on since movie 1 (GOD, the HORSERADISH flavor was AWFUL. UGH.). The generation before these has a single flavor that literally made me retch. The fish flavored jelly beans are SO AWFUL that you will gag. You will. Trust me. These, on the other hand, only have a few really awful ones. Avoid vomit if you can, because that's probably what you'll be doing next. whoever makes these is awesome. …",44 out of 46 users found this review helpful
 Decent Brew,3,"Prince of Peace Peony White is better classified as a Shou Mei grade of tea. It forms a relatively dark brew in the cup, reminiscent of a green tea or perhaps an Oolong. Nevertheless, its taste is smooth and pleasing with little astringency. All in all, this a good deal on a decent cup of tea - but if you're looking for a true white tea, you should search elsewhere. …",13 out of 13 users found this review helpful
 Endless uses!  Great product! You gotta try it.,5,"This is the best brand! [[ASIN:B000VUMSE0 Organic Extra Virgin Coconut Oil 54 oz]I have been using more and more coconut oil for the past for months. First it was for facial moisturizer than learned how great it is for a whole body moisturizer. Use as you would baby oil. The I tried for my baby who has eczema and is allergic to just about all the ""pure"" and ""natural"" products out there. His skin drinks it in and leaves it super moisturized and smooth. No more cracks and irritation. Great for all seasons. My husband uses after shaving as do I. I love it for cooking, No more olive and canola. If you do your research this should be your only cooking oil. Whether savory or sweet or deep frying and sauteing. Has a very mild taste, my husband doesn't even notice the difference. Also try in your hair as a conditioner, hot oil treatment or sealant also cuticles. I am an african american woman with natural 4a hair. I can't say enough about this. I started with the 16oz, but the more I used this the more I found that I needed a larger size. To my amazement I found this gigantic size. I put some in my smaller containers and leave one in the bathroom, one in the bedroom, one in the baby room and the largest one in the kitchen. Can't get enough of coconut oil. …",55 out of 55 users found this review helpful
" Great product, Horrible customer service.",3,"I received the garden and followed the directions exactly as written. Everything was sprouting wonderfully except the cilantro. There are germination days listed on each pod and the cilantro states 14 days. Everything else in the garden was growing great! I wrote 3 emails to aerogarden and after a week no response. I've called them three times and been on hold over 15 minutes each never getting a customer service representative. I have left a voicemail on their vm service, still ZERO response. Once you buy the product you are ON YOUR OWN! Good Luck! …",15 out of 18 users found this review helpful
 Pregnant 1 month after drinking,5,"I drank this tea 3-4 cups everyday and the next period I was pregnant after 7 years of trying. I boiled water and used 1 tea bag drank that entire pot the whole day. I didnt know it would work this well, worth every penny. …",18 out of 18 users found this review helpful
