Title,Star Rating,Review,Helpfulness
 Slight Cinnamon Flavor,3,"This is a Light Roast coffee with only a faint cinnamon like flavor. I brewed this In my B40 at the 7.20oz mug size. Adding a sugar substitute and liquid creamer and it created a mellow flavor with at best a very slight cinnamon flavor. I was expecting more. I will try this coffee at the larger 9.25 mug size and report back. I brewed a cup at the larger 9.25oz lever and still no real desirable cinnamon flavor. But as a light roast coffee alone, it has a nice smooth flavor with low acidity; just wished they'd would have put just a tad more cinnamon in it …",14 out of 15 users found this review helpful
 I'd give it zero if I could!!!!!!,1,"I usually go for Eden Soy or Trader Joe's as they are cheaper and usually taste as good or better, but I was in Walmart and said, ""what the hell."" Got a half gallon of Silk Vanilla soy milk and took it home immediately, storing it in a Trader Joe's insulated carry-all with some frozen goods on the way home. Right off, it seemed thick, but I shrugged it off as I hadn't had Silk for a while, and I remembered that their stuff was usually thicker than others. Well before a week had elapsed the carton was bloated with gas. The milk got really thick like paste. Yum, a half gallon of mystery Soy-gurt. I looked over the carton and found a ""guarantee"" of freshness and a web address. I used their web form and explained the defect in their product. Weeks later, they respond with the following response (basically tough poo, our ""guarantee"" isn't worth the cardboard it's written on): Thank you for your recent e-mail to Silk®. We appreciate your interest in our products. We guarantee the freshness and quality of our products if opened by the freshness date code and used within seven to ten days. However, our products are perishable food items and spoilage may occur if the products are stored in the refrigerator beyond the recommended number of days after the seal has been broken or if there was an interruption in maintaining the proper storage temperature. We apologize for the inconvenience, and hope you will continue to enjoy our products. For us, the good news is that you cared enough to let us know about it. Thanks again for contacting the Consumer Affairs Department. Sincerely, Yvonne Ortega Consumer Response Representative This is my response back: Yvonne: Thank you for your entirely cut-and-pasted, canned response. I appreciate that you didn't even bother to address me by name. Your lack of care and unfettered indifference overwhelms me. You obviously don't ""guarantee the freshness and quality"" of your products. Otherwise, you would be offering a refund on my purchase, or some form of compensation for the stale milk you produced. Your product's texture was a little off from day one and your product went completely bad on my family before ""seven to ten days after the freshness date."" There was no ""interruption in maintaining the proper storage temperature"" during our trip to WalMart, as we use reusable insulated shopping bags for our refrigerated and frozen goods. So, instead of trying to pass off the blame for your faulty product and shirking your promises, you should consider honoring your ""guarantee."" I had almost forgotten about writing to you, but due to the nature of your response I have to let other consumers know just how worthless a ""guarantee"" from WhiteWave is. I'm glad your title is ""Consumer Response Representative"" instead of Consumer Care Representative; at least WhiteWave is honest about that. Disgusted, So there you go, a premium priced product with below average taste and consistency, and worthless customer service!!! …",13 out of 16 users found this review helpful
 The Real Deal,5,"Great hickory flavor. Used it to make pulled pork for 20 people. It has a rich, natural flavor, no chemical aftertaste. Made the pork with only Hawaiian sea salt (red), black pepper, a little onion, some garlic and the Colgin Liquid Smoke. It was gone in less than 2 hours! …",12 out of 12 users found this review helpful
 Amazingly Good!,5,"I do not like pre-cooked pork rinds, not even made fresh in the Mexican Carnecerias, but hubby likes them, so I decided to buy these. I was shocked to find that they were light, airy and crispy. Some bags were saltier than others, but we've cooked up about 5 so far and the majority aren't overly salty. Another reviewer mentioned watching them to figure out how long the cooking time should be. In our 1100 watt oven 40-43 seconds seems to be just right. The key is to take them out the moment the bag has fully inflated. Leave them in too long and you end up with charcoal and not enough time will make them gummy. Since I follow a fairly low carb regimen for health and weight reasons, I like the fact that these can be a perfect vehicle for guacamole and salsa without the carbs. I'm still trying to come up with more dip ideas that will go well with the flavoring. I wish they'd put out a version that didn't have seasoned salt as I'd like them with just salt and/or garlic. …",17 out of 18 users found this review helpful
 NOT VEGAN,1,"I dont know why they have this under vegan items, this is not a chicken broth alternative this is ACTUALLY powdered chicken broth!!!!!!! …",5 out of 23 users found this review helpful
 Fantastic Food for Good Cat Health,5,"The pet food industry can be one of the most infuriating as you start doing research and discovering what trash manufacturers (and the vets who get paid off by the manufacturers) push onto the unsuspecting public. For reference, don't ask your vet - do some Internet research at sites like, for example, petfoodratings.net. What you'll find is that even the supposed ""high-end"" lines from basically every major supermarket label are horrible for your fuzzy friends. People who trust the marketing or trust their vets overpay and feed their cats foods that are full of carcinogens, cheap ingredients that are inappropriate for a cat's digestive system, and byproducts that provide nothing of value and are basically a way to make cheap profit off of literal garbage. It's a tragedy, as these same cats end up with shorter lifespans, kidney problems, UTIs, cancer, and a host of other issues, all of which could have been avoided by a high quality food. This is an A-Grade food. What you'll find here is very high protein content, many meat meals, potatoes, salmon oil, flax seed, and no grains, which is great as a cat is not an omnivore, it's a carnivore, and it simply does not need grains. It has 50 percent protein, which is among the highest you'll see in cat food. The first 4 ingredients are all meats. What you will NOT find here is the kind of junk you'll see in things like Purina One and Science Diet - byproducts (aka beaks, feathers, bird feet), brewers rice (aka the waste product from making beer), wheat flour (a leading cause of pet allergies), corn gluten (a cheap waste of space), and things like ""liver flavor"" (because they don't want to pay for the real thing). I didn't just pull those ingredients out of the air - I was reading the ingredients list of Purina One. It's pathetic. Don't feed your cats trash. Pay a little more to feed them good food now, and they'll lead longer, healthier, more satisfied lives as a result. It's worth it. …",19 out of 23 users found this review helpful
 Seems to be helping me,4,It seems to help. It's early though. I'm gonna keep taking it and see how it goes. …,9 out of 12 users found this review helpful
 product of China,1,It is a product of China. If I had known I would not have ordered it. For those of you that share my concerns you will find the information useful. As for the rest of you - ignore this review - or - do some research on the safety of what is comeing out of China. …,11 out of 18 users found this review helpful
 Chocolates might be great; shipping was less so; customer service is great,3,"While it was shipped to me insulated in styrofoam, no cold packs were included in the shipment--which was heading to Atlanta in early September (the American South in the summer). I assumed that since I was paying over $20 for shipping--the absolute fastest time, greater care would be taken to ensure that the product arrived intact. Unfortunately, the chocolates I received were largely melted. I do not recommend the purchase of this item to be shipped to any region experiencing temperatures above 78 degrees. UPDATE: Received an e-mail, which read (in part) as follows: First, my apologies for not answering you earlier... I didn't notice there was a melting issue with your order till late last week while addressing a small more recent delivery problem. Anyway, as you have noticed with your order, melting can and does happen in transit, but luckily only with an insignificant number of our packages as we only experience about two dozen or three dozen a year out of well over 15,000 packages. Insignificant when view in percentage terms, but still most infuriating when this happens. The e-mail went on to note that they are replacing my order. I am stunned--I have had a melting issue before with a different chocolate company (remember, I live in Atlanta, Georgia, where summer temperatures are a bear), and I received nothing in the way of satisfaction. I figured it would be the same and didn't even bother to directly contact the company (a mistake on my part). I am *very* pleased with this level of service. …",61 out of 64 users found this review helpful
 Tastes Great - 10 Calorie Treat,5,"This is the best tasting Sugar FREE drink for a K-Cup I have tried. I used the medium setting for my brewer adn got a very good cup; there is no aftertaste at all. This is a fresh apple caramel with a hint of cinnamon. I have had real apple cider that tasted about the same. This is a treat that even a diabetic could go for and enjoy. I am not sure why there are so many 1 star reviews, but i really do disagree. 10 cal (0 fat) -- 0g fat sat -- 1 carb -- 0g sugar -- &lt;1g fiber …",19 out of 19 users found this review helpful
 Ingredient list for those who are interested,4,"I thought I'd share the ingredient list and allergy information for those who are looking for it. The box I just received from Superstore says that these are made in the USA, and the ingredients are: water corn syrup glycerine high fructose corn syrup sugar sorbitol food starch - modified (corn) FD&C Yellow #5 FD&C Red #3 FD&C Blue #1 FD&C Yellow #6 FD&C Red #40 FD&C Blue #2 sodium benzoate and potassium sorbate (as preservatives) agar gum carrageenan salt citric acid Made in a facility that also processes tree nuts, egg and soy products. …",38 out of 39 users found this review helpful
 Polar Tuna is better!,2,"We're Polar Tuna fans, but were curious to try this one because of the great reviews. It may simply be personal preference, but we were disappointed with the flavor of Wild Planet. We did a blindfold test of this brand plus two others, and this came in last. We'll stay with Polar Tuna, which is scrumptious! …",5 out of 13 users found this review helpful
 CHECK THE SUGAR,1,"I would check the sugar grams before you buy and be forewarned. This seems a healthy snack but of the 140 calories per serving, 117 are from sugar! (26 grams) The Cherries and all others like this are the same. When seeing the deal, I thought what a great healthy snack until I looked at the calories and breakdown that includes how much sugar. …",10 out of 15 users found this review helpful
 Perfect...And i dont use that word lightly !,5,"I LOVE THE SMELL TASTE FEEL OF COFFEE ! However as a health issue i dropped all caffiene including my beloved coffee. Oh the Pain. Several months later i was on a trip and was served ROASTAROMA and it was amazing. Full bodied and rich like coffee without caffiene and not that horrible taste of decafe coffees. I couldnt find it anywhere and checked Celestial's web site and learned there wasnt ONE store within 25 miles that carried Roastaroma ..hence my purchase from Superstore. If you dont want the caffiene, and love the rich smell and taste of coffee...without that decafe taste.....this is the drink for you. …",20 out of 20 users found this review helpful
" I've purchased this several times, because it's GREAT!",5,"The strawberry banana flavor of this individually packaged drink mix is really out-of-this-world! It's as good as the far more expensive bottled drinks. The packaging is ultra-convenient, and saves me the hassle of carrying in cans of diet soda. Besides, who really needs the carbonation? Now, as for the ""hunger satisfaction"" part -- I can't believe it, but it really does seem to work. Now, it is true that if I drank plain water before a meal, it would also kill my hunger. However, the taste of this stuff is so great that it really does satisfy my craving for something sweet. So, if this is ""science,"" ""magic,"" or my will to believe in the power of Crystal Light -- I don't know. But, the bottom line is that this is a great product that I've already purchased several times, and will continue to buy. …",33 out of 35 users found this review helpful
 Nice cinnamon taste,5,"I snack a lot, and I don't always have time to brush my teeth afterwards, so I'm trying to chew this gum after eating. It has a nice flavor, not too sweet. I'm not chewing it for long periods of time, but the flavor lasts long enough for me. The larger size is more cost effective, and I'm keeping one at my desk and one in my car. …",12 out of 13 users found this review helpful
 Miraculously wonderful!,5,"I would never have dreamed that the plant would arrive in such pristine condtion! I had this Jade Tree delivered to work so that it would be a surprise for my husband's birthday. It raises a lot of curiosity when ""Live Plant"" is printed on a sealed box...especially when I was out of the office on the day it arrived. NO one could believe how bright green and beautifully formed the plant was. The fact that it had spent a few days in a sealed box was doubly mystifying! This birthday present was paraded up an down the halls of our office building before it ever made it home to my husband. Everyone was amazed. Thank you for a great birthday surprise. I hope we can take as good care of this gem as you did getting it to me. …",19 out of 19 users found this review helpful
 Great Chips,1,"Just the right kind of chips, they are crunchie, light and wonderful. Great for people dieting. They are popped, not fried or baked. Try them you'll enjoy them. …",1 out of 14 users found this review helpful
" Clearly handly, if a bit overpriced",3,"Bought both the aerogarden, and master gardener deluxe kit, for my sister with the brown thumb. Fit and finish seem good, ease of use can't be faulted, and she's already got plants growing in a remarkably short time, which given her success at converting seeds into little blobs of mold is nothing short of miraculous. OTOH, a quick review of what goes into it, from the perspective of a mechanical engineer, suggests that it's vastly overpriced. I do hope they'll be bringing the price down in months to come. There could be a huge market for it at a more reasonable price. …",64 out of 69 users found this review helpful
 What Every Consumer Should Know - NOT Economical,1,"The taste of SodaStream diet cola does not match that of mainstream brands. This becomes especially noticeable for frequent drinkers of Diet Coke or Diet Pepsi. Yet that isn't the main problem with the SodaStream offering. The truth is simply that consumers are paying way too much for C02 refills -- sixteen times (16x) too much. While the general idea of at-home carbonation is solid, consumers should understand that they are grossly overpaying for SodaStream carbon dioxide refills. In fact, the prices charged are sixteen times (16x) wholesale costs or many, many times more expensive than the prices a restaurant would pay. In Europe, frugal consumers are aware of such markups and actually purchase their own restaurant-sized CO2 refills. In the US, we aren't so frugal. Other than the outrageous costs for the CO2 refills, there are other issues with the SodaStream Fountain Jet. One is the construction quality is quite low with very thin molded plastic and little weight. Additionally, the taste of generic soda flavors do not match that of the brand name products. Below is the calculated cost per two liter for the output of SodaStream soda. This includes the cost of the consumables AND the equipment costs. I have used very generous assumptions, including a low discount rate (i.e. cost of money). Transportation costs were not factored because 1) purchases of typical groceries should more or less overlap with soft drink purchases 2) grocery delivery has long been available in many areas 3) most people live closer to a grocery store than to a home furnishings store (I walk 100 ft. for groceries and drive one mile for BB&B) 4) the reverse logistics for the CO2 refills is an extra expense for the retailer that has to be factored into its profit margin and will ultimately be borne by the consumer. One of the reasons Bed Bath & Beyond, Macy's and Crate and Barrel choose to carry SodaStream is that they want the consumer to make MORE FREQUENT trips to their establishments for consumables. Instead of going to such establishments once every 3 to 6 months, customers will now visit once every 1 to 2 months. That makes an enormous difference for generating impulse purchases at such retailers. One could argue then that transportation costs could increase for the individual consumer. Total Costs = $1.73 per Two Liter -- More Expensive Than Retail *Concentrate Flavor cost bottle of concentrate $4.99 Liters of product per container 12 Flavor/l $0.42 *Carbonator Volume of CO2 130 Cost of CO2 per refill (130 liters) 29.99 CO2 cost per liter $0.23 *Sodastream Equipment Costs - Amortization Per Liter Equipment cost $89.00 Equipment life (years) 5 Discount rate (cost of money) 8% Liters per month 10.00 Monthly amortized cost $1.80 Cost of equipment per liter $0.18 *Water Cost with Brita Filtration Municipal water costs per liter in US $0.0004 Brita filter three pack (454 liters of water output) $16.95 Brita cost per liter $0.0373 Water and filter costs per liter $0.0377 (assumes you already own Brita Pitcher so no equipment costs, just incremental filtration) ***TOTAL COSTS PER TWO LITER = (Flavor + CO2 + Equipment + Filtered Water) * 2 SodaStream Total Cost Per Two Liter = $1.73 Without filtered water: SodaStream Total Cost Per Two Liter = $1.65 *****What does CO2 Really Cost???? THE MATH BELOW IS WHAT SODASTREAM DOESN'T WANT THE CONSUMER TO KNOW *Restaurant Carbonation (note distributor prices, so there is still a distributor profit) weight of CO2 contents of large restaurant CO2 tank: 50 lbs weight in grams: 22,680 grams of CO2 cost to refill - Summer 2011: $35 CO2 grams/liter of carbonated water: 7 grams *Efficiency of Restaurant CO2 Carbonation losses: 10% available CO2 in tank (residual is required for pressure): 85% net accessible CO2 of total: 77% usable grams of CO2: 17,350 grams *Output carbonated liters of water: 2,479 cost per liter in USD$: $0.014 *SodaStream Output SodaStream Refill: 130 liters (quoted end product) Cost per refill: $30.00 cost per SodaStream carbonated water: $0.231 *SodaStream Markup Economics ratio of SodaStream to Restaurant prices: 16.3x SodaStream inflation price over restaurant pricing: 1534% math: [y/x-x] to give increase over base case restaurant pricing This is an incredible 1500% markup Pros Saves plastic Allows flexible mixture of flavors Cons Cost of output is not compelling Grossly inflated CO2 refill costs Another store trip required for refills separate from grocery store visit ***Disclaimer: I am an investor who has used the product multiple times. At the time of this review, I did NOT have an investment in SodaStream either short or long. In the past, I have both owned the stock and shorted it (bet against it). I may be on either side of the trade by the time you read this -- I am not very sentimental. …",31 out of 36 users found this review helpful
 Changed the ingredients to now include meat products! ZERO STARS,1,"We discovered in puppyhood that our boxer was allergic to chicken, beef and pork and had to be restricted to a fish- and vegetable-based diet. He has been on the veterinarian-recommended Eagle Pack anchovy, etc. fish-only dry food for eight years... his entire life, and with fabulous results. We noticed recently that his allergies were acting up. I just sat down to order another 30-lb. bag and while price-comparing, the ingredients list caught my eye: They now include chicken and pork products! How can you advertise that this food is good for dogs with allergies and digestive issues when you start including the very ingredients to the food we owners turn to in order to AVOID the allergic reactions and digestive issues? I gladly paid top-dollar for this food, even when the price increased during the recalls of other brands over the past few years (NOTE: This brand was unaffected), because I was glad and thankful to be secure in my knowledge that I was protecting my dog's well-being with a trusted company who seemed dedicated to serving this smaller market for special-needs food. I suspect Eagle Pack is trying to cut costs by decreasing the amount of fish-based ingredients and substituting the less-costly poultry and pork. I can no longer trust this company since they have clearly put canine health far behind their bottom line. I also suspect their corporate attorney approved the change due to some loophole(s) in truth-in-advertising laws. Did they think consumers such as myself would not notice?? We pay top-dollar for this type of food because we need it! Heaven forbid a beloved pet has a severe reaction or dies as a result of this. How long have I and other owners been putting our dogs' health at risk?? I just hope I can find another fish-based dry food without poultry, pork or beef products. There are so few, this is another reason I am baffled... Eagle Pack had this market cornered because their fish-only version was superb. …",8 out of 12 users found this review helpful
 Chemical poison?,1,"One of the worst things I have ever tasyed that was supose to be drinkable. Under fizzed and over chemicalled. My Grand children tasted it and got sick. Nothing like the real ""Fizzies"" of old. Reccogmended only for suicides to hide the taste of the poison-naw it might make you throw up and screw up the suicide attempt. They only sell it in large quantities because after tasting one no one would ever buy a second one. …",6 out of 28 users found this review helpful
 Vita Coco Buyers BEWARE- Mold inside,1,"<span class=""tiny""> Length:: 0:32 Mins </span>I have been on the coconut water wagon for over 2 years now. I truly feel there is no better coconut water than the one that comes directly from the source in hand. Because fresh coconuts are not easy to find I started buying Vita Coco over a year ago. From all other coconut waters out there I felt theirs was the best tasting, best quality and I also liked the fact that the source of the water came from just one country and not multiple ones. I have been a happy consumer for over a year, most of my purchases came from the local supermarket until I decided to purchase the vita coco 6 pack on Superstore as part of the subscribe and save program I gave a box to my mother in law. Earlier this week she opened one of the containers and she said the taste seemed a bit off, a little rancid and she felt like I had swallowed something more than just water. She decided to take a closer look and I was appalled at what she uncovered. Huge chunks of mold her water; it made her sick to her stomach. I am sad to say that after this experience we will no longer consume this product. My concern is what kind of quality control is out there and is this the first incident. I have heard many reviews talking about rancid taste and moldy taste I wonder how many of those containers had the same stuff inside. Worse of all is that I have been giving this water to my 3 year old who loves coconut water. My mother in law sealed the container and took these pictures I have contacted the company but I have yet to hear from anyone. …",30 out of 31 users found this review helpful
 Pup Tents!!!  Acres and Acres of Pup Tents!,5,"What rhymes with Dipper? Pipper!!! And Ol' Dipper's pipper has found the oil it needed in Lee Kum Kee Premium Oyster Sauce! The Dipper's pipper is hipper, no longer the dripper! Yip yip yipper shouts the Happy Dipper!!! Buy it for love!!! …",0 out of 19 users found this review helpful
 Exeedingly Good,5,"When I left England in 1997 I think I missed these the most, sure there were parents and aunts and uncles, but that's why they invented the web cam. Looking at Cherry Bakewells on a webcam never gave me the same satisfaction of actually eating one. I could get other people to eat them and then describe precisely the sensation, but it was never enough. I tried to find a US substitute over here, Cherry Poptarts? Hah! I laugh at your pitiful attempts at creating a cherry cake. Jump forward about 10 years and these babies show up on Superstore, what a great day indeed. I ordered a pack immediately and awaited their arrival, they arrived promptly and as I ate the first one (whole) that same great taste I remembered came flooding back. The soft fondant icing, the almondy crumble filling, the plum jam at the bottom, the firm but somehow soft pastry case and of course the cherry on top. Bliss :) I don't recommend anyone buy these as I want them all for myself. All of them you hear? ALL OF THEM!!!!! …",17 out of 18 users found this review helpful
