Title,Star Rating,Review,Helpfulness
 What a gift!,5,"Perceptions about this innovative box of flowering teas and accompanying teapot range from ""Buyer Beware"" to ""Gift of the Year."" Here's my take: The Good: 9 tea selections that are unique in bloom, taste and fragrance. Each bloom yields 3 pots of tea. Lidded Glass teapot to view the spectacular blooming. 2 attractive, reusable and sustainable bamboo boxes (1 containing the individually wrapped flowers and a larger containing the whole kit and caboodle. Superstore's price, which at wholesale is a steal for this type of handmade, artisan product. And the sensory experience itself is priceless (though many a tea salon now have put a price on it). The Bad: All selections do not quite yield 3 pots, and speaking of the pot, yes you may want to invest in a back-up. For the price, I haven't seen a better gift. The nay sayers are looking for a product that would have to retail at twice the full retail value of this set. And you don't like the flavors? Isn't that a matter of personal taste? It certainly isn't a reflection of the tea quality, which is very good. To add to your experience, enjoy with friends and afterwards flip through The Tea Box by Gilles Brochard. …",13 out of 13 users found this review helpful
 Very good baking mix,5,"I am very pleased with my order of Bob's Red Mill Low-Carb Baking Mix. I love the 16 oz packages. They are small enough to use up one at a time while the other packages remain unopened (also easier to store). The flavor is also great, and I can make quite a few recipes with it. My favorite recipe being the low carb pancakes, the recipe is right on the package. The absolute BEST reason I love this baking mix is the fact that it has 5 g fiber per 1/4 cup. 0 trans fat and 0 sugar. Try it, you won't be sorry! …",29 out of 30 users found this review helpful
 Very high quality tea,5,Many of the common brands of herbal teas are not palatable to me. This one is very good. I enjoy it. Easy on the palette and easy on the digestion track. Yum! Just like any high quality tea. …,16 out of 17 users found this review helpful
" You change Your Honey, You Don't Get My Money",1,"I have been consuming and sharing with others Wedderspoon Active 16+ for almost two years. Then Wedderspoon made changes that I find unacceptable. The first had to do with their label, which most people don't bother to read since the label color didn't change. Gone was organic certification by Ecosert SA. Gone was ""Support the OMA mark which guarantees honey that is free from chemicals and pesticides."" Missing are the following: Never feeding the bees sugar, area of forage is 5 km. from intensive farming, Ecosert approval. Added was the word ""harmful"" before chemicals and pesticides. Obviously, chemicals and pesticides are added and we are supposed to hope they are not harmful. Then I noticed that batch 110576 was definitely ""watery"" compared to earlier batches. It had nothing to do with the weather because last summer was just as hot and the manuka was just fine. Batch 110583 was almost as runny as 110576. Then came another shipment from Superstore that was packed very securely, but there was leaked honey all over the box. Superstore reimbursed me, but it wasn't their fault. The outer seal was intact but there was no inner seal. This runny honey had no difficulty passing between the jar and the cover. Additionally, although it no longer affects me, it appears that Wedderspoon followed through and no longer sells direct to Superstore , which raises the price a little more. I rated this product one star so I could submit my review. One star is very generous. …",34 out of 48 users found this review helpful
 This milk makes our baby really sick!! :(,1,"Sorry to give this 1 star. but this milk really makes our baby really sick!! :(, literally!! if your baby can take it, I guess it's a good one but for us, we had the worst experience with it. Here is our story. My baby had been solely breastfed. After 9 months my wife was running short of her milk. She didn't have enough breastmilk for the baby and he didn't take as much solid food as we would want him to. We gave him Similac Advance, it was recommended by the hospital. First Similac Advance Liquid, he threw up 9 times within 2 hours after half an hour of feeding. That happened twice. A few days later, we tried Similac Advance power, he threw up again! This time 5 times plus serious diarrhea for 5 days. He has lost 5% of his weight within 2 days. That's really bad. We were desperate. We took him to the hospital twice that week. The doctor though it was stomach flu. However, I didn't quit agree with him. What a coincident that 2 different formula milk feeding incidents would throw my baby off balance. I'm a computer engineer and dealing with solving and debugging problems all the time. I was firm with the doctor that this was not a coincident. I thought it might have something to do with the protein in the formula that my baby couldn't digest. We decided to try Lactose free formula (Nutramigen from Enflora). It smell and taste really awful (my wife tried it and she gagged. As we thought, my baby rejected to drink it. Then I tried Good Start soy. Same story, smell bad but not as bad as Nutromigen. My baby also rejected to drink it. Now we were really desperate, not enough milk for him and he doesn't like to eat solid food!! He would throw up + diarrhea if he gave him normal formula milk. Phone call to 4 advise nurses, no luck! I finally search on the internet and found a lot of similar story to what we experienced (including this on Superstore reviews). I decided to give it a final try, crossing our fingers really tight. Good Start Gentle Plus is our last hope or my baby would not have any more milk to drink. He's losing weight!! And then miracle happened!!! This milk works wonderfully for him. The only complain I would have is that it doesn't smell as good as the normal cow milk-based formula, however, doesn't smell or taste awful like the other two. My baby didn't quite used to the tasted in the beginning and didn't really want to drink it at first. So we tried mixed it with breastmilk for a few days. Now he is a happy baby, gaining weight, doesn't throw up and used to the taste of it. My wife and I are now happy again :) …",2 out of 23 users found this review helpful
" There were 87, NOT 100",3,"Okay, yes, they are good. However, when my package arrived, the box had been opened and didn't look full. So, I counted them. There were 87, not 100. (and there were none loose in the box among the other items.) I guess the ""box packer"" got hungry and decided to eat a few. not cool. Follow up: Superstore was great about my complaint about the number! They sent a new box right away. thanks! and I would order again. …",20 out of 36 users found this review helpful
 undrinkable,1,"I found this tea undrinkable -- the spice flavor is way too strong for me. ""Hot"" means ""completely numbs your taste buds"" here, not hot temperature-wise! …",1 out of 12 users found this review helpful
 Smooth and Creamy,5,"I am on a sugar-restricted diet and had a hard time finding mayo that didn't have added sugar. Dukes fit the bill. At the same time, I discovered it was creamy and delicious! My husband was a long time user of Kraft mayo and once he tried the Duke's, he happily switched. …",11 out of 12 users found this review helpful
 Exotic and easy dinnertime help,4,"I live in Italy and have a small child so I would never have time to collect all these things and put them together in a basket AND get to the post office to send them, so..... this was a great way to help out and tickle the fancy of a friend who was having a hard time and I had hoped she could use the products to quickly whip up an Italian meal or two for her family. She was delighted and so was I. …",25 out of 26 users found this review helpful
" Having just eaten this for dinner, I have advice and raves",5,"First of all, don't be put off by the price. If you've kept track of grocery store receipts lately or the sharp increase in basic foods over the last year, you may see how this product could save you time, gas and MONEY. At the time of this writing, it cost about $16.88 for four packages of this mix. EACH package easily serves 8-16 people with soup left over. While the instructions note to add 4 cups of water or a water and broth combo, we quickly discovered we had to double or even triple the liquid added. No problem there, because we had more soup! If you don't have fresh veggies or spices around, this will suffice as is and it is thick and satisfying. If you garden, you'll improve the taste by adding fresh chopped parsley, garlic and whatever veggies you want. A can of tomatoes (or fresh, chopped ones) does no harm. This is a mix you can play with, add ingredients and spices. IMPORTANT: this is not a salted mix. It is full of split peas, barley, lentils, whole wheat pasta, dehydrated spinach, tomato, onion, etc. If you don't use salt, consider adding a salt substitute. I also added basil. It was delightful, quick and is now a pantry staple. Nutrition: 330 calories (1/2 cup) only 20 calories from fat. Significant source of iron at 22% of the Daily Value. Protein: 20 grams. Fiber - 8 grams. Add some bread and you have a meal, rounded out with some greens, perhaps. …",148 out of 150 users found this review helpful
" Filler food is empty, leaves your cat always needing more",1,"This review will make me sound really stupid, but whatever. I don't really care as long as people find out what's real and can avoid my mistakes. I got my wonderful little sweet Bella Bean when she was a few days shy of three years old. She had been bounced around from house to house and eating whatever was cheap. I have had cats around me my entire life, for about twenty-five years now. My mother always just fed them whatever, the kinds of food you buy in the supermarket - Friskies, Nine Lives, Kit & Kaboodle, stuff like that. And our cats were always fine, at least in terms of their eating habits. They would eat in the morning, stop when they were done, come back, and eat some more when they got hungry. My housemate at the time was working for Hill's and assured me that this was the best food ever made, so great, so on and so forth. I now know that she is an utter buffoon, but I initially trusted her judgment, which is so unfortunate because she doesn't think. She also had plenty of coupons for free or deeply discounted bags, which made it a much more attractive choice. I first tried feeding the little Bean an unmeasured amount of Science Diet in a bowl, but that didn't work, as she would devour it in one sitting. So then I took to measuring it, and she did the same thing. Then I started parsing it out to twice a day. That didn't work either, because she would start going crazy in the middle of the day, running around, intentionally destroying things, deliberately spilling her water, crying, etc., until she got more food. So then I split it into three servings. Same thing. Then it got to be four servings. That was a little better, but it was too much maintenance and unrealistic to be around every day to feed her four times. So then it went back to three. All the while, I was trying to reduce the amount of food I was feeding her to less than 3/4 of a cup because she was a little chubby. Reducing was hell. She became even more hungry, but I figured she would get used to it. Not really. For over a year, she would wake me up every morning looking for food in a serious way, knocking things off my desk, ripping up any paper she could find, scratching at the door and committing general acts of mischief. As soon as she got food, she was back to her sweet self, but only for three or four hours. We thought she was bored, we thought she was a little nutty, and maybe even had a kitty eating disorder. She always wanted food. It was kind of funny but in the end it was just sad. A few weeks back, we took her to a new (good, non-money factory) vet for her second checkup since I've had her. I talked with him about her being always hungry. He asked what she ate, and I told him the adult indoor Science Diet. Without saying as much, he basically told me that this food is garbage and I should look for something else. He said cat food should have a protein followed by a carbohydrate as the first two ingredients. Science Diet does, in a very loose, by-product kind of way - ground up slaughterhouse leftovers and corn dust. Then they put a bunch of vitamins in it to make it ""healthy,"" instead of just using good ingredients from the beginning. Not that I care about spending money on the Bean, but this food is way too expensive for what it is. So we began transitioning her onto Wellness indoor formula about two weeks ago. She is still eating 50 percent Science Diet with 50 percent Wellness (you really shouldn't just give a cat different food one day out of the blue) but SHE NEVER FREAKS OUT ANYMORE. It's amazing. And it's 100 percent because she is eating real food now, along with that sawdust and chicken hearts I still regrettable have to feed her. We have her down to eating twice a day, only 1/3 cup in TOTAL. She was eating three times a day, 5/8 of a cup in total. Now she eats some in the morning, walks away, eats some more a few hours later, and then looks for dinner about twelve hours after her initial feeding. No more knocking things over, no more trashing Dad's papers on the desk, no more howling, no more deliberately spilled water on the floor. It's incredible. I feel so bad that I was doing this to her for so long. We really thought she was just being dramatic or whatever. But no, she was genuinely hungry because she wasn't eating any real food. Do your cat a favor - buy her or him so food made with real ingredients, things you would eat - Wellness, Halo, Innova, Evo, whatever. Figure it out for yourself, but please don't feed your cat this. It's garbage. …",33 out of 48 users found this review helpful
 Yummy! Pamela's does it again!!!,5,"I absolutely loved corn bread and thought that I would have to stop eating it when I went gluten free. Then Pamela's came out with this super easy and versitile corn bread mix. I immmediately ordered a case having never tried it before because it was a Pamelas product and I have yet to find something I don't like of hers. Anyway, I would definate recommend that if you love corn bread because you will not be disappointed. …",12 out of 13 users found this review helpful
 Half the size!!!!! 8.8oz!!!!,1,"I read the review and thought that's a good purchase, until when it arrived and they're half the size. It's not shown clearly in the picture or anywhere!!! Be careful! Make sure you notice it's only 8.8oz …",6 out of 33 users found this review helpful
 Product--Outstanding; Price--Gouging!!,1,"We researched cat foods to find the best, and Newman's is one of the best. The problem is that I can buy it for ~$9.60 for the 3lb bag and ~$13.70 for the 4.75. It was not easily found at local stores, but definitely worth the effort. I hope Superstore gets a little more realistic in regard to pricing this line …",9 out of 16 users found this review helpful
 How Could You Be So Bold,5,"After FINALLY purchasing best coffee maker I've ever had in 40 years of drinking coffee, the hunt was on to find the best tasting coffee to go with it. When it comes to coffee, I suppose that it's really a ""to each his or her own"" thing. But I've tried 'em all, and out of all the various varieties that are offered here at Superstore, the K-cup that provides the most pleasurable mix of everything that I was looking for in a cup of coffee is undisputedly Emeril's Big Easy Bold. Nothing beats Emeril's Big Easy Bold. There are plenty of other brands trying to suggest that they're bold. I've tried the ""Midnight Magic"" brand; I've tried the ""Jet Fuel"" brand; I've tried the ""Donut Shop"" brand; I've tried all of the ""Extra Bolds""; but the K-cup that really tastes like the jet fuel packed cup of coffee that you get in the best donut shop is Emeril's Big Easy Bold. What's really cool is that whether you make a small cup or large cup of Emeril's Big Easy Bold, you won't lose the rich flavor. Most Keurig Coffee Makers have at least two buttons that let you choose to make a large or small cup. Some even have three buttons for a large, medium or small. I like a large cup. Some of the other brands noticeably lost some of their flavor as I went from a medium cup to a large...but not the Emeril's. There is no question here. If you like a darker roast that's full of flavor and packs a punch, you've found the right page here at Superstore. Wake up people, and add this to your cart. Bam! …",69 out of 72 users found this review helpful
 Not what I ordered,1,"I orderd what was listed as 360 grm metal containers of Nido milk powder. What I received was ones made from cardboard and a different size. I wanted the milk powder in the metal tins as adverized and shown in the illustration. NOT another stock item. The vendor said they were not produced any more. My question is why is this style still shown as being available on the website.? The metal tins work better in a more humid enviroment on my boat, the crdboard ones do not. I'm not happy and I will not order items such as this from Superstore again. I've learned my lesson. …",13 out of 17 users found this review helpful
 Emeril's Coffees have burnt flavor,1,Emeril's coffees have a burnt flavor. It is good strong coffee and would have been very good but the burnt flavor ruins any enjoyment. The bold roast gives it the burnt flavor. Don't confuse bold roast with strong coffee. My husband loves very strong coffee and even he could not drink this. Disappointed. …,11 out of 16 users found this review helpful
 My dogs love 'em!,5,"My husband and I like to buy Newman's products. We love their cookies so we thought our dogs might like them, too. So we got these dog treats and the LOVE them. They're even shaped like hearts! They come with 6 bags so they'll last a while but they're packaged so they won't go stale. …",27 out of 27 users found this review helpful
 Excellent service and an even better product,5,"To begin with I am a vegetarian and do not have eggs. My review will be in 2 parts 1. For the seller: When I received my first package, it was damaged and the product spilled. On raising a complaint I was promptly provided a replacement and the overall service was courteous. Full marks to VitaCost 2. For the product: Ener-G Egg Replacer is a blessing for all those who don't eat or bake eggs. I have already used it for chocolate cookies and cake and the results are far superior than anything else I have used so far. Definitely recommend this product. …",13 out of 13 users found this review helpful
 Don't bother ordering this,1,This is a joke!! I have never been so mad as I am right now writing this. Not only is the coffee a big joke the way they shipped it is as well. The assortment in this is ridiculous. The majority of the coffee is french vanilla. And hopefully we will like spicy eggnog and kahlua because those make up pretty much the rest of the coffee. This looks like somebody threw in the coffee they didn't like into a box and sent it to the sucker who was stupid enough to buy it. I am not usually this brutall with reviews but this angers me. The coffee was in a brown paper bag and thrown in a box to ship. If I could return this I would but this is not a purchase that can be returned. How sad this is. …,12 out of 12 users found this review helpful
 Delicious Extra Crunchy,5,"These potato chips are excellent.There are no trans fats. They taste absolutely delicious.Whenever I am in the mood for potatoe chips, Kettles is the brand I buy. A great product that anyone should enjoy and I highly recommend them! Enjoy! …",14 out of 17 users found this review helpful
 My dogs love 'em!,5,"My husband and I like to buy Newman's products. We love their cookies so we thought our dogs might like them, too. So we got these dog treats and the LOVE them. They're even shaped like hearts! They come with 6 bags so they'll last a while but they're packaged so they won't go stale. …",27 out of 27 users found this review helpful
 The Good and the Bad,3,"I've worked with different types of fondants and if you are reading reviews because you are new to the Fondant Cake process, here are some things to keep in mind: 1. Satin Ice is Yummier than most 2. Satin Ice is harder to work with than many 3. Satin Ice shouldn't be you're first ;) I started my Fondanting adventures using Wilton's, a brand that makes most professional cake decorators cringe. It isn't yummy, but it is forgiving. If you are new to cake-ing I would recommend using Wilton's the first few times to get the hang of things before moving to the more finicky fondants. If you start by using this fondant, you may be Freudianly misspronouncing it in a loud voice: ""I hate you SATAN Ice!!"" Really, fondant tears may stain your cheeks. Fondants I've used in order of easiest to work with: 1. Wilton's 2. Elite by Fondx 3. Satin Ice 4. Homemade Marshmallow Fondant's I've worked with in order of yummieness: 1. Homemade Marshmallow 2. Elite by Fondx 3. Satin Ice 4. (distantly) Wilton's I would recommend the tutorial on Satin Ice website, really great: [...] If you are only buying Satin Ice to sculpt edible animals, than this would be a great one. For first time cake coverings, try Wilton's, get things down then come back to Satin Ice. Thanks for reading and good luck on your cake adventures! Jackie domesticfits (dot) com …",75 out of 75 users found this review helpful
" Delicious with 5 spice aromas, not full of sugar and cream",5,"This India Spice Chai while brewing fills the whole room with wonderful aromas of nutmeg, cinnamon, ginger, and cloves almost like the Chinese 5 spice blend. There is no added sugar or cream so if you want that go with Escapes Chai Latte K-Cups for Keurig Coffee Machines - 16 Pack . Those k-cups which are delicious as well have the cream that many expect in a chai tea. This particular brand of Celestial Seasonings is just tea. You can add what you want after the fact. I've not had any trouble with the packaging, nor having the tops flop off while brewing. This is just a nice cup of spiced tea. It's not peppery and won't offend or be too spicy for most. I really like it and highly recommend. …",27 out of 28 users found this review helpful
 Diabetic testimonial,5,"Being a type II diabetic is challenging when it comes to desserts. Concerned that I was consuming too many products using artificial sweeteners and while researching some other products (allergic to stevia and agave), I came across the SweetTree Blonde evaporated palm sugar which claims a glycemic index of 35. My body has had positive gylcemic reactions to sesame and coconut products and I made the purchase on faith that the glycemic load using this sugar versus artificial sweeteners would be similar. I made a batch of cookies using Splenda and another batch using the SweetTree blonde sugar and then tested my blood glucose. I did this repeatedly over the course of about 7 days and was pleasantly surprised that my blood sugars in both cases were consistently within a few points of each other. So, for my body I found this sugar to be just as good a substitute as splenda. For my money, I would rather put something in me that is closer to nature. We use it now in our morning coffee and the company will be releasing a new liquid version of the product in the fall sometime. …",83 out of 83 users found this review helpful
 you won't miss the salt,4,"I ordered these chips by accident. I meant to order ""with added salt."" I know, not a healthy choice but hey, I love salt! So, I ended up with a whole case of these unsalted chips. My wife said, hey these aren't salted! She was pleased. She worries about my diet. So, I had some chips. They're delicious! Good crunch. Very fresh corn flavor. Excellent with salsa. Sometimes a guy has to be wrong to do right! …",16 out of 16 users found this review helpful
 Vegan Natural Kosher Choice,5,"Vegan. Natural. Kosher. Beautiful, classic yellow dal. Dal means lentils which have been split in half, similar to split peas and split pea soup. Yellow dal is a staple of Indian meals (thalis.) Not spicy, but very rich and flavorful. In addition to serving with or over rice, great with bread or toast. Jodhpur is a city in Rajastan, India located southeast of New Delhi. Raja means king. Rajastan is also well known for the high percentage of orthodox Hindu vegetarians living there. Made with lentils, sunflower oil, salt, tomatoes, garlic, cumin, tumeric, and chilis. Easy-open foil pouch. Approx 220 calories, 12g protein, 5g fat per pouch. Labeled vegan on the back of the box. By using only vegetable oils, this wonderful treat also lets Ama Gai [mother cow] save her milk for her own babies. Although freshly and locally made is always better, this Tasty Bite dish is a fantastic tribute to the cuisine of Rajastan and a great choice for everyone to enjoy the wonders of this wonderful Indian cuisine at home. Product of India. Highly recommended. Also really like Bite Entree, Bombay Potatoes, 10-Ounce Boxes (Pack of 12) and Bite Entree, Bengal Lentils, 10-Ounce Packet (Pack of 12) . This review is out there for those for whom this makes a difference. See all of my reviews and the vegancompassion Profile for more great choices. Check out ""Vegan Grocery Favorites"" and ""Vegan Grocery Top Ten"" & all the other helpful ""Vegan Grocery"" Listmania. Your input counts and will be greatly appreciated to benefit the search of others. Thank you. …",12 out of 13 users found this review helpful
