Title,Star Rating,Review,Helpfulness
 I LOVE this stuff,5,"I'd been buying it for years WHEN I COULD FIND IT, at the local grocery. Generally buying 5 or 6 cans cause I couldn't be sure it would be there next time I went. As such, I was thrilled to see Superstore selling it in bulk and cheaper than at my local store. These are almonds... so you get the health benefits of that. They are very tasty, with a mild wasabi tang... I've shared them with friends and they love them. Granted, these don't provide the entertainment value of the wasabi peas from the Japanese place that blow out your sinuses. But Its still a very tasty, semi healthy (lots of salt), snack that fills my need for something crunchy. MUCH healthier than potato chips. …",12 out of 12 users found this review helpful
 A major improvement in menopausal symptoms,5,"I tried this product after researching menopausal heart palpitations and internal tremors on www.power-surge . The relief was immediate! What surprised me was the improvement in many other aspects of my health. No more headaches that feel like a tight cap binding my scalp. Reduction of my migraines. No more nightmares (brought on by hormone fluctuations). No more ""internal earthquakes"" or buggy-crawling sensations on my skin. Less anxiety (formerly triggered by hormonal changes). No more weak nails. Monthly acid reflux greatly reduced, sometimes none at all. Greatly reduced frequency of colds, flus and sinusitus. I chose the Calm with Calcium since I am dairy allergic. My body assimilates it well, much better than calcium & magnesium pills, which had little to no effect on the above-mentioned problems (in ANY ratio). Overall, I feel much calmer & more energetic. Not a cure-all, but definitely has raised the quality of my life. I highly recommend this product! …",14 out of 14 users found this review helpful
 Healthful it is not,1,"Why would anyone want to add sugar to coconut water??? I mean, what's the point of spoiling it and making to it like all the sugary drinks out there. Can the American palate not tolerate anything that is all natural that does not have added sweeteners? I bet you that no one from the Caribbean or other places that coconuts are indigenous to would appreciate the alteration of this delicious water. We who are used to it do understand that the natural sweetness levels in each coconut varies, so some may be sweeter than others, and we are quite ok with that because it is natural. Please read ingredients people- not all coconut waters are created equal. …",7 out of 12 users found this review helpful
 spinal disks,5,I take Knox gelatine on the advice of my physician to strengthen spinal disks. A side benefit is stronger fingernails. …,16 out of 18 users found this review helpful
 Nothing like the coconut water from Brazil,2,I grew up in south India drinking coconut water regularly. The brands that come from Brazil taste more like natural coconut water. Not this one. This more tastes like the tender coconut meat blended into the coconut water. …,7 out of 12 users found this review helpful
 not a true variety pack,1,"This is suppose to be a variety pack, it contains 60 packs of shortbread cookies, 30 packs of lemon and 30 packs of chocolate chip cookies. Not much of a variety as far as i'm concerned. …",6 out of 16 users found this review helpful
 Cholestrol Dropped over 50 points,5,"I have been taking this product for the past 12 months. Not only is it simple to take and easy on the taste buds, but as you will read also much more effective than I ever thought it would be. In addition, I have been taking direct source of milk thistle and tudca powder, Milk Thistle Powder 25 Grams + TUDCA Powder (Tauroursodeoxycholic) 5 Grams . I am forty-two years old and exercise regularly and eat moderately healthy. I recently took a physical for a new position I acquired with a huge company and my total cholesterol was 149. I was completely taken off guard by hearing this number because the last time I had my cholesterol checked was three years ealrier and my total cholesterol at that time was over 200. I was 39 then, and in much better shape physically than I currently am. It is true what they say that the metabolism takes a sharp decline at 40, not joke there! I assumed my cholesterol must have been at least somewhat lower but I had no idea that such a drastic change would occur. I believe these Benecol Smart Chews along with the recommended dose of milk thistle and Tudca have played a big part in this incredible drop from a once 200+ cholesterol rating. I haven't grew any younger and my lifestyle is pretty much the same as it was three years ago (if not a little more relaxed) so needless to say, these are products I can highly recommend without prejudice. …",34 out of 34 users found this review helpful
" Designed to Sweeten, not to affect flavor",5,"I only see a single 3 star review for this product currently, and that simply doesn't do it justice. It exists as a way to sweeten Teas (and other beverages) without having a strong effect on the flavor itself. I am primarily a Fruit-based Tea Drinker, and its fantastic for sweetening a batch of Tea, Iced or hot, and has no trouble being turned into a simple syrup for later application. It is indeed on the pricey side, but its well worth it for what it brings to the drink. A fine product, through and through. …",14 out of 14 users found this review helpful
 The devil is in the details...,2,"Love these cookies. They taste wonderful. No trans fat, vegan, Kosher, healthy ingredients. So what's my gripe? If you look at the nutrition label on the back of the cookie package carefully, notice that a serving is 1/2 a cookie. And, 1/2 a cookie is 210 calories (different from the info on the Superstore site, but I'm looking at the package right now -- same product, current package). So, if you eat the whole cookie (I dare you to stop at 1/2. I know I can't! I tried.), you've eaten a 420-calorie cookie. Wow. That's a lot. Sorry to burst the bubble. I take one of these to work every once in awhile to eat for lunch (and 420 calories is a large lunch for me), but that's the only way I can eat them. I bought these not realizing they'd counted the cookie as two servings (which is pretty sneaky, IMO), and relied on the Superstore site info, which needs to be updated to reflect current package count. Great cookies, but if calories factor in for you, beware. …",16 out of 17 users found this review helpful
 Unhappy customer,1,"I purchased the ""I Love You"" basket for valentine's day for my boyfriend. It was total garbage. All of the snacks were stale, I mean everything, the popcorn, the cookies, and the cheese straws. I was so disappointed, and was really embarrassed. The cellophane wrapping was even ripped..............I wish I could get my money back..... …",36 out of 36 users found this review helpful
 70% Robusto,1,"The worst thing is that they do not list the fact this is a 70% Robusto / 30% Arabica blend. I do not like Robusto coffee at all. It has the taste of smelly socks. This is personal preference. Since this coffee did NOT list that it is a Robusto blend and had such great reviews from many people (who obviously like Robusto coffee) I purchased it. I am dissatisfied with it and the item is not what I expected. Since I was not able to return it, I opened one package. Just for people to be aware. …",18 out of 25 users found this review helpful
 The Good and the Bad,3,"I've worked with different types of fondants and if you are reading reviews because you are new to the Fondant Cake process, here are some things to keep in mind: 1. Satin Ice is Yummier than most 2. Satin Ice is harder to work with than many 3. Satin Ice shouldn't be you're first ;) I started my Fondanting adventures using Wilton's, a brand that makes most professional cake decorators cringe. It isn't yummy, but it is forgiving. If you are new to cake-ing I would recommend using Wilton's the first few times to get the hang of things before moving to the more finicky fondants. If you start by using this fondant, you may be Freudianly misspronouncing it in a loud voice: ""I hate you SATAN Ice!!"" Really, fondant tears may stain your cheeks. Fondants I've used in order of easiest to work with: 1. Wilton's 2. Elite by Fondx 3. Satin Ice 4. Homemade Marshmallow Fondant's I've worked with in order of yummieness: 1. Homemade Marshmallow 2. Elite by Fondx 3. Satin Ice 4. (distantly) Wilton's I would recommend the tutorial on Satin Ice website, really great: [...] If you are only buying Satin Ice to sculpt edible animals, than this would be a great one. For first time cake coverings, try Wilton's, get things down then come back to Satin Ice. Thanks for reading and good luck on your cake adventures! Jackie domesticfits (dot) com …",75 out of 75 users found this review helpful
 An Up-sized Gummi Bear: The Gummi Bears Strike Back,4,"This is the big daddy bear of the Gummi Bears. This Bear has come on the scene to take revenge on all those that have been yumming down too many Gummi Bears. The Revenge takes place on several fronts so be warned!!!! [1] Extra sticky portions are designed to stick between your teeth to give cavities and to try to rotten them out completely. [2] If large bits are taken, the portion will attempt to make you choke. If you are successful in getting this Daddy bear down into your tummy, the revenge continues on a new level: [3] It will make you heavier, 4.5 pounds to be precise. [4] It will make you fatter, 12,500 calories to be precise. [5] It will increase your blood sugar and attempt induce a stroke or diabetes. If you are successfull in digesting the Daddy bear, he has one last trick: [6] Hint: take a very thick book the next time you go the washroom. …",9 out of 13 users found this review helpful
 90s Decade Box Gift Basket,5,Excellent selection of candies and speedy delivery. My son & his wife loved the candies while walking on the Appalachian Trail. …,7 out of 16 users found this review helpful
 Not currants,1,"Given the cost, I had finally believed that I had found dried currants. Wrong; they got me again - they sold me Zante raisins and NOT currants. …",16 out of 17 users found this review helpful
" Horrible, horrible, horrible.  Do not buy.",1,"I bought this on a whim at the store, intending to use it in risotto. I didn't think it smelled very chicken-y so I tasted it. It tasted nothing like chicken...it tasted like nothing I wanted to eat. Fortunately I had some ""Better Than Bouillon"" on hand and used that with water. I checked the Cooks Illustrated review of chicken broths - it was the lowest rated broth of 9 tested. One of the remarks: ""like an entire vegetable drawer gone bad"". I would agree with that. Stay away from this broth. …",15 out of 20 users found this review helpful
 Choking Hazard,1,"Please be careful with this product. My pug almost died today choking on one of the dog chews. I assume that the larger and smaller ones are fine, but my pug who weighs about 16 lbs (within the 11-25 lb suggestion) could not swallow the chew and got it stuck in her throat (after she chewed it until the point when it got wet and pliable). Thank god that my wife and I were in the living room to witness the accident. My dog fell over in convulsions while choking and my wife physically yanked the chew out of the dog's mouth. I think that this sized chew is very dangerous and you should think twice before purchasing it. If you do have a similar dog and want to buy this product, please supervise him/her! …",14 out of 17 users found this review helpful
 YUMMY but Expensive!,4,"OK, I have to admit these are REALLY yummy, and they don't have anything really yucky in them. As a vegetarian family finding fruit snacks without gelatin (bovine source) is a tough job. And finding them without any HFCS, artificial flavors, and artificial colors is even harder. So, as far as taste and quality go these are great. However, they're REALLY EXPENSIVE! My 4 year old could easily eat a box a day if I'd let him, and so could I truth be told. At over $4 a box, that's pretty pricey for a quick snack that doesn't offer up any real nutrition. I know quality ingredients cost more, but jeez. Maybe if they offered a bulk pack or something, reducing the price AND the packaging, it would bring down the cost a bit. …",17 out of 17 users found this review helpful
 Delicious Spinach and Potatoes,5,"Because I have celiac disease I must eat a gluten free diet, I'm also vegan by choice. This item meets both of those requirements and is also absolutely delicious. It is not spicy hot at all, perfect for typical western tastes, yet the sauce is very tasty. I've been using Tasty Bite products for years, as they have long offered gluten free and vegan items, but this is the best of all of their products I have tried. I eat it over rice and it causes me to have Happy Tummy, always good for people with celiac disease. The spinach and potatoes dominate, but I love both. It probably is not as high in protein as many other similar dishes, but not every meal needs to be packed with protein. I'd subscribe to this product if the option were available. …",13 out of 13 users found this review helpful
 Just like what you'd get with McCormicks tiny bottle,5,"I am hooked on toasted sesame seeds. I toast them in my countertop oven and keep them in a small parmesan cheese shaker and use them on just about everything. I was paying over two dollars an ounce by buying the McCormicks one ounce bottles so you can see buying in bulk this way is a very good thing. Before I bought I was confused about whether I should get hulled or unhulled. After researching I decided I wanted unhulled and so I choose this brand because everything I get from Bob's Red Mill is great. When they arrived I was relieved to see they were just want I wanted, exactly the same as the McCormicks. I allow myself two ounces of toasted sesame seeds per week. A little goes a long way because the flavor is so intense. I wanted to make some hummus and although I know it can be tasty without tahini I decided (since I have so much now) to toast and puree some sesame seeds and used about two tablespoons of the resulting thick peanut butter-like paste in the hummus along with some olive oil. Best hummus I've ever made. Update - I see the product description now includes a statement saying that the outer coating of these seeds has been removed. So I guess these are hulled seeds then? I don't know for sure but they are just like what is in the one ounce canisters of McCormicks. …",18 out of 18 users found this review helpful
 not what I expected,2,I bought this olive oil because I thought it was a good deal for a large quantity of olive oil and it wasn't nearly as much as I thought it would be. …,1 out of 14 users found this review helpful
 Truly Disappointing. Product Changed. Not for the better!,1,"We have been buying Caribou Blend K-cups for a couple of years. It is a fine medium blend that we, and everyone that we have served it to, loves. We usually order it in larger quantities to try and save some money since we go through it fairly quickly. The last order we placed for 2 x 80 boxes was fulfilled with the K-cups with green color labels (the older labels were orange around the edges). The taste of this new k-cup can only be described as vile and has nothing to do with the former product. It is not drinkable. We have written to Caribou and have been waiting for a response, but nothing yet (I will update if I hear anything). DO NOT BUY this product if you have used the older product with he orange color on the label and liked it. You will not get the same thing and this coffee is truly terrible! Deserves 0 Stars... Update - a note from Caribou Corporate: Thank you for taking the time to contact us. We certainly apologize for any confusion. Recently the packaging for Caribou Blend K Cups did change. Previously the regular blend had an orange band and the decaf had a green band. The new labels the regular is a green band and the decaf is an orange band. The coffee itself has not changed, simply the label. There are two factors that might be involved in the change you taste. The change in taste is affected by the time that has lapsed between roasting the coffee beans and brewing them...freshness. Also, coffee is an agricultural crop that varies with weather and other environmental factors. Our Roastmasters put in a lot of time and attention to provide a consistency when roasting the coffee beans. We do apologize for any confusion and please let us know if there is anything else we can do for you. Sincerely, Linda Caribou Coffee Customer Relations The coffee is Dramatically different, but they will not admit to the change. Oh, well. Goodbye Caribou Coffee. …",15 out of 21 users found this review helpful
 Simply the Best,5,There's no other on the market as good as this. I've ordered it many times. My family wouldn't settle for anything less. Simply the Best. …,23 out of 24 users found this review helpful
 Awesome horsepills,5,"First off, I think the reviews on this page are confusing. It seems to me there is a mix of people who bought the container of oil and those that bought the pills. I bought the pills and am enjoying them very much. I read news reports on how coconut oil may help with Alzheimers, diabetes and diet so I thought I'd try them since I have issues with all of these in my family line. I feel more mentally focused and alert since I've started taking them a week or so ago. I definitely plan to continue to take the pills. They are large as many people have noted (see my photo uploaded with the quarter), but they are not any bigger than any other large vitamin. The pills, like other vitamins, do have a slight smell if you stick your nose in the bottle. But they have no taste, no after taste and no gross burps later. The bottle calls for 3 pills 3x a day. 9 seems pretty excessive for vitamins. I'm taking 6 right now, 3 with my coffee in the morning and 3 with dinner since I usually only have 1 or 2 meals a day. I would note that taking these has loosened some things up, you know -- down there. It's not an emergency bathroom thing but you probably will be flowing pretty freely when you do go. I'm assuming my body will eventually adjust and become more regular but it's not really bother if it doesn't. …",25 out of 25 users found this review helpful
" Finally, an affordable, delicious green tea powder",5,"I love drinking green tea. It is delicious hot or cold, but being able to take it with me anywhere was key. So I searched long and hard for an alternative to canned and bottled green tea which can be cumbersome, expensive and hard to come by in most parts of the US. In the beginning, what I found was either too expensive, had sugar in it (which defeats the purpose of drinking green tea in the first place) or did not get very good reviews. Then I found this product and quickly ordered it at the great price and free shipping. I was pleasantly surprised. The product works as advertised. It dissolves quickly in cold water making it great to carry anywhere and it tastes great too. The instructions say to use one packet for 8 ounces of water, but actually it should be used with 16 ounces of water, otherwise it can be too bitter. It not only saves money, but has replaced my canned green tea completely eliminating the number of cans that I need to recycle monthly. …",15 out of 15 users found this review helpful
 Tried them all and love them!! but price is too high,5,Love the taste and so quick and easy. normally i am a made from scratch kind of girl but wanted to try these flavors and i love them. but so high in price 2.08 each? wow tha tis high. My grocery store has them for 1.25 each. I will get them fromt here. …,17 out of 18 users found this review helpful
 Ewww gross,1,"My first review on Superstore, and It's a real downer. Ever since I walked over the the vending machine here in the office a few minutes ago and dropped my last 75-cents on Kellogg's Cherry Flavored Fruity Snacks, I felt compelled to log on to the first website I can find that sells these and give them a horrible review, and warn everyone and anyone about this poor excuse for a food product. They taste somewhat like plastic, and the ""cherry flavor"" is worse than the worst tasting cough medicine you can think of. These don't taste ANYTHING like fruit. These are supposed to be cherry flavored, but the word cherry appears no where in the ingredients (apple puree concentrate is the only fruit item listed), and the word ""fruit"" doesn't appear anywhere at all. They also pull that bait-and-switch telling you 70 calories per serving, but there's 2.5 servings in these dinky little 2.5oz bags. These are disgusting. It's been 60 minutes and I still can't get this taste out of my mouth. Next time I want something fruit flavored, I'll just eat a piece of fruit. Don't give these to your kids unless they did some horrible thing and you're planning on using these disgusting ""Fruit"" snacks as some form of punishment. …",6 out of 24 users found this review helpful
" No meat by-products, good and safe, Turkey & Chicken Dog Food",5,"Everyone knows about tainted pet food from China. Newman's Own is a branding that I can trust, and this one is a real winner. Newman's is what I would make if I were making it for my own family, as in you can trust that it is great tasting, good for you and safe to eat. I'm very pleased that the Newman's line was extended from people food to pet food. When it comes to moist dog food every single choice on the market has meat by-products except Newman's Own. My 3-month old puppy goes crazy for this, as well as for the Chicken-only Newman's canned dog food variety. In fairness he would probably go crazy over meat by-products too. While they *may* never hurt his health, I won't give him any, that lucky dog. One other finding: When you open almost any moist dog food you smell ""dog food"". When you open Newman's Chicken or Chicken & Turkey you smell meat. It actually smells good. Imagine that. …",29 out of 29 users found this review helpful
 Changed the ingredients to now include meat products! ZERO STARS,1,"We discovered in puppyhood that our boxer was allergic to chicken, beef and pork and had to be restricted to a fish- and vegetable-based diet. He has been on the veterinarian-recommended Eagle Pack anchovy, etc. fish-only dry food for eight years... his entire life, and with fabulous results. We noticed recently that his allergies were acting up. I just sat down to order another 30-lb. bag and while price-comparing, the ingredients list caught my eye: They now include chicken and pork products! How can you advertise that this food is good for dogs with allergies and digestive issues when you start including the very ingredients to the food we owners turn to in order to AVOID the allergic reactions and digestive issues? I gladly paid top-dollar for this food, even when the price increased during the recalls of other brands over the past few years (NOTE: This brand was unaffected), because I was glad and thankful to be secure in my knowledge that I was protecting my dog's well-being with a trusted company who seemed dedicated to serving this smaller market for special-needs food. I suspect Eagle Pack is trying to cut costs by decreasing the amount of fish-based ingredients and substituting the less-costly poultry and pork. I can no longer trust this company since they have clearly put canine health far behind their bottom line. I also suspect their corporate attorney approved the change due to some loophole(s) in truth-in-advertising laws. Did they think consumers such as myself would not notice?? We pay top-dollar for this type of food because we need it! Heaven forbid a beloved pet has a severe reaction or dies as a result of this. How long have I and other owners been putting our dogs' health at risk?? I just hope I can find another fish-based dry food without poultry, pork or beef products. There are so few, this is another reason I am baffled... Eagle Pack had this market cornered because their fish-only version was superb. …",8 out of 12 users found this review helpful
 Tastes disgusting!,1,"I normally don't write reviews, but I wanted to spare others from tasting this chocolate. I was looking for an alternative to the Dr.'s chocolate (sweetened with xylitol), and so I ordered this product. Once I opened it, I ate two small squares of the bar. From the first taste, it was ok. It was the aftertaste that had me on the couch trying not to vomit, that prompted this review. It's taken about two hours, a few apples, and some melba toast to re-settle my stomach. You'd have to be pretty desperate to eat this nasty chocolate. I think you'd be better off just eating unsweetened bitter chocolate than any chocolate sweeted with Stevia. …",9 out of 13 users found this review helpful
" Waste of Money, Waste of Resources",1,I tried this product out of curiosity since it was new. It tastes like all the others but with a much higher price tag. I am now at the point where I think bottled water is such a waste of money and natural resources - clogging landfills with all the bottles that no one recycles - that I am going to buy a water filter for my sink and just use that. You can also buy packets of electrolytes from companies like Emergen-C and add them to your water. I used those when I ran a marathon and they worked wonders! Save a buck and save the environment...use filtered water in a bottle you can reuse. …,8 out of 12 users found this review helpful
