Title,Star Rating,Review,Helpfulness
 A major improvement in menopausal symptoms,5,"I tried this product after researching menopausal heart palpitations and internal tremors on www.power-surge . The relief was immediate! What surprised me was the improvement in many other aspects of my health. No more headaches that feel like a tight cap binding my scalp. Reduction of my migraines. No more nightmares (brought on by hormone fluctuations). No more ""internal earthquakes"" or buggy-crawling sensations on my skin. Less anxiety (formerly triggered by hormonal changes). No more weak nails. Monthly acid reflux greatly reduced, sometimes none at all. Greatly reduced frequency of colds, flus and sinusitus. I chose the Calm with Calcium since I am dairy allergic. My body assimilates it well, much better than calcium & magnesium pills, which had little to no effect on the above-mentioned problems (in ANY ratio). Overall, I feel much calmer & more energetic. Not a cure-all, but definitely has raised the quality of my life. I highly recommend this product! …",14 out of 14 users found this review helpful
 Wow! Chocolate without the guilt.,5,"In a word: amazing. Imagine chocolate without toxic sugar and gas- inducing malitol. They're high in fiber and great in taste; ChocoPerfection is the way to go if you're on a diet and want to indulge now and then. I believe the woman who makes these delicious treats initially came up with these chocolates as a way to lose weight. Whatever the reason, way to go! I highly recommend them. By the way, if you find the price a bit too high, remember that they are sweetened with erythritol which will command a higher price since that particular sweetener is pricey. …",13 out of 13 users found this review helpful
" OVERPRICED, ARTIFICIALLY CARBONATED WATER",1,"Well I did find their radio ad & music enticing (""Dinner at eight, San Pellegrino...""). Talk about incongruity. Read the LABEL. CO3 added. This is flat water pumped up with artificial carbonation. At least they reveal it, unlike another mineral water company which hid this fact. Conclusion: does not belong in the same catagory as waters that are bottled in their true carbonated state. Save your money, buy a 12pk of seltzer or club soda in 12 oz cans for about four bucks. Reason for recommending cans: once you open a bottle or can of sparkling water, they go flat in no time flat (no pun intended). …",2 out of 13 users found this review helpful
 Please avoid!!,1,"Please do your research on pet foods and what is actually good for your cats. Hills science diet is a horrible food filled with horrible ingredients. They charge an outrageous price because it's the #1 vet recommended food. This is a joke and the only reason why it's rated #1 buy vets is because Hills gives money to soon to be vets to help them go through school. Then they sell the cat food to them cheap so they can jack up the price and make a nice profit off of your marketing foolishness. Read the back of the labels of Hills brand and you will see that most of the top ingredients are grains or cheap meat by products which are the feathers, bones, unwanted organs from animals, basically all of the stuff we wouldn't eat. try something like orijen or evo. …",9 out of 13 users found this review helpful
 The best Hemp protein so far,5,"I will start by saying that I feel all hemp protein is gritty, and a bit hard to swallow. I was really happy with the Vanilla spice. It has been the best hemp powder I have tried to date. It has a wonderful sweet vanilla flavor, and is finely ground, so it's not as chalky as others. I usually buy Nutiva(which is also good) but to me this is much better. I mix it in a glass of soy or almond milk with breakfast. I would not recommend mixing this product with plain water. I love the benefits of hemp protein. I have already placed an order for my second container! …",19 out of 20 users found this review helpful
 The only food I will feed my dogs!,5,"I have two senior dogs that were on a raw natural food diet for many years. I had been hard pressed to find something that would fulfill my pets nutritional requirements while being comprised of healthy ingredients. This is it! Even my vet, a fierce advocate for raw food, approves of this. My dogs love it, I no longer have to mix my own ingredients together, and I have peace of mind knowing my beloved pets are being fed high-quality food. They devour every last particle! …",12 out of 12 users found this review helpful
 This product almost killed my Border Collie,1,"We gave this treat to our three year old border collie, and within minutes she began vomiting blood. We rushed her to the vet and he could find nothing wrong with her. Her vomiting stopped. We were not sure why this had happened. We suspected the treats but were not sure. Three weeks later we tried again, giving her a small piece. Same effect! She became even more ill and began vomiting blood! We rushed her to the emergency care for dogs and they checked her out completely. They could find nothing wrong. Her vomiting stopped. We will never give her these made in China products again. You have to look closely, when we first looked we say Newport Beach, CA and thought it was made there but more careful inspection showed it's made in China. Your dog can't tell you if this is making him/her sick, they are a lot tougher than we are and don't complain like we do. …",18 out of 25 users found this review helpful
 Overpriced!!!,1,Many online retailers have this so much cheaper! The 12pack is only $10.99 on Bed Bath and Beyond's site! Why are they so expensive here? It makes no sense! …,2 out of 16 users found this review helpful
 Great Bullion And Value,5,"I bought two bags of this along with some beef broth from the same company. Despite the negative reviews from a couple of folks here that it has MSG, and that it also contains chicken broth (really??....Duh!), I highly recommend this powder for its excellent value and rich taste. Since it comes in a powdered form it is much easier to personalize to your taste. It also contains a little less sodium than cubed bouillon. (For anyone that cares about that sort of thing). I don't make chicken soup every day, and hardly ever during the summer months. So when I do I want it to taste really yummy. And that means using the best tasting stock I can find. Unless you are someone that is either sensitive to MSG, or just chooses to avoid it, I highly recommend this chicken powder. Trust me, I think you will like it....Bon Appetite! …",16 out of 18 users found this review helpful
 Please check the controversial ingredients and decide for yourself,3,"While several reviewers have alluded to the healthfulness of this product, I think that we owe it to our beloved pets to pay closer attention and educate ourselves about the actual ingredients. The overall appearance gives an allure of wholesomeness to this product, but an item listed in the ingredients is actually controversial with regards to our pets' health. (And if you're considering this food good enough for your own consumption, please note that the ingredient is also potentially toxic to human organs). Here's the list of ingredients, from the manufacturer's website: Fish broth Tuna fillets Yellow fin whole loin tuna/red snapper/shrimp/sole Soy bean oil Trialcium phosphate Guar gum Calcium sulfate Carrageenan Vitamins and Minerals Vitamin E supplement Vitamin A supplement Vitamin D3 supplement Zinc Sulfate Thiamine Mononitrate Manganese sulfate Menadione sodium bisulfite complex (source of vitamin K activity) Riboflavin supplement Folic acid Pyridoxine hydrochloride Copper amino acid complex Iron amino acid complex First of all, it's great that the manufacturer has whole seafood as the major ingredients (as opposed to the by-products, meal, grains, etc). But there is one item which I would not have expected to find in something of this quality: Menadione sodium bisuifite complex. Menadione is a synthetic precursor for the K vitamins and has been reported, at high doses, to have toxic effects. Moreover, I had actually never seen menadione listed as an ingredient in other cat foods (though there seem to be others out there). A little bit of Internet sleuthing yielded some disturbing information, which I feel obliged to list here. *Menadione is banned by the Food & Drug Administration in over-the-counter supplements due to its potential for organ toxicity. It's also banned in Europe for human consumption. *There are safer alternatives to menadione for proper K vitamin-related functions (e.g. blood clotting). The use of menadione over the alternatives (leafy greens, kelp) is only for cost-saving reasons, hence usually only found in cheaper and lower quality animal food. *A study in rats showed that exposure to menadione ""produced lesions in the kidney, heart, liver and lung."" Chiou et al. Toxicology 1997. *Menadione's toxicity seems to be due to its ability to induce oxidative stress in cells. There seems to be a pet food watchdog trying to stop the inclusion of menadione in pet food: [...] Does this information mean that this food is bad for our cats, when normal doses are given? I don't know for sure, but I wish that I'd been more aware about this ingredient before feeding it to my cats. Admittedly, more research needs to be done regarding this subject. In light of recent episodes of toxic pet food and the questionable behaviors of manufacturers and our regulatory agencies, I'm erring on the side of caution on this one. …",91 out of 98 users found this review helpful
 Do not order this product....,1,"It has been over three weeks and I still have not received this product. And, they have charged me for it already... …",0 out of 12 users found this review helpful
 Surprisingly good!,5,"I have to start with the fact that I was extremely skeptical on a chocolate coconut water. I expected a watered down chocolate milk taste. I was actually resistant to try it the first time for fear of ruining my coconut water experience. Needless to say with my five star rating I was impressed. This beverage is hands down the healthiest way to get your chocolate fix and hydrate at the same time. I have converted at least half a dozen people over to this beverage. Everyone has that ""commercial"" look of being surprised on how good it is. I highly recommend this product and think it is a home run for Zico. I expect some of the other brands to follow soon. …",15 out of 17 users found this review helpful
 moldy,1,"These bars are normally good but the shipment we got was moldy and inedible. Superstore's customer service was very helpful, agreeing to send a replacement box without requiring us to send the bad bars back. Unfortunately the second shipment was every bit as moldy as the first. I would not order from this vendor again until they get their act together. …",18 out of 29 users found this review helpful
 Wasn't the same as description,2,"There is a list of 18 items in the description of this basket. I only received 16 and a couple of them were duplicates. There are also things that weren't on the list at all. I figure there's 5-6 items in the description that weren't included, and one of those items (the licorice candy) was one of the reasons I chose this package (one of my coworkers loves licorice). I understand it's probably a busy time of year for them but I'm still disappointed. I would return it but it's getting too late to order something else. EDIT: I wrote Superstore customer services and told them I was disappointed with the item but wasn't going to return it because we'd went ahead and started eating it and it was getting too late to get something else. They wrote back within an hour and said they were crediting me for the basket. So five stars to Superstore for customer service! That's impressive and they have a loyal customer in me now. This is the first problem I've ever had with an Superstore order, and now I see how they handle things. :) …",16 out of 17 users found this review helpful
" Fry, Chicken!",5,"This oil is great, high smoking point, great for deep frying. It doesn't actually add any flavors to food when you use it. So you taste the food and not the oil. …",15 out of 15 users found this review helpful
 Some of the worst stuff on EARTH!,2,"Only things worse are as follows: Liver Okra Asparagus Brussel Sprouts (SP?) Lemon Marangue pie (SP?) Anything lemon, besides the sodas Horse radish sauce Olives, any color Beefaroni Ravioli Spaghetti in a can And other disgusting foods (BLEH!) 2 stars. …",0 out of 14 users found this review helpful
 This is the only starter to use!,5,"I tried this with 2% milk, 1% milk, fat free, and lastly with goats milk I bought by the quart at Walmart, it is the richest most delicious yogurt ever (my husband is the one I make it for) I add a lg teaspoon of honey, mix it up and there is nothing better, the tartness blends with the sweet. I let the machine work for 8 hours and it is custard like. Excellent …",16 out of 16 users found this review helpful
" All it takes is one death, and these will be pulled from market",1,"We're pretty avid Whole Foods shoppers now, and have felt pretty good about purchasing organic baby food for our now 9.5 month old son. Earth's Best brand has been popular with him, so we bought these teething biscuits recently. Today, he could have died eating one. Although I'm an anesthesiologist, and half of my job is to ""protect people's airways"", one needn't be a medical professional to realize why these biscuits are dangerous. Most babies get their front teeth (upper and lower incisors) first, long before molars arrive. So, they're limited to biting with their front teeth, and only mashing with their gums (where their molars will someday erupt). These biscuits are great for the first 5 minutes, baby happily chomping away on the hard surface. Then, they soften. Pretty soon, baby bites clean through the biscuit with their front teeth (size of chunk depending on how far they had inserted it into their mouth at the time), and the chunk that remains in their mouth is WAY too hard to mash with gums. Baby has nothing to do but try to spit it out (difficult at this age), or swallow it whole (if lucky enough for it to be a small piece), or have it completely occlude their airway. We were able to quickly fish one large chunk out with our fingers, but our poor soon started gagging, tearing, and wretched once before something resolved (still don't know if he swallowed a large piece or if it ended up on ground), but not before we scooped him up and tried to knock it loose with some back blows. In any case, although the kids may love these, all it would take would be one infant death from choking to prompt a recall or something. Why risk your own kid? …",12 out of 12 users found this review helpful
 Ummmm...white chocolate is NOT real chocolate....,5,"It cracks me up hearing people crying on here that the product ""doesn't taste like hot chocolate"". Well duh, that's because it's hot WHITE chocolate which isn't actual chocolate, it is the cocoa butter that is produced when cocoa is made, then it is sweetened and made into whatever. The result is a creamier, sweeter and smoother taste which is NOTHING like actual chocolate, so unless you are a fan of white chocolate and are expecting this to taste like real chocolate you ARE going to be disappointed. I am a a fan and love it and my K-cups, I have the platinum B-70 coffee maker so I can make a 6 ounce cup if I want it to be extra tasty or 8 ounce if I want it more mild. I would suggest giving it a quick stir as all the flavor can somtimes settle. It's delicious and for those of you who are giving this a bad review because it ""doesn't taste like hot chocolate"", it's not supposed to, stick to that gross Green Mountain Cocoa that tastes like choco-chalk water! …",72 out of 79 users found this review helpful
 Not the miracle I anticipated,3,"Sambazon Acai Powerscoop Powder 90g from Sambazon As a person with an auto-immune disease, where chronic fatigue is a major obstacle, I have navigated through many nutritional support options to supplement a healthy diet and when I first began to read about the Acai Berry, I was interested in trying it. I have used other anti-oxidant products from very dependable sources, and there is just no dramatic difference I detect with this product. Freeze dried Acai appears to be the most dependable formulation for delivery of the benefits of the berry, but I honestly noticed no change after a month trial. (I actually had to stop taking this product for a few days as for some reason, perhaps attributed to the pH of the supplement, I found the product worsened my gastritis). I give the product three stars, because I do believe that for some people, they may see remarkable results, but I certainly did not. I still believe that this product is worth a try, for all the reasons that the Acai Berry has the potential to yield wonderful changes in overall health. It just did not do it for me. Good luck to those who choose to try this. I would recommend this brand because of the preference of the freeze dried state to hold onto all the nutritional ""miracles"". Don't get succored into cheaper brands. The nature of a complicated illness may or may not be a factor that determines clinical outcomes. Healthy supplement options are at times only as good as the Company that makes them. I do believe that the Acai Berry is a very important food souce. Besides the wonders of its potential health benefits, it is a product that ensures the preservation of the Superstore Jungles. On the flip-side, the less we eat hearts of palms which comes from the same tree and literally ensures the destruction of the tree to harvest the hearts, the better. …",26 out of 41 users found this review helpful
 The premier bulk sweetener,5,"Erythritol is the bulk sweetener that the sugar free food manufacturers should be using. It has many advantages over the ones most used by the manufacturers such as maltitol, sorbitol, mannitol, lactitol and xylitol. First, Erythritol has only 5 calories per ounce while the others have between 40 and 90 calories per ounce. Also, Erythritol has a glycemic index near zero while the others can be as high as in the 50's such as maltitol syrup. A low glycemic index is highly desirable as it does not cause an insulin spike which is a problem for those of us who are prone to overeat. Also, and most importantly, Erythritol has a far better laxation threshold than the others. For the uninitiated, this means that one can eat twice (or three times) as much erythritol as the others before having to go to the bathroom. Some of the candy makers used to use Erythritol in their sugar free candy bars but they stopped and substituted maltitol. Hershey foods in particular should bow their heads in shame as they had the best product made with Erythritol and ruined it with maltitol. The new maltitol laced product has more calories and is more likely to cause the ""Runs."" I sometimes think the candy companies are in league with the toilet paper companies. I use erythritol to make my own sugar free candy along with a good brand of unsweetened baking chocolate (e.g. Callebaut, Valrhona) along with some fiber such as inulin or polydextrose. If you do not wish to make your own candy with this product you can find some excellent ones on the internet that use Erythritol such as choco-perfection bars or chocolite bars. …",17 out of 17 users found this review helpful
 Dogswell Happy Hips - Made in China,1,"I had bought this product last year my dog loved them, but... I subscribe to a couple of Bichon Frise newsgroup and they are saying not to feed these to your dog as they come from China I threw out what I had left for the outside critters in the forest. I called Dogswell today and they verified that even though they say U.S. on them they are still coming from China. …",77 out of 85 users found this review helpful
 Excellent odor control and soft on the paws!,5,"I bought one bag each of the micro crystals and the Pearl crystals by Ultra Pet. Having used Fresh Step Crystals since my two cats joined the family over a year ago, I didn't want to shock them with the switch so I tried the Pearls first as they are larger crystals. I layered the Pearls with a thin carpet of Fresh Step crystals and they seemed to take to it well enough. The odor control was equivalent (superb) to Fresh Step which is a big thumbs up from me and the two ""boys"". After finishing that bag, I went to the Micro Crystals. Before I could even start to put a layer of the Fresh Step on top, one of the cats leaped into the box and basically started dancing around in the litter. I don't know if it's because of the sand-like quality compared to the hard, rough crystals but he was literally having a ball just spinning around in the box. I guess it took his brother shoving him out to go do his business for the first one to figure out it's not to play in! All in all, both products I tried were superb quality and highly absorbent with long lasting odor control. I'll be purchasing the Micro Crystals because it's easier on MY feet considering they do tend to throw this all over the floor before they ""go"". It's unfortunate that there's a 3 week shipping delay and there's no subscribe & save option. If not for those issues, I would make the full switch over to Ultra Pet litters. …",17 out of 17 users found this review helpful
 Great taste - poor packaging wastes k-cups,3,"I love the taste of this coffee. But apparently they have poor quality control. These K-cups come too full and they tend to not brew properly. You can always tell when you got a bad cup, because the grounds are so packed in the cup that the water doesn't come out completely and your cup of coffee will have less liquid than you are used to. Sure enough, when you go to lift the K-cup out of the Keurig for disposal, you will find it is very heavy compared to others. We also know this is a problem with Coffee People DOnut Shop k-cups only, because my husband drinks a different brand and never has this problem. It doesn't happen all the time, and I have found if I shake the k-cup before putting it in the Keurig, it happens less frequently, but it still happens. I've tried ordering from Coffee People multiple times to see if it was a one time manufacturing glitch, but it appears every time I buy a box of their K-cups I have a problem with 10-15% of them. Fortunately, another brand is offering a donut shop coffee which I tried with this last order and I find it just as pleasing. …",116 out of 128 users found this review helpful
 shipping issues!,1,"The issues I have with this item have to do with the shipping. I have not tasted the product yet, so cannot comment on taste. The first order arrived with one jar compromised and green/white mold on the cardboard box and noticeably less sauce in one container. The container was not cracked or broken, but somehow it leaked out. Customer Service was helpful and sent a free replacement. That just arrived today and that package was even worse! Black, fuzzy mold was widespread on the cardboard box and container label. This time I just asked for a refund - I'll not try a third time. The sauce might taste lovely, but it doesn't seem to handle the shipping process very well. …",27 out of 33 users found this review helpful
 I can now type without thinking,5,"Before I used this product it hurt to type, not physicly but mentaly. I worried was I good enough to type? After drinking Kombucha for one week I feel nothing, I am now mentaly pain free. I use to think twice about offering up my review on a product. With Kombucha in my belly I type away on reviews feeling no pain, in fact I feel nothing in my head. Thank you Kombucha! …",3 out of 20 users found this review helpful
 zip fizz,1,The product was wet in the tube as if the tube was not seiled correctly. …,3 out of 22 users found this review helpful
 Primo Catnip,5,This is primo cat weed. Cats that can generally take or leave catnip can't resist the stuff. …,46 out of 49 users found this review helpful
 kids fight over them!,5,"these are delicious and full of green foods-what could be bad? my daughters fight over these bars, i had to get a case. the flavors are natural and realistic, not too sweet. true, the chocolate coating may melt in a toddler's hand or on their face, but that always happens. i keep them in the fridge to keep that at bay. enjoy! …",14 out of 14 users found this review helpful
 This order never came,2,I've used the product before and love it but there is just one problem.... The order never came and I ordered it a month and half ago. I think I would do better ordering it from some where else. However I gave the product two stars because the product itself is good. It would have been five if I had recieved the product. …,1 out of 12 users found this review helpful
 Watch out for stale products from Superstore,1,"I bought a case of Kashi GoLEAN cereal from Superstore in December 2007, and opened it only to find an expiration date of March 2008. According to the manufacturer the cereal has a shelf life of one year and therefore has been sitting on the shelf for the past nine months. Superstore offered only a partial refund for the stale product. …",6 out of 12 users found this review helpful
