Title,Star Rating,Review,Helpfulness
 My little yorkie is 14 years old and developed digestive problems a couple of years ago,5,"My vet gave him a prescription diet which helped him tremendously but he HATED it and wouldn't eat it until he just couldn't stand being hungry any more. With my vet's okay, I started mixing just a little of other types of canned food with the prescription but after a few days I could see he wasn't feeling well and his problems began to return. Finally, I picked up a can of Newman's organic and mixed that with his prescription. Not only did he like it, he was fine! I can't give him this alone - he still must have the prescription - but as long as it is at least half the prescription mixed in, he can eat it every day and he is fine! I was so happy! And so was my little dog! …",20 out of 20 users found this review helpful
 Natural Calm Magnesium,5,"I have used this product before in the calcium/magnesium blend. It was suppose to be tasteless. It wasn't. It tastes awful. This lemon-raspberry tastes okay and the product is more reactive when the hot water is added. I was medically advised to take my magnesium in this form because of slipped disks in my back. This is only one piece of my back program however I can attest to the efficacy of the product. My disks are no longer slipped. It has helped me to heal. A bonus benefit for me is that taking the magnesium in this form has stopped the migraines that I have had for 36 years of my life. I have learned that if a headache begins that I need a dose of Natural Calm. I was dealing with a magnesium deficiency. I would highly recommend this product to anyone with muscle or joint issues, migraines,and back issues. Calm Raspberry Lemon Flavor 16oz, Natural Vitality …",94 out of 120 users found this review helpful
 UHHH..Is that ALL?,2,"Box arrived as pictured. So beautiful! I was so impressed...until we opened each box. Not as pictured! In the ad, the boxes are over flowing with goodies...in reality, the snacks come in a hard plastic bag...not even as big as a single bag of animal crackers. Even the popcorn boxes that are supposed to be the big treat boxes have a cheap single serving of popcorn in them. Good thing I bought this on a lightening deal! If I had paid full price, I would have been very upset! The best thing about this tower is that after the boxes are all empty, little kids can use them for stacking blocks! …",13 out of 14 users found this review helpful
 Doesn't get much better,5,"Long time Oatmeal eater here. I usually bought McCann's in the store, but it can get pretty pricey. Superstore is a great deal, and you get free shipping. FYI, medium- to long-term is it unhealthy to consume steel-cut oatmeal UNLESS you soak it in warm water with something acidic between 12 to 24 hours, preferably some fermented milk product like yogurt, kefir, buttermilk, etc. Reason being is that oatmeal contains in its hull enzyme inhibitors that have a chelating effect on your body, i.e., they remove metal from your body. While short-term this may be beneficial (meat eaters stockpile extra iron, copper, etc. over time), medium-term this could lead to deficiencies in essential metals. Soaking the oatmeal at least overnight neutralizes the enzyme inhibitors. Additionally, it allows you to cook up the oatmeal in about five minutes, versus over 30 minutes when left unsoaked. This recipe follows the recipe in Nourishing Traditions, but basically soak one part oatmeal with one part lukewarm water. Add a little bit of yogurt to create the acidic environment: I use one TBSP per 1/2 cup of oatmeal and 1/2 cup of warm water. Oatmeal should be eaten with some fat (many of the vitamins are fat soluble), so I add butter or cream. I also add shredded flax and coconut, increasing the healthiness of my breakfast. I then top it off with plenty of raw honey (also from Superstore), which sweetens my porridge and thus makes me look forward to breakfast in the morning. Enjoy! …",27 out of 32 users found this review helpful
" Great Taste, more Maintenance Required",3,"I enjoy the flavor of the Green Mountain Hot Chocolate. I found that after brewing, the nozzle (that sharp plunger that comes down from the top) was clogged with a small amount of chocolate paste. Nothing major, but I needed to clean it off immediately, before it dried. I used my cleaning tool, a thin tiny dental brush &lt; Easy Brush Cleaners 10 ea >, and removed a bit of chocolate from the nozzle. Never a problem after that, as long as I clean it each time. When I use coffee only, I only need to clean the nozzle once every 2 or 3 weeks. I think it's the different consistency of chocolate powder vs. ground coffee. I own a Kuerig B40 at the office and a B77 at home, same problem. …",28 out of 29 users found this review helpful
 Organic is the way to go.,5,"-I'm editing my review because due to travel, I've been forced to buy various brands of regular black beans at the grocery store. These Natural Value beans are 1000 times better than regular canned black beans you buy at the store. Seriously- they taste better, they look better- way blacker- their consistency is way better- they are just far superior. In my original review I said all black beans were the same- NOT TRUE!! I can't wait to get back home so I can stop eating crappy black beans from the store.- Organic farming practices are way better for the environment and the watershed, therefore even though these and all canned black beans taste, look and feel exactly the same either way, you know you aren't contributing to the huge dead zone in the Gulf of Mexico by supporting all the farms that spray chemicals all over their fields. SO buy up. …",7 out of 14 users found this review helpful
 Great butter by the best coconut brand!,5,"I purchased this along with the Artisana Raw Organic Coconut Oil. After having tried about 4 other coconut oil/product brands, Artisana is BY FAR the BEST tasting. This butter is heavenly...it is hard so when you melt it you can spread it on apple slices, banana slices, on toast, or in between two cookies or two graham crackers...YUM! Plus, it offers the good fat from the coconut, along with fiber, amino acids, and minerals. Awesome. You will not be disappointed with this brand. P.S.- Artisana is an environmentally-friendly company, and uses only glass jars to store their oils and butters. Very important to purchase only glass jars with fats because they can oxidize quickly and can absorb things that leech out of plastic! …",48 out of 49 users found this review helpful
 My Dog Thinks This Is Her Treat For the Day!,5,"When my vet told me my little Yorkie had stage IV luxating patellas (knees blown out), I was devastated. The vet told me to give her Glucosamine & Chondrotin. I went to the local pet chain and spent a considerable amount for the ""chicken flavor"" tablets. For such a large chain, tablets were the only product they carried. They are hard tablets not easily broken in half for a small (7lbs) dog. On top of that, she wouldn't have anything to do with them, took her little nose and pushed them away. I had to start crushing them and hiding them in a piece of people food. It was such an annoyance, I began a search for a different product form and found Zuke's online. They are soft, she can't wait for her Zuke's treat every day! No more crushing, I still have the tabs left and will now only use Zuke's. The product also includes beef, fruits, vegetables and more. I am so happy with this product, I will continue to use it. My little Echo has perked up, jumps, runs and one would never know she has this condition. This condition, at this stage, is correctable only by surgery; thousands of dollars which I don't have. I thank the founder of this company, Patrick in memory of his dog Zuke. They also donate to the Dog & Cat Cancer Fund. I know this is a long review, but that's just because this product really deserves kudos. As a side note, my pain management physician also recommended ""Golden Aloe"" daily to help with the arthritic pain that sets in with this diagnosis. So she both and is doing well. She's my best friend, I'm on disability and won't be able to afford the surgery if and when it's required so I am really relying on these products to keep her comfortable for as long as possible and she is only 3 years old. …",26 out of 26 users found this review helpful
 Manuka magick!,5,"This is an excellent quality Manuka Honey product. There is a bit of confusion over the UMF, MGO and OMA rating thing. UMF is the original and trademarked. MGO is a newer rating system that does not directly correlate to UMF but is accurate nonetheless. OMA is Wedderspoon's own rating system for determining activity within the raw honey. From my reading it appears to be pretty equitable to UMF. This honey is also USDA Organic certified (although that doesn't mean as much these days) to ensure that there are no additive ingredients to the product. As for usage, I have two jars of this honey. I used the first on my wife's wounds following MOHS surgery for removal of skin cancer. The results were amazing and the surgeon and plastic surgeon both asked what we were using to allow the wounds to heal up so quickly with minimal scarring. There was also a staph infection as a result of the surgery that the honey took care of as well. It takes a bit of diligence to ensure daily dressing changes with fresh honey, but the results pay off. I ended up pre-soaking gauze with the honey and sandwiching between two layers of plastic wrap to create more manageable ""bandages"". These were used by my wife when she traveled in addition to direct application to the cleaned wound bed. Basic process: Clean wound with Hydrogen Peroxide, follow with colloidal silver in nebulizer, then drizzle honey into wound and cover wound with pre-soaked gauze pad. The last bit is to cover the pre-soaked pad with a waterproof dressing like a Telfa-style pad to reduce oozing onto clothing/bedding. Care must be taken in finding adhesives that do not irritate the skin too much with the frequent dressing changes. There are also larger waterproof wound dressings with silver-impregnated that might be a good combination. Main idea is to minimize air-space and keep honey in constant contact with wound bed. If this all sounds new, do some research on honey for wound care at the University of Waikato in New Zealand courtesy of Dr. Peter Molan. Note, this honey is not ""sterilized"" via gamma radiation (which is not supposed to reduce activity in the honey like pasteurization) but is still highly effective. Honey is resistant to most any spoilage due to its activity and the sterilization process is just an extra step some honey manufacturer's take (Comvita or Summerglow) to be able to sell their products as medical devices in the US. It will allow the honey to be FDA-approved. Again, as I understand this is not a requirement but is done largely to gain approval for medical usage in hospitals and clinics. Check out Medihoney dressings. BTW, I have also used this topically on oral canker sores with great effect! Sores dissappeared in days and not weeks! Applied directly 3 x day. Lastly, the other jar I use for tea and even coffee and it is delicious. It has a strong floral taste and finish (as would be expected) and is alittle more viscous than other Manuka honeys I have tried. I have tried nearly all Manuka honey brands from NZ as I visit often and find this to be a great option for those of us who need a high-quality active raw Manuka honey without paying a load for shipping up the stuff from down under. Or you can just ask a friend heading that way to bring you back some :P …",429 out of 436 users found this review helpful
 High Fructose Corn Syrup,2,"I think a name like ""Nature Valley"" is misleading, considering there are several unnatural ingredients in these granola bars (like high fructose corn syrup). They taste fine, they sustain - but they're not healthy or natural. …",7 out of 17 users found this review helpful
" article is misleading as one states glass bottles and i received plastic bottles., outlaw plastic please!!!",2,Misleading advertisement! Ad stated glass bottles and mine came in plastic bottles. I ordered this item because it was in glass! I am really dissapointed in this order. …,9 out of 14 users found this review helpful
 The best chocolates in the world,5,"These are the best chocolates in the world, all the others dim in comparison including godiva. …",12 out of 15 users found this review helpful
" 1/10 as strong as other brands, won't disolve in HOT coffee",1,"I've loved using NuStevia for 5 years. I tried using this stevia instead. It's won't dissolve in HOT coffe. It takes 9 packets of this brand instead of 2 packets of other brands. Customer service refuses to pay for me to ship this back to them. Do not waste your money on this diluted, non-disolving stevia. It's cheaper to buy a more concentrated brand that will disolve in coffee. …",11 out of 15 users found this review helpful
 Why this isn't a common US tea is beyond me.,5,"Traveling world wide, I've come to much prefer good tea to bad coffee, and good teas are so much more common. Yellow Label is one of the most popular teas in the world because it has a rich, clean flavor without bitterness. Its clear distinctive red color makes it also one of the prettiest. The only supermarket teas I've found in the US that taste similar are the ""English Breakfast"" labels. If you like these, or like strong black tea flavor without the bitterness or muddiness of overbrewing the usual black teas, you should try Yellow Label. …",14 out of 14 users found this review helpful
 Terry's Milk Chocolate Oranges are a treat not to be missed!,5,"The first time I had a Terry's Chocolate Orange was during Christmas, when our local ""Superstore USA"" stocked them. I love chocolate. And orange-flavored things are among my favorite flavors. I never once imagined that combining the two flavors would yield one of my favorite desserts in the world! The folks in England got it right when they began to make Terry's Chocolate Oranges! Buying these in bulk are totally worth the price you pay for them - they are meant to be savored. One orange can last you a month if you really, really try - but they can also disappear in just a few hours, if you aren't careful! They might look like they're pretty delicate, but trust the label when you read ""Whack and Unwrap!"" Take the ball in your hand and turn the orange so the bottom of it is facing downward, find a sturdy surface like a kitchen countertop, then raise the orange up high, and whack it down hard onto the flat surface. You'll feel the individual ""slices"" form, and then you can unwrap, pick out a slice, and savor its delicacies! Buy them today, so this can remain a staple in Superstore's food store! I don't want them to disappear anytime soon! I'm going to order another case in a few weeks! 1,000,000,000,000,000 Stars, if possible!!! …",14 out of 17 users found this review helpful
 Works great! But how does it compare to Solofill?.... Read on,5,"This Ecobrew reusable Keurig K-cup is great for brewing your own coffee. It seems to have been very well designed and is easy to use. One of the things I felt bad about when I bought my Keurig coffee maker was the fact that although it was a great convenient coffee maker... it does tend to produce lots of waste when you buy the disposable k-cups. I think this product also ends up saving you lots of money in the long run too. K-cups can be quite expensive. I really love this product and I really can't find anything bad to say about it. There is another product called the Solofill that essentially does the same thing but is made from another company. I own both products and if you're curious to how they stack up against one another, check out the paragraph below. You may want to do research to make sure that your Keurig coffee maker is compatible with the EcoBrew or Solofill. I know that some K-cup coffee makers are not compatible with these products. I own the MR. Coffee single K-cup coffee maker and can say that it's compatible with both of these products. If you want to know more about the Mr. Coffee Keurig coffee maker, feel free to read my review on that as well :) EcoBrew VS Solofill First off, I'd like to state that I purchased both the Solofill and the Ecobrew. Both of these products are really great reusable Keurig filters that let you brew your own coffee in a Keurig coffee maker. These essentially let you make your own K-cups with your own coffee... and they're reusable! I would rate the Solofill as 4.5 Stars out of 5 and the Ecobrew as a 5 out of 5 Star Product. The Ecobrew is a bit better than the Solofill because it is easier to rinse out. The Solofill tends to collect grinds at the very bottom and it's very hard to get the few last grinds out. The Ecobrew also fits better in my Mr Coffee single cup K-cup brewer. The Ecobrew seems to have a slightly larger capacity for coffee grinds too, which may mean it's capable of brewing slightly stronger coffee. And lastly, the Ecobrew has a flat bottom that can sit on a counter top by itself. This makes it much easier to fill than the Solofill. With the Solofill, it couldn't be balanced on a table-top so I had to cut out the bottom of a small dixie cup to make my own ""stand"" in order to fill it properly. …",559 out of 562 users found this review helpful
 Fukien Tea Bonsai Tree,1,"My rating is actually a ""ZERO"" but I had to choose between 1-5. I will never order from this site again. I ordered the Fukien Tea tree. My order was delayed, which is not a big problem and not why I was disappointed. But when the tree finally arrived - it was the wrong tree, I received the Gardenia tree. The Fukien has the very tiny little white flowers which produce small red berries. The Gardenia has larger flowers (which I do not like). I was not happy that since there was a delay in the shipment of the Fukien tree - someone took it upon themselves to subsitute a different tree. Did they think I would not know the difference??? If I wanted the Gardenia - I would have ordered it. This shipment was returned the next day. Hopefully I will be refunded in a timely manner!! …",5 out of 21 users found this review helpful
 IT ACTUALLY WORKS!,5,"I received this for Father's Day last year. I was skeptical - but it actually works. I can put some tri-tip in the smoker and hang in the pool or chat with guests while keeping an eye on the large LCD display. The range is very good, I can sit in the pool with the display next to me on the deck (at least 20-30 feet away) or go back inside the house. It beeps and talks to you a few minutes before your food is at the desired temperature. I use it primarily for beef, and the settings (rare, medium, etc.) are pretty accurate. This is especially good for large cuts of beef since it is often difficult to gauge whether the meat is pink inside or not. I would highly recommend this. Easy to set-up, then all you do is select the type of meat and the desired cooking level. Pork and seafood default to only one setting choice (well-done) but you can just use the temperature readout to cook to the desired temp. …",33 out of 34 users found this review helpful
" This is a little embarrassing, but...",5,"When they say mammoth, they mean mammoth. I thought I was buying a bone on the large side. Uh, the thing weighs a ton and looks like the shin bone of a cow. Or a dinosaur. It's 18"" long. It would take my dog about a year of gnawing, but he'd be happy the whole time. …",20 out of 21 users found this review helpful
 SWEEEEET......and Hot,5,"This goes down in my Self Proclaimed Condiment Queen Nation as a ""keeper"" I saw it in the asian market i go to for 2.50, a huge bottle, i looked at the ingredients, no preservatives or added colors, good, good, said it went with everything, also good, got it home and WOW, its amazing! Garlic, Hot, Sweet, I am a dippin fool now. …",10 out of 12 users found this review helpful
 Good in Moderation,3,"Although I enjoyed the taste and texture of the Snapea Crisps, I found eating them in small quantities was important. They are somewhat greasy and are not as healthy as they may seem in regards to calories. …",21 out of 25 users found this review helpful
 My sheltie love these treats (and so does my sister's cat),5,"My 30 lb shetland sheepdog is picky. She's fed a high-quality food, and she only gets the best treats. No ""doggie junk food"" to be had in our household, no corn, no by-products, no treats pressed and colored to look like mini T-bone steaks (unfortunately, I don't eat as well as she does.... Doritos can pass as a meal for me). She's been known to spit out treats that didn't meet her standards. Not so with these Zuke's Mini Naturals. These really get her attention, and they were vital in training her to go potty as soon as I let her out into the backyard, to let me brush her teeth, and to walk nicely on a leash (nothing on our walks is more interesting than Mama or Daddy in possession of Zuke's Minis). My little sheltie comes running at the crinkle of the bag. She loves all three flavors: Peanut Butter, Salmon, & Chicken. It's amazing to find a product like this, where the flavor of the treat, salmon, comes from salmon being the first ingredient on the ingredient list. The texture is soft, not crunchy, and they don't fall apart in your pocket, nor are they greasy or stinky. Also, we've found that my sister's cat goes nuts for these Zuke's in the salmon flavor. They're not intended for cats, but my sister's cat apparently didn't read the package when she found and inhaled these. These Zuke's Mini Natural treats are the best, I'll continue to buy them again and again. …",14 out of 20 users found this review helpful
 Not Awesome,3,"I don't know how this stacks up against the Keurig brand drawer but I would hope for the price difference that it is a little more sturdy. Cons: - We have a B70 and it barely fits on this from front to back. - The whole drawer unit itself does not lay flat with the machine on straight, so I turned the machine diagonally so that it would not wobble. - The drawer does not open smoothly at all, it is very rough and is probably scraping paint off the bottom of the drawer. I'm hoping after it has been used a million times this will improve. - If you try pushing the thing on the counter the little white rubber feet come out. I'm glad I did it before I lifted the machine onto it because I would not have been happy to dump my new coffee toy over. - I feel like it could be a lot sturdier since it is meant to hold a $100+ coffee maker on it. There are a couple pros though, that earned the 3 stars: - It does hold 36 k cups. I read reviews on other products that don't actually hold the number of cups that it claims. At least this one really does. - The black color matches the machine nicely. - It gets those bulky boxes of k cups off of the counter. I still have partial boxes to stow somewhere (since I wanted more than 2 varieties in the drawer) but at least I don't have to keep them handy. All in all I would not buy it again and still might return it. It was cheaper than the other drawers I was finding but I feel like I got what I paid for. Sometimes it's worth a few more dollars to get something a little better. …",35 out of 38 users found this review helpful
 Addictive!,5,This is my new favorite tea. It's black as coffee maybe even darker. It has a very strong flavor. You will either love it or hate it. The tea leaves are allowed to decompose or compost a bit.... it is weird but it makes a amazingly powerful tea. It is supposed to promote weight loss if you want to use it for that reason. …,12 out of 12 users found this review helpful
 Creme de Creme,5,"I lived in Leuven, Belgium for 8 years and tried many a chocolate. Leonidas is the creme de creme, that is, the best of the best. Especially their Framboise Praline is an Epicurean delight if you are a dark chocolate lover. Also, their plain dark chocolate medallion is outstanding as an addition to a freshly brewed Tully's espresso. Superstore, you provide a number one global service by bringing the best of Belgium to the US. Thanx, Heironymus de Medina (aka Jerome) …",19 out of 20 users found this review helpful
 fringe,4,The Chinese Fringe Flower produces beautiful pink fringed flower several times throughout the year. The Chinese Fringe Flower requires good indirect sunlight and is best suited for patios or areas in front of a large window that gets good light. The Fringe Flower likes watering conditions on the dry side. Watering should be done through the foliage and around the base of the plant. The Chinese Fringe Flower can withstand temperatures down to 32 degrees F. …,16 out of 17 users found this review helpful
