Title,Star Rating,Review,Helpfulness
" Made in the US version, not the same recipe as Imported from Austrailia version",3,"I thought, wow, bulk Lucky Country Red Licorice, sweet, but alas no, it is a mass produced Americanized version from Lucky Country's new US manufacturing plant. The recipe is completely different from the Lucky Country Red Licorice (same brand, same name) that is Imported from Australia. The original recipe has more real licorice despite being a red licorice, and is much softer. The Made in US version is your typical chewy waxy candy licorice with barely a hint of licorice, just pure sweet. Shame on Lucky Country for taking a high end sophisticated product and watering it down like every licorice sold in every drug store in the US. I'm heading back to Target or Trader Joe's for the real thing. …",15 out of 18 users found this review helpful
 For those  who like mild coffee,5,"I have a Keurig in the office for guests (and myself) but I learned that most of my guests prefer a lighter roast than I do. After tasting the Veranda Blend, I found it was light, but very aromatic and you could still add sugar and cream and it was very similar to a good restaurant coffee. So when supplying choices of blends for guests, I'm including Veranda as a milder blend for those who don't like French Roast or Sumatra or other bold blends. I find that there is a bit of woodiness, but also a slight flavor of nuts and cocoa. It's a pleasant blend of coffee and a very good cup if you don't want something awfully strong. Some lighter roasts are acid to me, but this one seems to be balanced. …",12 out of 13 users found this review helpful
 Disgusting!,1,This tea tastes nasty. Maybe I just dont like sage but it made me gag! …,1 out of 13 users found this review helpful
 Do not buy the U.S. version of this product,1,"Do yourself a favor and do NOT Buy the U.S. version of this product. This is a bastardized, truly corrupted form of the original made with (GASP!) peanut oil -- surely not to increase its tastiness but to fatten corporate profits. If you can find a local retailer, try and get at least the Canadian version or even better - original imported Italian or German. I grew up in Europe and have had many a jar of Nutella in my lifetime but this U.S. version has nothing to do with the original we so much love. How sad! …",22 out of 25 users found this review helpful
" Tasty, but.....",3,"Coombs family must be big, as the label says ""product of Canada and USA"" If I wanted unbranded Canadian syrup, I would have asked for it. …",5 out of 21 users found this review helpful
 The texture and smell - HORRIBLE,1,"Only if you can stomach a raw smelly fish smell when you open the package and the rubbery noodle texture that doesn't go away with chewing should you order these. I made the mistake of ordering 10 and threw most away after trying to do something with them twice. These noodles were like eating rubber bands -- NASTY and look like clear tapeworms. I tried cutting them, only could stomach them if I cut them in tiny pieces and didn't chew after smothering them in Ragu. NOT GOOD - I threw that meal out. I'd steer clear, goes to show if something looks to good to be true - a no calorie no carb noodle it is too good to be true.... These are also not worth the price. If you do decide to order the noodle, there are also much less versions than the ""Miracle Noodle"" on Superstore . Order one package for trying - not a lot. …",13 out of 18 users found this review helpful
 chewing gum,4,i was pleasantly surprised that one piece was enough for me and the cinnamon taste wasn't real strong. it is also great that this gum doesn't contain aspartame so i am able once again to enjoy chewing gum. the taste seemed to last longer than normal gum. …,13 out of 13 users found this review helpful
 Disappointing change,1,"I, too, noticed a change in the Ovaltine with the new packaging. It is extremely disappointing. The flavor seems a little different and the texture is definitely different. I'm not sure why they changed something that didn't need changing. I am no longer a loyal Ovaltine customer -- it doesn't seem much better than Nesquik anymore. …",23 out of 25 users found this review helpful
" Made in the US version, not the same recipe as Imported from Austrailia version",3,"I thought, wow, bulk Lucky Country Red Licorice, sweet, but alas no, it is a mass produced Americanized version from Lucky Country's new US manufacturing plant. The recipe is completely different from the Lucky Country Red Licorice (same brand, same name) that is Imported from Australia. The original recipe has more real licorice despite being a red licorice, and is much softer. The Made in US version is your typical chewy waxy candy licorice with barely a hint of licorice, just pure sweet. Shame on Lucky Country for taking a high end sophisticated product and watering it down like every licorice sold in every drug store in the US. I'm heading back to Target or Trader Joe's for the real thing. …",15 out of 18 users found this review helpful
 Horrible!,1,This is DARK roast coffee. I did not notice this before buying. I do not like dark roast as the coffee seems burned and strong. If you like Starbucks coffee then you will probably like this coffee. I took one taste and dumped the entire pot out. The smell is very strong which reminds me of a nasty cigar. …,4 out of 14 users found this review helpful
 Thoroughly Disgusted,1,"I googled Organic Valley to find out how to let them know the lot number of some spoiled aseptic chocolate milk. I was planning to return the milk to the local grocery where I bought it, but since I've always thought Organic Valley was an ethical cooperative, I figured they would want to know about the spoiled milk. To my horror, I happened upon a recent article (April 2011) describing how Organic Valley is allowing giant factory farms that abuse their animals to sell milk and eggs via the Organic Valley label. I am so disgusted. Here I've been paying a premium for organic milk, eggs, and cheese (carefully avoiding Horizon since they are notorious for factory farms), and now I find out that Organic Valley has been lying to us about all the ""family farms"" in their cooperative. The board of directors of Organic Valley should be ashamed of themselves. Honestly, the only thing that has kept me from going vegan was thinking it's OK to buy organic. Guess what--it's not OK to buy organic dairy products. Animals are still being abused.Organic Valley is evil. …",8 out of 14 users found this review helpful
 The best of the energy chews!,5,"I'm a runner doing 30-50 miles a week and am currently (9/10) training for the Chicago Marathon. I've tried all of the gels and chews that are out there and these are my favorite. I don't like gels as that squirt of mush activates my gag reflex. Plus you always need water with them. I've tried all of the other brands of energy chews (I think); Sharkies (good but sticky and not very tasty), Clif Shot Bloks (nice package, very sticky on the fingers), GU Chomps (super sticky and caused some nausea), PowerBar Gel Blasts (very good but tough to chew if cold). The Honey Stinger chews are very easy to chew and you don't need water. They don't stick to your teeth either. The main selling point for me is that they taste good and don't cause nausea no matter what. I'm sticking with these ones. …",24 out of 24 users found this review helpful
 Better than most,4,"This came in a small box of ten foil packages three inches long and a half-inch wide. There is a cut at one end that allows you to open the foil package so none of the usual difficulties with getting these things open just to spill out some of the contents. The package says to mix with one 16-ounce bottle of water. The powder mixed into the water completely by the time I was ready to put the lid on to shake it up. It turned the water a light pink. This flavor of Stix To Go does not have aspartame in it. The box says sweetened with honey and indeed honey granules are the first ingredients, however there is also sucralose, similar to Splenda. There is also maltodextrin, which is often used in soda or candy as a thickener, but it is made from real food not chemicals. The other ingredients are the flavors and hibiscus extract. WebMD says that hibiscus extract is used to improve odor, flavor, and appearance of tea. The package also says that a serving size is half of a package at five calories, but you are told to add the whole package to a bottle of water, so beware if you are counting calories. The taste is not bad. I do not drink anything with artificial sweeteners because I cannot stand the aftertaste, but I did not notice an aftertaste with this. There is a slight aftertaste, but it did not last. If think you are getting tea you are not. This taste like kid's strawberry drink. If you just can't drink water then you would probably like this. …",15 out of 22 users found this review helpful
 Bunnies Trounce Goldfish,5,"I have enjoyed ""Goldfish"" and other cheese-based snack crackers since I was a child, but no more. I tried these Cheddar Bunnies as I have enjoyed other products by Annie's, and have now found my all-time favorite snack cracker. From a nutritional standpoint, they are better than many competing products as they have no hydrogenated oils or artificial flavors, and are made from organic ingredients, including real Wisconsin cheddar cheese. The packaging does an excellent job of preserving freshness, the taste is natural and very refreshing for a snack food, and the price is comparable to other non-organic products. I am completely satisfied with these crackers: the are a good value, they compare favorably in the nutritional realm with competitors (although they really don't qualify as ""health food,"" of course,) they taste fantastic, and last but not least, they're fun! …",21 out of 22 users found this review helpful
 What don't you understand about &quot;Black Licorice&quot;?,4,"Despite the, previous, scathing review from someone who does not even like black licorice...(What kind of dummy eats black licorice and then complains about it tasting like black licorice???)...I have to say that these are very good, fresh and not too sweet little dogs...They are truly the taste of American licorice as opposed to the European varieties that differ in old fashion licorice taste. The texture is chewy, but not too soft or sticky. They are a tad less sweet than &quot;See's Licorice Medallions&quot;, but just as flavorful. The only reason I don't give them a five star rating is because I believe that it belongs to the &quot;King&quot; of all licorices, the discontinued, Heidi/Hershey dome shaped drops, with the imbossed diamond on the top. They were what real, old fashion, American licorice was all about and what made several generations of Dentists rich with their, &quot;near Ju-Ju-Be&quot; chewy-ness and deep licorice flavor... I'd sure appreciate it if someone were to start making them again! In the meantime, these little black dogs will impress the licorice lover, but not the dummies who eat what they don't like! …",27 out of 28 users found this review helpful
 First time ever leaving a review,5,"This product actually works!! I don't leave reviews for anything, but Neuro Sleep earned one. I work shift work so it is very hard for me to get a set sleep schedule and that has affected things at home, I feel I'm always tired. I used to value sleep more than other things (I.E dinners, events, ect..) but now using Neuro Sleep I sleep good and on a normal schedule. It relaxes me and helps me fall asleep and stay asleep, I wake up fully and completely rested even if I only get 6 hrs of sleep. Neuro Sleep is amazing and I would recommend it to everyone!! …",16 out of 16 users found this review helpful
" Delicious, healthy...Product of China?!",1,"This product is portrayed as healthy and natural, but I was shocked and dismayed to see that it's shipped from halfway across the world. I understand buying electronics, shoes, etc. from China, but my FOOD? I doubt the safety of this food product, and don't see how they can guarantee that it's vegan, non-GMO, dairy free, wheat-free, gluten-free, etc. Plus I don't see the point in purchasing something that has obviously left such a hefty carbon footprint. But beyond that, how hard is it to make a delicious snack like this in the USA, from USA-grown ingredients? Seriously? …",12 out of 16 users found this review helpful
" Short on pesto, long on onion.",2,"I thought this would be an interesting take on pesto sauce which is a favorite in our house. There were some green bits in the sauce but so few that I'm not sure why it is called pesto sauce. It is hard to taste the basil for the overwhelming flavor of onion. Pesto should contain basil, fresh garlic, olive oil, pine nuts or walnuts, and parmesan cheese. This list of ingredients appears on the label along with tomatoes and cream to make the sauce pink. And then the onions, lots of onions, big chunks of onions. They take over the sauce. The pesto should shine through but it hardly makes an appearance. The folks at Scarpetta need to go back to the kitchen with this sauce and try again. …",10 out of 13 users found this review helpful
 Healthy and Happy,5,"We adopted a mix breed that was approx 1 year old. His coat was coarse, dry and skin was flaky. He was licking his feet and shaking his head. Tried several brands and found that duck and lamb make him extremely gassy with a really rude odor. He loves the fish and sweet potato, his coat is like velvet now in just a couple short months. No more shedding or flaking and NO RUDE ODOROUS GAS problem. Highly recommend. …",14 out of 14 users found this review helpful
 Misleading,1,"This product was misleading. We had no real idea that it was Fat Free, Calorie Free, heck ... everything free, rendering the product almost taste free too. Our first clue should have come from the fact that this salad dressing was coming from a health food company. Good rich, and tasty salad dressing will almost never be totally healthy. Our mistake. Do you have any REAL russian dressing? …",1 out of 12 users found this review helpful
 The best way to use pest traps,4,"Yes, the moth pheromone wafers are very effective at attracting moths. No, the traps are not very good at catching them. I have tried these, and many similar brands, all with the same problem. Here's what you do: Buy the pest trap. Take out the pheromone wafer and throw away the rest. Buy a fly paper ribbon (maybe fifty cents) and hang it up. Stick the two pheromone wafers on the fly ribbon, about a foot apart. This will catch meal moths for weeks, and will stay sticky even with dozens of moths on it. …",40 out of 40 users found this review helpful
 Everyone else is crazy! :D,5,"I really think this cereal tastes awesome. Yeah, the chocolately pieces aren't ""real"" chocolate. And sure, they sink to the bottom, but seriously, is everyone too lazy to go fishing for them with their spoon? I think the chocolate Special K is much better than the Strawberry kind! …",12 out of 13 users found this review helpful
 Good treats!,5,"Our puppy loves these little treats! They are small enough to give him a few at a time, but I like to cut them up even smaller and use them for training. They are tiny as is (about the size of a pencil eraser), but can easily be cut into quarters for reward-based training. I will always keep these in stock for him! …",31 out of 43 users found this review helpful
 Lies,1,"The world's largest gummy bear is in Austin. It is 27 lbs and in Campus Candy. It's $149.99 and the store is awfully loud. Back to my original point, this post is lying. I have not bought this product though. …",9 out of 133 users found this review helpful
 VERY FRESH PEANUTS THOUGH AN EXPENSIVE WAY TO BUY THEM,4,"IN A NUTSHELL: EACH PACKAGE CONTAINED 2 OZ. OF FRESH PEANUTS OR CASHEWS These 2 oz. packages are filled with fresh nuts with nothing but salt added [& peanut oil or cottonseed oil]. As snack foods go, this is a very healthy choice. Although expensive on an ounce for ounce basis, as portions of snack foods go, this is still a fair value and a relatively healthy choice. Bear in mind that about 75% of the 170 calories per ounce are from fat, but there are NO TRANS-FATTY ACIDS or CHOLESTEROL while there are some healthy mono-saturated oils. My big complaint against many other snack-nut products is their lack of freshness, and in fact a rancid taste to the nuts which NEVER happened with these Planters nuts. In fact, each individual package has an expiration date clearly marked on the front of the package. BOTTOM LINE: I PREFER THE LARGER JAR BECAUSE I EAT MORE THAN 2 OZ. AT A TIME My preference is to get these peanuts and cashews in the larger jar and unsalted, but for the summer, the salt is okay and the freshness was consistent in every package. For product info, Kraft has a website [plantersdotcom] [I AM NOT AFFILIATED WITH ANY PRODUCT OR COMPANY] …",15 out of 20 users found this review helpful
 NO MORE CRAMPS!,5,"I used to have EXTREMELY bad cramps during my time of the month. When I say EXTREME, I mean cramping so bad that I would have minor blackouts. My mother-in-law suggested I take some organic virgin coconut oil and I took a tablespoon of it, however it didn't taste good at all. It did make my cramps go away for that entire day. So my wonderful husband went out and bought me some of these capsules from the health food store, I was kind of skeptical b/c he paid $20 for it, but I thanked him and started popping the suggested amount, 3 caps, 3 times a day. Since the caps have a small amount in each cap, you have to take that many to get it in your system. The first month I took them, the cramps subsided to just enduring slight pain in the morning on my first day. The second month I didn't experience any PMS symptoms and even less pain on the first day. The third month I experienced NO PMS and NO PAIN through my whole 7 days. I've heard it is good for lowering your cholesterol and help maintain weight amongst other things. I'm just happy they made my cramps go away. …",11 out of 12 users found this review helpful
" Had such great hopes, but......",1,"We have three cats - two wanted nothing to do with it no matter how many times we tried. Ended up pooping on the carpet, something they have never done before. The other cat, who uses this litterbox, gets diahrea on a regular basis. The box is not designed for that type of mess! We ended up scooping most of the granules out. So if your cat has these type of issues, do not use! …",73 out of 84 users found this review helpful
 bad beef,2,I'm normally a fan of jack links but this really disappointed me. Ordered 4 bags and had two of them. I spent more time picking through the meat taking out the nasty gizard and fat chunks all throughout the bag. Also the meat quality was terrible and quality control isn't. Good for this flavor. One piece would be moist and flavorful and the next would bard as a rock and uncomfortable to chew. Overall this was a terrible product. Jack links shouldn't put 10 different cuts of meat in the same bag. If you like quality controlled products this isn't for you. …,13 out of 13 users found this review helpful
 Does NOT Work w/Senseo,1,"I usually enjoy Starbucks products, but this one does not work for the purpose I ordered it. The pods are too small and packed very tightly, so they do not work w/my Senseo. Too small is the biggest problem. My coffee came out as slightly colored water because the hot water went around the pod because the pod did not fill the holder. Oh well. …",14 out of 17 users found this review helpful
 Only bought it,4,Bought it for the ice cream maker which did not make ice cream since then sitting in the fridge. …,1 out of 35 users found this review helpful
 Yogurt Sucks,1,"Yogurt sucks bad enough, then they make it into a pretzel, it's so dumb. Anyone who likes yogurt is crazy, it's rotten milk. it's nasty. And putting it on a pretzel is gross. I can't stand yogurt pretzels. …",0 out of 12 users found this review helpful
 Very good Ceylon cinnamon,5,"Frontier's Ceylon cinnamon tastes good, and I've bought more of it after trying half a dozen others. It has a bit milder flavor than Penzey's, but I like theirs too. Frontier Co-op itself offers more variations of Ceylon cinnamon than are usually available here on Superstore through resellers. To see what else they have, you might want to have a look at the Co-op's own extensive retail and wholesale sites. …",25 out of 27 users found this review helpful
 Tastes Great and Has Health Benefits..,5,"The Taste of this tea is very nice. Not grassy like other Teas and has a nutty taste in the background. I enjoy the taste. I drink mostly Green Tea and added this Oolong tea to have more options. I haven't been drinking it long enough to know if it helps with weight loss, but it is very tasty. According to research has antioxident values and that is a great benefit added to a great tasting Tea. ENJOY!!! …",18 out of 19 users found this review helpful
 It's okay.,1,"And by that, I mean, it's okay if you need a paper weight. Or a door stop. Or some other solid, inert mass. Because as a food, Haribo gummie bears are somewhere between Friskie's Turkey & Giblets and gravel. Haribo brand gummie bears lack flavor, gum, or bear. They're even shaped like tiny fragments of Mount Rushmore -- doubly impressive for a German candy that never even witnessed South Dakota. If you need a solid gummie, go for Target's Market Pantry brand or whatever Area 51 concoction going on at Saratoga Sweets in Clifton Park, NY. I mean, man, the banana flavor of those bears kicks your teeth right down into your sweet spot. Double flippin' awesome. In closing, real Germans prefer other bears and/or hunt meisters. …",3 out of 20 users found this review helpful
 Be warned - Mites in tree,2,"I thought the bonsai was a cute little tree at first, but I noticed little bugs on my desk where I kept the tree. I didn't think about why they were they at first, but after 2 weeks, I noticed the tree was crawling from little mites that were coming up out of the soil. I'm sure the seller didn't intend on this happening, but I'll never order another bonsai. Addition - Seller was great. They recieved my email about the bus & offered me a full refund. They explained it was not intentional & that flooding in their area may have caused it. …",15 out of 17 users found this review helpful
 Guess I'm in the Minority,1,"I was looking for a good sweet and sour sauce for chicken and based on the reviews, I took a chance. Well, no one in the family likes this stuff- it tastes nothing like sweet and sour sauce- more like what it says it is- Chili Sauce. Now I'm stuck with two huge bottles. Sometimes reading the label is really all that matters. …",2 out of 15 users found this review helpful
 Darn good indeed!,5,"Bear Creek Darn Good Chili Mix is just that - darn good! The instructions to turn this mix into chili or dip are clear and concise, and include suggestions for ""doctoring"" it up. Following the directions to the letter will result in a meatless (but not vegetarian - read the ingredient list) chili that is flavorful but not too spicy. I especially love the variety of beans included. My suggestion for perfect chili: add a half pound of spicy turkey sausage (mild is too sweet) and a half pound of lean ground beef. Brown the meat first then add water as indicated on the package (don't increase or decrease the water measure) and follow the directions from there. Yum! …",13 out of 13 users found this review helpful
 Not Bottled Water,5,"Superstore has a problem. A person can send them info on why they should change product info, but they have idiots working for them who don't understand that they don't need an act of God to change obviously erroneous info. 90% of the time, they refuse to correct obvious mistakes. What a bunch of jerks. And yes, this is the Helstar CD - Burning Star... not bottled water as the heading and item description indicate. …",2 out of 16 users found this review helpful
