Title,Star Rating,Review,Helpfulness
" completely bland, flavorles, tasteless ""jumbo"" lump crab",1,"For the first time, I'm going to look into returning a purchase to Superstore, sorry. I expected jumbo lump crab, but got some totally wet, soggy, tasteless lumps of white pieces of crab. I've had jumbo lump crab in the past, this is not it. For some reason, it's packed in some sort of liquid and then the can is lined with some sort of paper substance. I've used this companies products for many years, this is not up to their usual standards. The pieces are quit small, like they came from a small crabs and they are saturated with liquid. Lump crab that I have bought previously in the pouch has almost no liquid run off and consequently the crab is tasty and solid. Krab tastes better to me. I thought it was a good deal as the price per pound computed to be about half what I usually pay, but a bad bargain to say the least. …",12 out of 14 users found this review helpful
 Because our kids aren't obese enough,1,"Thank you Gerber, for helping us get our kids off to the right start! Why should we parents take the time to prepare healthy snacks for our children and teach them to like REAL food, when you have Baby Cheetos in a can for them to enjoy? One-third of America's children being overweight or obese simply isn't enough -- we need to strive for more. America's kids need to learn to fill up on empty calories and eat for boredom, not hunger, starting at a year old or younger! And thank goodness this product ""tastes good"" -- because that's all that matters, right? …",3 out of 15 users found this review helpful
 Loving it!,5,"I've used the refrigerated Int. Delight Irish Creme before, and it's easily my favorite flavor. However, being a college student with a rather small fridge, it's hard to make sure I have it when I need it. It's also rather hard to go and pay $6 for a bottle that could easily expire if my power goes out in the dorm (which is often). I paid $.06 per individual package- far less than I would have otherwise. I went and bought this last week for the start of term, and I must say, having the single serve packages is much more convenient than a large bulky bottle. I can put the extras away in my closet, and keep a few out on my desk without worrying about keeping them cold. The taste is exactly the same as what you would find in the cold section of your supermarket. I highly recommend getting this if you love your creamer as much as I do, and are either on a budget or need the extra space in your fridge. …",13 out of 13 users found this review helpful
 Greenies - Catnip for dogs,5,"I have been using Greenies for years, including the older formula that reportedly had digestion problems. However, we never have had any problems with Greenies. Just make sure you get the appropriate size for your dog. I have never seen a dog that could resist a Greenie. They will start doing tricks never seen before once you bring them into the house. They do help with their breath, teeth cleaning and training and we normally use them as ""well earned"" treats (they aren't the cheapest thing in the treat world). I just ordered 4, 27 oz. tubs of the Teenies (we have Papillons) and I know our dogs will enjoy every one of them. Never have to worry about our dogs getting fat eating these as we do not give them multiple times a day. The new formula reportedly has solved the digestibility problem and the manufacturer claims is now more digestible than normal dog food. In the original formula, the problem usually involved incidents when dogs just tried to swallow them whole or get it down in 2 bites. Our dogs always chewed them into small pieces avoiding any problems. Believe me, your dogs will love them. …",23 out of 23 users found this review helpful
 I'm Converted!,5,"This long grain,American Basmati brown rice is sensational. I have switched from my old brand of rice to this one for nutritional reasons being that brown rice contains nutrients like zinc, magnesium and manganese. It has more fiber It's so flavorful, I added some garlic,onion and celery as I boiled it. The aroma was captivating, without exageration. It tasted delicious and I just wish I had more time to cook. It takes a little longer to cook than white rice but it's worth it. …",15 out of 15 users found this review helpful
 Great flavor!,3,"This is a tricky product to review. On the one hand, the flavor is great! (especially the choc. peanut butter). If I were rating it on flavor alone, I would give it five stars. However, I took one star off for the price and another star off for the quantity. It has 15 servings, with each serving being two Tablespoons. however, two tablespoons of the powder mixed with a little water only yields about 2 teaspoons of peanut butter. So if you are making peanut butter for a sandwich or for apples, you go through the jar pretty quick (only took me about two days). But if you are going to add it to a vanilla protein shake, the one serving adds a ton of flavor. So I would repurchase this but only for adding to shakes. …",180 out of 188 users found this review helpful
 Choloate beyond belief,5,"I had a chance to try these chocolates while in Holland. I only bought a few because I wasn't sure what they were (the sales person and I couldn't communicate past a few English words). Well, I am home now and I want more. I finally found them here... at a decent price and just this kind instead of a mixed box(which I am sure would be fine, but I want these and only these!) If you like almonds and hazelnut, buy them, they are better than anything I have had from Godiva and that is saying a lot! …",23 out of 23 users found this review helpful
 Tastes great AND it's good for you!,5,"I'm sitting here this morning drinking a cool and refreshing Guayaki Yerba Mate and it reminded me that I have not yet done a review on my most favorite drink. Guayaki mate comes in many forms; dry loose-leaf tea, tea bags for steeping, and sweetened, flavored iced tea. I was first introduced to the joys of mate over a year ago by my tea-savvy sister-in-law. She was so devoted that should could not help but tell everyone she knew about the awesome powers of mate. Yerba Mate is made from a holly tree that grows in the South American Rainforest and the native people have been drinking it for centuries. In fact the natives call it the ""drink of the gods."" Mate contains a cousin of caffeine that many have dubbed ""mateine"" which wakes you mentally without all the negative side effects that caffeine has. It doesn't give you the jitters, or an upset stomach, or the sweats. It just gives your brain a little energy boost slowly but very effectively. Mate also contains many antioxidants, even more than green tea! The plain hot tea tastes very similar to plain green tea and is great on a chilly morning. They have recently started selling flavored versions of the hot tea (at least at the store near me) but I have not had a chance to try them. I know one of them is mint flavored and I would bet that it's tasty. The sweetened and flavored ice teas are beyond delicious. They come in Revel Berry, Lemon, and Mint flavors and I have tried all three. I'm not a big fan of the mint flavor, but my husband thinks it's the best of them all. My personal favorite is the Revel Berry flavor. Best of all, Guayaki is Certified Organic, Fair Trade, Kosher, and Non GMO. Guayaki is committed to helping the farmers earn a decent living as well as restore the Rainforest. According to the Guayaki can, ""Guayaki's mission is to steward and restore 200,000 acres of South American Atlantic Rainforest and create over 1,000 living wage jobs by 2020"". So, we can rest assured that the delicious beverage we are enjoying is going to actually HELP the Rainforest instead of ruin it. So drink up! …",14 out of 15 users found this review helpful
 Extremely Yummy,5,"I havent actually purchased these here yet, but I grew up with the Milk Brand in Europe, and I am SOO pleased to see them here for sale. All I can say is if your a chocolate lover, you WILL LOVE MILKA, its in no way close to any of the chocolate I've had here of just regular store brand typs. So if you need a small push, here it is, you wont regret it, I dont know anyone how doesnt absolutely love it when they taste it. …",5 out of 12 users found this review helpful
" Oh, happy day!",5,"I just had a big bowl of oatmeal and I'm not sick! No heartburn or cramps! I just feel full and happy! It has been YEARS since I've been able to eat oatmeal! These oats are delicious, chewy, wonderful! I made the oatmeal in three minutes in the microwave...a quick breakfast or snack! Tomorrow, I am going to create a recipe for oatmeal chocolate chip cookies...then, maybe oatmeal bread...then oatmeal muffins...then... Having these oats available Red Mill Gluten Free Whole Grain, Rolled Oats, 32-Ounce Bags (Pack of 4) gives me so many more gluten-free options for baking and cooking! Hurrah! …",17 out of 19 users found this review helpful
 Put Pasta Back in Your Diet,5,"Okay, I first came across the ""Fiber Gourmet"" brand from a vague Google search for ""low calorie pasta"". I'd previously bought into the shirataki noodle craze and while I admit--calorically speaking--shirataki have EVERYTHING else on the planet beat hands down, I quickly tired of the stuff mainly because I knew I would have to chew the heck out of it before swallowing, lest It Come Out Looking the Same Way It Went In ('nuff said there) and for the cost of each bag (the store brand I found in the tofu aisle was roughly $2.50 ea and the Miracle Noodle brand from online is essentially the same for 8-9 oz bag) my diet was getting pretty expensive eating 2bags a day 4 days a week. I ate shirataki by the bag, after all... So when I happened across the Fiber Gourmet website, I simply bookmarked it and went along my way. Finally, after a couple more weeks of laboriously chewing shirataki, I decided to give it a whirl and ordered from the official website. I have to admit, the first time I tried the Light Spaghetti pasta I wasn't exactly bowled over and that was because I was actually mixing the Fiber Gourmet noodles with another, lower sodium (but still 210cal/srvg) noodle brand and honestly wasn't seeing much of a difference--on the scale or satiety-wise. However, in the past couple weeks I went back to my case of 6 boxes and tried them again, this time wondering why in the world I didn't like them first time! I stopped mixing them with the other noodle and most times have either exactly the 56g serving size or 84g (1.5 srvg) and mix it with veggies, spices and low-sodium/calorie glazes (Captain Rodney's Sweet & Spicy Pepper Glaze being my fav). For a treat I'll throw in a couple ounces of Morning Star Farms fake chik'n strips. The best part about the Light Spaghetti is how absolutely filling they are. I've taken to having the above-described dish for lunch and honestly I don't feel hungry again until several hours later. 18g of fiber is just ridiculous (per serving) but I'm so glad it's there because you really don't need much of the noodles to get satisfied. That's one thing these have over the shirataki. Another is the whole ""chewing element""; I found I don't have to count 32 chews (literally; I actually did this w/ the shirataki) before swallowing. Fiber Gourmet also cooks dang close to legit pasta. I found that really leaving them on the stove boiling for a while (over 20mins) is best and you can tell from sight when they're ready. I haven't managed to overcook this pasta yet. But above all the pros, I have to say that the fact they fill you up is the best. I'm on a low calorie diet so having that extra 70 cals/serving these spare you really helps. My faux-lo mein:) meal described above is around 250-395 cals depending on whether I add any meat to the pasta. Since I don't need an afternoon snack on the days I eat Fiber Gourmet for lunch, I can save another 100-150 there for dinner. I wouldn't recommend having these more than once a day or having more than twice the serving size on account of how much fiber is in a serving but so far I've had no intestinal issues whatsoever (TMI?). Oh! And even though I bought my first case from the Fiber Gourmet website I'd highly recommend buying them here from Superstore--when I saw the case for $16.92 WITH PRIME S/H I was sold and ordered immediately so I won't have to go even a day w/o these. I paid about $20 for the case from FG's site and then about $7-10s/h on top of that so the deal is DEFINITELY here. Since I've incorporated the FG pasta into my diet I've dropped almost 3lbs in 10 days whereas shirataki 4 days a week had me at a statistical standstill. I highly recommend FG's pasta if you want to taste noodles almost exactly like the real thing and can't stand the thought of life w/o a past dish like I can't:) …",24 out of 24 users found this review helpful
 UPS and Cake,1,"Unfortunately, i never received my tortuga rum cakes. UPS left this with someone in the building and I never ever received it I went to the person's apt. after tracking the order and to pickup the cakes and they said UPS gave them a computer which they had ordered instead. No cakes. So I can't tell you if the cakes were good or bad. Please do not let UPS leave anything with anyone unless you're home to sign for it. This happened this Christmas 2008, I was heartbroken because I had paid for this already including shipping and handling. It added to an unhappy part of my Christmas. Thanks. …",0 out of 13 users found this review helpful
 Ugh....never had grounds in my coffee until I bought this brand,1,"I have had a keurig for over 4 years. Never have I had grounds in my coffee until I bought a fifty pack of Jet fuel. As I work my way through the box, I am throwing out about every third cup. I ""believe"" the problem is a thinner than usual foil top, a larger hole is created, during the punch, and the water is not regulated at the same percentage. I called to talk to ""the coffee people"", 2x - never got a human, left my phone number both times, and have never gotten a call back in since the orginal call 10 days ago. I am done with jet fuel and coffee people, Timothy's - you have my k-cup money! …",37 out of 44 users found this review helpful
 should ship without damaging what I pay for.,1,"I buy a lot of stuff, and a LOT of vitamins, herbs, homeopathic remedies, and only organic food. I bought some over priced oil from these people, and it came in a simple envelope with the lid cracked off (the foil kept it from leaking in the mail. I called and asked them to mail me a cap for the plastic bottle, so I may dispense & use the oil. No cap came. With other companies available online, and an opportunity to make a comment, I waited over a month to post a comment. These people need to a) ship in a way to protect your purchase b) replace what they send and is recived broken. Won't be back. (you know, first time, shame on you. second time, shame on me...) J.T. …",15 out of 29 users found this review helpful
" human quality ingredients, unique manufacturing process-- my cat loves it!",5,"Blue Buffalo Spa Select is great! Top of the line ingredients, human food grade-- in addition to the indoor cat formula there's a chicken version and a fish version. This food meets a very high standard. No yucky meat ""by-products"", meat and meat meals are the top ingredients, plus a host of wholesome and varied ingredients and probiotics. On top of that, this is an incredibly palatable food. My cat LOVES it. In fact, she scarfs it right down, when she typically has just grazed on a piece or two at a time of other premium foods. I have to be careful to use a measuring cup and not overfeed her, 'cause she will seek me out and meow for more! Blue Buffalo uses a unique process to manufacture ""lifebits"" which are added to the food. These smaller, darker pieces are cold formed in order to maintain nutrients. I don't believe any other company incorporates this kind of element into cat or dog food. I came across this cat food at the local Tractor Supply. I'd never heard or read about Blue Buffalo, but I respect what they are doing, and I've changed to Blue Buffalo dog food for my golden retrievers, too. ~~~~~~~~~~~~~~~~~~~~~~~~~~~~~~~~~~~~~~~~~~~~~~~ Here's a summary of the nutritional information: -Recommended daily feeding chart-- amount varies based on age, activity level, breed, and environement, but in general a 5-9 pound cat will eat 1/4-1/2 cup, while a 10-14 pound cat will eat 1/2-1 cup. -One cup contains 478 calories -Major ingredients: Deboned chicken, chicken meal, whole ground barley, fish meal, oatmeal, whole ground brown rice, whole potatoes, chicken fat (preserved with natural mixed tocopherols), natural chicken flavor, dried egg, dried cellulose, whole sweet potatoes, whole carrots, cranberries, blueberries, flaxseed (natural soource of Omega 6 fatty acids), barley grass, dried parsley, alfalfa meal, kelp meal, taurine, l-carnitine, l-lysine, ycca schidigera, green tea extract, turmeric, salmon oil (natural source of Omega 3 fatty acids), black malted barley, dried chicory root, fructooligosaccarides, oil of rosemary, the expected vitamins and minerals, and several probiotics (lactobacillus acidolphilus, bacillus subtilis, bifidobacterium thermophilum, bifidobacgterium longum, enterococcus faecium). I hope this helps you evaluate whether or not this food is a good match for your feline friend. My cat and I have been really happy with it. …",12 out of 12 users found this review helpful
" Like crack, but runny and brown.",5,"This stuff is on every restaurant table in Costa Rica. Many an unsuspecting tourist has been strung out on this liquid crack brownsauce. It is good on eggs, meat, fish, veggies, table legs, mystery meat, breakfast, brunch, lunch, drunch, dinner, supper, snacks, old leather shoes, pieces of table cloth, tofu, sushi, Thanksgiving turkey, Christmas turkey, random middle of April Turkey, tacos, hamburgers, cheeseburgers, bacon cheeseburgers, and of course french fries. In summary, it is good on anything you can shove into your mouth. If you accidentally drip some on your hand, you may end up nibbling off a few fingers! of course there's a lot of sodium in it, but that just means you can leave off the extra salt in the recipes. Buy one bottle for yourself, and another bottle for yourself. And a third bottle just in case the first two go empty. …",67 out of 67 users found this review helpful
 Not Really K-Cups But They Do Fit in Your Keurig,3,"Don't be alarmed when you receive these and they don't look like a standard K-cup. These are not K-cups, but dowill fit in your machine. I thought I had ordered the wrong product at first. These simply have a plastic ring at the top so that they'll fit in your K-cup holder and the rest of it is like a standard coffee filter. I've only tried Fog Chaser (ordered all 3 flavors) and was surprised that I liked the coffee. However, because it's using a filter rather than the K-cup technology, it does leave a sediment in the bottom of your cup. I find this also happens when using the My K-Cup filter with whatever brand of coffee I use. You will need to store the ""k-cups"" in a ziploc to keep them fresh. The 36-count come packaged in 3 plastic bags of 12 each. This is nice so that you only have to open up one 12 pack at a time so the others can stay fresh. I'm mostly neutral, but lean more toward ""would buy again"". …",86 out of 95 users found this review helpful
 Very Good Popcorn,5,"This yellow popcorn comes in a useful airtight plastic canister that will keep your popcorn fresh and can be re-used to store grains, beans, tea, etc. With a four-pound supply, one canister should last a while. This popcorn pops very well on the stove. Here's how I do it: I recommend using a 5-quart stockpot/chili pot/dutch oven to make popcorn on the stove. You don't necessarily need high walls on the pot, but you do need some interior volume to accommodate the expansion of the popped kernels. 1) Pour 2-3 tablespoons of olive oil into the pot. 2) Put three corn kernels into the oil and cover the pot. 3) Turn the heat on to medium-high. The interesting thing about making popcorn on the stove is that a medium-high heat works better than a low heat, because the kernels pop more quickly and thus have less time to burn. 4) Listen carefully to the pot -- the three kernels should pop within a couple of minutes. When the kernels have popped, remove them from the pot. Now sprinkle or grind some sea salt into the oil, and any other spices you may want to use (curry powder, turmeric, cumin, pepper, etc.) Spread the salt and/or spices around with a wooden spoon to incorporate them into the oil. 5) Pour 1/2 a cup or 3/4 of a cup of popcorn kernels into the pot. Use a spoon to move the kernels around and coat them thoroughly with oil. Cover the pot. 6) Now wait for the kernels to pop. Make sure the lid on the pot is tightly sealed. Every 30 seconds or so, grab the pot handles using oven mitts or potholders and lift the pot slightly off the flame, shaking the pot around in a vigorous circular motion and side-to-side. Put the pot back down on the flame. Shaking the pot helps to keep the kernels from burning and also ensures the kernels are receiving even heat distribution. 7) The kernels should begin to pop, slowly at first, then building up to a rapid crescendo. Continue shaking the pot every half-minute or so. When the kernel popping starts to die down, turn off the heat. 8) Remove the pot cover, and stand back for a minute. Sometimes, some kernels will still be popping, so just keep some distance. 9) Pour the popcorn into a large bowl and enjoy! Put any leftover popcorn into a zip-lock bag and seal it. It will last a few days. …",22 out of 26 users found this review helpful
 Not good with an air popper.,3,"This popcorn is not good with an air popper, because the kernels are too light. …",16 out of 18 users found this review helpful
 No savings in 36 oz. value pac,3,Greenies 36 ounce dental chews value tub regular size with 36 chews in package is actually more per chew than the same item in the 27 ounce package. where is the value or savings in buying the larger package of chews. The 27 oz package cost per chew is 0.78 cents each chew the 36 oz package is 0.85 cents per chew. Why buy the larger tub for more money. am I missing something here? Great product though just misleading price and value advertising. 3 stars only because of the misleading value advertising. …,27 out of 29 users found this review helpful
 Wonderful Tea,4,"The tea included in this is wonderful. Without a picture, I didn't know what it was going to arrive in, what kind of container, and the little box is nothing to brag about, so I wouldn't order it again. I will order the tea again and the bamboo boxes, which I have also received, are a lot nicer than this little box. …",15 out of 17 users found this review helpful
 I'm a convert!,5,"When I first tried this product, I wasn't thrilled...the sauce was a bit gritty and clumpy...and REALLY strong. But I've found the solution. Add extra dairy substitute (I use unsweetened rice milk) to thin the sauce out a bit and stir CONSTANTLY to prevent clumping. Add 1/2 a bag of frozen peas to the pasta when cooking...and then once it's completed...refrigerate it overnight, and microwave the next day. That is the secret. The sauce has time to rest and becomes creamy and develop a mild, cheesy flavor. I really recommend this! …",14 out of 14 users found this review helpful
 dissappionted,1,"To Whom It May Concern, I just received today (11-29-2011) The Holiday Wreath Gift Basket and I have to tell you I was extremely disappointed at the very least. Whoever set the price for this product should be ashamed. ($24.95 plus shipping) I understand you're in the business to make a profit but this is a sin. Shame on me this time but I will never purchase a product from you in the future and I will pass the word along to …",14 out of 16 users found this review helpful
 A must-have for dynamite sauce,5,"I purchase this mayonnaise regularly, usually more than one bottle at a time. I use it for making Japanese dynamite sauce, although it is very nice in sandwiches as well. This mayonnaise has a flat taste to it, and is not at all sweetened like American-style mayonnaise. The product is tops but the packaging is a little odd. The mayonnaise itself comes in a squeeze bottle, and the squeeze bottle is packaged in the red-printed cellophane bag you see in the picture. Well, when you remove the bottle from the cellophane bag, you are left with a plain bottle, with no markings on it whatsoever. You will know what is in the squeeze bottle, but others won't, so you just need to communicate that to anybody that has access to your refrigerator. A nice little bonus is that the cap on the squeeze bottle has a rosette tip, so you can make fancy little mayonnaise decorations straight out of the bottle if the occasion arises. …",42 out of 43 users found this review helpful
