Title,Star Rating,Review,Helpfulness
 White Gold Honey is a Great but where's the honey?,4,"Well after some hours on the internet looking for a truly RAW honey I stumbled on this and decided why not give it a try. After receiving it in the mail I realized that 23oz wasn't much at all, but I guess that's the price you pay for unheated, untreated honey these days. With my first spoonful it was quite clear that this was honey was well above par. Consistency is great, not runny but not stone hard either; texture is smooth & soft, and taste is very unique for a honey. It tastes more like candy to me then actual honey. Very sweet, mild tasting. For some this may sit well but for me I was looking for something more ""earthy,"" more ""organic."" Bottomline: An excellent honey if you are interested in something RAW, SWEET tasting, & very MILDLY aromatic, but other then that I would recommend to others. Update: I recently picked up Stakich's Manuka Honey and I must say it's really a spectacular tasting honey, exactly the taste I was looking for, although the consistency was a bit more runny then I wanted. After trying out over six different honey types & brands this is my favorite by far. …",12 out of 12 users found this review helpful
 Yummm - If You Don't Have Sodium Concerns!,4,"These little cheese crisps taste like toasted cheese. My favourite part of making anything with melted cheese is the little bits that get brown and crunchy - and that's what these taste like. They are low in carbs and anyone who is on a low carb diet knows that once in a while you crave a crunchy snack. They are salty, but I don't eat anything else that is high in sodium so I figure a 2 oz bag isn't going to hurt me. …",14 out of 14 users found this review helpful
 Due to availability MOST OF THE flavors may be substituted without prior notice,1,"""From Nantucket to Jamaica & Vienna to India, this sampler box has every exotic location you've ever wanted to visit. Due to availability some flavors may be substituted without prior notice."" Sounds pretty good doesn't it? Makes you believe you are going to receive coffee from all over the world. And just a small notice, nothing major, but we may not have every coffee in the picture available when we put together your box. Though, never fear, we will replace it with something equally exotic and exciting. That doesn't sound like a terrible trade off so I placed the order. Here's what I received, a white box with what looked like a home made label with all the coffees jumbled inside without any packing to keep them organized. Now for the flavors, more than half are doubles, a few triples and more than 50% are some variation on ""French Vanilla"". Defnitely do not recommend. …",16 out of 19 users found this review helpful
 DON'T BUY HILL'S PET FOODS!!!!!!,1,"My cat has gone into RENAL FAILURE, possibly from this food, and Hill's company has hired people to REFUTE CLAIMS. They won't even consider it after MY VETERINARIAN HAS CALLED them. These people hired by the company will RUN YOU IN CIRCLES ""standing by their food"" yet REFUSES TO ANSWER a single question posed to them. They have the WORST CUSTOMER SERVICE to date. They even LISTEN IN ON CONVERSATIONS while on hold. I dare you to call them to get a list of TOXINS they test for in the food! They will say they do not have access to the list in their department. Good luck with this brand, I am up to $2500.00 in vet bills. How much do you want to pay? See here for more info from others …",17 out of 26 users found this review helpful
 DO NOT BUY!!,1,"If you want coffee grounds floating in every cup of coffee, and K-cups that explode open in your Keurig, then this product is for you. I have used about a dozen of these K-cups so far, and about half have come open inside my Keurig, with the top foil seal coming off and the water and grounds going everywhere. The other half stayed sealed, but I still get a lot of coffee grounds floating in my coffee.The inner constuction and filter must be defective as well. The manufacture of these K-cups is somehow inferior to Green Mountain and others. The taste of the coffee is irrelevant when the K-cups don't work. I have used many other different K-cups, Tully's, Donut Shop, Emeril's, Starbucks, Green Mountain,Timothy's, Caribou, etc. and never had any problems. I should have heeded the other reviews that stated the same problems, and not believed the company's claim that these problems were resolved. I now have a partial box of unusable K-cups. …",12 out of 14 users found this review helpful
 the best of the best,5,"My husband and I are crazy about Coffee People k-cups. A friend gave us a box of the ""Donut Shop"" cups and they are spectacular. Very rich and bold, not bitter, but packs a nice punch. Reminds me of coffee from an old-fashioned percolator. A good, strong cup of coffee is hard to come by when you are using some of these newer brewing machines, but the Keurig system is definitely the exception and this variety of k-cup is the best we have ever tasted. …",52 out of 55 users found this review helpful
 Definitely not worth the money!,1,"My mom bought into this product and went through bottles and bottles, at a lot of expense. As far as she (or we) could tell, it did not improve her health in any way. Conceivably if it was only a few dollars a bottle, it may give some noticeable boost (although we did not experience that), but it is NOT worth this huge amount of money people are being roped into paying. Also, Mom didn't seem to mind the taste, but I tried it once, and honestly, it tasted so bad that I probably couldn't make myself drink a dose every day anyway. …",9 out of 12 users found this review helpful
 Quality control needed ASAP!,1,"Just left packaging feedback, but upon review, the issue appears to be quality control. I ordered 2 boxes, 50 count each. In both boxes, the foil lids were not positioned correctly and the seal was not 100%, causing coffee grounds to coat every K-Cup, the frustration free boxes and the box they were shipped in. Worse, about 20% of the K-Cups no longer have the full amount of coffee in them. Additionally, I am not sure that these loose grounds won't impact the Keurig. I hope the folk at Coffee People can rectify this situation, as this is my favorite coffee, but I will not order this product again without some resolve on their side. …",20 out of 20 users found this review helpful
 Wow,5,"Not really sure if I can describe this salt properly. Yes, it has a wonderful flavor without too much of a salty flavor. It's very clean tasting. Mostly, though, I think it seems ""creamy"". Yea, I know that sounds weird, but the moisture with the salt gives it a creamy-salty embodiment. I use this for special dishes to add a delectable flavor to a dish...also knowing that I'm serving food with a healthy salt with tons of minerals. …",12 out of 12 users found this review helpful
 A Reliable Product - Makes delicious breads...,5,"If you love using your bread machine and want a reliable yeast that does not need to be proofed (can't remember the last time I did that), then this yeast will make your life much easier. While this is not a rapid yeast, the bread does seem to rise more quickly than with packets of yeast from the grocery store. This saves time and gives you an empowered feeling instead of the ""Is this going to rise or not?"" feeling. The yeast can be stored in the refrigerator or freezer and is very convenient to use. Unlike the yeast cakes, you don't have to worry about mixing it with water or milk. You just measure it into the bread machine. Here is the recipe I love making for Focaccia bread. It turns out wonderful and you can start it in the bread machine or make it by hand. We serve this in slices or squares topped with butter and fresh rosemary or an herbed cream cheese. Perfect with homemade soup in the winter. Focaccia for the Bread Machine (start in machine, finish by hand) 2 1/2 cups water 2 tablespoons Saf instant yeast 2 tablespoons sugar 2 teaspoons freshly crushed sea salt 2 tablespoons olive oil 6 cups all-purpose flour (the Baker's Catalogue sells an amazing flour) Measure the water, yeast, sugar, salt, olive oil and flour into the bread pan. Program for white bread, dough cycle and large loaf. After the dough has been kneaded, you can put it in a large stainless bowl and cover the dough with a damp cloth. I normally forget it is in there and catch it just before it is about to rise over the top of the pan, so it still works, either way. You could also use half the ingredients for just one loaf if you want to let it rise in the bread machine pan. Let it rise until double in a warm place. My secret it to turn the oven on and then almost immediately off (just leave it on until you feel some heat on your hand) and this seems to create a ""just warm enough"" environment for bread to rise. Punch down and divide into thirds. Roll out two squares and one elongated loaf. This works well on the regular size cookie sheets. If you have a larger cookie sheet, you can roll the dough into two 8-inch squares. Make deep indents with the end of the rolling pin handle at regular intervals. Then brush with olive oil. Let the bread rise until almost doubled. Either sprinkle with sea salt or sprinkle with dried or fresh rosemary and sea salt. You can also top the dough with tomato slices, onion slices and sliced and pitted Kalamata olives before baking. Bake at 400 degrees for 30 minutes. After the bread cools, it will slice easily and it freezes very well. I normally slice two loaves and cut one into squares for sandwiches. To make an Herbed Cream Cheese: Blend together 1/3 cup butter, 1 (8-ounce) package cream cheese, 2 teaspoons dried parsley, 2 teaspoons dried rosemary and 1 teaspoon dried thyme. The idea for this bread came to me after visiting a sandwich shop at a garden center in Seattle. After arriving home from visiting my grandmother, I knew I had to try to make the cream cheese and the bread because they were perfect to serve with homemade soup. This bread has a lot of possibilities so you can vary the toppings to suit the types of soups you are serving. The Instant yeast always works and with a bread machine, you end up feeling like a professional baker. The results are sure to impress. The bread always has a ""fresh from the bakery"" taste unlike the taste of breads made with packets of yeast. ~The Rebecca Review …",52 out of 56 users found this review helpful
" Filler food is empty, leaves your cat always needing more",1,"This review will make me sound really stupid, but whatever. I don't really care as long as people find out what's real and can avoid my mistakes. I got my wonderful little sweet Bella Bean when she was a few days shy of three years old. She had been bounced around from house to house and eating whatever was cheap. I have had cats around me my entire life, for about twenty-five years now. My mother always just fed them whatever, the kinds of food you buy in the supermarket - Friskies, Nine Lives, Kit & Kaboodle, stuff like that. And our cats were always fine, at least in terms of their eating habits. They would eat in the morning, stop when they were done, come back, and eat some more when they got hungry. My housemate at the time was working for Hill's and assured me that this was the best food ever made, so great, so on and so forth. I now know that she is an utter buffoon, but I initially trusted her judgment, which is so unfortunate because she doesn't think. She also had plenty of coupons for free or deeply discounted bags, which made it a much more attractive choice. I first tried feeding the little Bean an unmeasured amount of Science Diet in a bowl, but that didn't work, as she would devour it in one sitting. So then I took to measuring it, and she did the same thing. Then I started parsing it out to twice a day. That didn't work either, because she would start going crazy in the middle of the day, running around, intentionally destroying things, deliberately spilling her water, crying, etc., until she got more food. So then I split it into three servings. Same thing. Then it got to be four servings. That was a little better, but it was too much maintenance and unrealistic to be around every day to feed her four times. So then it went back to three. All the while, I was trying to reduce the amount of food I was feeding her to less than 3/4 of a cup because she was a little chubby. Reducing was hell. She became even more hungry, but I figured she would get used to it. Not really. For over a year, she would wake me up every morning looking for food in a serious way, knocking things off my desk, ripping up any paper she could find, scratching at the door and committing general acts of mischief. As soon as she got food, she was back to her sweet self, but only for three or four hours. We thought she was bored, we thought she was a little nutty, and maybe even had a kitty eating disorder. She always wanted food. It was kind of funny but in the end it was just sad. A few weeks back, we took her to a new (good, non-money factory) vet for her second checkup since I've had her. I talked with him about her being always hungry. He asked what she ate, and I told him the adult indoor Science Diet. Without saying as much, he basically told me that this food is garbage and I should look for something else. He said cat food should have a protein followed by a carbohydrate as the first two ingredients. Science Diet does, in a very loose, by-product kind of way - ground up slaughterhouse leftovers and corn dust. Then they put a bunch of vitamins in it to make it ""healthy,"" instead of just using good ingredients from the beginning. Not that I care about spending money on the Bean, but this food is way too expensive for what it is. So we began transitioning her onto Wellness indoor formula about two weeks ago. She is still eating 50 percent Science Diet with 50 percent Wellness (you really shouldn't just give a cat different food one day out of the blue) but SHE NEVER FREAKS OUT ANYMORE. It's amazing. And it's 100 percent because she is eating real food now, along with that sawdust and chicken hearts I still regrettable have to feed her. We have her down to eating twice a day, only 1/3 cup in TOTAL. She was eating three times a day, 5/8 of a cup in total. Now she eats some in the morning, walks away, eats some more a few hours later, and then looks for dinner about twelve hours after her initial feeding. No more knocking things over, no more trashing Dad's papers on the desk, no more howling, no more deliberately spilled water on the floor. It's incredible. I feel so bad that I was doing this to her for so long. We really thought she was just being dramatic or whatever. But no, she was genuinely hungry because she wasn't eating any real food. Do your cat a favor - buy her or him so food made with real ingredients, things you would eat - Wellness, Halo, Innova, Evo, whatever. Figure it out for yourself, but please don't feed your cat this. It's garbage. …",6 out of 14 users found this review helpful
 You Lucky Dog!!,5,"This is the second time I've bought these for my dog. Although they are not dog treats, my dog loves them. She is very special to me, so I get her the best. This is a great price for these slim jims. If I buy them in the store I pay alot more for them. I've tried them also & their very good. They come individually wrapped in a nice box that opens from the bottom so you can get one or more out at a time. Just like the ones they sell in the stores. If you buy them one at a time at .25C a piece you pay $25.00 dollars for them. I think this is a great value!! …",6 out of 12 users found this review helpful
 SIMPLY THE BEST!,5,"I was skeptical when I received my Orange Blossom honey and noticed how clean it was for being raw and unfiltered. Most raw and unfiltered honey is creamy tan/brown so, I gave the company a call. I spoke with John and he was just the most helpful person and he explained their filtration process was very minimal (which was what I need) and yes indeed, the honey IS raw and has all the goodness of raw honey, without all the waxy material and other things that could get into honey during the collection/pouring process. But the taste- Oh, the taste is magnificent! It is probably the best honey I ever tasted and goes GREAT in brewed cinnamon tea. It has a real light smooth flavor (not ""bitey"" like some honeys). And with the squeezable bottle- The only thing better would be letting the honey drip right off the comb into your jar, it's that easy to squeeze! You can't go wrong with this honey! …",14 out of 14 users found this review helpful
 Broken in a million pieces,1,I had this shipped to my home while I was on vacation so I did not see it when it arrived. When I got it it was broken in many pieces and unusable. I will never do business with this company again. …,4 out of 19 users found this review helpful
 Best Buy !,5,I am addicted to this green tea! It has the smell of passion fruit. I have to have at least 1-2 cups a day. Great Buy. Can't find it at all stores and it cost half the price on Superstore. …,17 out of 19 users found this review helpful
 No more non-GMO on label,1,"Bought the nacho chips regularly for my kids but the last delivery came and there was not a non-GMO label on the package anymore, they still use organic corn but use non organic canola oil and any non organic canola is most likely Genetically Modified, which is something I do not want in my body. Will not buy this product again. …",12 out of 14 users found this review helpful
 ABSOLUTELY HORRIBLE! STAY FAR AWAY,1,"Thanks to this horrible deodorant, I have damaged over 20 shirts of mine. This deodorant works great and does the job, however you soon realise that all your shirts are becoming damaged. You will notice large yellow stains under the arms of the shirt, where you applied the deodorant. These stains DO NOT come out and your shirts will be permanently damaged. This is one of the worst products I have ever used. Stay far away from this horrible product or risk losing all your favorite shirts. …",13 out of 20 users found this review helpful
 Great,5,My mom sent me this as a gift for my 23rd birthday and we had a blast remembering all the diffrent kind of treats. It was the best gift i can remember because it opened doors full of great childhood memories so thanks mom !!!!!! …,12 out of 24 users found this review helpful
 Easy & delicious,5,"I love having this in my pantry. I cook a batch of rice, add some sauce and dinner is served. My 10-year-old son loves it and asks for it several times a week. …",11 out of 13 users found this review helpful
 Excellent product,5,"My primary reason for buying this product was to help my digestive system. I have iron deficiency anemia, but I could not tolerate any brand of iron supplement, and the shots were extremely painful. So I became extremely anemic and needed transfusions. Consequently, I couldn't take a chance anymore on not using iron tablets and I had to find a way to take them without suffering. Because I use coconut oil and milk in my cooking and for skin/hair care, I've done research on the benefits of this amazing seed, and I thought that these capsules might help me to tolerate iron tablets. Well they have, and I am now able to tolerate 3 daily doses of ferrous sulfate, so I'm in compliance with my doctors orders and my hemoglobin level is rising. …",12 out of 12 users found this review helpful
" Good, filing, tasty",5,"I eat this cereal cold, usually, after soaking it for 10-15 minutes, but it is excellent hot as well. Its very filling so it doesn't take much to make a satisfying breakfast. I appreciate the lack of sugar and fluff; this is real food! …",40 out of 43 users found this review helpful
 not great,3,"only three of the four types of seed really sprouted. my cat loved it and munched on it constantly. however, just about a week ago, it all pretty much died. maybe my cat munched too hard? i still have the nice container, so i'm just going to get the seeds it came with and replant them in the container. maybe thats what i should have done to begin with. its a nice container though. …",33 out of 36 users found this review helpful
 Worth Every Penny - Wellness CORE dry and Wellness Grain Free canned,5,"Over the last two years, our older cat (now 11 years old) had ongoing issues with diarrhea and vomiting. After several trips to the vet and numerous tests that found nothing wrong, we were left thinking that this was her lot in life, sensitive to hairballs with a testy stomach. We changed her to a vet-recommended food and went on with life, but as you can imagine, she was still suffering. She was dehydrated, her coat was rough, she was losing muscle and constantly hungry because she was essentially living life as a non-voluntary bulimic. At one point, I hoped a test for her thyroid would be positive so we could just figure out what on earth was wrong with her. Last month I decided I didn't have anything else to lose so I started researching holistic treatments for her various symptoms. I happened upon a description of grain allergies in cats and I was astounded at the number of symptoms she had. Her eyes were always watery, her lips and gums a little swollen, and these were things her vet and I had attributed to ""getting older"" or her ""hairball sensitivity"" since none of the test had pinpointed a problem. After some research to select a quality brand, I ordered Wellness Core Dry and Wet food. I didn't bother to transition her, just started her on it right away. Besides, she wasn't keeping down much of the other food anyway. She took to it right away, and she's a picky one. Within two days, the diarrhea was gone. Within a week, she brought up a hairball that would shame a lesser cat. It's been a month now and the only bad thing I can say is that I wish I'd found this food sooner. No more watery eyes, no more swollen lips, and no more noxious fumes from the litter box. My husband and I cannot believe that fact, but it is true. A high-quality food WILL reduce litter box odor. I didn't believe it until I...well...didn't smell it. I'm transitioning our other cat to it now and he already looks better for it. The food has a stronger odor than store-brand cat food. You'll also want to note that it doesn't have preservatives, so it's bound to have a stronger smell. The wet food actually smells good, for cat food. We use the Wellness Core 3oz Grain-Free Chicken. I'm sure our experiences will vary, but I've watched a cat who was the epitome of finicky, who would turn her nose up at Fancy Feast if the same flavors were served back to back, gobble the same flavor everyday for the last 30 days without complaint, and most notably, without vomit. So I'd say she gives her claw of approval. Bottom line? It's pricy, sure. But it's worth it for us. Considering the money we're saving in paper towel clean up expenses alone, we're probably saving a buck or two. I should also thank Superstore for making it Prime eligible, so it's easier to buy it here than to find it in the store. So now, instead of begging me to feed them, our cats can start mauling the UPS man. …",16 out of 16 users found this review helpful
 What a rip-off!!!,1,"These boxes are very small! Each is 1.2oz ... yes, you read that right, ONE POINT TWO OUNCES! About the size of a box of raisins. At $5/box you would think you would get something more substantial. I ordered these for a party, thinking the kids could share it. Ha! I'm embarrassed to even bring them out :( …",12 out of 14 users found this review helpful
