Title,Star Rating,Review,Helpfulness
 Not a K-cup but works in a Keurig,4,"As the other reviewers have said, this is not a K-cup! I uploaded an image of one of these pods next to a K-cup for comparison. The difference is the filter is exposed in these pods as opposed to being fully sealed in a K-cup. Since the coffee is exposed to the air when you open the package, you will have to seal them with a clip or put them in an airtight bag or tupperware to prevent the rest of the pods from loosing freshness. Having said that, in my experience they are a great inexpensive alternative to use in your Keurig brewer. The 36 count boxes arrived as unmarked brown cardboard boxes, not the colorful retail packaging shown on Superstore. Inside each cardboard box, there are three clear heavy duty plastic bags, each of which holds 12 of the pods. The bags are not resealable! …",45 out of 48 users found this review helpful
 Popcorn Salt,5,I ordered this product because I had difficulty finding it in the grocery stores. I will definitely order from this company again. …,7 out of 12 users found this review helpful
 Beware new Nutrition Facts - Sodium Content Has Changed,3,"I love this broth. I just ran out and purchased a new supply. I happen to re-read the nutrition lable and discovered that the sodium content has gone from 54 mg (2% daily) to 430 mg (18% daily). If you use this because of the low sodium content, please be aware …",16 out of 17 users found this review helpful
 Cheap packaging - slightly deceptive photo of product,2,"Product seems ok but, is shipped in a flimsy cellophane bag that cannot be reclosed. (Note that the photograph of the product appears to show the rim of a jar, but the ad intentionally avoids a description of the packaging.) A cheap jar with a screw on lid would not have added much to the price. …",10 out of 26 users found this review helpful
" Not great matcha, but for the price it's good for everyday use",3,"It tastes good enough and is affordable enough to use every day. It's not sweet and super bright, almost-neon green like medium and high grade matcha, but it's not bitter, unpleasant, stale, and brownish like Malden's similarly priced matcha. It is only slightly more expensive than Malden's matcha ($3.40/oz. or $2.62/oz. in bulk vs. Malden's $2.50/oz) but the quality is superior. I highly recommend this as an overall good mathca at a really good price. If this is the first matcha you try you won't be disappointed. But if you're not impressed with the taste keep in mind that the next step up in quality available through Superstore is at around $10/oz (ex. DoMatcha's 2nd Harvest). …",22 out of 22 users found this review helpful
 For those  who like mild coffee,5,"I have a Keurig in the office for guests (and myself) but I learned that most of my guests prefer a lighter roast than I do. After tasting the Veranda Blend, I found it was light, but very aromatic and you could still add sugar and cream and it was very similar to a good restaurant coffee. So when supplying choices of blends for guests, I'm including Veranda as a milder blend for those who don't like French Roast or Sumatra or other bold blends. I find that there is a bit of woodiness, but also a slight flavor of nuts and cocoa. It's a pleasant blend of coffee and a very good cup if you don't want something awfully strong. Some lighter roasts are acid to me, but this one seems to be balanced. …",12 out of 13 users found this review helpful
 Can't live without it,5,"Having suffered from Chronic Candida Albicans for over 10 years, I finally came to terms with the idea that I CANNOT have any type of sugars or sweeteners, not even natural sugars from fruits. Being a fruit lover who used to eat lots of fruits on a daily basis, I started looking for a safe way to have sweet stuff without feeding the microorganisms that have been for so long attacking my system. After a lengthy research of more than a year, I found out that though most sweeterners FEED bacteria and Candida Albicans, Xylitol DOES NOT. I started using Xylitol regularly and found out, to my surprise, that my worst Candida symptoms were GONE. The symptoms would recur every time I had fruits (darn!)or something made with refined sugar or other sweeteners like Splenda or Stevia, or even the Aspartame that is used on Diet Drinks. Whether I liked it or not, it became clear to me that I could not eat or drink anything sweet, that I could neither have any fruits and that I could not drink any diet sodas. I have intensely and extensively ""tested"" Xylitol for over a year and I can AFFIRM without a doubt that it is the ONLY sweetener I can use without getting my symptoms back. I buy chocolates made with Xylitol on a regular basis and I use this brand of Xylitol to make chocolate bread and all kinds of cookies. I also make healthy chocolate ice cream with Xylitol, unsweetened cocoa powder and soy milk. If it were not for Xylitol, I would not be able to put anything sweet in my mouth. One of the most recognizable and annoying Candida Albicans symptoms was that I had to get up every one or two hours every night to urinate (!!). It was a nightmare, but it helped immensely when it came to ""testing"" what was good or bad for me. Conclusion: If I stay away from all types of sugars, natural fruits, fruit juices and sweeteners, and only use Xylitol-sweetened stuff, I feel much better in every respect and, very importantly, I can sleep 6 or more hours in a row without waking up to go to the bathroom. …",30 out of 30 users found this review helpful
 Not as heathful of a snack as you might think,3,"The good news is that the peanut butter flavor of these granola bars is really good. When I first bit into one, I immediately thought I was eating a peanut butter cookie. They're very reminiscent of a Girl Scout peanut butter cookie, minus the cream filling of course. That brings me to the bad news. While a serving of these granola bars has a tad less fat and sugar than a cookie, the difference isn't great. If you don't believe me, just look at the nutritional information for a Nutter Butter cookie here. That doesn't mean that this isn't a good snack to have on occasion. These are a healthier alternative than a candy bar, for example, but they're really not much different than a cookie. In other words, even though most people would equate granola bars with health food, one must be careful not to overindulge in these. …",21 out of 26 users found this review helpful
 They are powdered and they are eggs,5,You probably don't want to fix them for your guests but they are an excellent way to keep eggs on hand for baking or as part of your emergency food supply. …,14 out of 16 users found this review helpful
 Solving the Moth Problem,5,"05140 Safer Pantry Pest Trap (2 per box) I have had great results with this product. Those who say they work for a while and then quit need to remember that the traps are only meant to catch flying stages of the insect. I use these traps once or twice a year, whenever I see a moth or two, once the infestation problem has been solved. 1) Use Pantry Pest Traps to eliminate all ADULT moths. 2) Next, go on a larva hunt (in the early stages they look like caraway seeds -- dark little crescent shapes about 1/8"" long). Check all the food in your cabinets. Take it all out. Anything can house larva. Look in the flour, cereals, boxes, bags, anything with a seam or crevice. Think like a mother -- she is trying to hide her young so that they will survive! 3) We have a pantry cabinet with adjustable shelves. When moths kept coming back, I got a flashlight and discovered that there was larva in every single hole for the shelf brackets. Swabbing the holes with a cotton swab dipped in alcohol produced mixed results, so I finally placed a piece of tape over each hole. If the larva survived the alcohol, they starved to death in their little cell. Using this method, I buy traps when moths come in with the groceries. I use canvas shopping bags that I wash every now and then so that the bags from the store (especially paper bags) don't bring in larva. …",15 out of 15 users found this review helpful
 Not nutritionally sound,1,"I had been using this food mixed with the canned science diet for my lab puppy (because that is what the shelter had used), and didn't have any issues. However, after reading the other review, I asked the manager at a local pet food store what he thought of this brand, and he said it was NOT good - all fillers (corn) and animal by-products. He suggested I gradually shift the dog to Blue, which has a similar protein/carbohydrate mix, and then when the puppy is a bit older (around a year), move to a food with a higher protein content. (To ease the puppy into a new diet, he suggested I start by mixing 1/4 cup new food with 3/4 old food for a few days, then half and half, etc). He also recommended that I mix in a couple of tablespoons of canned food with some water, just to make the dry food moist. (He said the nutritional content of the canned food isn't as important, since the dry food will provide most of the substance, and that I can vary the canned food.) Finally, he also said that bully sticks are far better for dogs than rawhide (which are basically like eating leather). …",6 out of 13 users found this review helpful
 Clif Crunch bars,1,"Just when you think you're eating healthier - you research to find out ""Your NOT"" with Clif Products. Theirs so much sugar, carbs & fats in these products that you might as well eat cookies or candy bars. They definitely taste better and you get the same sugar & calories. …",3 out of 21 users found this review helpful
 Nut Milk Bag vs Paint Strainer Bag,5,"I bought a couple strainer bags at Home Depot for about 2.50. I used one bag for maybe 5 times and it was obvious that it was loosing integrity every time I used it. I don't think I could have got 5 more uses out of it. It did work fine... though I think that the pulp was starting to stick to the bag a little. I would NOT recommend buying paint strainer bags. This nut milk bag works great. I have used it to make almond milk about 20-25 times now. I can see it easily lasting quite awhile....at least a year. Though I will update my review as time passes. It is easy to clean and the mylk goes through well. I think it is well made. For the convenience of buying this and having it last a long time and not making one myself, I think this bag is definitely worth the investment. The only thing I think the maker should change is the drawstring. It is made out of a slippery type rope and when you tie it, it does not knot tight and stay knotted. So I have to re knot it many times. Also, the rope is starting to fray at the ends. Even so, I am still giving 5 stars for this product. Advise....buy this nut milk bag and not the paint strainer bag …",13 out of 13 users found this review helpful
 Actually pretty good,3,"These are actually pretty good little potato puffs, and best of all - no CHEESE! (unless you like that sort of thing, which we don't so it's nice to actually find a potato side dish with no cheese in it). Anyways- - these are surprisingly good and they toast up nicely in the oven in like 10 minutes. worth it for $10. …",15 out of 18 users found this review helpful
 not what i was hoping for,3,the plant is pretty but they didn't gave me what i ask for. i ask for this plant in this picture and the send me another one with a darker color. what is not good is that once you open it you can not send it back. and also it was very small one. and the orchid is fake. …,15 out of 17 users found this review helpful
 The best twice baked potatoes you'll ever have!,5,"Perfect year round with just about any meat dish, these Omaha Steaks Twice Baked Potatoes are a gourmet delight. The consistency of the whipped potatoes is smooth and the little bits of bacon, peppers and cheese add to the explosion of flavor. They cook easily in either the conventional oven, or on the grill when wrapped in foil! Go ahead, treat yourself! …",13 out of 14 users found this review helpful
 The worst !!!,1,I usually don't leave reviews but I had to voice my opinion. Save your money !! Red Vines doesn't deserve to be called licorice. With a family of two children candy never gets thrown away in my house. Well Congratulations Red Vines !!! Your on top of the **** list !!! …,1 out of 16 users found this review helpful
 Hummus gets raves!,5,"I have avoided making real hummus for years. I made a white bean/olive oil variation because I couldn't make hummus that tasted as good as what I bought in stores. I believe this product will save on my grocery bill considering a tub of hummus averages $5. I found and tweaked a recipe online and now people request I bring hummus to gathering. Many don't believe I made it until I give them the recipe. I use three tablespoons of the Al Wadi Tahina to one can of garbanzo beans, among other ingredients. The product comes in a plastic container with a wide mouth making it easy to stir. …",19 out of 19 users found this review helpful
 Superior product!,5,"I have just recently begun using VCO for nearly all of my cooking. After purchasing two books on the benefits of coconut oil, I have purchased several different brands of oil. The Nutiva Organic EVCO is by far a superior oil with a delightful flavor. The price from Superstore if you are a Prime member is the best I have found for this quality of oil. I began eating the oil mixed in about 1/2 cup of cottage cheese because I read on a forum that cottage cheese has properties which help the body assimilate the oil. Since then I have expanded to many other uses. I use the oil to sautee garlic, onions, peppers, etc for all of my soups and stir frys. I spread it on toast and add it to my corn bread. In just the first week of eating coconut oil regularly I noticed that my chronic aches in my joints and muscles subsided. My skin is smoother and blemishes began to disappear. I began using it as a topical ointment on my hands, feet and face along with knees and elbows. It is a much better skin conditioner than almost anything else I have used. I found that it also works great as a conditioner for all of my wooden cooking utensils and I rub it into my cutting boards to condition them. It is far superior to mineral oil! I have introduced the oil into my husband's diet also. He has been a Type II diabetic for about 15 years and just turned 77. He is beginning to notice positive benefits also. He particularly has noticed more mental acuity. He adds the oil to his morning cereal and spreads it on his toast and really enjoys the flavor. I am so happy to have found this wonderful Nutiva oil and appreciate its many benefits. I find it kind of addictive. I now look forward to adding the oil to more and more foods and it seems to make nearly everything, including eggs, soups, stews, casseroles, muffins and breads more delicious. I highly recommend the Nutiva brand of Organic EVCO for a huge variety of uses. To those who think it has too much coconut flavor - well, I guess you can't please everyone. Try it and decide for yourself. The health benefits are worth it! This oil has given me a new energy and improved my health so positively that I would recommend it to everyone. The only downside I can mention is the plastic container. It would be better if it were packaged in glass, but hopefully all those anti-bacterial, anti-fungal and anti-viral properties of the oil will negate the use of a plastic container ;-) …",17 out of 18 users found this review helpful
" Bold robust flavor. Refreshing for all occasions, great for colds and weight loss!",5,"Red Zinger is the tea that made Celestial Seasonings famous. This was the must-have tea in the seventies. Every well stocked hippie cupboard had to have this tea next to the brown rice and soy sauce. The ingredients are healthy and tasty, and blend into a tasty ruby potion that smells lemon-mint tart. Red Zinger is especially good for colds--the ingredients strengthen the immune system and the tea is soothing to the throat. It is also great for a diet tea--the bold flavor helps with cravings and the diuretic ingredients prevent and ameliorate water retention. And aside from its benefits it is just a delicious tea! The flavor is sour-cherry with a hint of mint and flavorful hot or cold. Hibiscus is the first ingredient. First consumed by the ancient Egyptians, Hibiscus tea has diuretic qualities, can lower blood pressure, and has minerals and flavonoids. The second ingredient, rose hips, are very high in vitamin C and are used in herbal medicine to prevent urinary tract infections. Other ingredients include peppermint, lemon grass, orange peel, lemon myrtle, licorice and wild cherry bark. Celestial Seasonings gets extra points for their packaging: they utilize 100% natural recycled paperboard in their boxes and they don't package each tea bag individually. Instead they use a system of a waxed paper bag inside the box that stays shut when you fold it. It keeps the bags fresh and utilizes less packaging than individually wrapping each bag. The art they use on each box is beautiful as are the quotes and information they put on every surface. Quote from the box: ""Passion colors all that it touches in its own hues."" Baltasar Gracian. …",12 out of 14 users found this review helpful
 Now I Make Pad Thai that Tastes Like It Should!,5,"Tamarind paste has not been a staple in my pantry -- until I discovered what a difference it can make in my cooking. I created a marvelous Pad Thai sauce, simply by using this paste (and a few other ingredients). For all its goodness, I have to say that you've got to have a little faith in order to put something like this in a sauce. It resembles nothing so much as road tar, black, gooey, utterly yucky-looking. But do give it a shot -- its worth your time and effort. By the way, I bought the 6-pack. That's a lot of tamarind paste, more, in fact, that I can use in this lifetime. I'm sharing bottles with friends and relatives. Highly recommended for those who enjoy oriental cooking. …",15 out of 16 users found this review helpful
 Deceptive labeling for glorified peanut bars,1,"I agree with Catriona about these bars tasting like a peanut bar and nothing like the advertised description. It seems like the company is trying to pull a fast one here by promoting these bars as almond, walnut and macadamia, especially when peanuts are listed as the first ingredient in tiny print in the ingredients list. Maybe they think that people can't tell the difference between peanuts and macadamia nuts? I would have given these bars two stars since they actually taste OK, but I have a hard time believing that the 4.5 star rating the product currently receives hasn't been created by company shills. It is a shame too, since the cranberry almond bars I also ordered were excellent and actually tasted like the description. If I had only ordered these I likely would never have purchased another product from KIND PLUS. …",10 out of 12 users found this review helpful
 perfect size and refreshing,5,"This is a perfect, on the go, refreshing beverage. I love the chocolate flavor. It is nice and rich/smooth without being too rich. This is low fat and has only 100 calories. This is easy to chill and throw in a lunch box or work bag. It is enough for a quick burst of energy without a crash mid-morning or mid-afternoon. I feel good about giving this to my kids since they do not ever get soda or any other junky drinks. …",17 out of 18 users found this review helpful
 bad beef,2,I'm normally a fan of jack links but this really disappointed me. Ordered 4 bags and had two of them. I spent more time picking through the meat taking out the nasty gizard and fat chunks all throughout the bag. Also the meat quality was terrible and quality control isn't. Good for this flavor. One piece would be moist and flavorful and the next would bard as a rock and uncomfortable to chew. Overall this was a terrible product. Jack links shouldn't put 10 different cuts of meat in the same bag. If you like quality controlled products this isn't for you. …,13 out of 13 users found this review helpful
 Very high quality tea,5,Many of the common brands of herbal teas are not palatable to me. This one is very good. I enjoy it. Easy on the palette and easy on the digestion track. Yum! Just like any high quality tea. …,16 out of 17 users found this review helpful
 Good value if you know what to expect,4,"No, this is not sweeter than honey nor regular sugar nor even artificial sweetener. However, it has the maple flavor that I need to add to certain winter cocktails (hot buttered rum, replacing some of the dark brown sugar with this) and to tea. If you are expecting something super potent and super maple, like maple sugar candy, this ain't it. It's what you'd expect from something that is pure and not artificially enhanced with other sugars or maple flavoring. I'm satisfied and I think anyone would be IF they have proper expectations. …",14 out of 16 users found this review helpful
 good stuff,5,"this red clover tea is worth my money, i have shed 8 pounds in 3 weeks, i know its not a diet tea or anything but, i drink this twice a day eat my 3 regular small meals, and a fruit or a rice cake or something lowfat, the tea coupled with better eating habits and i ride my exercise bike and do a few stretches, lunges, lift a 5 pound weight in sets of 5's twice, for about 15 minutes total2 times a day, nothing long and drawn out. before 3 weeks ago i honestly weighed 199, that's a lot of weight if you are 5'2, mostly in my **** and thighs. today i weigh 190, today meaning march 20, 2012. i have a long way to go but that is a good start for me i love food it is hard but i find lowfat and sugarfree things to snack on. being overweight makes you tired easily, and the more tired you feel the more you will just sit around and when you sit around, yep you tend to snack. my goal is 170 pounds, yea that is still a lot of weight but i am a realistic person, i will not set myself up for a let down. if a should lose anything beyond 170 i will be very happy, i will update my quest on april 20, 2012. thanks …",15 out of 17 users found this review helpful
 Buyer beware BPA!!!!!,1,"Muir Glen cans are lined in plastic and leach Bisphenol A. Too bad because this was a great product and was a standard in my household. My initial conversations with them they contradicted this fact, which to me was misleading. General Mills owns Cascadian Farms as well and now I don't buy there either. Now we use BioNature in jars or Pomi products in Tetra Pak cartons. All canned tomato products use BPA and so do many of the lids of jars used in food containment. Now I also just make from scratch which is made simple by chef Andrew Carmellini in Urban Italian. Lydia Bastianich is another favorite chef that deserves mention for simple yet big flavors. Boil, peel, freeze and store. Can manufacturing companies that I corresponded with said they were working on a solution for later this year or next year. …",13 out of 16 users found this review helpful
 Loving this product,5,"My husband and I love to cook. We just ordered all the Palouse Brand products and are so excited about the quality of each of them. We had many ask for the recipe, but it wasn't the recipe it was the great quality of our ingredients. Palouse brand isn't just packaged cutely it is the real deal. If you like to cook this product is a must try! Thanks Palouse brand for bringing fresh, great ingredients to my family table! …",12 out of 12 users found this review helpful
 Not nutritionally sound,1,"I had been using this food mixed with the canned science diet for my lab puppy (because that is what the shelter had used), and didn't have any issues. However, after reading the other review, I asked the manager at a local pet food store what he thought of this brand, and he said it was NOT good - all fillers (corn) and animal by-products. He suggested I gradually shift the dog to Blue, which has a similar protein/carbohydrate mix, and then when the puppy is a bit older (around a year), move to a food with a higher protein content. (To ease the puppy into a new diet, he suggested I start by mixing 1/4 cup new food with 3/4 old food for a few days, then half and half, etc). He also recommended that I mix in a couple of tablespoons of canned food with some water, just to make the dry food moist. (He said the nutritional content of the canned food isn't as important, since the dry food will provide most of the substance, and that I can vary the canned food.) Finally, he also said that bully sticks are far better for dogs than rawhide (which are basically like eating leather). …",6 out of 13 users found this review helpful
 C.E.T. VeggieDent Chews,5,"We find it keeps our dogs teeth clean, breath fresh and she loves them. We found that the Petite Chews are the same product as the Regular. Only difference between the two is the Petite are half the length. Per OZ the Regular size cost less so you can just break them in half if you want a shorter size. …",22 out of 22 users found this review helpful
