Title,Star Rating,Review,Helpfulness
 one great big huge high-five--from my cat !!!,5,"My cat LOVES Fancy Feast cat food; and this variety pack in particular makes mealtime a veritable newsworthy event! He always eats it down and he loves it; I can tell. You get eight cans of Ocean Whitefish & Tuna Feast; eight more cans of Savory Salmon Feast with Cod and eight more cans still of Sole & Shrimp Feast. Very good! The food does have some nutritional content; I always look for that when I buy food for the cat. There's some vitamin E, A, D3, B12, and B1. I like that. Naturally, ask your vet if you have any concerns about your cat's personal individual needs for nutritional content in their daily diet. If you catch a sale on this, stock up! However, I would use these cans of food within six months of buying them. Overall, this is one of the better brands of cat food out there; and I recommend it. Your cat will love it and it has nutritional content which is great for them, too. …",12 out of 12 users found this review helpful
 Best thing since Sliced Bread....Awesome !!!,5,"I am not a big fan of fruit roll-ups as they tend to be more like candy than fruit with added sugar. These Twisted Fruit ropes are a ""whole"" other story. They are Organic and provide ONE FULL Serving of Fruit! Each one is 70 calories and best of it, they are satisfying. And I love its dense, chewy texture. It's SO GOOD that I enjoy it as much as my children do ! So far, I have had the pleasure of trying the strawberry, sour apple, and tropical fruit twists. I love them all although the sour apple is indeed ""sour"". It will make your mouth pucker which I personally love but I buy the strawberry & tropical flavors for my children. I just wish that they were less expensive but I can see how they cost more to produce so I am willing to pay more to get a better, more nutritious fruit snack ! Btw, Superstore has the best prices on these esp. if you ""subscribe and save"". They are not yet readily available and at my Whole Foods Supermarket, they sell for 99 cents EACH ! …",39 out of 40 users found this review helpful
 not so much a spray as a stream,3,"The liquid spilled in transit so the label and bottle were all sticky. Also, I was hoping this would be a spray, but it is more of a stream or squirt. …",3 out of 13 users found this review helpful
 ALMOST A DOLLAR A CUP????!!!!!!!!!,1,"BUYERS BEWARE - I guess it's my fault I really thought when I ordered this coffee I was gettinng TWO BOXES of coffee for 22.50 like almost every other coffee dealer on Superstore sells this stuff for. But this guy sells this coffee for 22.50 for ONE!!!!! box of coffee.When it arrived at my house I asked my wife where the other box was and she said: ""Thats It just one box arrived!"" I looked my order over and sure enough he does sell it for 1 box of coffee for 22.50 making this probably the MOST expensive k-cup coffee on Superstore. So shame on me for not looking the order over before I purchased it. If you look at all the other sellers, their coffee is 23.00 for TWO BOXES OF 25 count k-cups. Thats 50 k-cups. This guy only gives you 25 k-cups for 22.50 which is EXTREMELY EXPENSIVE!!!!! congratulations you fooled me, but I hope this review warns others off. …",31 out of 48 users found this review helpful
 Makes terrific Dark Rye,5,"My family enjoys good dark rye. I followed the package directions (just add three tablespoons of molasses and three tablespoons of powdered cocoa) and made the best dark rye we have ever eaten. Three cheers for Hodgson Mill. If you like rye bread, you will love this mix either way. The bread mix works great in my bread machine and yields good volume, texture, color and flavor. …",16 out of 18 users found this review helpful
 Absolutely the BEST!,5,"I have tried many olive oils and this olive oil is absolutely the best olive oil I have ever tasted. More and more while watching food/cooking programs that are actually filmed in Italy, and especially Sicily, it is this olive oil I see on the table. The other reviewers are correct when they state Mario Batali uses it, as I have seen him use this oil on many occasions. The price is a little higher than some, but when used on fresh bread, or a little over Minestrone, or poured over fresh pasta dishes will make you a believer too. …",22 out of 22 users found this review helpful
 Look at the Ingredient List,1,"This food is not a good food and is not worth the money. It contains by products and lots of corn. It will make your cats fat and lazy. My friend's cat was vomiting and had been to every vet and had every test but when she switched the food to Innova Evo, the cat stopped vomiting. Do not buy this food because for the same price you can buy Evo which is grain free and made with table-grade meat. SCIENCE DIET IS GARBAGE! …",7 out of 12 users found this review helpful
 I Agree With A. Leahy,1,"Although I'm not a former disgruntled employee, I have developed some reservations about ""San Marzano"" brand tomatoes. When I bought my first can of these tomoatoes at my local grocery store, I thought, great San Marzano plum tomatoes stright from Italy for under $3 for a 28oz can! Then when I got the can home and opened it, the tomatoes inside didn't look like the ones on the can. They were round, and didn't look like plum tomatoes, which resemble little eggplants. Further, after reading the label, I realized these tomatoes are from California, and have nothing to do with the San Marzano reigon of Italy at all. What a dissapointment! Buyer beware: these tomatoes are not from San Marzano, and probably aren't even plum tomatoes! As for taste, it was OK, but definately I was left wondering 'where's the great, sweet, fresh flavor people say San Marzano tomatoes should have?' If you are looking for an average tomato this brand should suffice, but if you want the real San Marzano tomatoes, please save youself the dissapointment and keep looking. …",15 out of 18 users found this review helpful
" Healthy, delicious, and at a decent price.",5,"I love ""Food for Life Ezekiel"" products. Originally, I was introduced to the bread when on a special diet -- an offshoot program of ""Over-eaters Anonymous"", the H.O.W. program -- many years ago. The bread contains NO flour, no sugar, is high in protein and fiber, and, for my taste, is delicious. Actually, I learned that OVER-eating was not really my problem. My problem was NOT eating the healthiest, life-giving, minimally processed foods available. Over time, I learned, relapsed, and relearned, etc. I was thrilled when I learned ""Food for Life"" added cereals to their product line. In looking at labels at my local health food store, I discovered that this brand was the ONLY cold cereal on the shelves that had NO sugar content! Since then, this is the ONLY cold cereal I buy. It can be served warm, as well. Generally, though, I prefer ""John McCann's Steel-Cut Irish Oatmeal"" (also zero sugar and high fiber) for hot cereal. Needless to say, the cereal is expensive (but cheap if you consider that you're no longer polluting your body with all the sugar, air, preservatives, and other junk in most commercial cereals), so I was thrilled to find that Superstore offered it in a 6-box bundle for a far better price than my local market. I usually have a bowl a day with fresh berries (strawberries are very sweet this year in my area) and slivered almonds topped with light soy milk. I find that when I'm eating really nutritious food, I eat slowly and savor. When I'm eating junk, I tend to ""wolf"" it down. It doesn't matter why. I just hate that sensation, so I avoid it and my body thanks me every day. …",32 out of 33 users found this review helpful
 Great Assortment,5,"This assortment is a great way to try a bunch of flavors. I love the variety and I'm ordering it again right now! UPDATE: I ordered this a second time; it's that good. I've only had my Keurig about a month and am loving the different k-cups, trying to find which brands and flavors I like most. The second batch was different from the first which was nice!!! …",12 out of 14 users found this review helpful
 Don't Be Without a Buster Cube!,5,I bought a mini buster cube for my miniature dachshund to help build up his rear leg muscles a few months after he had back surgery. All I had to do was put a few pieces of his dry dog food in it and he figured it out quick. It's 7 years later and it's still his favorite toy. He can even pick it up with his mouth and carry it around the house. He puts it in his dog house and bangs it around for hours. He literally plays by himself and keeps busy all day in the yard too. He doesn't even care that I stopped putting food in it years ago. I had a few of these break after wear from the rocks in my last yard but I keep about 5 at a time in my house in case the company decides not to make them anymore. I bought one for my friend's pomeranian and he doesn't stop playing with it either. He now has two. …,39 out of 39 users found this review helpful
 Great product - Insane Price,5,$57 for 12 cans of Starbucks Doubleshot is not only insane but it's insulting to consumers. Superstore- get a clue and remove products that are so absurdly priced. …,18 out of 19 users found this review helpful
" Great product, can get cheaper at Target - CHECK FOR RECALLED POUCHES!",4,"We love Happy Tots food. My 12 month old has tried many varieties and loves them all. He has not had one sour face yet! I'm surprised at the price here, you can get this item at Target for $1.09 per pouch which is much less expensive. I guess buying it online is helpful for people who don't have access to a Target or Health food store, and in that case, is worth the price. *** as a special precaution *** A baby food recall just issued by the FDA (Jan. 2010) may have some of the most stomach-churning details I've read in awhile: ""Swollen or leaking pouches may indicate problems with the product, including possible contamination by bacteria that can cause illness, or that the packaging has been compromised and is at risk of bacterial contamination."" The recalled food is made by Happy Baby, and it's a mix of the baby and toddler lines that parents should be throwing out. The recall covers: * HAPPYTOT Green bean, pear & peas, NET WT. 4.22 OZ. (120g), UPC 8 52697 00127 9; * HAPPYTOT Sweet potato, carrot, apple & cinnamon, NET WT. 4.22 OZ. (120g), UPC 8 52697 00128 6; * HAPPYTOT Spinach, mango & pear, NET WT. 4.22 OZ. (120g), UPC 8 52697 00129 3; * HAPPYTOT Butternut squash & apple, NET WT. 4.22 OZ. (120g), UPC 8 52697 00130 9; * HAPPYTOT Banana, peach, coconut & prunes, NET WT. 4.22 OZ. (120g), UPC 8 52697 00131 6; * HAPPYTOT Banana, peach & mango, NET WT. 4.22 OZ. (120g), UPC 8 52697 00132 3 * HAPPYBABY Mango, NET WT. 3.5 OZ. (99g), UPC 8 52697 00134 7 * HAPPYBABY Spinach Mango Pear, NET WT. 3.5 OZ. (99g), UPC 8 52697 00139 2 * HAPPYBABY Apricot Sweet Potato, NET WT. 3.5 OZ. (99g), UPC 8 52697 00136 1 The foods are sold in plastic pouches with plastic caps, and none are set to expire until late this year or even next year, so check through the stuff way back on your shelf. No illnesses have been reported so far, and Happy Baby's CEO Shazi Isram said in a company statement that this is a voluntary precautionary recall. If your pouches are leaking or swollen, the FDA advises you keep them away not just from baby but from your pets as well and wash your hands if you've handled the packages. Happy Baby directs parents to return them to the store for a full refund or contact them at 718-852-7606 or info@happybabyfood …",28 out of 30 users found this review helpful
 Bad Vendor,1,"Don't ever order from Cheapees (Leon Tosse): this vendor, whose merchandise is fulfilled by Superstore, is incredibly slow and can hold up an entire order that consists of items sourced form multiple vendors. Thus, an order consisting of two items directly from Superstore and one item from this vendor, is just sitting and waiting for several days, awaiting action from the vendor. …",10 out of 12 users found this review helpful
 Warning: Contains Menadione,1,"According to the manufacturer's website, this (and many of their other products) contains menadione sodium bisulfite complex. Menadione is a synthetic precursor for Vitamin K and has been reported to have toxic effects. The use of menadione over the natural alternatives (such as leafy greens and kelp) is only for cost-saving reasons, hence usually only found in cheaper and lower quality animal food. It's surprising that pet food at this high of a price actually contains this substance. Menadione is banned by the Food & Drug Administration in over-the-counter supplements due to its potential for organ toxicity. It's also banned in Europe for human consumption. A study in rats showed that exposure to menadione ""produced lesions in the kidney, heart, liver and lung."" Chiou et al. Toxicology 1997. Menadione's toxicity seems to be due to its ability to induce oxidative stress in cells. Do an online search for menadione and you'll find more info from a pet food watchdog trying to stop the inclusion of this substance. In light of recent episodes of toxic pet food and the questionable behaviors of manufacturers and our regulatory agencies, I would advise you to avoid feeding this to your cats. …",20 out of 23 users found this review helpful
 PLEASE I implore you to do research before buying Blue Agave!,1,"Agave syrup (nectar) is basically high-fructose corn syrup masquerading as a health food. Agave nectar has a low-glycemic index for one reason only: it's largely made of fructose, which although it has a low-glycemic index, is probably the single most damaging form of sugar when used as a sweetener. With the exception of pure liquid fructose, agave nectar has the highest fructose content of any commercial sweetener. All sugar -- from table sugar to HFCS (high-fructose corn syrup) to honey -- contains some mixture of fructose and glucose. Table sugar is 50/50, HFCS is 55/45. Agave nectar is a whopping 90 percent fructose, almost -- but not quite -- twice as high as High Fructose Corn Syrup!!!! Based on the labeling, I could picture native peoples creating their own agave nectar from the wild agave plants. Surely, this was a traditional food, eaten for thousands of years. Sadly, it is not. Native Mexican peoples do make a sort of sweetener out of the agave plant. It's called miel de agave, and it's made by boiling the agave sap for a couple of hours. Think of it as the Mexican version of authentic Canadian maple syrup. But this is not what agave nectar is. According to one popular agave nectar manufacturer, ""Agave nectar is a newly created sweetener, having been developed in the 1990s."" In a recent article now posted on the Weston A. Price foundation's website, Ramiel Nagel and Sally Fallon Morell write, Agave ""nectar"" is not made from the sap of the yucca or agave plant but from the starch of the giant pineapple-like, root bulb. The principal constituent of the agave root is starch, similar to the starch in corn or rice, and a complex carbohydrate called inulin, which is made up of chains of fructose molecules.Technically a highly indigestible fiber, inulin, which does not taste sweet, comprises about half of the carbohydrate content of agave. The process by which agave glucose and inulin are converted into ""nectar"" is similar to the process by which corn starch is converted into HFCS. The agave starch is subject to an enzymatic and chemical process that converts the starch into a fructose-rich syrup--anywhere from 70 percent fructose and higher according to the agave nectar chemical profiles posted on agave nectar websites. ""Agave syrup is almost all fructose, highly processed sugar with great marketing,"" said Dr. Ingrid Kohlstadt, a fellow of the American College of Nutrition and an associate faculty member at Johns Hopkins School of Public Health. ""Fructose interferes with healthy metabolism when (consumed) at higher doses"", she told me. ""Many people have fructose intolerance like lactose intolerance. They get acne or worse diabetes symptoms even though their blood [sugar] is OK"". Agave nectar syrup is a triumph of marketing over science. True, it has a low-glycemic index, but so does gasoline -- that doesn't mean it's good for you. If you simply must have some sweets, a small amount of agave nectar every once in a while isn't going to kill you. Just don't buy into the idea that it's any better for you than plain old sugar or HFCS. Info is taken from Jonny Bowden, PhD, C.N.S. So please. I implore each and every one of you to do your own research on this sham of a product and tell everyone you know. Write letters and let the world know that we won't fall prey to loopholes in ""Organic Marketing"". The fact that so many people use this because they are diabetic is quite frightening. …",130 out of 156 users found this review helpful
 Do Not Buy - Doesn't Work,1,"I really wanted this to work. It looks nice and is a little more narrow than some of the other K-cup drawers. First of all this says it holds 35, but the box it came in says it holds only holds 30. That is not the problem. It looks very nice, I like the material on top, BUT the entire thing slips and slides. The Keurig (B70) slides on top even with a full water reserve. When you pull the drawer the entire drawer, Keurig and all slides as well. That's not the worst part, however, I could get past that and use rubber shelf lining to fix that issue. The worst part that you cannot fix is the fact that even with LESS than 30 K-cups in this drawer it WILL NOT OPEN. The K-cups in the middle column get stuck and jammed due to a metal rod along the top of that column. The K-cups on the ends get stuck on the metal pieces that bend over the top of the columns. This will RUIN your k-cups as they get snagged and pressed by the metal. It took me several minutes to remove K-cups that jammed in the drawer and the drawer would not open. AWFUL. Completely unusable and worthless. I returned this product and instead bought a larger one with rubber mat on top that slides easily (from Bed Bath and Beyond for $20 w/ 20% off coupon. Cheaper, holds more, slides easier, doesn't damage k-cups and won't slide off your counter. …",14 out of 20 users found this review helpful
 Fantastic Food for Good Cat Health,5,"The pet food industry can be one of the most infuriating as you start doing research and discovering what trash manufacturers (and the vets who get paid off by the manufacturers) push onto the unsuspecting public. For reference, don't ask your vet - do some Internet research at sites like, for example, petfoodratings.net. What you'll find is that even the supposed ""high-end"" lines from basically every major supermarket label are horrible for your fuzzy friends. People who trust the marketing or trust their vets overpay and feed their cats foods that are full of carcinogens, cheap ingredients that are inappropriate for a cat's digestive system, and byproducts that provide nothing of value and are basically a way to make cheap profit off of literal garbage. It's a tragedy, as these same cats end up with shorter lifespans, kidney problems, UTIs, cancer, and a host of other issues, all of which could have been avoided by a high quality food. This is an A-Grade food. What you'll find here is very high protein content, many meat meals, potatoes, salmon oil, flax seed, and no grains, which is great as a cat is not an omnivore, it's a carnivore, and it simply does not need grains. It has 50 percent protein, which is among the highest you'll see in cat food. The first 4 ingredients are all meats. What you will NOT find here is the kind of junk you'll see in things like Purina One and Science Diet - byproducts (aka beaks, feathers, bird feet), brewers rice (aka the waste product from making beer), wheat flour (a leading cause of pet allergies), corn gluten (a cheap waste of space), and things like ""liver flavor"" (because they don't want to pay for the real thing). I didn't just pull those ingredients out of the air - I was reading the ingredients list of Purina One. It's pathetic. Don't feed your cats trash. Pay a little more to feed them good food now, and they'll lead longer, healthier, more satisfied lives as a result. It's worth it. …",19 out of 23 users found this review helpful
 To offset the 1 star reviews,5,"I was looking to see if this pet food was cheaper on Superstore than it is at my local pet store (it is) and I saw the 1-star reviews and was shocked. I understand that people are having issues with the listing versus what they get in the mail but that has nothing to do with the product itself, which is what you should be reviewing here, maybe with a disclaimer in the review of the food about the mix-up. Superstore is where I go for reviews of products and notes on shipping mix-ups hardly ever tell me what I need to know! That being said, I love Merrick Before Grain. When I adopted my little strays they were living in the zoo and surviving off of raw ground meat and fish, so when I brought them home I chose a grain grain free food because I thought it would be the easiest transition on their stomachs from what they were eating. I've also done some pet nutrition research of my own, and while I'll concede that cats can process nutrients from grains in their foods, it just doesn't seem right to me that they many pet foods have most of the protein coming from vegetable sources, so I stayed grain-free even after the initial adoption. Recently, though, my budget has gotten tighter and I'm close to a ramen budget and decided my cats would have to be put on a ramen diet, too. I did the gradual transition to a new food the way you're supposed to, a little at a time, and the cats didn't seem to mind the change at all. As soon as the cheaper food took over, though, one of my cats started having terrible gas and had some minor tummy troubles. That bag is just about through so I'm going to start the transition back to this food. A big bag of this food ended up cost less per-pound than smaller bags of lower-quality foods, anyway, so I decided the additional cost was worth it. There are also several more expensive brands (Wellness, Blue Buffalo) that have grain in their cat food formulas, unless you opt for their grain-free variety which is even more. Merrick offers the grain-free choice without being the most expensive option out there, and is even comparable in price to many brands that have lower-quality ingredients. All-in-all, definitely worth a try! The canned foods are great, too, but my cats have decided they only like wet foods that are in gravies and won't eat the pates Merrick has. …",12 out of 13 users found this review helpful
 ABSOLUTE FRAUD PRODUCT,1,"I used this product for a few years because i thought it was organic and did not have the junk common to other broths. How false that was. This product is chuck full of MSG, a neurotoxin known for its adverse excitatory effects on the brain. The word Spices means MSG in food industry, so as other **** in it, including hydorlyzed vegetable protein. This product is total fraud and health hazard. Shame on you for your greed. …",5 out of 23 users found this review helpful
 How Could You Be So Bold,5,"After FINALLY purchasing best coffee maker I've ever had in 40 years of drinking coffee, the hunt was on to find the best tasting coffee to go with it. When it comes to coffee, I suppose that it's really a ""to each his or her own"" thing. But I've tried 'em all, and out of all the various varieties that are offered here at Superstore, the K-cup that provides the most pleasurable mix of everything that I was looking for in a cup of coffee is undisputedly Emeril's Big Easy Bold. Nothing beats Emeril's Big Easy Bold. There are plenty of other brands trying to suggest that they're bold. I've tried the ""Midnight Magic"" brand; I've tried the ""Jet Fuel"" brand; I've tried the ""Donut Shop"" brand; I've tried all of the ""Extra Bolds""; but the K-cup that really tastes like the jet fuel packed cup of coffee that you get in the best donut shop is Emeril's Big Easy Bold. What's really cool is that whether you make a small cup or large cup of Emeril's Big Easy Bold, you won't lose the rich flavor. Most Keurig Coffee Makers have at least two buttons that let you choose to make a large or small cup. Some even have three buttons for a large, medium or small. I like a large cup. Some of the other brands noticeably lost some of their flavor as I went from a medium cup to a large...but not the Emeril's. There is no question here. If you like a darker roast that's full of flavor and packs a punch, you've found the right page here at Superstore. Wake up people, and add this to your cart. Bam! …",27 out of 28 users found this review helpful
" Expensive, but my cat is thriving on it",5,"I decided to switch my cat's food because she was having all kinds of problems: excessive throwing up, urinary tract issues, and significant weight loss that the vet couldn't explain. I switched her from Kirkland dry and Friskies Turkey Pate canned to Wellness dry and Wellness chicken formula, and it's been almost an overnight miracle. She's put on at least a pound in 3 weeks (she eats an entire 5.5 oz can plus dry food every day--no more pushing the food around and not really eating), no more straining on the litter box, and she hasn't barfed in over a week! I'm really impressed at what a difference this food has made for my cat's health. …",24 out of 24 users found this review helpful
