Title,Star Rating,Review,Helpfulness
 Trying to determine total price.,5,"I went through 7 screens to get the shipping charge in order to compare with Koeze's web price and shipping for exact item. Same exact price and shipping charge as ordering the Colossal Cashews directly from Koeze's. No Deal Here, sorry. (Superstore people: we are ordering here to save time and money. I can drive to Grand Rapids, MI for the nuts. Please be honest.) …",6 out of 12 users found this review helpful
 Yummy but pricy,3,You can find similar grade maple syrup at Sams or Costco for much less. The product is great (5*) but not happy with Superstore's pricing (1*). …,6 out of 20 users found this review helpful
 when is coconut not good?,4,"The texture and cut of the coconut are nice. I bought this to add to granola. I love coconut, so all I care about is what form goes into what kind of food. This is unsweetened. Really. If you have never tried unsweetened coconut before, be warned that it is more texture and filler than flavor for most people. What I like about this kind is the flakes are nice and big. …",13 out of 15 users found this review helpful
 Our Favorite,5,"Green Mountain is our favorite coffee. We switched from grinding our own to K cups recently. We still love Vermont Country Blend and Heifer Hope, but this is the ultimate K-cup for us. A medium roast, rich but not bitter. It satisfies every time. …",23 out of 25 users found this review helpful
 A delicious treat,5,"Well, since some other user decided they'd paste their review on to each flavor allow me to give my short but sweet review: MiO is delicious. I like that I can just put in the tiniest of splashes in my drink and just have a hint of flavor... or splash a lot in and get a real flavorful experience. It's a quick and easy thing to use. It's also fun to watch it splash into the water. I've also found it's good to flavor different types of alcohol. In regards to the criticism by other reviewers for it containing propylene glycol - don't be in a panic like them. propylene glycol is harmless unless ingest massive quantities of it. Using a canard like ""it's considered harmful to pets so humans shouldn't ingest it!"" is just alarmist behavior. Chocolate is harmful to dogs. Better not eat that then! Lastly, in regards to it having so many ""food colorings"" - well, if you don't like anything that flavors your water to have anything artificial in it, squeeze a lemon into it. Put a dash of sugar. Or just drink the water plain. You know what you're getting into when you buy this stuff. Bottom line: This is my new favorite drink flavoring. I will be buying from them again and again. …",28 out of 37 users found this review helpful
 Good suppliment for Hypothryoid issues and cold sensitivity,5,"If you happen to be hypothyroid, give this a shot. I read about it on several thyroid patient advocacy sites and in Brendan Brazier's Thrive book and gave it a chance. It has changed my life. I was suffering from extreme reactions to cold, a common symptom of thyroid disease, and I was going to have to move out of New York. One hit of cold air and I was exhausted for the rest of the day. Maca changed this. Now I stand outside and enjoy the snow. It's shocking the improvement. Be patient. It took about two weeks and 2 tbsp a day to feel a difference. I am an evangelist for this stuff now. …",29 out of 30 users found this review helpful
 A NECESSITY FOR CIVILIZED AND A TRANQUIL LIFE,5,"The only tea. The Irish tea. To be taken only in the morning unless you have no reason to sleep that night. A tea to heal the disturbed mind and soul. A tea for the Irish. Take half and half with even skimmed milk and you will never see coffee again. Wake up and smell the tea. How kind of the Superstore to offer it on line. I shall never again suffer tea-separation anxiety when the local grocer is out. A source of peace and of comfort far from home. More powerful and peaceful than any artificial pharmeceutical prescribed. Take two cups and call me in the morning. Thank you, O mighty Superstore. …",57 out of 61 users found this review helpful
 lime leaves,5,"I live in a small town and you can't buy these in the stores. They are very nice leaves, some smaller, but most very nice sized, excellent for Thai food. I froze mine, so I should have enough to last at least a year! …",18 out of 18 users found this review helpful
 Healthy and Great Tasting Product,5,"I have been using nutritional yeast for years, almost every single day, and it not only tastes great but is incredibly nutritious. Our three year old son loves it, and especially likes sprinkling it on pasta--I think he feels empowered, and little does he know that he's literally sprinkling nutrition on his food. You can sprinkle this on popcorn or other snack foods to impart a cheesy taste, add a tablespoon to smoothies, pasta sauce, bread, or just about any other savory food. If you're looking for a cookbook with recipes that use this, try New Farm Vegetarian Cookbook . It's a little hipped out, but there's a recipe for nutritional yeast cheese that's pretty amazing. There's also Ultimate Uncheese Cookbook: Delicious Dairy-Free Cheeses and Classic ""Uncheese"" Dishes , but I would try the Farm cookbook first. Lastly, these are large flakes, but Frontier Coop online offers 1 pound bags of Nutritional Yeast ""mini flakes"" which have a finer consistency and sprinkle well from a container with tiny holes (like the kind used to sprinkle powdered sugar). Frontier's prices are also very reasonable, and they offer organic nutritional yeast as well. …",51 out of 51 users found this review helpful
 Best supplement if you must use formula,5,"Breast milk has a plethora of advantages over formula. Until recently, one of these advantages was that it contained DHA and ARA, fatty acids that are important components of brain structure. Recently, manufacturers have begun adding DHA and ARA to their infant formula. Some studies have indicated that addition of DHA and ARA to formula provides an advantage of 6-7 IQ points over normal formula, nearly as much as the IQ point advantage of breast fed babies. However, the DHA and ARA added to infant formulas are chemically extracted from certain species of algae and mold using solvents, and are not identical to the DHA and ARA found in breast milk. There have also been reports that the DHA and ARA supplemented formula causes diarrhea in some children. In our daughter, it seemed to cause softer and messier stool, though it wasn't quite diarrhea. Baby's only DHA and ARA is extracted from egg yolks using a water based process, and thus may avoid some small risk associated with the solvent extracted versions. It's mixed into formula that isn't fortified with DHA and ARA or into other foods. We use it with Baby's Only toddler formula, and it does not cause messy stool with our daughter. Breast feeding is still better than any formula, of course - it has other advantages, such as a protective effect against infections that the formula makers haven't figured out yet. However, if you must formula feed for some reason - for us, my wife's pumping at work didn't keep up with the baby's demand, and eventually we also had to stop breast feeding to try to start a second baby - mixing Baby's Only DHA and ARA supplement into a nonsupplemented formula is probably the next best thing. …",18 out of 18 users found this review helpful
 Exactly what I wanted.,5,"I have wanted a Keurig for quite some time now for home use, but wasn't really sure which model I wanted. After plenty of research, I settled on the Office Pro. The major complaint I read about this model was that it wasn't exactly quiet. Those reviews are correct, to an extent. I don't think it's so loud as to be any more distracting than any other noise in the home. It's certainly a lot quieter than my vacuum and my washer. I can't hear it in the next room, and neighbors haven't complained about the noise in the surrounding apartments. I have read review after review of the home brewers with the quiet technology, and I noticed that the one common complaint with those was that the pump failed after a couple months. I'd rather deal with a bit of noise than with a dead coffee maker. We are avid coffee drinkers, and we always use travel mugs in the morning. There isn't a setting for a 16 ounce cup, but we get around that by brewing two 6 ounce cups with a singular k-cup. It give us the perfect amount and intensity of coffee, and leaves enough room for cream and sugar. I love that everyone can have exactly whatever kind or flavor of coffee that they want. No more having to drink chocolate peppermint coffee in the morning because I wasn't the first one up and I don't want to waste a whole pot. I also love that it's always a fresh cup of coffee. No more burnt, old coffee. Just a nice fresh cup. I find that there is a nice variety of K-cups as well, and if you shop around you can usually get them at a great price. My local Bed, Bath and Beyond carries them and you can use a 20% off coupon on them. Impact Office Pro also carries them online, for even cheaper than Keurig's site with their coffee club discount. Speaking of prices, I got my Office Pro for a lot cheaper. Staples has them for $129.99 and you can use a coupon. My account rep at Impact Office Pro went a little lower than the Staples price, and then even took my $25 Staples coupon, bringing the price down even more. So shop around and see where you can get the best deal! A word of warning, the my k cup reusable filter offered by Keurig does not work with this model. However, the solofill refillable k-cup does work so if you want to use your own coffee, buy the solofill k cup. All in all, I highly recommend this brewer. It's a great addition to our home. …",43 out of 43 users found this review helpful
" Cytomax, a runners best friend.",5,"I have been using Cytomax regularly for about six years now. I cannot preach the benefits of this product enough. It really does beat the burn. The percieved exertion levels, the lowering of lactic acid levels in muscle and the subsequent enhanced recovery are all truly part of the package. I frequently use it before bed when I know I will only have a limited time to sleep (i.e. 3-5 hrs) and have found that I will have deep restful sleep and awake feeling invigorated. It is also a handy hangover drink according to some of my past roomates. I have been encouraging other fellow runners, triathletes, cyclist, backpackers, mountaineers, etc to try the product and have recieved similiar feedback. Many nice climbing/outdoor gear shops have the individual packets available if you wanted to demo the product. …",18 out of 20 users found this review helpful
 My Favorite by a Landslide so Far,5,"I must admit that I have gone a little overboard with my k-cup sampling. So far I must have tried about 50 different blends. OVerall I must say that the vast majority of them have been pleasant, better than what I used to make in my coffee brewer. Then I tried the Donut Shop brand. When I first tried this I was not expecting much, it sounds bland, plain, everyday type of coffee. Don't get me wrong, I have had some pretty good cups of coffee in donut shops but nothing to write home about. When I took my first sip, I thought wow, this is amazing. Smooth, not much of an acid taste, about as close to perfect as I could describe. My love for this k-cup continued and continues to this day. Many times you find a k-cup which at first is very good, but after a couple of cups you get a little sick of them; not with this one. It has been and continues to be my absolute favorite. I will still search for something better, but I doubt I will find it. I hope you like -- no strike that -- I hope you love this coffee as much as I do. …",172 out of 174 users found this review helpful
" ""We Package Only When You Order"" - NOT SO",2,"Your product description says ""We Package Only When You Order"" yet the Garam Masala I received today is stamped ""MFG Date - OCT 2010""... I am not happy …",18 out of 18 users found this review helpful
" Easier, but overpriced",2,"This kit saves you the time of making your own, but at three times the cost. Anyone can buy bulk planting sponges or rock wool and make their own for a couple dollars. However, if you don't care about the price and want to make Aero Garden planting fast, easy, and thoughtless, then this is made for you. The kit is great, just uncomfortably priced for what you get. …",34 out of 35 users found this review helpful
 I love chia seeds!,5,"Chia seeds are an amazing nutritional powerhouse - and to me, they don't even really taste like anything (which is a positive; no funky taste here)! They are great sprinkled on salads, added to a smoothie, used to make raw vegan pudding, etc. Its uses are many! Also - I wanted to add that this is a really good price. My co-op charges almost $20/lb. for chia seeds, and Superstore has them for just over $13! …",17 out of 18 users found this review helpful
 Bigelow Chinese Oolong Tea,5,"is my favorite tea. The bags are individually packaged so they travel well. This is one of the stronger Oolong teas and may take some getting used to. Once your tastebuds adapt, you may not want to drink any other tea. I have tried many of the other so-called ""best"" Oolong teas and Oolongs promoted by ""experts."" I always come back to Bigelow. My corner store has been sold twice over the past 7 years. The company that owns it now quit stocking the Oolong, so I am very happy that I can still purchase it through Superstore! …",12 out of 12 users found this review helpful
 Do not eat these cookies in bed!,1,"Overall I was not happy with the crumbiness of these cookies. They were way to fragile and crumby. There is just too many crumbs in my bed, how am I supposed to sleep like this? …",5 out of 19 users found this review helpful
 Converted me to tea over coffee - it's that good,5,"Before buying my Keurig brewer, I never really like black tea. I would drink herbal tea from tme to time but black tea always seemed too bitter. After trying Celestial Seasonings English Breakfast Tea, I was instantly converted. There is no bitter taste and it's so much less acidic than coffee and therefore much easier on my stomach. It has a mild, slightly fruity taste that is perfect with breakfast or really anytime of day. I've tried it plain and with a bit of milk and sugar as well. I honestly have become more of a tea drinker than coffee drinker since trying this delicious tea. …",14 out of 14 users found this review helpful
 Something has changed. Quality control must have slipped as far as being organic goes.,2,"We have been using Newman's organic dry dog food for over 5 years...it was a Godsend when we discovered it. Our little Jack had such severe allergies she was tormented day and night with unrelieved itching...after trying endless other avenues to find relief for her we were to the point we thought we might have to have her put down for her to find relief. Then the idea came up that maybe she had chemical sensitivities...so we decided to go organic...all her deals miraculously cleared up once we started the Newman's. However after giving glowing reviews for many years, we now have to concede something has changed...our little Jack's itching returned to the point of drawing blood. It is clear something changed and I believe it clearly is no longer as organic as it once was...we are on the hunt again. I am not saying it does not have good quality ingredients...but if you have a dog that is highly chemical sensitive...this likely is not for you. Too bad...it once was a superior product. …",38 out of 43 users found this review helpful
 Wouldn't buy agin,2,"Not a good value for the money. Not as pictured, not nearly as full. Crackers were soggy and some of the boxes were crushed. …",14 out of 14 users found this review helpful
 Please don't give these to those you love.,1,"Dogs are not born to eat grains, preservatives, artificial flavors and colors. Did anyone even check out what's in this crud? Ground Wheat, Corn Gluten Meal, Wheat Flour, Ground Yellow Corn, Water, Sugar, Glycerin, Meat, Hydrogenated Starch Hydrolysate, Soybean Meal, Bacon Fat Preserved With Bha, Salt, Sorbic Acid (A Preservative), Artificial Smoke Flavor, Calcium Propionate (A Preservative), Glyceryl Monostearate, Phosphoric Acid, Choline Chloride, Added Color (Red 40, Yellow 5, Blue 1, Yellow 6). The ingredients here are despicable for the health of your dog. Sure your dog may like them because they're lathered with rancid bacon fat and Bha preservative. Please consider something more healthy as opposed to these mass marketed gimmicks. Your puppy will love you for it. …",18 out of 29 users found this review helpful
 These are completely vile,1,"I bought these after reading all the great reviews and I would not advise you to do the same -- not to the tune of 12 boxes anyway. I've foisted as much off on friends as I can and I still have one box left. It's funny that everyone raves about it being free of chemicals, etc. because to me the taste makes me think of exactly that. It's just truly awful -- does not resemble a cheese taste in the slightest. Just a weird sharp and very unpleasant taste. The sauce is thin. They are even worse is you try to reheat. Obviously, this is just my opinion, but I warn you not to buy 12 boxes if you're a first-timer! …",8 out of 15 users found this review helpful
 Fabulous,5,My grandmother is still talking about how wonderful this arrangement is that I sent her for her birthday. The delivery was prompt and the flowers were beautiful. …,32 out of 32 users found this review helpful
 Whole grain bugs?,1,"I ate the last bowl today of 7 whole grain Kashi and the last shake of the box which had an experation date of October 2008 exposed the insect, not sure what kind of bug it was, but I know its not whole grain anything! …",7 out of 13 users found this review helpful
 VERY MISLEADING,1,"My understanding from a recent Forbes Magazine article is that Kobe beef isn't exported from Japan to the USA including the fact that beef labeled Wagyu simply means ""Cows from Japan"" including the fact that Japan imports cows from other places in the world. So, you can only wonder what you are paying so much money for regardless of the actual quality of the meat. Apparently, it isn't Kobe and the label of Wagyu is really meaningless. Decide for yourself here: [...] …",15 out of 18 users found this review helpful
" Once you try, you'll be in love",5,"Ya, in love, and that's not exaggerate. I grow up eating instant noodle, and i know what i'm talking about. This is eaten without the soup, so i think they pack you more noodle then most other instant noodles. Its got great flavor. not the healthiest thing to eat, but this is great comfort food. …",13 out of 13 users found this review helpful
 Better than store brands,5,Hi to be honest with you i've bought 5-6 honeys with Superstore all taste great.i like the raw honey the best.checked on web its the best for you to.Do not feed any honey to a baby …,7 out of 12 users found this review helpful
 Contains BPA!,1,"I love Muir Glen tomato products but sadly I had to give them up due to their can liners containing bisphenol A (BPA). I will not feed anymore BPA to my kids! It makes me sick that I fed them with BPA laden baby bottles before I knew better. We already have enough cancer in our family. I don't know why anyone is surprised that BPA acts like a synthetic estrogen therefore an endocrine disrupter--BPA was ORIGINALLY developed in the 1930s as a synthetic estrogen drug for women. Shortly after it was developed, a new synthetic estrogen drug came out (DES) so BPA fell by the wayside until someone figured out it could be used in plastics and can liners to help make them harder. I wrote to Muir Glen (now owned by General Mills) to see if they have any plans to remove BPA from their cans but they did not respond to me. I would be happy to pay a bit more for jarred tomato products if they can't come up with BPA free cans. Or how about tomatoes in cartons or frozen? Please write to the companies that you buy canned tomatoes from and ask for BPA free products. Let me know if anyone finds BPA free tomato products, such as tomato paste, diced tomatoes, whole tomatoes...by responding to this comment--I will get an email. I have young children and I will not feed them anymore BPA!!! …",38 out of 53 users found this review helpful
" A funny gift idea, funny taste too",4,"I received this as a gag gift from my wife because I like gummy bears. It's a great novelty gift and everyone that sees it is amazed by it. However, it's a litter harder to chew than a real gummy bear and the taste is a little off. It doesn't taste *bad* but it doesn't taste like a normal red gummy bear. So I ate his ears and his arms off, and now he sits on my desk at work in his box as a conversation piece. So overall a good idea, just wish they could adjust the flavor a little to match the taste of a normal gummy bear. Maybe one of the other flavors besides cherry do a better job at tasting normal, I don't know. …",27 out of 28 users found this review helpful
 This reminded me how much I love fruity gelatin,5,"Great product, and so wonderful to know it comes from pasture grazed and humanely treated cows. Got this for the health benefits for myself, and to make gelatin treats for my kids. So far everything has been a huge hit (with kids and adults) Fruit juice gelatin squares, mouse, coconut panna cottas. …",20 out of 21 users found this review helpful
 Awesome!  Better than Pop Tarts!,5,"I stopped eating pop-tarts because of all the junk that was in them (hydrogenated oils, artificial colors, etc). I tried these and - wow! They are actually better tasting than pop-tarts. They still have the rich buttery crust, but their filling is actual fruit, and tastes incredible. These look exactly the same as pop-tarts, right down to the foil wrapper and little grooves on the back of the pastry. They have organic ingredients though, and no hydrogenated oils, white flour, or artificial colors. This doesn't make them completely ""healthy"" (these are still over 1/3 sugar by weight), but for an occasional snack they are awesome. …",16 out of 16 users found this review helpful
