Title,Star Rating,Review,Helpfulness
 best tomatoes other than summer fresh,5,"These are great tomatoes, from Italy, in a box. They are chopped just right for all kinds of sauces, soups, and everything. Great flavor. These are a basic in my pantry. With these, olive oil, garlic, and some cans of beans you are prepared. A great basis for a puttanesca sauce (this plus garlic, black olives, hot pepper flakes, anchovy paste, and capers) or just about anything else. …",14 out of 14 users found this review helpful
 Be sure to order appropriate size,4,"I am obsessed with researching stuff and I was nervous about ordering such a spendy dog toy. I am very happy I did! I originally purchased a small for my 10 lb wire fox terrier puppy (chews on EVERYTHING-he's teething), after getting it home I realized how some folks would have problems w/their dog popping out the treats too fast. IMO, order the largest size your dog can have fun with. I exchanged the small for a medium and it's worked out great. This way, he can't get his jaws around it and he can't pop the treats out-he just licks it to death, rolls it everywhere and growls at it b/c he can't get to the treats-which is the whole point of the toy. Like the reviewers before-know your dog and order bigger. I have also read that you can put the refill treats in upside down to make it more difficult. Hope this helps! …",13 out of 13 users found this review helpful
 Just like Mama used to make...,5,"With a son recently diagnosed with Autism, I was faced with revamping his diet to a gluten-free, dairy-free diet. I tried mixing different gluten free flours (rice, potato, tapioca) myself, but it's not nearly as good as this flour blend. I really think the addition of the bean flours makes the difference. I made chocolate chip cookies (dark chocolate chips--no dairy)with it and served it to my daughter's girl scout troop, and they couldn't tell the difference. That's all the validation I needed. …",37 out of 38 users found this review helpful
" Yummy, but expiring",3,"We liked the product, my kids thought they were wonderful, but I was bummed to see that the sell by date on the cookies was less than 30 days from the date that I received them. How can we eat 12 bags of cookies in that amount of time? We won't and they will get stale. I thought that was lousy. …",13 out of 15 users found this review helpful
 Great WILD blueberries,4,"Eden is a great ethical company with superior products. This is one of their few products I wouldn't give 5 stars to only because they are wild blueberries which I don't care for as much as cultivated varieties. If you haven't had wild blueberries they are smaller and have a different flavor. As far as wild blueberries go, these are top notch! My local store charges $8.25 each which would be $24.75 for 3 packages. …",13 out of 14 users found this review helpful
 Healthy Dogs,5,"My dogs are incredibly healthy with this food. The first time I purchased Innova, I set a bowl of it next to the IAMS they had been eating since birth (they were 2 and 4 years old at the time). They refused to eat the IAMS. They were overweight and have slimmed down to a healthy weight on the Reduced Fat food and I don't have to worry about their nutrition at all. Innova has everything they need. They have lots of energy, bright eyes and healthy, shiny coats. The cost seems to be initially higher but they eat less so it is not that much more than other premium foods. I will never feed them anything else. …",12 out of 13 users found this review helpful
" Great juice, horrible price",4,"My local health food store has these for $6.89 a bottle... $6.89 x 6 is $41.34, cheaper than the $45.84 directly from the manufacturer, and that isn't even counting the insane $25 shipping cost. Now of course, my local health food store probably isn't anywhere near you, but my point is, ordering this product online seems quite pointless, especially factoring in the shipping, unless you live in the middle nowhere. Considering this is direct from the manufacturer themselves, you'd think the price would be something reasonable. As for the juice, it's quite delicious, and I try to have several glasses a week. …",23 out of 26 users found this review helpful
 A nice 'get acquainted' variety pack,5,"I have been trying to replace my former supplier of single-origin coffee (which raised its shipping prices five fold!) here on Superstore, without too much luck up until now. Can't say I didn't try. I have 20 lbs of coffee; sinlge origin beans I love, BUT the roaster has maybe gone to roasting more than they can handle? The beans taste burnt, leave a bitter after taste. I had some qualms about ordering from coffee masters given the number of flavored coffees they carry, which generally indicates either inferior beans, or that they are producing for a clientele which does not know coffee. Because of this I was wary of ordering and got this sampler, *hoping*, as noone had yet described the contents, that it would not contain any flavored coffee. and, I am happy to report, it does not. For those of you as baffled as I as to what is in the box, here it is: Brazilian Santos Columbian Huila Costa rican Terrazu Ethiopian (Mocha) Harrar ""euro Espresso"" blend French roast blend Guatamalan ""Amatitlan"" Hawaiian blend Kenya AA Louisiana blend Mexican ""Coatepec"" Sumatra Mandheeling Thus far i have only tried 2; the Ethiopian and thr Brazillian Santos, and, overall i am impressed, It is beyond the shadow of a doubt the best of what I have purchased on Superstore, and I have read dozens and dozens of reviews to avoid getting another 5,10, 15 pound of mediocre burned coffee. While the Ethiopian was not the very best I have had, it is right up there. The Brazilian really surprised me. I basically never buy light roast, do not like ""weak"" coffee, but this was most excellent; not weak but smooth, full, well rounded. I am off to change my subscriptions. I think I have found myself a roaster here at last! and, now that I know what they can do will be ordering the whole bean., which I expect to be better still. (if it is the same, I will still be very happy) …",12 out of 12 users found this review helpful
 The body loves coconut oil,4,"I used this product on toast instead of butter, I used it to cook curry chicken. I used it to scramble eggs. I used it to flat iron my hair (smooth) i used it on my skin (mmm). Good vaginal lubricant too. Also great for oil pulling. I read it can be used with baking soda as a natural toothpaste? Haven't tried that one yet. This product is well worth the money for its many uses. …",28 out of 28 users found this review helpful
" Gluten free, vegan, kosher, and very concentrated.",5,"O.k., so it's not officially kosher--but this is how you make gelatin without cow's hooves, for those of you who get grossed out by Jell-O if you think about it too much. Now foods is a company that sells gluten-free stuff, and this is no exception: if you have celiac this won't make you sick. Even better, this is powdered agar agar, not flaked agar agar. That means this will last for months, if not years--although it's also easy to use too much. 1 tablespoon of the flakes = 1/2 tsp of the powder. The ratio most cooks call for is 1 cup liquid to 1 teaspoon flaked agar agar, which means 1/4 tsp of this powder to 1 cup liquid, with more added for more acidic things like orange juice. However, agar agar doesn't gel as well as Jell-o, so don't expect to get the same results that you would for Jell-o--for that, you need Jell-o or kosher gelatin. (You can add more agar agar to add firmness; but then it starts to taste like what it is: seaweed.) …",31 out of 31 users found this review helpful
 Call me a convert,5,"I was frightened by my breakfast today. Vegemite on buttered toast. Yes, I had researched the traditional way to eat it. But still... I was scared. I faced my fear. I opened the jar. I stared down the thick, dark, brown, gooey goo. I took a spoon and took control. I spooned out a tiiiiiiinnnnnnnnnnnny bit. Tiny. I put it on the edge of my toast. I made a face. I took a bite. I smiled. In dismay. In pleasure. I picked up the spoon again and commanded the brown goo to give me more more more. Well, still sparingly, but, nevertheless... more. I used no more than 1/2 teaspoon on my slice of toast. I had a second slice with another almost 1/2 teaspoon. I updated my Facebook status. People replied in curiosity, in fellowship or in disgust. Or all of the above. About an hour later I craved it again, and I indulged again. Between waking and dinnertime, three slices with that just-less-than-one-half-teaspoonful of Vegemite was all I consumed, and, I swear, I was pleasantly satiated all day and full of energy. Can't wait until breakfast tomorrow! :) (Standard disclaimer: I've been vegetarian for almost 18 years. This had an almost beefy taste. Salty, beefy, vegan, lots of B vitamins. Yum.) …",12 out of 14 users found this review helpful
 Vino Italiano - A Quality Economy Wine Kit,5,"This is my third Vino Italiano kit and I made a double batch of this Tuscany Rosso Magnifico to fill a 40 liter oak barrel I have ... I want to give this kit every opportunity to shine. It's going to be my ""house table wine"" to enjoy with everyday meals while I wait for some of my upper end wine kits to fully mature. A couple of hints to better appreciate these Vino Italiano wine kits: 1. Have realistic expectations. These kits make a nice light to medium-bodied wine. Beautifully red and brilliant in the glass, they are light and food friendy wines (and not necessarily great representations of their varietal). But if you're expecting something full-bodied and inky dark like a Napa Cabernet, you're setting yourself up to be disappointed. Keep in mind, this bottle of wine cost you $1.50 to make. (The cost of bottles doesn't count ... you can reuse them over and over - stay green!) 2. These wines will improve with time in the bottle. While it's hard to resist dipping into your supply for weekly tastings, six months to a year in the bottle will make for a much nicer, less green-tasting wine. I'll add more to this review after I bottle this wine, but I will say that it is drinking better than the Valpolicella did at this early stage. Less dry than the Valpolicella with a nice balance of both fruit and tannins. I think I'll be proud to call this Rosso Magnifico my ""house red."" …",16 out of 17 users found this review helpful
 This one supplement has changed my life!,5,"I eat well. I read a lot of research on health. I'm a Medline junkie. I've tried a lot of different supplements in my time--- probably 40 or 50 different things over the years--vitamins, minerals, herbs. Some of them made me kind of ill, some had a minor positive effect. (For example, I noticed that ginkgo actually did help me think more clearly, at least a little bit.) None of them, however, made a MAJOR positive impact on my life. That is, until Natural Calm. This miraculous substance has improved the quality of my life dramatically! Here are the things this supplement has helped with: Sleep--- Basically cured my occasional insomnia, and gives me a deep restful sleep every night. Stress-- I now feel spectacularly relaxed. Also increased my ability to deal with difficult ""crisis"" situations. Mood--- Made me generally happier. Decreased muscle cramping and soreness. Improved gums and teeth. Improved hair loss. Improved digestion and transit time. Yeah, hard to believe it cured so many things, right?? Me too! But out of all the things I have ever taken, this is the ONE THING that I would NEVER be without. It has made that important an improvement in my life. It is almost like a miracle. Really. There is a huge amount of research on the need in the body for more magnesium than Americans usually consume. Especially important is the ratio of Calcium to Magnesium you consume. In America this ratio is about 4 to 1. Ideally it should be around 1 to 1 or 1.5 to 1. I have settled on a ratio of about 1200 mg Ca and 800 mg Mg per day. (Try ""The Magnesium Factor"" by Margaret Seelig or ""The Magnesium Miracle"" by Carolyn Dean here on Superstore if you want more science of magnesium.) I highly recommend that everyone try this supplement, at least for a week or two. You probably won't need that long. I noticed an improvement in two days. A MAJOR and IMMEDIATE improvement. If you try it, I'd be curious as to your results. Leave a message in the comments section of my post, if you want. Here's wishing you great health! …",219 out of 263 users found this review helpful
 Novelty Item loaded with artificial chemicals and carcinogens,3,"The product was a great idea. I actually bought 2 boxes of the gift pack with the bacon lip balm (the only thing good in the box made with coconut oil and aloe vera oil) but once I read the ingredients like MSG, Red 40 ( a carcinigen!) and partially hydrogenated oils.... I was really turned off.. You can really taste the artificial colors and flavors in this thing. It's really not a healthy item and dangerous to anyone you will give it to. This stuff contains all types of endocrine disruptors and will really screw up your metabolizm! Ok to have once in a great while but tastes like powder smoke and loaded with chemicals and carcinogens. If you dont care about your health and eat lots of **** anyways, then you'll prob love it..LOL.. I think the recipe needs more tweaking..I'd rather have real uncured bacon with no carcinogens found at Whole Foods. …",7 out of 14 users found this review helpful
 High Quality Rooibos! Very good deal!,5,"I have tried many various Rooibos tea and this tastes one of the best for me. It is very good value for the amount, I've been drinking one bag for almost 6 month now. Highly recommended for Rooibos tea lovers! …",21 out of 22 users found this review helpful
 The price is higher than retail price in CVS/Walgreens,2,"The price per can works out to be higher than what it is in CVS/Walgreens stores. They are selling it for 14 dollars only. Why you guys are asking for 92 dollars for 6-pack, which means it will be around 15.3 dollars? …",23 out of 28 users found this review helpful
 Great Product - Bad Vendor,4,I really like the product and it does make a great margarita but buyer beware. The web site for ordering is not very clear and you may end up getting only one jar and paying $30 for shipping when you can get three jars for the same $30 shipping cost (does not include the product cost). I complained to the vendor but they didn't seem to care. I ended up paying $52.50 for one jar (including shipping) when I could have paid $97.50 for three jars which would be an average of $32.50 per jar (including shipping). …,26 out of 27 users found this review helpful
 Good treats!,5,"Our puppy loves these little treats! They are small enough to give him a few at a time, but I like to cut them up even smaller and use them for training. They are tiny as is (about the size of a pencil eraser), but can easily be cut into quarters for reward-based training. I will always keep these in stock for him! …",31 out of 43 users found this review helpful
 Must have been a contaminated batch,1,"We bought a case of 12 12 oz cans back in April. Just now opened the first can. Wow. Consistency of vomit, grayish tinge, and a vile odor. Opened a second can -- exactly the same. No way were we going to feed it to our dog. Something was clearly wrong. We've been buying Newman's Own dog food for the last two years (since we got a dog) and never experienced anything like this. Interesting to look back at the reviews here and see three from the April - May timeframe that sound like there may have been similar issues for others around the same time we made our purchase. Guessing there must have been a production run that resulted in contaminated product. We've reported the issue to both Newman's Own and the FDA. …",20 out of 22 users found this review helpful
 Zotz the way I like it,5,"Classic Zotz fizzy sour candy - kind of like Pop Rocks in a hard candy, or a lozenge filled with sour Pixy Stix powder. The box contains 48 strings of 4 individually wrapped pieces, for a total of 192 pieces. This is basically the same as the Zotz candy that was popular back in the 1970s, but it's now imported from Italy. The flavors in the box I received from Superstore Grocery weren't as pictured in the item listing (cherry/orange/lemon/lime); instead, it contained equal numbers of cherry (red), apple (green), and watermelon (pink). …",40 out of 41 users found this review helpful
 Not K-Cups for Keurig Brewer,1,I searched for K-Cups and this product was listed. It is not for a K-Cup Keurig brewer. Superstore needs to remove this product from the K-Cup category. …,6 out of 21 users found this review helpful
 Not Worth The Risk,1,"We have 3 mixed breed working dogs. We purchased these as a treat and they loved them. There have been several dogs in our area that have been sickened by tainted products from china. We recognized the issue immediately in our dogs, because other pet owners had written detailed reviews that clearly defined the symptoms. Thank you to all the reviewers on this site and others. We no longer purchase any pet food or pet treat that is made in China or contains products made in China (hard, you have to really check out the maker) to our dogs. They are willing to poison there own people to make a buck, so why should they care about animals in another country. We bake our own dog cookies (lots of great recipes and books out there) we recently purchased a food dehydrator and use locally grown chicken and beef and make our own jerky treats. It's remarkably cost effective if you buy meats and chicken from the producer, instead of a store. …",10 out of 13 users found this review helpful
 Grains arrived on time and healthy,5,The grains were fresh and plump and produced Kefir well...re-produced more grains well also. They grew very quickly and we ended up eating many because they have re-produced so much. I liked the recipes and instructions that came with them also. I also appreciated the list of the numerous bacteria contained in kefir he/she included. Good seller - good product. Sorry to see others had problems. …,15 out of 15 users found this review helpful
 Don't buy this garbage!,1,"I bought a case of this (Adult Organic Turkey and Organic Vegetables Formula)12.7 oz cans beause my dog adores the Organix Dry Dog Food and he does very well on it. As soon as I gave him a little canned (a small amount mixed with his other food) he started vomiting white foamy stuff the following morning. I ended up giving a can to a friend and her dog had horrible breath (from his stomach--does not have bad teeth). I didn't give the rest away, will throw it away. I emailed the company twice and they couldn't bother to respond in about two weeks. Apparently they don't stand by their products. Now I don't trust any of their products even though my dog does fine on the dry formula. …",4 out of 12 users found this review helpful
 Honestly the BEST!,5,"I just LOVE ""Honest Earth All Natural Mashed Potaotes"", ALL of them! They are absolutly the BEST instant mash ever with nothing but potatoes in them. They are very difficult to locate and I have no idea why. I used to find them at CostCo and Safeway, neither place carries them and now Superstore is out of them too! Hey Superstore, Bring back the BEST mashed potatoes ever! PLEASE! …",17 out of 17 users found this review helpful
 OK stuff if used within reason.,4,"First, I'm not sure why it's called ""oil"": it's butter, not oil; it's solid w/o refrigeration. The consistency is translucent sorta clunky white, sorta like grated candle would look. Just like butter, it immediately melts in your hand or mouth, to say nothing of the frying pan. Smells great, tastes also nice: like, well, coconut. Supposedly it's great for cooking due to its supposedly higher heat-resistance something: it's supposed to keep its nutritional qualities when heated better than other common cooking oils. There's a rub though: with many foods you can mix and match and achieve some sort of mixed flavour -- not with this stuff! It's irrepressible: whatever you add it to -- veggies, cakes, meat, cardboard, or motor oil -- will then smell/taste like coconut and nothing beside. It overpowers every other flavour. So the only cooking variables you have left when using it is texture and sweetness (and looks, I guess). It goes very well with something that's sweet (probably because we're used to coconut being used in sweets). From what I've tried, it goes well with carrots, apples, sunflower seeds (anything nutty-tasting), stuff like that. Real good with sweet potatoes. But I would not recommed using it for cooking meat (unless you like your pork chops smelling and tasting like coconut). You can't kill this flavour, that's what I'm getting at. I'm using it carefully (not too much and in suitable combinations) and I'm happy with it so far. The product seems good, and so is the price (Added on 12/18/2010: that was the price at the time of purchase, $13.54 on Dec 2, 2010 -- and now, only two weeks later, the price on this page is $18.46, amazing, no? A 30% increase in two weeks, wow, these guys sure are optimistic about the value of their product). A bit of a warning: there's a megaton of unsubstantiated semi-literate BS online about miraculous powers of coconut oil. Be careful about it: coconut oil is pure saturated fat (a serving consists of 14 grams of fat, 13 of them saturated) -- and I've found no acceptable medical/scientific info in support of the healthfulness of saturated fat (while there's a lot on the opposite). What I did find was that it's not openly harmful when used in small doses: a healthy 200-lbs 40-sh male, not overweight and exercising regularly, is allowed 200 saturated-fat calories a day. A serving of coconut oil is 130 calories, but of course, you'll get saturated fats from other foods too. Another thing is that coconut oil contains no appreciable amounts of vitamins/minerals (unlike butter, which is _loaded_ with all kinds of goodies). So be careful: despite the squall of shilling on the net and in print, it's not health food. But it's tasty and not like lethally bad, so... ------- Added on 12/18/2010: I'm half-way through the first jar, and I find myself using it less and less. It's too smelly, and I just don't have that much opportunity to use it for stuff where it's OK. Besides being food, it is supposedly also good for external use, for skin and hair; I haven't tried it this way (yet; maybe I will). But I have a feeling that _as food_ it doesn't have much of a future in this household: it's too overpowering, too particular. ----- 01/01/2011: Tried it for skin lotion: well, um, yes and no. No: it doesn't get absorbed into the skin, and the area of application stays greasy forever, so you can't do it before going out (even wiping with, say, paper towel, doesn't remove enough of it, so you'll stain the clothes with oil). Yes: it has a terrific staying power, hours and several hand washes after application there's still something remaining on the skin. And I work with my hands a lot, with the result that they tend to get real dirty, so I wash hands frequently and rather severely, the surgical way: very hot water, several soap-ups, brush. This causes severe dehydration of the skin, so I've always used hand lotion immediately after, but with coconut oil the skin remains slightly oiled, soft and moisturised even after a couple of such washes. So, finally: I'm not sure how (and whether) I'll continue to use coconut oil: I have definitely ceased to use it as food; as moisturiser we'll see... at least it's marginally cheaper than dry-skin cream so I'll give it a longer try. But the cream dries up in a minute, so it's more practicable, I must say. Doesn't smell of coconut either! :-) I must say I did not find the product as useful as it's hyped, so I'm taking one star off right now. I'll revisit in a month or two: if I discover by then that I've stopped using this thing altogether, I'll update the review to this effect. -------- 02/20/2011: Bottom line: I think I've settled into a two-sided routine with this oil: I use it, first, for light-frying/sauteing veggies (with yams or sweet potatoes as a basis; adding greens, like spinach, in the mix later on). I don't do this often though, 'cause I prefer to steam or eat raw, rather than fry anything; sauteing is quicker though, so when I'm pressed for time, this is workable. The other use is for skin: skin really loves this oil -- in addition to staying hydrated forever, it becomes very even in texture and colour; after shower I grease myself up, literally from head to toe, and it's just lovely (except for the clothes who get stained :-). …",5 out of 13 users found this review helpful
" Half Shark, Half Banana, All Awesome",5,"Once you see sharkbanana, you can never look at sharks or bananas the same way again. Why has evolution created two magnificent species which fit together so beautifully like this? I recommend giving a sharkbanana to all the most wonderful people in your life. Then they too will understand what it is to be alive. …",34 out of 38 users found this review helpful
" fine, but ultra premium pricing",2,"Not a chickpea expert, and these seemed fine, but nothing extraordinary. I just bought a bag at the indian grocer for $4.00 vs $14 for these. These seem awfully expensive. …",4 out of 15 users found this review helpful
