Title,Star Rating,Review,Helpfulness
 An extremely flavorful light-roast coffee,5,"One of the pleasures of a Keurig is that you can serve a friend or a guest a cup of coffee that will please them and their tastes, not just what you brew for yourself everyday. I happen to enjoy strong, deeply roasted blends (the kind that you usually find at the specialty coffee shops which seem to be all over the place now). However, not everyone shares my enjoyment of a strong, full-bodied cup of coffee. I have many friends who often say something like ""I love coffee but Starbucks is just too strong for me"". Enter Donut Blend. I have purchased many boxes of Coffee People's Donut Shop Coffee and it is a favorite for many of my friends and family. When Timothy's announced that they were coming out with the ""Original Donut Blend"" I got in line to try it. Here is my take on it: It is certainly a little lighter than Coffee People's version but the taste is more complex with clean, bright notes of spice and low acidity. Surprisingly, it reminds me a little of the Peaberry Kona coffee that I brought back from Hawaii. It is a perfect blend for those who like their coffee black or with just a little cream and still want it to taste like coffee. If someone drinks several cups a day I think that Timothy's Donut Blend will not overwhelm their taste buds and will still taste fresh cup after cup. Mind you, I drink Newman's Own Bold Blend on a regular basis and will continue to do so, but if I am having more than two cups (for those ""special"" mornings when nothing seems to go right) or if I am having a cup later in the day I will drink this one. Just rating it on what I want in a coffee I give it four stars, but judging it for what it is (and not just what I like), it fully delivers and deserves five stars. People Medium Extra Bold, Donut Shop K-Cups for Keurig Brewers (Pack of 50) [Superstore Frustration-Free Packaging ] …",82 out of 83 users found this review helpful
 Awful Awful taste...and phosphoric sick color...,1,"Awful Awful taste...and phosphoric sick color... Awful Awful taste...and phosphoric sick color... Awful Awful taste...and phosphoric sick color... I was totally schemed, this is not a drink. it is an acid poison. Who for god sake manufacture and sale this kind of awful product. Don't believe it? try for your self. I only show ""The king is naked"" …",2 out of 15 users found this review helpful
 BEWARE! READ UPDATE!!,1,"I purchased 2 of these systems for my 5 cats (we have 3 other litter boxes). One of my cats injested some of the litter pellets and has been in the veterinarian hospital in bad shape for the last 3 days. After xrays, and sedatives, enemas and iv fluids and blood tests, the vet removed 9 pellets, found a raging UTI and his kidney values are through the roof! I called the manufacturer to find out what was in the pellets and was told: zeolite, silica, cement, and polysomethingorother. Their website does not tell you that, just says no problem if your cat ingest - it'll will pass thru. Not so! I already have a vet bill in excess of $500 it is climbing because they have to keep him there!! Update September 15, 2008 Vet bill in excess of $1000, kidney failure and Freddie died on Saturday, September 13, 2008. …",189 out of 216 users found this review helpful
 Perfect treat Puzzle for Active dog!,5,"<span class=""tiny""> Length:: 1:04 Mins </span>Bella my two year old weimaraner really love this toy! everytime i take it out she wags her little tail like crazy. its simple and keeps her busy for the time. Packaging was great! Perfect for that super active dog. Please see my video review as well! This is a Socialwriteup! …",38 out of 38 users found this review helpful
 Real Customer Service,5,"I ordered this collection on 6/9/10 and it arrived on 6/12. Although it was was very well-packaged, this did not prevent the USPS from managing to break one of the tubes. The seller was contacted by email and a replacement requested. As this was a birthday gift and the occasion was only a week away, I offered to pay for expedited shipping. Seller responded immediately stating that a replacement would be shipped ASAP. The replacement tube arrived three days later in good shape. My offer to pay additional shipping charges was declined. In summary, this product is excellent and the customer service absolutely first rate. I highly recommend both the product and the seller. …",10 out of 12 users found this review helpful
 Good price?,1,Over 6.00 a box and people call this a good deal?? Waste of money. You can get better deals at Sam's Club or Costco... …,5 out of 14 users found this review helpful
 Love Jiffy Pop but check the expiration first,3,"I have loved making Jiffy Pop since I was a kid and have since made it a point to share the fun with my own 2 children. It is getting almost impossible to find this stuff so I was really glad to find it here. I eagerly placed an order back at the end of July 2008. My order arrived quickly and was packaged nicely. I was super excited to see so much yummy jiffy pop all in one box. Upon closer examination however, I realized that the expiration date was the first week of October 2008. My kids and I love Jiffy Pop but making/eating 24 servings in just a little over 2 months was going to be an impossible task! I ended up giving several of them away to friends and family before they became too stale to eat. So the deal was great and I will likely try again but just be sure to ask about the expiration date before you order so you ensure that you get that great *fresh* Jiffy Pop taste! …",17 out of 18 users found this review helpful
 you won't miss the salt,4,"I ordered these chips by accident. I meant to order ""with added salt."" I know, not a healthy choice but hey, I love salt! So, I ended up with a whole case of these unsalted chips. My wife said, hey these aren't salted! She was pleased. She worries about my diet. So, I had some chips. They're delicious! Good crunch. Very fresh corn flavor. Excellent with salsa. Sometimes a guy has to be wrong to do right! …",16 out of 16 users found this review helpful
 Cheap ingredients in an expensive bottle,1,"This oil was something else a decade or so ago. It was also pricier. When I recently bought it at a local Indian grocer, I was surprised the price had dropped significantly. Hair oils in India are traditionally coconut oil mixed with other essential herbs, extracts etc - which is what I assumed Dabur's would be too. What a disappointment to find this only but an unhelpful formula of 1. Canola oil 2. Paraffinum Liquidum (a fancy name for Mineral oil) 3. Palm Glycerides (Solids as byproducts from hydrogenating Palm oil)...search the internet for contra-indications for these and it should steer you far away...Goes to show, bigger brands are not necessarily better (DABUR is huge in India)Unfortunately my purchase was not from Superstore and I ended up tossing it - so no refund. I would highly recommend pure coconut oil: you can use essential oils to add to its perfume, but sometimes I even use Azulene oil on my scalp. Works like a charm for oily, greasy scalp days... …",31 out of 33 users found this review helpful
 no help on loose stools,1,"POOP-FREEZE Aerosol Freeze Spray (10 oz) This product worked fine on regular poop, so what, I can pick that up with a baggie any day. I purchased this product for when my dogs had loose stools but it did not work on hardening these stools up to prevent a messy clean up. Sorry, it appeared to be a great idea! …",31 out of 31 users found this review helpful
" What, no chocolate!?",2,"Every year I enjoy one or more delicious whole rabbits during the Easter holiday and they are not only tastier but better to look at than this... thing. Besides, by taking off the ears the seller has deprived the buyer of the best part. …",17 out of 20 users found this review helpful
 Wrong item in package,1,"I ordered Roadside Rootbeer (which I enjoy). The bags contained Cinnamon Stick (horrible). In all fairness to Superstore, Yummy Earth surely made the mistake. Superstore was very reasonable about refunding my money. …",1 out of 13 users found this review helpful
 LavAzza Crema,5,Excellent coffee product. Bought for my espresso maker but also use in my drip coffee maker and is great either way. …,51 out of 56 users found this review helpful
 The Big Cheese,5,"From Parma,Italy comes two famous food products. Parmigiano Reggiano and prosciutto (which translates into something like dried meat.If you're ever in Bologna,I'd recommend a stop at Tamburini, which has stood in its place for as long as I can remember. This cheese is worth every cent. When you buy it, don't have it ground at the store, buy the block and grate it at home or it will lose it's strength of flavor. I recommend this with a 100% guarantee of falling in love with the product, so buy it for St. Valentine's Day if you're single. …",13 out of 14 users found this review helpful
" Intensely salty, healthy salt",5,"We were pleased with this salt. It's actually more salty than regular salt, even kosher salt or sea salt. A little bit goes a long way! I don't usually cook with it, but add it to things afterwards. I've been hand grinding it. …",12 out of 14 users found this review helpful
 This one supplement has changed my life!!!!!,5,"I eat well. I read a lot of research on health. I'm a Medline junkie. I've tried a lot of different supplements in my time--- probably 40 or 50 different things over the years--vitamins, minerals, herbs. Some of them made me kind of ill, some had a minor positive effect. (For example, I noticed that ginkgo actually did help me think more clearly, at least a little bit.) None of them, however, made a MAJOR positive impact on my life. That is, until Natural Calm. This miraculous substance has improved the quality of my life dramatically! Here are the things this supplement has helped with: Sleep--- Basically cured my occasional insomnia, and gives me a deep restful sleep every night. Stress-- I now feel spectacularly relaxed. Also increased my ability to deal with difficult ""crisis"" situations. Mood--- Made me generally happier. Decreased muscle cramping and soreness. Improved gums and teeth. Improved hair loss. Improved digestion and transit time. Yeah, hard to believe it cured so many things, right?? Me too! But out of all the things I have ever taken, this is the ONE THING that I would NEVER be without. It has made that important an improvement in my life. It is almost like a miracle. Really. There is a huge amount of research on the need in the body for more magnesium than Americans usually consume. Especially important is the ratio of Calcium to Magnesium you consume. In America this ratio is about 4 to 1. Ideally it should be around 1 to 1 or 1.5 to 1. I have settled on a ratio of about 1200 mg Ca and 800 mg Mg per day. (Try ""The Magnesium Factor"" by Margaret Seelig or ""The Magnesium Miracle"" by Carolyn Dean here on Superstore if you want more science of magnesium.) I highly recommend that everyone try this supplement, at least for a week or two. You probably won't need that long. I noticed an improvement in two days. A MAJOR and IMMEDIATE improvement. If you try it, I'd be curious as to your results. Leave a message in the comments section of my post, if you want. Here's wishing you great health! …",37 out of 46 users found this review helpful
 Average,3,"Is this hot chocolate....yes Is this good hot chocolate....um, sorta Is this gourmet hot chocolate....not a chance. In my opinion, the only advantage you get but using the Green Mountain K-cups of hot chocolate is the simplicity of using your Keurig machine to heat the water instead of using the microwave or stove-top. Other than that the finished product is comparable to any Swiss Miss or other brand of powdered instant cocoa. It actually may be worse if you use the largest setting on your machine. The largest setting makes it much too watery. Green Mountain needs to go back to the drawing board on this. 3 stars because it does make hot chocolate in your Keurig without having to dirty dishes and tear open pouches, but if you're looking for good hot chocolate, keep shopping. …",40 out of 41 users found this review helpful
 Dislike the taste of this product.,1,"This product has a very strong taste that overpowers everything that I have used with it. I had never purchased blackstrap molasses before, but after this batch, I will likely never purchase them again. …",4 out of 21 users found this review helpful
 TRIVEDI WATER IS GREAT!!  GREAT RESULTS!,5,"Transformed Favorite Tree with the Trivedi Blessed Water - After the San Diego Retreat - My story: I came home from the San Diego Trivedi Retreat and I remembered what Guruji said about wanting us to be ""the happiest we could be."" I had this thought in my head as I was coming out of my car and when I saw ""my favorite"" tree in the front lawn. I decided to convey this same message to the Japanese Red Maple tree and to the grass I walked on going to the front door as I poured the last of my Trivedi Blessed water around the base of the Japanese Red Maple and on the grass leading to the front door. Well, this year just 1 month later, the Japanese Red Maple tree has the most beautiful colored and healthy looking leaves and the most unusual beautiful arrangement of pink flowers I had not seen before. I asked my friends and family members if they ever remembered the tree producing so many pink flowers in this circle pattern ever and they all said they do not remember the tree having so many of these kind of pink flowers in this full circular pattern and so many all over the tree. Some remembered it had pink flowers here and there always, but this year they are all over the tree abundantly and each outcropping is in a beautiful and full circle pattern. The flowers are EVERYWHERE this year. ALL OVER the whole tree! Usually the flower bunches are just a few places on the tree, but after the Trivedi Blessed water; the flower bunches were so full and everywhere on the tree!! Also, there is a new Circle Pattern of Flowers on ONE Stem!! No one (friends, family) ever remembers seeing this beautiful circle pattern of a lot of flowers on ONE stem. Usually there are 2 to 5 flowers on a stem but here and everywhere on the tree EACH STEM had at least 500% more flowers per stem after the Trivedi Blessed water. In the past the tree never made this beautiful circle pattern of flowers per stem. Before usually there were just 2-5 flowers on a stem in a random pattern! Now there is this beautiful circle pattern of flowers we have never seen before. Aside from the plants, when I drink one bottle of Trivedi Blessed water daily I feel so energized and healthy. Since I have run out I see that my energy level has gone down some and I'm a little ""squeaky"" in my joints. I can't wait till it is in stock so I can stock up. In my opinion it is the best present you can buy yourself and any of your friends and family. I know what's going under our tree this Christmas! Maybe not the most conventional gift but my family and friends will thank me later once they start drinking it and pouring it on their plants. PS A neighbor asked us to watch her 2 house plants while they were gone and I used a little Trivedi blessed water that I had from my last retreat and before they could come back 3 weeks later BOTH plants are blooming!! When I asked her if she had ever seen them bloom before, she said she's had them around 5 years and had seen them bloom maybe once. Coincidence? Maybe, but I doubt it. I only used regular water and Trivedi Blessed water on her plants while they were gone. I've seen it too many times when I've poured Trivedi Blessed water on my own plants and bushes. They bloom and flower like never before. This year I used it in our flower pots on the porch and it was the first year in over 20 years that the deer actually came up on our porch (up 2 steps to a concrete porch) to eat the flowers we had planted in the flower pot. The same type of flowers we always plant only this year I used the Trivedi Blessed water in the pots. I don't eat the flowers so I don't know but there must have been something good in those flowers this year for the deer to make their way on our porch to eat them. They never did that before and it's not like the deer around here are hungry, they are all big and fat this year so in my opinion only they were going for their dessert! LOL! PS For more of my results with the Trivedi Blessings and water and to see the actual photos of the Red Maple tree go to thebestoftrivediblessings The tree story is no. 10. Thank you for reading this. …",16 out of 17 users found this review helpful
 Only two fish but very tasty,4,I was surprised to find only two fish in the can. They were very tasty but very expensive for two fish after paying for shipping. I wish Superstore would stock Seasons products. …,6 out of 13 users found this review helpful
 Great Flavor,5,"As stated in the title, this powder was exactly what I was looking for. It has the same flavor as the Green Tea Latte sold at Starbuck's and it's good for your health too! …",13 out of 16 users found this review helpful
 price is highway robbery,1,"These pellets are the EXACT same as ""equine (horse) bedding"", and similar to wood pellets for pellet stoves. You can buy a 40 (yes, forty!) pound bag of equine pellet bedding for only $6!!! (vs $10 for 20 pounds of Feline Pine!) I purchase at my local farm/tractor store. Wood stove pellets are even less - can get 40 pounds as cheap as $4. I called the manufacture of one wood pellet stove product and they told me it is totally safe for pets...no chemicals used in production, and made from PINE, etc. However, some wood pellet stove are made from hardwoods (not pine) and this would not be as absorbent so you need to double check on the type of wood stove pellets. I'd stick with equine bedding...it is pine and made for animals. I do love this type of litter! No dust. Absorbs and masks odor better than any other litter. After using this type of litter for a couple years, I am pretty ""skilled"" at being able to scoop out mostly only the sawdust, and leave the intact pellets behind. My cats usually pee in the corners so that is where most of the sawdust is. Also, if you shake the box, sawdust drops to bottom and you can scrape intact pellets to the side and scoop the sawdust underneath out. If you don't pay attention when you scoop and are not tedious with a ""method"" like me, you will likely also scoop out a lot of the intact pellets too and thus waste a lot of it. We went out of town for 2 weeks, and our cat sitter used DOUBLE the amount of litter we use! For the star rating - I'd actually give 5 stars for this pine pellet type of litter. But I am giving one star because of the ridiculous price charged by Feline Pine!! …",12 out of 14 users found this review helpful
 $36 for 21 lbs of bad dog food? You can do a lot better!!!,1,"Look at the first three ingredients of the following products (the first ingredients on the list are the highest in the makeup of the food): Product A: Ground yellow corn, chicken by-product meal, corn gluten meal Product B: Chicken,chicken meal,whole grain brown rice Does a product primarily composed of corn and ""by-products"" sound as healthy for your dog as one whose first two ingredients are chicken and followed up by rice, a quality grain? Do dogs feed themselves on primarily corn in the wild? Of course not. And what if I told you that Product B is sold for $30 per 40lb bag at Costco, while Product A is being sold at $36 for 21lbs worth of inferior food? Which sounds like the better deal to you? Do yourself a favor and save yourself some cash while also providing a healthier meal for your loved one. I'm not here to push Costco's Kirkland brand dog food, which is Product B in this comparison and is clearly a better value then Beneful. Blue Buffalo, Taste of the Wild, Canidae,etc are other examples of much higher quality foods that can be had for a lot cheaper. For once you can eat healthy AND save money. …",20 out of 26 users found this review helpful
 TRICLOPYR is what you need for POISON IVY...,5,"This contains Triclopyr, which is more aggressive than Glyphosate. It is also more persistent which means that you don't want to spray it close to plants you value. Triclopyr is what you need to knock out Poison Ivy. Poison Ivy and a lot of other shrubs or trees can take a swig of Glyphosate (Round Up), gargle twice with it and spit it back into your face just for giggles. I've used this and the Ortho Brush-B-Gon. They contain the same active ingredient and I haven't observed any significant difference. This stuff is the real deal - I found it when I was trying to locate a product called Vine-X (discontinued?) and found out that it was 13.6% Triclopyr in a penetrating oil. You simply brush it onto cuts or active vines and it would kill the entire plant. This is where it is really nice to buy the concentrate instead of the pre-mix. I spray the diluted version but also use the concentrate in a small bottle. If I cut a thicker vine or trunk, I simply drip the concentrate on it and it will kill the roots and vine. Besides PI we also have wild grapevine, Buckthorn, Box Elder, and many other invasive and nuisance plans in the woods. Because Poison Ivy is a creeping vine with multiple roots along it's length, eradication is helped with a higher concentration than the label instructs. (My observation) I use it between 50% to 100% (double) strength. It appears that if you spray it in one spot you will kill that part of the vine, but if you hit it (in enough places) with something strong enough you can kill the whole plant down to the roots. Make sure you spray it when you think it won't rain for at least a couple of days or else you will probably need to spray it again. Make sure you get all ""sprouts."" From extensive hand pulling, My observation is that for every ""sprout"" there is another ~3 feet of vine lurking around and another sprout hiding somewhere nearby. If you've found this review helpful please let me know! …",76 out of 82 users found this review helpful
 fox u bet,1,I recently purchases fox u bet chocolate syrup. It was awesome. thamk you for prompt delivery ***** …,1 out of 16 users found this review helpful
 Ganocafe Classic,5,"Ganocafe is a product derived from coffee, so it retains the flavor of coffee, but the Reishi mushroom is what I enjoy most about this product. Reishi mushroom is not an easy ingredient to find and has been touted as a wonderdrug for hundreds of ailments and preventative for even more, including many forms of cancer. I'm unable to consume caffeine, so I had to find alternatives. Many coffee alternatives taste too ""earthy"" or ""forest-y"" and not much like coffee at all. This is the best that I've found. The classic style is no cream, no sugar, just a plain old cup of coffee and while it's not exactly like coffee, it's the closest to the real flavor. For all the people out there who can't drink coffee, enjoy! …",10 out of 12 users found this review helpful
