Title,Star Rating,Review,Helpfulness
 pretty good,5,I ordered this product after reading reviews from several hair boards. I use it as a treatment along with other oils before I wash my hair. I read reviews where people said that they could not handle the smell. It's not that bad. It reminds me of hair grease if that makes sense. I've been using it consistently on each hair wash day and my hair is softer and a little more manageable. …,12 out of 13 users found this review helpful
 great alternative side dish,5,"I've always enjoyed couscous, but I never tried the ""pearl"" version of it until I went to Walt Disney World and ate at an all-u-can eat Moroccan buffet at one of the parks! It's absolutely delicious! Most recipes I've seen for Israeli couscous have you adding things like tomatoes or olives, but I bought this pearl couscous from Superstore (Barry Farms) and just cooked it up using some plain chicken broth...amazing!!! There were no cooking instructions on the back of the bag so be sure to cook it 10-12 minutes using a 1-cup couscous to 2-cup liquid ratio until all the liquid is absorbed. Or I guess you could try one of the numerous recipes you can find online at various websites ([...], etc.) Oh, I almost forgot to mention that my husband was so pleased with the pearl couscous, he asked me to buy a lot more of it off Superstore! It makes a terrific side dish and it's a nice change from plain veggies or seasoned rice. Enjoy! …",13 out of 13 users found this review helpful
 Chicken by-product meal,1,"Chicken by-product meal, is **** and if you feed your dog this you don't care about your dog.Upgrade to the Lamb and Rice Naturals from the same company, Or Chicken and Rice. They are 4 star rated by DOGFOODADVISORS.COM …",5 out of 12 users found this review helpful
 Ciao To Unsatisfying Pasta,1,"I tried this pasta because it was on sale at my local store, I usually buy the discount-priced store brands. And I was willing to excuse the slightly higher price (even with a coupon) on the premise I was eating 'heathy'. Well, I found out that after eating a dish of this stuff, I felt hungry again by dinner. I have fairly good diet control, so I assumed it was the low-carb construction. Having not eaten a low-carb pasta before, I was theorizing on it's effects. I then did some independent web research on this suspicion. And other people also had the same experience after having eaten this product. It does not leave you full. This defeats the purpose of eating. Buying this product at any price was a waste if I was not nourished. I might as well only had been imagining about eating. And considering that I buy pasta to be economically frugal in today's oh-so trying times, this is one brand which won't be cooked up again. …",4 out of 24 users found this review helpful
 Nasty,1,The non-diet flavors all have Splenda. In addition to sweeteners. Tastes awful. If I wanted artificial sweeteners I would've bought the diet sodastream. Ick. …,11 out of 16 users found this review helpful
 Used to be an awesome food but they changed the formula. NO GOOD!,1,"This used to be a great food, but they've changed the formula and my dogs have suffered. Their customer service is very rude. My dogs showed signs of distress within the first 24 hours of eating the new formula. Explosive Diaherra, Vomiting, Fur became dull. Change it back Canidae!!! …",15 out of 17 users found this review helpful
 THIS COFFEE IS A-M-A-Z-I-N-G!!!!!,5,"Blueberry coffee...sounds weird, right? This is the best darn coffee out there. One try and you are hooked! It tastes like coffee in your mouth with a blueberry muffin aftertaste. The flavor is not strong, just a hint of bluberry! The smell when it is brewing is delightful! I encourage all people with a Keurig to try it once. I am the pickiest eater I know and I love it!!! …",22 out of 24 users found this review helpful
 Wha?,1,"HOW ON EARTH do they think a package of corn muffin mix that sells for under two dollars in Kansas, USA is worth fourteen dollars?! What a ripoff! The muffin mix is good, and I'd give it 4 stars, but NOT at that price. …",1 out of 27 users found this review helpful
 You Gotta Try this!,5,"I have a beautiful 3 year old black and white Cocker Spaniel. During the first several months with her, she demonstrated some puzzling symptoms...jerking and shivering, even in 100 degree summer weather...I took her to the vet. but he could find nothing wrong.....Instinct told me otherwise....So I tried giving her what we give our patients in the ER, when they have ingested something toxic...Activated charcoal....the shivers and jerking stopped.....I suspected immediately that something in the kibble type food I was giving her was toxic to her nervous system.....up to this point she would stare at the Kibble type food and eat only enough to survive.....I began a search for a substitute...thanks to a knowledgable pet store owner who showed me a bag of Sojos Europa...I now have a pet that no longer shivers or shakes, her coat is very healthy.....she has the energy of a puppy, and her breath no longer stinks....I mix Sojos with cooked chicken snapper and salmon, not all at once. She loves it. I'll try some other meats soon.....bottom line is this is really good stuff.....Read the list of ingredients, this stuff smells so good,I have been tempted to taste it myself...but remember tasting lemon soap the Fuller Brush Man brought when I was a kid, but that's another story. …",12 out of 12 users found this review helpful
" Waaaay Cheaper at Whole Foods (Crazy, Right?)",5,"First off, this is a STELLAR product. Just opening the box and taking a whiff of the tea makes your eyes roll to the back of your head. And the taste of it is...pretty amazing. I get mad sugar cravings after meals and this usually does the trick to suppress them. But the price here really throws me off. One box for $5.99 PLUS shipping is an extraordinary ripoff. I got a box at Whole Foods last night for $2.49. At WHOLE FOODS. If some vendor is marking this up more than double than at the Markup Emporium that is Whole Foods, something is wrong. So, please shop around! This is a product that is definitely worth the little extra effort of finding a better deal. …",11 out of 12 users found this review helpful
" lovely, beautiful tea",5,"Lapsang Souchong is what some might consider an acquired taste, because the smokiness and aroma of it are quite strong. Its aromatic reminiscence of woodsy smoke does not take away from the taste of the tea itself, which is rich, flavorful, and not at all bitter as one might suspect from the first overwhelming sniff. The taste is actually mellow and yet refreshing, the color a golden amber, and, as the reviewer below mentions, it is best when not steeped for too long. It's also best served without milk, as this takes away from the taste...but personal taste is personal taste. I must admit, I am not what you'd call a lapsang souchong snob, but I have tasted several brands, and Taylors of Harrogate offer the best I've ever tried. Their tea is divine, and I'm going to order some more of their other teas. …",17 out of 18 users found this review helpful
" not exactly green, is it?",1,"I have only seen one Keurig brewer here in Japan. Don't those little plastic packages generate an awful lot of non-degradable waste? Do we really need more, especially for the sake of saving a few seconds making morning coffee??? …",0 out of 20 users found this review helpful
 Hurricane Stock,5,Great shelf life and you can make it so many different ways. It is great to have when we know there is a storm on the way here in Florida. …,12 out of 12 users found this review helpful
 Better than Alton Brown's,5,"As another reviewer pointed out, this is NOT the same salt cellar as AB uses. I have both, and this one is better. Unlike AB's this one has a silicone gasket on the inside of the lid, which effectively seals out moisture, and more importantly, smells in. I purchased this one to use as a sugar bowl, hoping the seal would keep the ants out. My previous sugar bowls did not have air-tight lids and had to be retired during the summer, lest we find black six-legged critters happily munching on the contents. For the past two summer ""ant seasons"" this bowl has kept the critters at bay. While AB's is fine for salt, this would be better than his for that, too. Choosing between AB's and this one? I recommend this one. Well worth the extra $1.06! …",18 out of 22 users found this review helpful
 Evil.,5,"These pretzels are evil. When my snacking comes to an end, I see flashes of myself laying on the unkempt wooden floor of an abandoned house. Scant beams of light burn between the cracks in the boards on the lone window frame, illuminating my tattered and orange-stained clothes. The sound of my body writhing over a pool of empty yellow aluminum bags, a half foot high up the empty broken walls, is quieted only by the echo of my cries of longing and despair. …",65 out of 70 users found this review helpful
" Little filling, disappointed in quality of product",3,"Oreos have gone downhill in quality. Little creme filling and mostly chocolate cookie. Recommend Newman's equivalent, much more filling and great tasting. …",2 out of 13 users found this review helpful
 Crab? O_O,2,"I tried to eat this with some saltine crackers, which i like to do with most seafood. But the taste was just how can i put this....disgusting. This ""might"" be good for crab cakes but eating as is didn't go well for me. If you notice its very cheap compared to Crown Prince Crab Meat and believe me there is a very good reason. This crab meat is imported from Singapore. …",16 out of 17 users found this review helpful
 Great Trees Great Prices,5,"I've been a Bonsai hobbist for more than 10 years. I have personally visted the Brussel's Bonsai Nursery in Alabama. IT's about 40 minutes away from Memphis Tn and well worth the drive. I've purchased LOTS of trees from Brussel's (at the nursery, by mail and at bonsai shows) and have always been satisfied. You get great trees at really resonable prices. Pay particular attention to if the tree is rated for indoor or outdoors. Outdoor bonsais that are brought indoors for more than a few days will die. I love the Chinese Elm variety. It has tiny vergated leaves just like the mamouth elm trees that used to blanket Chicago neighborhoods. The Chinese Elm can be kept inside during the winter. but ALL bonsai's will do much better if you let them enjoy the summer weather outside. If you fertilize them, they will grow profusely, thickening the trunk and developing more character and allow to enjoy your had at shaping your tree to what you define as Cool. Dive in and Enjoy! …",12 out of 12 users found this review helpful
 Do not buy for the Cranberry Apple and Tangerine Orange!,1,The picture and description is NOT accurate for this product as the shipped package replaces Cranberry Apple and Tangerine Orange with Wild Berry and True Blueberry! …,15 out of 18 users found this review helpful
 Above average Berbere,3,"This is a fairly decent, commercial berbere mixture. It has a fair bit of heat, owing to a large amount of cayenne/red pepper flakes (some of which seemed to have missed the grinder). The balance in flavors isn't what you would expect from a fresher product or if you ground/toasted your own spices but it gets the job done particularly if you like your wats spicy. However, for the price this isn't a good value. The American Spices Berbere sold here has a deeper, balanced flavor profile and is vastly cheaper than this product. …",19 out of 20 users found this review helpful
 Why sbould I get crums?,1,"I selected this company over the other even though the price was higher. I was hoping the pieces would be more consistent in size. It tuened out the container was filled with smaller crum like pieces, worse than the other company's. I will never buy anything from this company. …",5 out of 13 users found this review helpful
 A Must Have!,5,"I love this stuff! I am trying to cut white sugar out of my life, but it is so hard because I hate sugar free stuff. I hate the taste of aspartame, sucrose, and other artificial sweetners. Stevia is a natural sweetner that tastes good. I drink lemonade & tea sweetened with it. I have put it in oatmeal, plain Greek yogurt, cereal.... a wonderful, healthy alternative for a hard core sugar addict! I even carry a bottle in my purse at all times! …",12 out of 16 users found this review helpful
 Please...not under EASTER,1,"please - this this is a big oversight, this should not be under searches for Easter / Easter Bunny. How horrible. …",16 out of 53 users found this review helpful
 not real kombucha,2,"This is not real kombucha. It may have a little bit of kombucha in it, but it is mostly carbonated water and juice. It comes in a plastic container, which real kombucha never should be in contact with plastic. It tastes good, but I don't think there's much benefit in drinking it. …",17 out of 19 users found this review helpful
 Purchaser,1,"Good product but I only received a single gel package instead of 24. The so called ""replacement"" package came with only 22 gel packs. And I was billed twice. Obviously some kinks with distribution and customer care need to worked out. …",3 out of 19 users found this review helpful
 NOT VEGETARIAN,1,"I don't know whose idea it was to list this as a return for a search on ""vegetarian bouillon,"" but it is very misleading since the broth is NOT VEGETARIAN! …",1 out of 12 users found this review helpful
 Rather weak and non-descript tea,2,"There are several other Stash teas that I've tried and enjoyed. But this one is sort of feeble-tasting. Up until now, I've gotten the Yogi Tea Egyptian Licorice Tea Organic Egyptian Licorice, Tea Bags, 16-Count Boxes (Pack of 6) and that one actually has a bold licorice taste. And it is that one that is serving as the point of comparison to this Stash tea. Keep in mind that I don't add honey or any sweetner to my teas, so they have to stand on their own. This Stash Licorice Spice has a weak licorice taste and a weak spice taste. I have to use TWO teabags at a time (which makes the seemingly low price not so much a good deal). …",10 out of 12 users found this review helpful
 Great product,5,"I take a daily tea spoon of hemp oil and let me tell you, this thing killed my toe nail fungus in about 3 weeks and also cured my light arthritis on my hands. I know this hemp oil has trace amounts of THC and im sure that's what helped me with my ailments. I would highly recommend this product and i will order again. …",22 out of 25 users found this review helpful
 Thankfully this formula is also for infants,5,"I exclusively breastfed my first child for 2.5 years. When I had twins 8 months ago, I found it impossible to exclusively breastfeed them. Thankfully, I found this wonderful organic formula which they were supplemented on from day 1 (and they were a month early). If you go to the website (www.natureone ) you will see that the ingredients are identical to infant formulas - they simply call it a toddler formula for political reasons. See below. My twins are thriving and healthy. More pediatricians should read up about this and recommend it to those moms unable or unwilling to breastfeed. At least your babies won't be getting all the pesticides and growth hormones etc in commercial formula. It's really a sad state of affairs when there is only one organic formula available. Mothers need to demand better products, healthier products for their infants. Kim, Mother of three. extract from website: ""...Infant Formula Act (IFA), passed in 1980. Baby's Only Organic® meets the nutritional requirements of the IFA just like conventional infant formulas. Baby's Only Organic® is labeled as a toddler formula due to the company's philosophy to promote breast milk for infants the first year of life when possible (as mandated by the World Health Organization). If breast milk is not available, Baby's Only Organic® can be used for an infant less than 12-months of age as directed by a healthcare professional. Baby's Only Organic® has complete nutrition - nothing is missing, nor is it concentrated. For any age baby, mix the formula according to label instructions. "" …",25 out of 29 users found this review helpful
 OMG It WORKS!,5,"I have been using this product for almost a week now and my only complaint is that I didn't find pit about it sooner! First, a bit about myself. I am a 45 year old black woman, suffering from gout, constipation, fibrmyalgia, muscle cramps, brain fog and horrible insomnia, along with chronic depression and yes I am overweight, yes folks I am a hot mess! I found out about CALM from an article about the five vitamins and supplements that our bodies need the most, I was already taking four of them, so that made me feel good and when I read about CALM, I was like great this may be just what I need, especially after I read about all of the possible benefits that were to be achieved after taking CALM. Well, let me tell you how it has helped me in under a week. I am sleeping through the night, my mood is improving and that in of it self is a miracle. I have been suffering from depression for over 20 years and nothing helped, this is helping. I am able to think a bit clearer and turn off my brain, which in turn is also helping me sleep! Another major benefit is relief of muscle pain and cramps, especially after exercising! I did a particularly tough workout the other day, well hell any workout when you're fat can be tough, but this one consisted of weight training, cardio and ab work. I fully expected that I would be in horrible pain the next morning, but I wasn't as a matter of fact, I felt great! This also, seems to be helping with my fibromyalgia too. Now, the biggest benefit so far is the relief from my contipation! If I went once a week, I considered myself lucky. I had tried everything under the sun to get things moving so to speak, and either it would work for a while and then nothing, or worse yet nothing would happen at all. Any one that has suffered from constipation, knows now horrible it can be and how miserable you can become, both emotionally and physically. Well, since I have been taking CALM, I go two sometimes three times a day! I feel so much lighter, my friends and family always said I was full of **** and I guess they were right! I guess after reading my review you are thinking either she is being paid for this or it really works, well it is definitely the latter! It is working for me and I believe it will work for you too, try it what have you got to lose besides a crappy mood, sleepless night, a lot of **** and cramps? Jeez, I think $23.00 is a pretty fair trade off don't you. One more thing the dosage that I am using is two teaspoons at night and one teaspoon in the morning, both with 3 teaspoons of benefiber mixed in girl still needs her fiber! and BTW it's a store brand). I hope this review helps and if you have any questions please contact me, I am real and this review is real! …",58 out of 69 users found this review helpful
 Large Dog bone,5,"My dogs absolutely love this toy! Even after they have devoured the treats that go on the ends, they gnaw on them for hours. I have used one for almost a year now and it is still holding up well... even under a large dogs teeth! I would recommend this for anyone with a dog who loves to chew. …",14 out of 14 users found this review helpful
 Not what the picture describes,2,"I bought this steak for my father in law for Christmas because he had always wanted to try Omaha Steaks, and I heard good things about it. I purchased the private reserve because it is a higher quality of meat than the regular cuts and wanted to get him something extra special, but was I in for a surprise. I should have stuck with the cheaper meat. The meat came with extremely large amounts of fat all around. We had cut off a significant amount of fat prior to cooking,and the steak was still fatty once it was cooked. I was very dissapointed and so was he. We were going to call Omaha Steaks to complain, will never buy this brand again. Very unhappy with it. The taste wasn't even something that was worth raving about either. I could have went to the supermarket and bought a prime rib on sale that tasted better than this was, which i have in the past, and didn't spend nearly as much as they charged. …",7 out of 14 users found this review helpful
 What a combination,5,"While I'm sure the rabbit tastes fine, I have to wonder... why does the part where Superstore shows what people who bought this item also bought display four enema devices and one teeny tiny thong? I'm kind of horrified. …",117 out of 150 users found this review helpful
" It has 202 cals and 53 carbs per cup. Great sweetener, but their marketing is misleading!",3,"I like this sweetener a lot. But it is not a NO sweetener like the label claims, it is a LOW calorie sweetener when you do the math. The company says on their website that are 202 calories and 53 grams of carbs for a cup of Ideal. So it is 12.5 cals/3.3 carbs a tablespoon, and 4 cals/1.1 carbs a teaspoon. So not an actual NO calorie sweetener like the bag says. They list 0 calories because they can since it is under 5 calories for the serving size they have listed, but on a large pouch meant for baking you would use way more than a teaspoon -- especially if you wanted to make any of the sweet items they have pictured on the front of the bag! The label should be changed to reflect its intended purpose. It's like saying a can of regular soda is calorie free if you list it as being 42 servings. That said, I will still be using it since it has less than a third of the calories of sugar, about a quarter of the carbs and tastes very good. Their shady lack of disclosure on the bag leaves a bad taste in my mouth. But while it's not a no calorie sweetener, but it is pretty close to ideal. Rating breakdown: Product claims = 1 star Product taste = 5 stars Overall: 3 stars Calorie and carb info from their own website. …",62 out of 62 users found this review helpful
" Good Mild Coffee,  Does not hold up to larger than 8oz brew settings.",3,"My wife and I are coffee people fans, with the Jet Fuel and WakeUp call being our very favorite K-cups. With the WakeUp Call apparently disappearing I tried the Tree Hugger as a potential replacement and am very disappointed. The coffee is not bad at all, it is just nothing like the other bold offerings from coffee people. If you like mild, low acid coffee with a subtle flavor, this will probably float your boat. If you like a strong cup of joe with a lot of flavor and character, or like to brew the 12oz setting, look for a stronger offering. …",12 out of 14 users found this review helpful
 What is this again??,1,"Well, I'll begin by saying that I was really looking forward to this product. I tried TruVia's erythritol/stevia sweetener when I ran out of the stevia sweetener that I used before and wanted to get something instead of plain sugar. I figured that I liked the mix and wanted to try this powder because I had already ordered stevia from Superstore. When it got here I used it right away, and did not taste the difference. I was very conservative in adding this to my coffee because I didnt know how sweet it was. After adding 3 large spoonfuls into my coffee I gave up, and I usually add 1 spoonful of sugar to my cup. if you want a sugar free sweetener that you can even make at home, get stevia. I have used it from local health food stores and always ended up with that funny aftertaste from stevia. the one I ordered from Superstore, sweetleaf vanilla creme didnt have that aftertaste, and I used 12 drops in my coffee looking for it, typically I only use 4 drops in my coffee. …",8 out of 20 users found this review helpful
