Title,Star Rating,Review,Helpfulness
 Very satisfied with the quality of this tea,5,"I was first introduced to Pu-Ehr tea by a Chinese friend, who told me that most westerners do not like it. After one sip, I agreed with him, and after one cup, I was hooked. That's the way it is with Pu-Ehr tea - initially an acquired taste, then an addiction. This tea is quite a good Pu-Ehr for the price. Some low quality Pu-Ehr tastes very musty and earthy; this does not. I brew one brick in a 22 fluid ounce (0.65 liter), and this yields the entire Pu-Ehr experience. (A can contains 25 bricks.) The first cups are mild, but the bottom couple of cups yield the heavy duty Pu-Ehr jolt. Never add sugar or milk or lemon to Pu-Ehr, just take it straight or with dried chrysanthemum blossoms. …",15 out of 15 users found this review helpful
 Good Coffee,5,"After going through the sample pack of K-Cups that came with my coffee maker and a second sample pack, Caribou has become my favorite. It's funny, but the first cup I had I was really excited (maybe the caffiene). There were no odd flavors that stuck out to me; which is my main complaint with most coffee. To me, many coffees have good flavor(s), but they also have an extra twang or something that throws it off. Caribou just tastes like good coffee without any distracting tastes. …",13 out of 13 users found this review helpful
" Good product, but...",4,"I've yet to find any of the dogs I know that love it. I still have my allergic dog eating it, but she has to be hungry to eat this without doctoring. My vet doesn't want me feeding her people food so I add some of Newman's or Happy Hips canned to it. I've talked to a couple of vets about prescription diet and they all push the big company brand names. The common objection appears to be the soy used in Newman's to increase the protein count. I am willing to put a little flavor in this to feed may dog high quality, social responsible food. I may be the only person who has made the following mistake but, assuming you catch the Superstore sales, make sure you are ordering the bag size you want. I thought I was getting a good price on one order until the food came and it was the seven instead of twelve pound bag. …",17 out of 18 users found this review helpful
 For entertainment only.,3,"Con *Not great tasting *No English directions (see youtube to find out how to do this that is what we did) *Box arrived crushed Pro *Fun to make *looks cute My boyfriend got this for me just for fun because we both love sushi. We could not figure out the directions via the pictures so we looked online and found directions on youtube. Everything smells like grape but the texture is not that appetizing and I like fake grape flavoring. We both had a problem just trying to swallow it but for $11 we kind of felt obligated. It is fun but as another user stated you can buy it places like j-list for around $5 if you want the experience buy it at another place. Otherwise I suggest you find directions online ""how to make candy sushi"" out of rice krispy treats, Swedish fish and fruit roll ups or come up with your own ideas and have fun! …",7 out of 12 users found this review helpful
 Great creamed coconut; NOT the same as coconut milk,5,"The folks giving bad reviews on this product don't seem to understand that creamed coconut is not the same as condensed coconut milk. It contains coconut-meat solids and is pulpier/thicker, and will not taste like coconut milk by thinning it out with water. What you get: inside the green box you see in the picture is a plastic-wrapped block of creamed coconut. Unless your house is very warm, it will be rock-hard. I fill a bowl with hot tap water and immerse the entire package, then knead it with my fingers after a few minutes. Repeat a couple of times, then snip the package open and pour/squeeze it out like toothpaste for use in cooking. If you don't use the entire package all at once it will resolidify; that's not because there's anything ""wrong"" with it, that's just what real coconut cream does. That's why I love these little packages, as opposed to the 16-oz jars of other brands that they sell at Whole Foods Market. …",61 out of 61 users found this review helpful
 This is a really funny story,5,"I only drink coffee in the morning and usually only one cup. I'm a pharmacist and used to drink coffee all day long for a little pick-me-up when my energy flagged, but the coffee sometimes bothered my stomach since I drank so much. My doctor suggested I switch to tea. I started drinking L****n tea, you know the one in the yellow and red box, what did I know about tea? I was working at the time with a young Chinese man (a friend of my son's) and he was a Star Trek fan, as am I. When I went out for a container of tea one day I asked if he wanted anything and he asked for Earl Grey. I asked why and he told me that Capt. Pickard on Gen II always ordered ""Earl Grey hot"" from the replicator. I laughed as I had seen that too and just never connected with the brand and had one also. Well, I liked it so much that it became my favorite tea. I still have English Breakfast and some Chinese teas sometimes, but I must have Earl Grey with my dinner. Sometimes people wonder at my ""tea sophistication"" and I don't tell them where my preference actually comes from.If they only knew. …",11 out of 12 users found this review helpful
 Best ghee in the world,5,"Ghee is more than an indulgence. Ghee can be viewed as an essential vitamin supplement (albeit, one that tastes really good). Ghee is especially necessary in a vegetarian diet in my opinion, but it can be a healthy addition to any diet. Some research shows that ghee can even lower cholesterol. I performed an extensive survey of the top ghee products available. I compared quality and value. Ghee is so important as an addition to the diet that quality should not be sacrificed -- especially because only a very small amount of ghee needs to be used. The ghee comparison table can be found at this blog: [...] When I started this ghee comparison, I was primarily interested in finding the best value in organic ghee products. However, I learned that several of the products go well beyond just organic standards. It was a very pleasant surprise to find out that such high quality ghee products are available. It is also great to see that my two top picks are both available on Superstore . (Ancient Organics Ghee is my #1 pick.) Because such high quality ghees are available, I focused on understanding which product is the most authentic. Some of the ghees are much more authentic than others. The information in the table (link above) reflects that fact. The focus of my evaluation is not gourmet cooking. It is optimum health. Therefore, I am concerned first with which ghee product is the healthiest. I rank Ancient Organics as the very best ghee. It is #1. It is the healthiest product as well as the best tasting. The ghee is so good it is almost magical. …",12 out of 12 users found this review helpful
 Kill the Wabbit!,5,"The twick is not so much to catch the wabbit, the twick is to ho'd the wabbit. Wight awm nestoled awound the neck, elbow beneath the chin, hand cwenching the back of the wodent's head. Weft awm fiwmwy wapped awound the wabbit's waist, ho'ding the body tight to yow body. And, quickwy, in one viowent twist, you snap the neck. Sometimes the wabbit will fwop a widdle on the gwound. You may not have pwopewly sevewed the spinal chord. This is a weal tweat, as a wiving and fuwy mobile wabbit can be dangewous, wascally even: a wiving wabbit with a bwoken neck is hawmless so wong as you stay away fwum the teeth. When I see a wabbit fwopping on the gwound, I wift my widdle boot and cwush its tiny widdle cwanium. Then the wabbit is quiet. Vewy vewy quiet. Huhuhuhuhuhu! …",97 out of 106 users found this review helpful
 WAY too strong,1,"I put one square in my mouth and it made me want to vomit. I love most of their other products but this was absolutely volatile. The taste was stuck in my mouth for the rest of the night. Unless you like your chocolate very very very very very dark, do not get this. 88% cacao content is ridiculous- I try to stay below 70-75. …",4 out of 50 users found this review helpful
 Ordered the item on the 7th.. wasnt shipped until the 14th!! WAY BEHIND THE ESTIMATED ARRIVAL DATE!,1,"Ordered the item on the 7th.. wasnt shipped until the 14th!! WAY BEHIND THE ESTIMATED ARRIVAL DATE! They did not offer any compensation for my inconvenience. When asked if they would express ship the item, they responded ""since we use proirity mail there is no guarenteed arrival date"". RIDICULOUS. I got this item FINALLY on Friday Oct. 17th (10 days after it was ordered... 5 days after the promised time frame) Product is just so-so. It only comes in a silver packaging, with a home-made looking logo on the bag. No Nutritional info, no ingredients. The communication was also very poor. took 2 emails befoe i got a response. …",6 out of 29 users found this review helpful
" Finally, a great cup of coffee",5,"I have tried them all...all the brands on Superstore, that is. Some have been less than thrilling and some pretty good. The Senseo Espresso Coffee Pods are the best I have found. You can make a great cup of coffee...I wouldn't really call it espresso with the convenience of a pod. I read a tip somewhere on Superstore about wetting both sides of the pod and it was the best tip I got in 2008. The resulting coffee is rich and full flavored, without bitterness. I think I will stick with Senseo Espresso. I did not use the special espresso pod, just the usual one pod holder, and it worked fine. …",40 out of 48 users found this review helpful
 did NOT taste like peanut butter,1,i personally wasnt impressed with this imitation peanut butter esp. for the price. it was very chalky tasting. thumbs down!! …,8 out of 14 users found this review helpful
 healthy cat food,3,"cats don't seem to like healthy cat food, took a long time for them to finish so they were robbing the dogs food until i opened them a bag of their cheap stuff then they gorged …",7 out of 15 users found this review helpful
 Not quite as much output as I would have liked.,3,"I'm sure others will pipe in with more thoughts, this is just a brief comment. This is very small, somehow I had pictured it larger. I thought I was going to be able to have enough lettuce to meet my needs. What I have is a few gourmet lettuce leaves a day. They are wonderful and the thing is a lot of fun and nice looking but it just doesn't produce much lettuce. I have not tried any other seeds yet. That said, being the only person in the house eating greens means that I can have the lovely tender lettuce leaves that I couldn't before because I couldn't eat the whole grocery store package fast enough. Love, Marianne …",17 out of 22 users found this review helpful
 As strong as K-Cups get,5,"This is it, the only Kcup that is strong enough to have taste at the largest setting. What more can I say, when I want something other than coffee water I reach for the Dark Magic. Cheers. …",12 out of 13 users found this review helpful
 Shipping is INSANE!!!,1,"I love the popcorn, but the shipping costs are INSANE!! A total rip off. Wabash Valley Farms or Superstore or whoever is charging the shipping is out of their mind. 5 Stars for the popcorn. Minus 4 stars for the terrible cost associated with shipping. Argh...Yes, the popcorn is tender and luscious, and it melts in your mouth like you're eating cooked grasshoppers, but come on!!! Can't you ship this product for less? Shipping the 6 pound bag is even worse. *sigh* Too bad really. …",22 out of 27 users found this review helpful
 Very salty and a little strange,3,"Maybe I had my expectations set too high after reading the other reviewers. This is nothing like homemade beef broth. Yes, it's better than bullion, and it avoids the ""tinny"" taste that canned broths tend to have. However, it still has a hard-to-describe strange flavor, not the rich beefy taste others described. Plus, it's very very salty. It's hard to make a good sauce or soup from it because of the amount of salt. Each pouch, which reconstitutes to one cup, has 770 mg of sodium. That's higher than most canned broths. I assume that high salt content is to make up for the lack of beef. I don't know how much they use, but the USDA requires less than an ounce of beef for every gallon of water - I don't think they're much higher than that. If you try to concentrate it into a sauce or gravy, it becomes as salty as cheap buffet food. It's not terrible, but it's nothing like the quality of a good boxed chicken broth. I'm certainly not going to reorder it once I run out; I'd rather just avoid recipes that require beef broth. …",12 out of 14 users found this review helpful
 Too Yummy for Their Own Good!,5,"And way too yummy for my waistline! How come I can't award these things fifteen stars, anyway? Stacy's Cinnamon Sugar Pita Chips are without a doubt, the most delicious cinnamon treats I've ever eaten. They remind me of the best bite of an apple pie crust, without the apples and the goopy moistness of eating an apple pie out of a bag. With Stacy's Pita Chips, you open the bag and get this tiny puff of cinnamon aroma and you are compelled to dive in, face first and mouth open. Sharing is not recommended, but the sharing police aren't going to do anything to you if you give a couple to someone you love dearly. However, that night you will lie in bed unable to sleep, obsessing about each chip that you gave away, and your stomach will growl accusingly. Be warned. Happily, now that you have found these chips on Superstore, you will not go broke because of your addiction. They have a superb price, far better than anything I have found in Boston area supermarkets. For example, I save over a buck every time I eat a bag of chips from Superstore. I'm eating several bags a day, and at dollar apiece, I am going to be rich, rich, rich! (sorry, richness not guaranteed in your area) On a less spectacular note: a baked treat is not a fat-free treat, and calories are the punishment for yumminess. The bag claims that a portion is a measly eleven(!) chips! Eleven! I've had more than eleven chips while writing this paragraph. That miniscule amount of flavory goodness is packed not only with wonderfulness, but also with 140 calories! The tiny snack size bag has 1.5 ounces, and is supposed to feed 1.5 people. That also means it has about 17 chips in it, and I'd be licking the inside of the bag, embarrassing myself for all time, and adding 210 calories to my personal fat-retention system. You may wish to purchase and split a case of Stacy's Pita Chips with a friend, so that you can both wear swimwear without embarrassment in the coming season. Make sure that your friend is there when the friendly delivery person arrives with your chips, or your friendship might be endangered. (Or you might have to buy a second case to split with the friend, but that leaves your waistline in worse shape than it was before) Better yet, make friends with the delivery person, and split the case with him. Enjoy your tasty treats, and if you have difficulty making friends, the kind you would want to share your Stacy's Pita Chips with, I am a kind and friendly person, and can be trusted to split a case fairly and evenly. …",37 out of 40 users found this review helpful
 Never again,1,"I read the reviews and took my chances and bought a bunch. I am so disappointed by the sweet, lacquered Chinese bbq pork like beef jerky with an overwhelmingly raw garlic/chili favor. Yes, the pieces are moist but in a preserved radish way with smallish, flattened pieces. It just doesn't have the premium beef jerky heft where you can separate the pieces along the grain. Don't expect premium beef taste and texture but rather a product processed more in the Chinese restaurant baking soda, tenderized fashion. I truly regret my purchase which I probably couldn't give away. …",8 out of 14 users found this review helpful
 Transcendental - you gotta try it.,5,"I'm a bit of spice hound and have flirted with other hot sauces before, but nothing has ever seized hold of me like Sriracha. An old Greenwich Village burger joint near where I worked at NYU used to serve it on the tables with popcorn and the combo was killer. The memory haunted me for years before I finally picked up a bottle. I shouldn't have waited. This stuff is amazingly addictive with a garlicky sweet hot yumminess that's hard to describe. It sits on my table in front of the salt and pepper and I've drained a bottle in a 3 month period. Incredible on eggs, superb on burritos, utterly transforms dull dietetic chicken vegitable dishes from the Chinese restaurant. I put a squirt in the health low-sodium soups instead of more salt and all of a sudden all the flavors perk up. Utterly highest recommendation. I, personally, do not buy the 28oz size - even though it's almost the same price as the 17oz size. (it's not a total freebie - Shipping is a bit higher on the 28oz). While Sriracha has preservatives and doesn't need refrigeration it does oxidize a bit and at the pace I use it the bottom third of the 28oz gets a bit stale for me, while I suck the 17oz down while it's still fresh. If I lived in a house with more spice hounds (I'm the only one around here) or if I were cooking with it more often in larger recipies the 28oz would be a big bargain. …",55 out of 56 users found this review helpful
 pretty good,5,I ordered this product after reading reviews from several hair boards. I use it as a treatment along with other oils before I wash my hair. I read reviews where people said that they could not handle the smell. It's not that bad. It reminds me of hair grease if that makes sense. I've been using it consistently on each hair wash day and my hair is softer and a little more manageable. …,12 out of 13 users found this review helpful
 Vitamin E...,5,"I purchase this all the time although it is not organic. Every week I take what I need and keep the rest in the freezer, double bagged in zip-locks since nuts go rancid due to the oil content. Almonds are high in vitamin E which is great for my skin. I place twenty almonds in a cup of water every night to consume it in the morning since it becomes softer and tastier without damaging my teeth. This is one nut that I take with me in prescription containers with some water when I go mountain biking and surfing since that is when I need healthy calories and vitamin E, exposed to the sun without sunscreen so I can get my vitamin D from the sun. Bravo. …",13 out of 14 users found this review helpful
 Grains don't belong in dog food,1,"I will never again even CONSIDER a dog food with corn, wheat or soy in it. Grain has no place in a dog's diet! …",3 out of 15 users found this review helpful
 The 28th Five Star Review,5,"Rarely have I encountered a product that doesn't have at least ONE person who either thinks it's junk, or gives a (bogus) low review because the delivery guy accidentally dropped the package before leaving the item at the door. As of this moment, 100% of the people reviewing the Greenies PILL POCKETS have given them a five-star rating, and I'm enthusiastically joining the crowd! If you're a dog owner, you've almost certainly had to, at some point, give your dog a pill that he or she was reluctant to take. The usual remedy until now, (as suggested by our vet) was to simply shove the thing down the poor dog's throat, and then rub their neck to help the pill go down. Recently, one of our dogs --a large yellow lab named Chip-- was suffering from untreatable throat cancer, but he still needed to take a number of pills to make his final days a little more comfortable. The vet specifically mentioned AVOIDING the ""shove and rub"" technique as it would be very painful for the dog --who at that point was even reluctant to eat his regular food. Someone mentioned PILL POCKETS. We picked up a bag and lo and behold, they worked like a champ. Though Chip was still not really interested in eating a meal, the *very* meaty smell of the PILL POCKETS was irresistible to him, and he happily gobbled up his meds. Sadly, we lost Chip about a week later, but then our other dog developed a minor skin rash that required he take some antibiotics. Eubie is a Border Collie, and they tend to figure things out before you do --and we were astounded when he wolfed down his medicine and then looked at us as if to ask ""is that all --when do I get another?!"" My technique for using the PILL POCKETS is to stuff the pill(s) inside, pinch off the open end --and then, using my palms, ""roll"" the pocket into a smooth, round ball. With Eubie at least, he loves the smell so much, that he simply swallows it whole. In fact, I discovered another great use for the PILL POCKETS and that is to take a rawhide bone and smear the nooks and crannies with a single pill pocket. Since they're kind of ""doughy"" in texture, they're perfect in this regard --and for a dog that will happily walk around the house with the rawhide bone for days without ever chewing on it, we've found that the ""pill pocket infused"" rawhide is something that he HAS to chew on. (In fact, he was SO focused on this task, that for the first time ever, he actually ignored the fireworks on July 4th.... it was truly amazing!) - Jonathan Sabin …",26 out of 27 users found this review helpful
 An extremely flavorful light-roast coffee,5,"One of the pleasures of a Keurig is that you can serve a friend or a guest a cup of coffee that will please them and their tastes, not just what you brew for yourself everyday. I happen to enjoy strong, deeply roasted blends (the kind that you usually find at the specialty coffee shops which seem to be all over the place now). However, not everyone shares my enjoyment of a strong, full-bodied cup of coffee. I have many friends who often say something like ""I love coffee but Starbucks is just too strong for me"". Enter Donut Blend. I have purchased many boxes of Coffee People's Donut Shop Coffee and it is a favorite for many of my friends and family. When Timothy's announced that they were coming out with the ""Original Donut Blend"" I got in line to try it. Here is my take on it: It is certainly a little lighter than Coffee People's version but the taste is more complex with clean, bright notes of spice and low acidity. Surprisingly, it reminds me a little of the Peaberry Kona coffee that I brought back from Hawaii. It is a perfect blend for those who like their coffee black or with just a little cream and still want it to taste like coffee. If someone drinks several cups a day I think that Timothy's Donut Blend will not overwhelm their taste buds and will still taste fresh cup after cup. Mind you, I drink Newman's Own Bold Blend on a regular basis and will continue to do so, but if I am having more than two cups (for those ""special"" mornings when nothing seems to go right) or if I am having a cup later in the day I will drink this one. Just rating it on what I want in a coffee I give it four stars, but judging it for what it is (and not just what I like), it fully delivers and deserves five stars. People Medium Extra Bold, Donut Shop K-Cups for Keurig Brewers (Pack of 50) [Superstore Frustration-Free Packaging ] …",82 out of 83 users found this review helpful
 wish they were in glass bottles,4,"I wish these were in glass bottles, but sometimes UPS beats boxes up pretty good, so I see why they're not. The water sitting around in #1 plastic for who knows how long means the plastic could leach into the water. Free delivery of bottled water from Superstore is really fast. I wish I could find cases of this stuff locally, ideally in glass bottles. I don't know why that's so difficult. I realize that coming all the way from Italy this water has a huge carbon footprint. With a little Torani syrup (also well priced and promptly delivered free by Superstore) in the bottom of a glass, topped off with Pellegrino, you have a delicious, inexpensive soda without all the chemicals of traditional soda. Yes, the Torani has sugar, but it's pure cane sugar, not high fructose corn syrup. We also use Pellegrino to cut and fizz up lemonade and juices. In the glass bottle, on ice, Pellegrino is a great alternative (or supplement) to wine at dinner. The merchant who makes this available in glass bottles, by the case, with free delivery, will be very busy. I wouldn't even mind paying a little more. …",12 out of 13 users found this review helpful
 Relieves PMDD,5,This tea is great. I like the taste. It helps with constipation too. But what I really found helpful about this tea is calming my PMDD. My PMS was getting really out of hand. I was getting to the point where I could hardly function during my pre menstural. When I drink this tea regularly it's incredible the difference I see. Really helps me with my irritability and bloating. This tea has become a necessity for me. …,20 out of 20 users found this review helpful
 Love this Product.....But cheaper on other sites,5,"I recently purchased this item from Superstore - then found it CHEAPER somewhere else. Superstore - please review your pricing policy on this product. I would like to sign up for the auto delivery program - but I will NOT until you can beat the cheaper prices. I am an avid Amazonian shopper and was very disappointed about the price difference. I LOVE this product. Please give serious consideration to this post. Thanks, …",13 out of 14 users found this review helpful
