Title,Star Rating,Review,Helpfulness
 Product not as described,3,"Package arrived in time. I was expecting the salt to be finely ground - which to me means something powdery. The salt was more like rock salt - the crystals being slightly larger than what you find in kosher salt. I have to dilute it with water before I can consume it. If you sprinkle it on a salad or similar semi dry food, you will feel the crystals, which is an unpleasant experience because it feels like you have sand in your food. This salt is not like regular salt that dissolves easily with little moisture/liquid. The package it is in is also labeled ""finely ground"". I use it for cooking - where I have no problems with it. The three stars are only because the salt was not what I would consider finely ground. …",25 out of 32 users found this review helpful
 bad beef,2,I'm normally a fan of jack links but this really disappointed me. Ordered 4 bags and had two of them. I spent more time picking through the meat taking out the nasty gizard and fat chunks all throughout the bag. Also the meat quality was terrible and quality control isn't. Good for this flavor. One piece would be moist and flavorful and the next would bard as a rock and uncomfortable to chew. Overall this was a terrible product. Jack links shouldn't put 10 different cuts of meat in the same bag. If you like quality controlled products this isn't for you. …,13 out of 13 users found this review helpful
" A perfect ""Anytime"" coffee that is sure to please.",5,"I have tried many, many brands and blends in my Keurig coffee maker and this is definetely one of my favorites. The type of coffe I drink depends on my mood. Sometimes I want a strong, bold cup like, Newman's Own Extra-bold Special Blend K-cups, 80 Pk for Keurig Brewers and sometimes I want something more mild like, Mountain K-Cup Single-Serving Coffee 108-ct.- Nantucket Blend But ever since I have had my Keurig I have been looking for one of my favorite coffees. The Dunkin Donut brand. This coffee is superb and very much like the Dunkin Donut brand. Not bold or bitter. Not weak or under flavored. It is smooth and very flavorful. It is the perfect crowd pleasing blend for any time of day or night. I have shopped all over and you can't beat the variety or the price here on Superstore when you join their club. A great value. I do wish that Superstore would change the name by removing ""Extra Bold"". It is not. It is, at most, a medium roast. Even when brewed with the smallest setting of the Keurig I would not concider it bold. It comes out great on the medium size setting. Very remanicent of that great cup of Joe you would get in the old days at your favorite diner. …",31 out of 32 users found this review helpful
 Expired Product,1,I bought this product on September 2010 and this product expires on the 27th of August 2010. I have bought alot of products with Superstore and until now I had no problems. I dont understand why Superstore would send me a product that would expire two months after I received it. …,8 out of 12 users found this review helpful
 First Rate Blend.,5,"I really enjoy coffee, and I have ever since my teenage years. My tastes have gradually evolved and escalated. The first to go was any kind of instant coffee. How anyone could drink that swill is beyond me. Next to go was any kind of additive, such as cream or sugar. The next to go was any kind of ground coffee in a can. Some is marginally OK, but compared to whole-bean coffee, it just doesn't cut it. No, whole-bean coffee without any additives and ground on the spot is the only coffee I'll drink, short of some kind of emergency. When It comes to whole-bean coffees, there's quite an amazing variety. I found Trader Joe's to have an excellent selection from all over the world, and the cost (on a per pound basis) was typically about 50% that of what you might expect to pay in the local super market. I particularly liked their Columbian Supremo. The problem is, the local Trader Joe""s is a long way off and I sometimes run out between visits. Well, I've then picked up some large bags of beans, one of which was Starbucks French Roast, at my local Costco store and it was quite excellent. Starbucks is first rate, but tends to be somewhat pricey, even when purchased at Costco. Well, one day I discovered the Kirkland Signature House Blend bags of whole-bean coffee at Costco. In my opinion, Kirkland Signature products have always been of the highest quality but at a substantially reduced price. For example, this Kirkland coffee is almost half the cost (on a per pound basis) of Starbucks French Roast. But, right on the front of the Kirkland package it says ""Roasted by Starbucks Coffee Co."" Hmmmm. I just had to try this one. Well, it's excellent. It's a little less robust than my Starbucks French Roast, but I prefer it that way. I'd say it's first rate coffee at a bargain basement price. Buying whole-bean coffee at the local supermarket is now out of the question. Gary Peterson …",19 out of 21 users found this review helpful
 Why do you have MSG?,1,I really wanted to buy these but for some unhealthly reason MSG was used in the ingredients. I'll be watching for the no MSG label on your future packaging. …,0 out of 15 users found this review helpful
" FYI, these are gels, not powders.",2,"I know this may seem silly, but I thought I was buying powder/dry icing colors. These are gels, and as such, contain all kinds of junk in addition to the coloring, including high fructose corn syrup, corn syrup, glycerine, and sugar. Gels are preferable to liquid color because they don't dilute your icing or cause it to crack as badly, but powder/dry colors don't contain other ingredients so they don't spoil and aren't as bad for you! …",30 out of 43 users found this review helpful
 Great Assortment,5,"This assortment is a great way to try a bunch of flavors. I love the variety and I'm ordering it again right now! UPDATE: I ordered this a second time; it's that good. I've only had my Keurig about a month and am loving the different k-cups, trying to find which brands and flavors I like most. The second batch was different from the first which was nice!!! …",12 out of 14 users found this review helpful
 Good Coffee Good Price  No Waste,5,"Timothy's Colombian Decaffeinated is a good tasting coffee for a good price. The savings are even better if you sign up for the auto renew program. Also, we have found that you can use each cup twice. Therefore it's like getting twice the quantity for the money. I checked with the Keurig company and they said by processing the cups for two cups of coffee or tea will not hurt the machine. Best, Al …",56 out of 58 users found this review helpful
 Don't touch it,1,"I purchased two boxes (50 K cups)and out of the 50, 40 of them ended up in the trash can, beside the fact that every time I tryed to brew a cup of coffee, coffee grind was all over the machine and inside the coffee cup, due to the K cup bursting during brewing. I did not have any problem with the same brand of coffee i purchased from my local supermarket though. I will not buy it ever again on line. A real nightmare. …",8 out of 12 users found this review helpful
 Not as good as it could be (misleading ingredient label also),1,"A number of us earnestly tried this product but after trying another brand, found this to be wanting very much. With that said, there is a company making soy jerky that has better flavor, texture and quality. They even make jerky that is unsweetened. Most importantly, this company tasty eats does not have any garlic or onion powder in any of their products. This was the biggest, we felt, downfall of this product. Except this company, every jerky company; except tasty eats which uses no garlic or onion powder in any of their product line, all would list garlic or onion if an ingredient. The primal strips company has ""vegetarian spices"" so one is not clear what this is. Even the company, after phoning them, are rather reticent about saying if their is granulated garlic or onion. But there is. In these primals strips, all are having some form of garlic, possibly onion. We found tasty eats soy jerky to be Perfect. Really, in quality, texture and also the fact that they use no onion or garlic whatsoever. …",0 out of 12 users found this review helpful
 Excellent,5,"This is some ""excellent"" popcorn. It pops up very nicely and is ""far and away"" better than the ""Orville"" that you've been popping. Very fine, almost non-existent ""hulls"" when it pops. Easy on the teeth and a very ""clean"" taste. Like ""Mikey"" says, ""Try it, you'll like it"". …",29 out of 29 users found this review helpful
 NOT WHITE CHOCOLATE!,1,"Do not be tempted to use these as a substitute for white chocolate just because they're cheaper! There is a reason they do not use the word ""chocolate"" on the package, as there is NO cocoa butter in them. In fact, the only natural ingredient listed is milk. This is reflected in the taste, which is very artificial. I tried to use these in a cookie recipe recently and ruined the cookies. They did not melt properly and every one fell off the top of the cookies. I will never use this product again and will tell everyone I know not to use them either. …",22 out of 24 users found this review helpful
 Unique sweetness makes Nectresse a winner,4,"""Hello, my name is David, and I'm a sugar addict."" ""Hello, David."" True, I love my sweets, but my sweets do not love me. Hence, I tend to rely on sugar substitues (perhaps a little too much) to stave off those sugar cravings. My go-to has always been stevia, in one form or another, whether liquid extract, powder, crystalized (Truvia), or organic ground, as I think stevia is an excellent sweetener. But, always willing to try something new, I was happy to indulge in Nectresse, a new natural sweetner from the makers of Splenda. The primary source of sweetener in Nectresse is monk fruit (aka luo han guo), which I have eaten as an additive in other foods, and have always found to be tasty. This was my first opportunity trying it as an actual sugar substitute, so I tried to utilize it in several different applications. First, on its own, Nectresse is great. I initially thought there was a slightly off aftertaste, but I realized it was hints of the monk fruit itself, and the flavor everntually grew on me. I then sprinkled Nectresse on various kinds of fruits, from watermelon and peaches to strawberries and cantaloupe, and it fared well on all of them, adding just the right touch of sweetness without overpowering the natural flavors of the fruits. I also added Nectresse to cold almond milk, as well as hot tea, and was very pleasantly surprised to see how well the granuals disolved in liquid, which tends to be problematic with stevia (mostly so with Truvia). And not a lot of Nectresse was necessary to sweeten the drinks (maybe half a packet), so a little goes a long way. I did not have the opportunity to bake with Nectresse, so I cannot comment on how well it does in baked goods, but based on my initial observations, I think it's likely to perform well. Now, I would exercise some caution here, as there is sugar in Nectresse -- though, less than 1g (which, in a 2.4g serving, could still be significant). The other ingredients are Erythritol and Molasses. So, if you are on a complete no sugar diet, you'd likely have to skip this sweetener. Still, there are 0 calories overall, with the Erythritol providing 2g of carbohydrates. Overall, I think Nectresse is a far better option than Splenda and Aspartame (especially considering their sketchy health and safety issues), but in my opinion, not quite as good as stevia. But, taste is highly subjective, so I think opinions are likely to be quite divided here. I will definitely continue to use Nectresse, as it's a great form of monk fruit extract, but it won't be the first product I reach for when attempting to quell my sweet tooth. …",19 out of 22 users found this review helpful
 Japanese-style cooking must-have,5,"Miso is a base for many Japanese-style soups and other food treatments, no western substitutions are possible. This is my first experience with miso and a positive one. It is salty and assertive, but it IS a fermented concentrate after all. Buying the 2lb. size is the only practical way to stock this item at home, IF one is serious about learning its uses. It stores beautifully in the fridge after opening. The flavors are a welcome change from the usual euro-inspired fare and is far superior to the ""plastic"" asian food to which we westerners are subjected. Storage is no problem. Clip one corner of the package and squeeze the miso out like toothpaste to measure. Then, squish the paste back to the package bottom, squeeze air out, roll/fold the clipped end under and fasten with a clothes clip, big paper clip, etc. Stores for many months in the refrigerator. …",21 out of 21 users found this review helpful
 Good in Moderation,3,"Although I enjoyed the taste and texture of the Snapea Crisps, I found eating them in small quantities was important. They are somewhat greasy and are not as healthy as they may seem in regards to calories. …",21 out of 25 users found this review helpful
 Takai! (Expensive!),2,"This pack is a great representation of Japanese snacks, but is incredibly over-priced. Expect to pay about [...] for each of one of these items in a regular or specialty store. I cannot believe the merchant is charging [...]. …",11 out of 12 users found this review helpful
 Do not purchase this product!,1,Upon receiving this product after my son had consumed some it was discovered that the bag was full of green mold!! I wouldn't even give it one star but I had to if I wanted to be able to post this. …,8 out of 12 users found this review helpful
 Good Energy,5,"This is just how tea is taken in Japan, but put into a steel can. A touch of astringecny (a preferred taste for Japanese green tea) is a small price to pay for all of the naturally occurring antioxidants to be had from this unsisified, fiesty little drink. …",22 out of 22 users found this review helpful
 It was a good idea but they ruined it by adding BHT!,1,"My son has autism and is allergic to gluten among other things. I was so excited to see that Rice Krispies had come out with a Gluten Free version until I read the ingredients. BHT is NOT healthy! It is an ingredient in jet fuels, rubber, petroleum products, electrical transformer oil, and embalming fluid. The MSDS (Material Safety Data Sheet) for BHT says the following: Do NOT let this chemical enter the environment. Combustible. Ingestion causes Abdominal pain. Confusion. Dizziness. Nausea. Vomiting. The substance may have effects on the liver. The substance is harmful to aquatic organisms. When Chex went gluten-free, they did the same thing. Yes, taking out the gluten is healthy, but adding BHT is not! I would have loved to have been able to buy my son ""normal"" cereal, with cute characters on the front. He would have loved it, but in the autism community, we are trying to get the toxins out of our kids, not put them in. I will continue to be a Erewhon Twice Rice Cereal customer. At over $4 per box, the price is steep, but I know the only ingredients my son is ingesting are organic brown rice, organic brown rice syrup, honey, and sea salt and he loves it. Shame on Kellogg's for putting BHT in our children's cereals! …",146 out of 178 users found this review helpful
 Love this stuff - best of the brands I've tried,5,"Of the several brands of agave nectar that I have tried, this one is by far the best. It has the least ""taste"" to it - it is just sweet (very similar to simple syrup that you would make with sugar and water). …",19 out of 19 users found this review helpful
" Don't bother with this if you are an athlete, vegan or healthy!",1,"While this product works with many others I know, it doesn't work for me at all. The only reason I cite that stands out for me is I eat healthy, I maintain an active lifestyle and I get enough of rest, so in the mid afternoon when I have the 5 Hour energy drink, I still feel sleepy and I can sleep through it without feeling energetic (I work out in the morning). I'd love to hear comments from others who do have a healthy, active (vagan) lifestyle and still find this energy drink valuable. …",7 out of 15 users found this review helpful
 Couldn't get it down...,1,"Drinking it once was bad enough, I'm sure I couldn't get it down ever again. I wish I could drink it for the nutritional value, but may try the capsules instead. …",11 out of 21 users found this review helpful
" These contain corn syrup solids, dextrose & sugar! toxic to dogs!",1,"If I could give these treats and a whole bunch of others 0 stars, I would. They contain among their first ingredients corn syrup solids, then dextrose and a little bit farther down the list sugar. Sugar and other forms of sugar like corn syrup and dextrose are linked to cancer in dogs. They're just as bad if not worse for them than for humans. Sure the dogs love them; but there are a lot of healthy treats out there that are just as well liked. You're buying the name brand, advertising and packaging. …",7 out of 12 users found this review helpful
 Tea no taste,1,I found the tea to be bland. Thank goodness the box can be reused for other teas in the future otherwise it would be quite expensive for the quality of tea in the box. …,13 out of 13 users found this review helpful
 A delicious treat,5,"Well, since some other user decided they'd paste their review on to each flavor allow me to give my short but sweet review: MiO is delicious. I like that I can just put in the tiniest of splashes in my drink and just have a hint of flavor... or splash a lot in and get a real flavorful experience. It's a quick and easy thing to use. It's also fun to watch it splash into the water. I've also found it's good to flavor different types of alcohol. In regards to the criticism by other reviewers for it containing propylene glycol - don't be in a panic like them. propylene glycol is harmless unless ingest massive quantities of it. Using a canard like ""it's considered harmful to pets so humans shouldn't ingest it!"" is just alarmist behavior. Chocolate is harmful to dogs. Better not eat that then! Lastly, in regards to it having so many ""food colorings"" - well, if you don't like anything that flavors your water to have anything artificial in it, squeeze a lemon into it. Put a dash of sugar. Or just drink the water plain. You know what you're getting into when you buy this stuff. Bottom line: This is my new favorite drink flavoring. I will be buying from them again and again. …",10 out of 14 users found this review helpful
 Great Product In Wrong Container,5,"Undoubtedly, the purchase and use of stool softeners would plummet if everyone, including physicians, considered magnesium. Fact: An insufficient amount of magnesium in the body is a primary cause of constipation and hemorrhoids, yet most physicians unwittingly recommend stool softeners. Fact: By taking your measure of Natural CALM daily your constipation will quickly subside. Friends, before you devour any more medications why not try a natural remedy? Natural CALM is an easy-to-assimilate powder that when mixed with water becomes effervescent. More effective and absorptive than tablet form, Natural CALM is the best selling ionic magnesium supplement to be found in health food stores to date. Choose natural or one of four flavored varieties. It's all the same healthful Natural CALM. Magnesium is also attributed to curing or moderating all of the following conditions: leg cramps, headaches, hair loss, insomnia, high blood pressure, nervousness, muscular disorders and depression. That is not to say that any or all of these conditions are apt to be remedied in each and every case. Pardon me, but I had to laugh when reading one reviewer's comment that said the product helped her leg cramps but didn't do anything for her sleeplessness. She readily awarded the product a mediocre three stars. Holistic alternatives are of utmost importance, especially--especially as we advance in years. I highly recommend this gluten-free product. You might be surprised at how little you require. Starting with half a teaspoon daily you increase or decrease as might be necessary. Soon you discover your proper dosage. Directions are unclear as to the amount of water to be used: ""Place powder in a glass or mug,"" it says. ""Add 2-3 oz of hot water. Let it fizz, then stir until dissolved. Fill with warm or cold water and enjoy. You can also simply add Natural CALM to a glass or bottle of cold water."" Got it? Neither do I. It's confusing at best. Just how much water to how much powder? It seems that they leave this for us to decide. Then there's the problem with this two-inch wide container. The size and shape may be suitable for stacking on store shelves, but not for home use. You need something wider. Consequently, I transfer the contents into something more sensible. Now I can utilize a measuring spoon, a measuring spoon for the sake of accuracy. Consistent results are what we desire and consistent results require accurate measurements. My dosage being precisely half a teaspoon, I use water (at room temperature) in one measured cup. Directions advise us to heat the water, but I myself do not find that extra chore necessary. I stir and let it settle. Then down the hatch. Need I mention that Natural CALM contains no yeast, dairy, egg, soy, wheat, sugar, starch, preservatives, artificial color or flavors? No fructose added. For further information call customer service at (866) 416-9216. Take charge of your health. Live life to the fullest. …",17 out of 20 users found this review helpful
 Looks like another kind of Flops from here,1,"We got a bag of brown, squished Jelly Bellies. Maybe. As the bag only contains Brown Flops, no one here will eat them, comparing them to other more bovine flops. …",9 out of 16 users found this review helpful
 Real Quality Nutrition,5,"I got this for my long hair male cat who has been prescribed wet food by the vet after having urinary tract problems. I read about Weruva and that the Paw Lickin' Chicken would be good for him and keep his urine pH at levels to prevent struvite crystals, just like the vet prescribed food. The Paw Lickin' Chicken has a lot of water and low magnesium, phosphorus, and calcium. But unlike the veterinarian recommended food, it has no byproducts or fillers or grains. Weruva actually looks like food, not gruel, and it doesn't have an unpleasant smell like a lot of cat foods. Weruva costs almost as much as the vet prescribed brand, but Weruva is clearly made with superior ingredients. I will still be monitoring my cat for any problems, but so far this food is working fine for him and I feel better knowing he is on a better quality food. At first my cat was hesitant to eat the Weruva food, but I believe that was simply because he wasn't used to the texture. The Weruva chicken is shredded into fine strips, rather than minced. My cat would drink the juices, as he had no problem with the flavor, but was reluctant to actually eat the chicken. So I had to mix it with the prescription food he had been eating before he would eat the Weruva food by itself. It is a good idea to mix the food with what your cat has been eating, anyway, so they can gradually get used to it. Now my cat doesn't hesitate and will eagerly eat the Weruva food. …",47 out of 50 users found this review helpful
 Anecdotal evidence was too true for me!,5,"I drank 3 cups brewed with 2 tea bags each of this tea for the last few months of my pregnancy. The amount of time I spent pushing my son out totaled 5 minutes. My midwife had said there were lots of anecdotal reports of raspberry leaf tea causing easier labors but I was skeptical. Obviously, my experience made me a believer! I found this tea's taste to be no different from the more expensive brands. And I appreciate that the design of these teabags is less wasteful by not using strings, tags, or staples like most teas. …",11 out of 12 users found this review helpful
 Two Paws Up!,5,"My two cats are, I admit, rather spoiled as far as food goes. I usually feed them Indigo Moon, Weruva and Tiki Cat, and as a consequence they eat a better quality diet than most people do. It's worth it though, everyone who meets them comments on how glossy their fur is. I decided we would give BFF a try as the ingredients list meets my standards and the price seemed right, and I must confess I really liked the label (yes I am that shallow) but I was a little apprehensive about how my two four footed food critics would react. It's probably because I indulge them so much but they are very picky eaters and will turn their backs on any wet food that doesn't please them. But I needn't have worried, they loved it! The Tuna Too Cool is a rich-looking, reddish pate with lots of jelly on top and my twosome were wolfing their portions down and got into a bit of a scuffle over the last couple of mouthfuls. They have no higher praise. …",24 out of 25 users found this review helpful
