Title,Star Rating,Review,Helpfulness
 Half the jar was solidified,2,"I wanted to make some protein bars at home that were lower calorie and didn't have all the fillers, and the recipe called for coconut oil. I used subscribe & save - so it was cheap. I was expecting a glass jar, but was disappointed when it arrived in a plastic jar (BPA, anyone?). From the outside, it looked like the oil had separated and that some had settled in the bottom. When I stuck a spoon in, I found it was hardened/had solidified on the bottom. I was able to break it up into smaller chunks, but it wouldn't dissolve. The oil I was able to get out of it worked, but I'm disappointed with the quality of the one I received. Too cheap to be worth returning. …",1 out of 15 users found this review helpful
 Perfect Dog Food,5,"My Pomeranian has a very sensitive digestive system and I could never find a food that I knew would provide him both great nutrition, taste and no allergic reaction. Until this canned food ----- that is. He loves it and it is made so well. You can tell there are no fillers in it by the appearance and texture. In fact, when you read the ingredients there is only Turkey Brown Rice and Vitamins. I encourage anyone who is thinking about ordering this food to give it a try. Your pooch will be glad you did. …",12 out of 12 users found this review helpful
" Filler food is empty, leaves your cat always needing more",1,"This review will make me sound really stupid, but whatever. I don't really care as long as people find out what's real and can avoid my mistakes. I got my wonderful little sweet Bella Bean when she was a few days shy of three years old. She had been bounced around from house to house and eating whatever was cheap. I have had cats around me my entire life, for about twenty-five years now. My mother always just fed them whatever, the kinds of food you buy in the supermarket - Friskies, Nine Lives, Kit & Kaboodle, stuff like that. And our cats were always fine, at least in terms of their eating habits. They would eat in the morning, stop when they were done, come back, and eat some more when they got hungry. My housemate at the time was working for Hill's and assured me that this was the best food ever made, so great, so on and so forth. I now know that she is an utter buffoon, but I initially trusted her judgment, which is so unfortunate because she doesn't think. She also had plenty of coupons for free or deeply discounted bags, which made it a much more attractive choice. I first tried feeding the little Bean an unmeasured amount of Science Diet in a bowl, but that didn't work, as she would devour it in one sitting. So then I took to measuring it, and she did the same thing. Then I started parsing it out to twice a day. That didn't work either, because she would start going crazy in the middle of the day, running around, intentionally destroying things, deliberately spilling her water, crying, etc., until she got more food. So then I split it into three servings. Same thing. Then it got to be four servings. That was a little better, but it was too much maintenance and unrealistic to be around every day to feed her four times. So then it went back to three. All the while, I was trying to reduce the amount of food I was feeding her to less than 3/4 of a cup because she was a little chubby. Reducing was hell. She became even more hungry, but I figured she would get used to it. Not really. For over a year, she would wake me up every morning looking for food in a serious way, knocking things off my desk, ripping up any paper she could find, scratching at the door and committing general acts of mischief. As soon as she got food, she was back to her sweet self, but only for three or four hours. We thought she was bored, we thought she was a little nutty, and maybe even had a kitty eating disorder. She always wanted food. It was kind of funny but in the end it was just sad. A few weeks back, we took her to a new (good, non-money factory) vet for her second checkup since I've had her. I talked with him about her being always hungry. He asked what she ate, and I told him the adult indoor Science Diet. Without saying as much, he basically told me that this food is garbage and I should look for something else. He said cat food should have a protein followed by a carbohydrate as the first two ingredients. Science Diet does, in a very loose, by-product kind of way - ground up slaughterhouse leftovers and corn dust. Then they put a bunch of vitamins in it to make it ""healthy,"" instead of just using good ingredients from the beginning. Not that I care about spending money on the Bean, but this food is way too expensive for what it is. So we began transitioning her onto Wellness indoor formula about two weeks ago. She is still eating 50 percent Science Diet with 50 percent Wellness (you really shouldn't just give a cat different food one day out of the blue) but SHE NEVER FREAKS OUT ANYMORE. It's amazing. And it's 100 percent because she is eating real food now, along with that sawdust and chicken hearts I still regrettable have to feed her. We have her down to eating twice a day, only 1/3 cup in TOTAL. She was eating three times a day, 5/8 of a cup in total. Now she eats some in the morning, walks away, eats some more a few hours later, and then looks for dinner about twelve hours after her initial feeding. No more knocking things over, no more trashing Dad's papers on the desk, no more howling, no more deliberately spilled water on the floor. It's incredible. I feel so bad that I was doing this to her for so long. We really thought she was just being dramatic or whatever. But no, she was genuinely hungry because she wasn't eating any real food. Do your cat a favor - buy her or him so food made with real ingredients, things you would eat - Wellness, Halo, Innova, Evo, whatever. Figure it out for yourself, but please don't feed your cat this. It's garbage. …",6 out of 14 users found this review helpful
 YUUUMMMMMMMMMY,5,"Thanks to our purchase of a Keurig, I am a converted coffee drinker. Timothy's German Chocolate Cake is my absolute favorite. A delectable blend of warm caramel and coconut gives this coffee a deliciously sweet note while retaining a medium-bodied blend. It isn't too sugary - it's just right! In fact, my hubby and his coworkers all claim this as their number one flavored coffee too. It is scrumptious. …",28 out of 28 users found this review helpful
 Nespresso coffee,5,Nesspresso's expresso capsules are the best. The different flavors has very distinctive aroma and taste so much better than the coffee house that I used to spend a large amount of money to buy them every morning. I highly recommended. …,0 out of 13 users found this review helpful
 Foutchie approved!!,5,"My cat Foutchie is heading toward 5 now and no one told her the trouble with a kitten is it eventually becomes a cat (so take that Ogden Nash!). She still voom-voom-vooms around at a pace that makes me exhausted. She loves toys, especially stuff she chases. So the bubbles are great full. Especially since they are catnip bubbles. You don't have the worry about them getting soap on them and making them sick. She love jumping high to pop them.<p>So if you are looking for something to awaken the kitten in your kitty, you might try these. …",20 out of 21 users found this review helpful
 Refuting the 2-Star Review.,5,"Not trying to start an online debate, but I fear the previous 2-star review is discouraging many consumers from buying this product for no good reason. I have been feeding my dogs Holistic Select for about a year after switching from Purina Beneful (which IS one of the unhealthy dog foods referred to in the 2-star review). I have seen noticeable improvement in their coat, skin, muscle mass and energy levels, not to mention more consistent and less waste matter. Those who read the above review, please do your own research before taking this reviewer for their word. Holistic Select is most definitely a premium dog food. I completed quite a bit of research between Holistic Select, Orijen and Lotus brand dog foods, and though Orijen proved to have higher protein content (which is best for most breeds), I decided on Holistic Select Lamb because my Dalmatian requires lower protein due to an inadequate ability to process purines which results in kidney stone formation. So, to those reading, yes the above review is extremely accurate for most retail store brand dog foods, (even when marked ""natural""), but I would not classify Holistic Select in the same category as those. Do your research. The Dog Food Advisor ([...]) is a great place to start comparing dog food brands. A food description and ingredient breakdown is provided for each brand listed, along with a 1-5 star rating. Holistic Select Dry Dog Food received 4-stars out of 5, classifying it as a premium dog food, while Purina Beneful Dry received 1-star. Reference the links below: [...] …",19 out of 20 users found this review helpful
 does not work-causes loose bowles,2,I have been taking this for several days on the advice of my acupuncturist and it has not had any effect on my chronic muscle pain and also has caused me to have loose bowls when going number 2 in the bathroom. does anybody know of a product that can help get lactic acid build up out of muscles? …,2 out of 12 users found this review helpful
 Let me know when you post the ingredients list!,2,"Like others, I cannot order this product w/o an ingredients list. Superstore, people with food allergies, intolerances, or other dietary restrictions need complete information! Thank you and please resend the G-F for Betty Crocker notice when ingredients lists are included. …",3 out of 24 users found this review helpful
 Save your money buy at Babies R Us,3,This same package costs 8.99 at baby's R us. Save your money. Asside from that the product works great and is very nice not to have the BPA and toxic chemicals in your little ones food. …,20 out of 23 users found this review helpful
 Good coffee...perhaps bad shipping?,3,"We owned a bed and breakfast for many years and the coffee we used daily was Cafe Bustelo. The flavor was rubust and not bitter...just good coffee that 95% of our guests thoroughly enjoyed. Recently, I ordered 8 packs from Superstore, and only 2 of the 8 arrived in their vacuum brick...the others seemed to have not been sealed well. This had never occurred before. The coffee in the sealed packs is the delicious flavor that is known, but the unsealed packs has given the coffee a bad flavor...who knows how long the vacuum was broken before arriving at our home. I will purchase this coffee again...but from the Cuban Market. …",12 out of 14 users found this review helpful
 Very Nice Medium Roast Flavor,4,"To cut to the chase, this produces a very good MEDIUM roast style cup of coffee...period. Some folks tend to compare all coffees to one another no matter what the bean is and how it's roasted. I do roast my own green beans (home roaster) when I brew a pot of coffee every morning and use the K-Cups when only a single cup is needed. If you don't like that 'in your face' dark roast, dense, heavy style of coffee in the morning (or any time for that matter) this is definitely the coffee for you. It's not bitter, a bit floral, with a true pure coffee taste. Does it match Dunkin Donuts style coffee in taste? I'd say YES to that when using the middle cup size setting on the Keurig brewer....which I use for folks that take milk in their cup, I use the larger cup setting because I drink my coffee black and like that taste profile. The new packaging is OK (you get 2 extra K-Cups for the $$) as long as you have the room in your kitchen to store the larger single box....as opposed to storing the two 24 cartridge boxes. NOTE: The description of this coffee uses the words ""Medium Extra Bold"" in it's packaging as opposed to the two 24 boxes version which lead me to think there was now two DIFFERENT varieties of this Donut Shop coffee....so I ordered both (wanted 98/100 anyway) but it turns out that both were the same. Superstore should correct that description and take out 'Extra Bold' so they match each other. …",454 out of 462 users found this review helpful
 bait and switch,1,"Ordered ""Dark Magic K-Cup - Box of 2"". Therefore should be each box of 24 x 2 = 48 K-cups. I only received 1 box of 24. The company changes its name frequently and sends wrong quantity. Beware of non- Superstore sellers. Superstore contacted and will investigate the fraud. However, Superstore has easy return process. …",10 out of 21 users found this review helpful
 Nothing that can't be fixed.,4,"Perhaps it's because I live in northern Canada (although that shouldn't be an excuse), but it took a few days for the product to be shipped. Once, however, it was, it arrive on the last day of the projected delivery day. No complaints. …",0 out of 19 users found this review helpful
" Not the greatest, but not the worst either.",3,"I drink espresso (moka) daily, and go through a 250g/8.8oz brick in about 2 weeks. In my opinion, this isn't the greatest blend from Lavazza that I've had, but it's not the worst coffee I've had either (it definitely beats the drip coffee I'd otherwise get at work). It's a 70/30 robusta/arabica blend, a dark roast with a fruity though noticeably bitter finish (but not as bad as Starbucks or Peet's coffee). The Lavazza Espresso (black tin, 100% arabica claimed) tastes better than this blend, but after having tried Illy's moka grind, the different blends from Lavazza, Kimbo, Segafredo, and also blends from the local coffee roasters, I actually think that a robusta/arabica blend works best for a moka pot; just not this one. Overall, I'd say that I got what I paid for, but I didn't get what I wanted and I was seduced by the 93 or so 4/5 star reviews for this coffee. I'd really give it a 2.5 or 3 but then again, all taste is subjective, That being said, this is a reasonable coffee (considering taste vs. price), but I'll probably switch back to my regular (and unfortunately more expensive) blend. …",16 out of 19 users found this review helpful
 The Best So Far,5,"I had previously stated that this product is organic, which it is not. My apologies! But it is the best I have found so far. Have not been able to find anything organic in the plain variety. …",12 out of 12 users found this review helpful
 Has a waxy taste and feel!,1,This chocolate has a waxy taste and feel to it that I found quite unappetizing. My husband didn't like it any better than I did. …,1 out of 15 users found this review helpful
 Never again,1,"I read the reviews and took my chances and bought a bunch. I am so disappointed by the sweet, lacquered Chinese bbq pork like beef jerky with an overwhelmingly raw garlic/chili favor. Yes, the pieces are moist but in a preserved radish way with smallish, flattened pieces. It just doesn't have the premium beef jerky heft where you can separate the pieces along the grain. Don't expect premium beef taste and texture but rather a product processed more in the Chinese restaurant baking soda, tenderized fashion. I truly regret my purchase which I probably couldn't give away. …",8 out of 14 users found this review helpful
 the best of the best,5,"My husband and I are crazy about Coffee People k-cups. A friend gave us a box of the ""Donut Shop"" cups and they are spectacular. Very rich and bold, not bitter, but packs a nice punch. Reminds me of coffee from an old-fashioned percolator. A good, strong cup of coffee is hard to come by when you are using some of these newer brewing machines, but the Keurig system is definitely the exception and this variety of k-cup is the best we have ever tasted. …",52 out of 55 users found this review helpful
 Cheaper at Walmart,3,"Good stuff....but. I'd gotten some at Walmart but didn't really pay attention to the price (for one bag). I enjoyed it so much that I searched for it on Superstore (in bulk) and ordered three different flavors. I happened to be in Walmart the next morning and discovered to my surprise that it was significantly cheaper there. (Walmart $3.50 for a 3.5oz bag, Superstore about $23.00 for ten 1.5oz bags - almost 50 cents an ounce more from Superstore plus you have to purchase it in bulk). I find that I tend to order blindly from Superstore when I'm actually purchasing from Superstore and not a third-party vendor because I'm so used to fantastic savings. This was a bit of a wake-up call. I will give kudos to Superstore for their customer service policies, though. I was able to cancel my order relatively hassle free. …",42 out of 54 users found this review helpful
" A very nice, smooth, Americano style coffee",4,"I bought a Wolfgang Puck sampler and this was certainly one of my favorites, so I ordered a bigger box and have truly been enjoying it. This is a classic, medium-roast cup of coffee. It's very smooth, with no bitterness. I would say that if you enjoy Donut Shop, Tully's Kona, and Caribou, you will like this blend. The label is adorable and makes me smile when I pop it in the Keurig each morning. …",12 out of 13 users found this review helpful
 sent the wrong grind,2,the company sent me whole bean instead of fine grind but when i called to complain they gave me my money back and i got to keep the product so everything was okay there. its okay too because illy is the best espresso. …,0 out of 17 users found this review helpful
" Davidson's Rooibos tea, not infuser friendly.",3,"I have been using loose teas for many years. However, Davidson's Organic South Sfrican Rooibos tea was cut so thin that a lot of the tea and sediment goes right through most tea infusers. Actually, the Rooibos tea seemed to be cut for tea bag use and was accidently placed in the wrong container. I would question the company before ordering. PS: Since I ordered the tea from Superstore , they stood behind by complaint and rectified the problem immediatly. Never a problem when dealing with Superstore . Russ (Russell3006) Superstore Storefront. …",12 out of 16 users found this review helpful
 BEST VARIETY RAVIOLI,4,"I've purchased the cheese and meat ravioli previously- the cheese is very bland- the meat was a little bland_ but this italian sausage variety is VERY TASTY- and it really does taste like italian sausage- there are even little bits of sausage in the sauce- it's even a little spicy like italian sausage should be. At $1 or less per can with a long shelf life- the ones i ordered in OCT 2011 have a 'use by' date of May 2013- that's more than a 1 1/2 years to eat them- so order lots when the price is low. Would/will buy again. ------------------------------------------ added june 14, 2012_in regards to the person who said these are factory rejects and all dented cans i have to say WRONG----i've ordered 3 cases of this italian sausage ravioli and not a single can was dented. i've ordered a couple cases of the mini-beef ravioli and they weren't dented either_ so out of 60 cans- not a single one was dented. …",13 out of 13 users found this review helpful
" The best chips ever invented, truly the pinnacle of human acheivement and civilization",5,"Fate has smiled upon you today, for you have stumbled upon a review of the best corn chips on the planet. Yes they really are that good. I'm not in thrall of the whole ""organic"" thing generally, but I have to say these blue corn chips themselves are somehow FAR better than competitors. Crisp and thick cut, a strong corn taste. You probably don't think a chip can have a strong corn taste, but these do, because unlike competitors they're not cooked in a month old batch of mystery oil. The person who came up with this ""red hot"" flavoring is a genius, this is the best flavoring for chips ever invented. It will make your toes curl and your eyes roll back into your head. It is only a little hot, but it builds up a bit if you eat the whole darn bag, which you almost certainly will. I also recommend their plain blue corn chips for dips, but for the love of everything that is good don't get the unsalted ones. …",29 out of 31 users found this review helpful
 Yuck!,1,"This was the first Larabar product that I tried, and it was awful! The bar smelled and tasted like Vicks Vaporub, which is not exactly a pleasant thing when you're talking about food. I will definitely not be purchasing any of their other products after this awful experience. …",6 out of 17 users found this review helpful
 Broken up,1,"The product itself was just fair. But the worst part of this order the condition that it came in. All six bags were terribly broken up. Each bag had very little chex pieces left in them because of poor shipping! I purchased another item along with this one and who ever packaged this put a box in the middle of a shipping box and put the chex mix on the sides (as if they were packaging cushions)! Who does Superstore have working in their shipping department? Obviously not a lot of common sense. I will not buy this product again.. or any other ""fragile"" items! …",4 out of 12 users found this review helpful
 New Favorite Dark K-Cup,5,"This coffee has a smooth, carmely, dark finish that I love! My husband gets other dark blends that taste like charcoal to me. This one is very smooth, with just a hint of sweetness. I wish that Superstore had it on its monthly purchase program, would love to save 15% on it! However, I was glad to find it someplace besides Green Mountain. As prime members, we can get our coffee replaced in 2 shipping days v. a week or longer over at GM. Sweet! …",27 out of 29 users found this review helpful
 Will NOT fail a drug test,5,"I know a concern of many in consuming hemp oil is failing workplace drug tests. For this reason hemp product manufacturers have started a program called TestPledge to educate consumers in this area. I highly suggest reading this page for an interesting explanation: [...] Briefly outline: TestPledge requires that pledging companies achieve this goal by committing to the following THC limits: * Hemp oil: 5.0 parts per million (ppm) * Hemp nut: 1.5 parts per million (ppm) How much hemp oil and hemp nut can you eat? At the 5 ppm THC TestPledge limit for hemp oil, a person would have to eat in excess of 8 tablespoon servings - half of an 8 oz. bottle - of pure hemp oil per day to ingest 600 µg THC, the dose found not to cause confirmed positive urine tests for marijuana with a wide margin of safety. To increase this margin even further and to address any and all health concerns, setting the daily THC intake at 500 µg per day still allows for slightly over 7 tablespoon servings daily. THC limits for TestPledge were set low enough to allow for the extensive daily consumption of both hemp oil and hemp nut. For example, one can consume 3 tablespoons of hemp oil AND 8.75 ounces (over a half-pound) of hemp nut before reaching the 600 µg daily dose, or 3 tablespoons of hemp oil AND 7 ounces of hemp nut before reaching the more conservative 500 µg daily dose. This example shows that even enthusiastic hemp food consumers will not be able to consume enough hemp nut and oil food products to produce a confirmed positive drug test. It also shows the TestPledge limits are set low enough to provide an ample margin of safety. Nutiva is one of the companies that have taken the pledge that they adhere to the testpledge criteria. …",33 out of 33 users found this review helpful
 Nutritious and... Ropey,1,"As a warning - I am not a vegan, I do not hug trees (though I do love them), and I really am not into the whole organic movement (though I have no problem with it).... If my stance on those three ""issues"" was different, I might love this product... as it is, I found it to be somewhat disgusting. I typically drink Meijer branded chocolate shake mix (Meijer is a western US mega-store & the shake mix is a knock-off of what slimfast puts in a can). I hoped that this mix would taste at least somewhat (even a little bit) like the meijer brand.... The ways that I described this taste to my wife each morning... well, they aren't good... I'm listing a few: - It tasted like rope - It tasted like licking a wet horses bridle - It tasted like sucking the water out of a wet hemp bracelet - It tasted like someone had mixed dirt in with my unsweetened baker's cocoa - It tasted like chewing on tree bark In all seriousness, the ""rope"" & ""wet hemp bracelet"" analogies are the closest... I used to wear a lot of hemp (before doing so was part of the ""organic"" eating movement I guess?)... and I remember chewing on the necklace/bracelets. This product tastes just like that. Another note - I was not impressed by the blending of this stuff. Most shake mixes actually dissolve in liquid; this stuff just sorta clumped into the liquid. On the other hand, I ate (almost) all of it... and it was much more palatable once I mixed it in with the meijer shake mix (2 parts meijer mix, 1 part this stuff). The fiber content is really high (always a plus).. and it was fairly reasonable. So, if you are into the earth loving hipster movement or are just a standard faire hippy - this stuff might be for you. For Joe Six-pack (even the liberal type), this product should probably be avoided. …",10 out of 14 users found this review helpful
