Title,Star Rating,Review,Helpfulness
 My Dog Thinks This Is Her Treat For the Day!,5,"When my vet told me my little Yorkie had stage IV luxating patellas (knees blown out), I was devastated. The vet told me to give her Glucosamine & Chondrotin. I went to the local pet chain and spent a considerable amount for the ""chicken flavor"" tablets. For such a large chain, tablets were the only product they carried. They are hard tablets not easily broken in half for a small (7lbs) dog. On top of that, she wouldn't have anything to do with them, took her little nose and pushed them away. I had to start crushing them and hiding them in a piece of people food. It was such an annoyance, I began a search for a different product form and found Zuke's online. They are soft, she can't wait for her Zuke's treat every day! No more crushing, I still have the tabs left and will now only use Zuke's. The product also includes beef, fruits, vegetables and more. I am so happy with this product, I will continue to use it. My little Echo has perked up, jumps, runs and one would never know she has this condition. This condition, at this stage, is correctable only by surgery; thousands of dollars which I don't have. I thank the founder of this company, Patrick in memory of his dog Zuke. They also donate to the Dog & Cat Cancer Fund. I know this is a long review, but that's just because this product really deserves kudos. As a side note, my pain management physician also recommended ""Golden Aloe"" daily to help with the arthritic pain that sets in with this diagnosis. So she both and is doing well. She's my best friend, I'm on disability and won't be able to afford the surgery if and when it's required so I am really relying on these products to keep her comfortable for as long as possible and she is only 3 years old. …",26 out of 26 users found this review helpful
 I'm pretty sure this was created as a joke,1,"As my moniker suggests, I LOVE the glorious coffee bean. This, however, has got to be some sort of test....trial by fire-brewed perhaps? At first sight this basket looked delightful. A relatively cheap basket, as is to be expected, filled with goodies. Then comes the unwrapping. The cello wrap was broken, perhaps that is evidence that some sneak removed the 'Jamaican Blend' that is promised but missing. The 'Coffee Box' box was a plain box with a photo copied paper taped to it, which contained 3 Arbuckle single pot bags. The next stuff I am giving a star because of the hearty laugh it gave me... Cafe Vergnano 1882 cookies (4) are ginger-y and a nice complement to the unimpressive but not-too-bad Arbuckle's coffee. The box of 'creamer' contained a few packets of the most generic of office coffee whitener, the brands car repair shops use while you wait to get the oil changed. The 'Sugar in the Raw' was few packets as well. Here is the delightful part. Each box was covered by taped on labels....over empty JELLO BOXES! But wait, it gets better. The coffee stirrers were in an empty Reese's Pieces box! I have this odd visual of rag-clad children being forced to empty Jello and candy boxes day in and day out. If I were the Queen of Back Mountain Baskets...I'd have a ban on scotch tape. I would make sure that the wooden coffee stirrers aren't flavored by the still fragrant Reese's Pieces box. Better creamer or no creamer. I don't mind the diner-esque coffee mug, but perhaps a more trend-on shape would be nice. The individually wrapped cookies/biscuits were quite nice. Perhaps I would add the tiny wrapped bits of chocolate served with coffee in most European cafes. Until all that happens, I think I'd rather have a basket that has the Jello and Reese's intact and original. EDIT PLEASE NOTE: I have been made aware that I received a MOCK UP and NOT the basket intended for Superstore customers. …",25 out of 36 users found this review helpful
" Don't pay for ""expedited"" delivery",2,"I paid over $13.00 for ""expedited"" delivery and the product still took FIVE days to arrive. Would not buy from them again. …",4 out of 22 users found this review helpful
 Our Dogs LOVE These and We Do Too!,5,"I have been feeding our dogs Greenie bones since they first came out and we have NEVER had a problem. I have German Shepards, Dobermans and medium sized hound dogs. They all love their GB's and I find that because our Dobie tends to be a ""garbage belly"" (meaning she'll eat anything!), so sometimes she doesn't smell as nice as she should, really benefits from the ""green"" in Greenie Bones. I would like to know where ""E. Antic"" gets his/her information from.....as I can find nothing that says they are ""deadly"", except for those people that haven't done responsible research (not just hearsay from some list). If your dogs are gulpers or greedy chewers, then I wouldn't feed them ANYTHING, especially RAWHIDE, that could be gulped and swallowed in large pieces or whole. Do we need to bring up ""NYLABONES""????? Always be a responsible dog owner and supervise your dogs when giving any kind of treats. Please don't be afraid of Greenie Bones because of E. Antic's post. You can buy Greenie's in singles, so try one before you commit to a whole box. I have friends that have dogs that don't really like them and that's okay. My girls live for their morning GB's and I now give them Greenie ""Smart Biscuits"" for an afternoon snack. They love the taste and we love them for the 'benefits'!! I respectfully request that Superstore and Superstore members make up their own minds, and not fall to the 'fear mongers' and ignorance amoung us. Always supervise your dogs when giving treats - after all, they are the animals and we are supposed to be the 'smart' ones.....don't be afraid, do your homework, it always pays! …",50 out of 53 users found this review helpful
 This is a lie!,1,"This ad is a lie! This order came today and the steaks are not any bigger than two store bought pork chops. There is no way these steaks weigh anywhere close to 30 ounces, much less a total of 60 ounces as the ad states! $72 for not even a pound of steak! RIP OFF! …",20 out of 21 users found this review helpful
 dried fruit,5,The dried fruit and pistachios were really good. Would purchase again from this company. …,13 out of 14 users found this review helpful
 Amazing customer service,5,"When I ordered this product, I was too lazy to convert ""3-4 mm"" to inches and consequently discovered the ""Coarse Grinder Salt"" was almost 1/4"" (1/6"" to be exact), way too coarse for my salt grinder. Shortly after receiving my order from Superstore, I received a courtesy email from the Spice Lab to make sure I was happy with my order. I replied that actually I was not happy, but the fault was mine because I didn't convert the metric dimensions to English units and consequently didn't realize how coarse the salt would be, which was too coarse for my salt mill. Two days later I received a package of smaller crystals, no charge. That's amazing customer service! …",25 out of 25 users found this review helpful
 Better than other seasonings,5,"We tried the Nesco Teriyaki and Nesco Hot/Spicy seasonings, but really preferred the ""ORIGINAL"" flavor. Our favorite thing to do with it is make the beef jerky with ground beef. I even got my boyfriend to use the beef jerky gun. Single serving packets, no measuring required. Open packs, mix with ground beef, put meat in extruder gun, squeeze onto drying racks. BAM! Good to go! Well in about 6-8 hours (give or take). If you are trying to decide which seasonings to buy, go with the Original flavor, it really is the best. …",14 out of 14 users found this review helpful
 Not very good.,1,"I bought these as the price was right and I thought the kids would like them. Kids think they are to spicy, I think they are outright terrible. TI will probably end up feeding these to my dogs. They will eat anything. Would not recommend these to anyone. …",9 out of 23 users found this review helpful
 A tasty treat with omega-3s for all,5,"Because I'm a vegetarian it's a little tricky getting those highly touted omega-3s in my diet so I'm always happy to find food source that does the job. This tasty granola contains flax seeds (hence the omega-3s) and a veritable cornucopia of whole grains including amaranth, quinoa, oats, millet, brown rice and buckwheat, but no wheat so it's gluten-free. It's sweet, but not too sweet. It does have evaporated cane juice and molasses, but a one third cup serving only has 6 grams of sugar. That same serving size has 5 grams of fiber, 3 grams of protein, 130 calories and only 3.5 grams of fat and 20 mg of sodium so unless you overdo it, and because it is delicious that's possible, it's a guilt-free food. It's great straight out of the bag, or with milk or (my favorite) yogurt. There are several other flavors and they all sound good so I know I'll be checking them out too. Since there's no honey or dairy I believe this would be good for vegans. …",12 out of 12 users found this review helpful
 Don't be fooled into thinking this is a traditional Japanese substitue for dashi.,2,I thought dashi was a soup stock made from fish flakes and kombu. The top two ingredients in this product are Salt and then Monosodium Glutimate. …,15 out of 23 users found this review helpful
 does not work-causes loose bowles,2,I have been taking this for several days on the advice of my acupuncturist and it has not had any effect on my chronic muscle pain and also has caused me to have loose bowls when going number 2 in the bathroom. does anybody know of a product that can help get lactic acid build up out of muscles? …,2 out of 12 users found this review helpful
 Not soft pretzel salt,2,I bought this salt expecting it to be the large compacted salt granules you get on a soft pretzel. I was sorely disappointed when it arrived and it is the oversized granules of regular rock salt like you find on standard hard pretzels. Make sure that's what your looking for before you buy. …,33 out of 33 users found this review helpful
 Not as strong as I would have liked,3,"When I first received the bag and opened it, I was in heaven. The smell of this coffee is amazing. However, the taste doesn't measure up to the smell. Some background: I love strong coffee and can't stand the thought of putting sugar in it. So far, I have used this coffee in my espresso machine to make cappuccinos. First, let me comment on the crema. I was expecting more. From reading other reviews, I expected the thickest crema I'd ever seen. In fact, the crema is about the same as with most brands of coffee I use in my machine. Depending upon how fine I grind the coffee, how much coffee I use, and how tightly I pack the coffee, the crema is better or worse. This brand didn't make any noticeable difference. From a flavor standpoint, I find this coffee rather weak. It might be okay straight up as espresso, but once I add steamed milk, it's quite watery. I brewed it side by side with Costco's Kirkland Espresso (Starbuck's roast), and the Kirkland brand is much bolder and more intense. So if you're looking for a strong coffee, one with intense flavor, this isn't the coffee for you. …",11 out of 17 users found this review helpful
 Briton's #1 Tea - PG Tips,5,"The folks in the United Kingdom drink more PG Tips tea than any other brand, and perhaps after you try it; it will be your #1 choice, too! (By the way, the folks in Ireland drink more tea per person than in any other country.) PG Tips Tea and PG Tips Special Blend Tea is our home's standard tea. There are a few specialty retailers in the USA that now offer the PG Tips Special Blend Tea and hopefully Superstore will do so soon. In the 1930s (the pre-digestive era in history) this tea was introduced by the name ""Pre-Gest-Tee"" suggesting the tea could be consumed before food was eaten, but it was the grocers who gave it the abbreviation of ""PG"" - and the company added ""tips"" (since the company uses only the best part of the tea plant, the two top leaves and bud of the tea plant to make the tea). Many black teas sold in the USA are graded the basic medium grade Orange Pekoe (generally the tea leaves below the top two and bud), which is one of the reasons PG Tips gets higher reviews than most other teas. PG Tips also uses their pyramid tea bag that allows ample room for the tea to expand as it is infused. Additionally, in my opinion, PG Tips blends only two blends, rather than blending a wide assortment, thus becoming really good at what they do. Here at Superstore PG Tips is priced at just over a nickel a tea bag (a good value for an imported product) when you order the 240 count boxes in a set of two, and even less expensive in the higher volumes. PG Tips makes wonderful ice tea too, and that's good news since Americans drink about 80% of their tea as iced tea and only 20% as hot tea. Worldwide more hot tea is consumed than iced tea, and worldwide tea is the most consumed beverage (next to water), while in the USA it is the sixth most consumed beverage (next to water). A very good question to ponder is ""Why this is?"" Drinking an adequate amount of tea daily is now being considered to be very good for one's health, and it is much more enjoyable to drink a really good cuppa (cup of tea), especially at the nominal cost of about a nickel a cup when compared to one of those gourmet coffee places who charge upwards of four to five dollars for a large cup of coffee. When we have a guest in our home we always offer them a PG Tips cuppa, and they always say they have never tasted a tea this good - thus, I rate it 5 stars for its quality and very nominal price! …",21 out of 23 users found this review helpful
 we love smoked paprika,5,"This stuff is great. I put it everything but dessert. It really kicked up a mushroom and onion gravy we put on cube steaks. Plus, don't forget what it does for paella, the reason I bought it. …",11 out of 12 users found this review helpful
 No savings in 36 oz. value pac,3,Greenies 36 ounce dental chews value tub regular size with 36 chews in package is actually more per chew than the same item in the 27 ounce package. where is the value or savings in buying the larger package of chews. The 27 oz package cost per chew is 0.78 cents each chew the 36 oz package is 0.85 cents per chew. Why buy the larger tub for more money. am I missing something here? Great product though just misleading price and value advertising. 3 stars only because of the misleading value advertising. …,27 out of 29 users found this review helpful
 The best!,5,"I've been using Xylitol, specifically Emerald Forest's product, for a few years now. It looks and tastes like sugar and can be used for baking too. There have been a few occasions when it didn't quite substitute right, but those are few and far between. Coffee, tea, hot chocolate, macaroons, chocolate chip cookies, brownies...all turn out great. I'm on a no sugar diet (along with no grains) to combat a possible candida problem. Xylitol has been my savior. I still get my little sweet kick now and then without any of the damaging health effects of sugar. And, xylitol is also anti-fungal, so it even helps with things like candida. High recommended! And this price is a total steal too! One 32 ounce can costs nearly $30 at my local health food store. This price can't be beat! …",26 out of 27 users found this review helpful
 Waaay overpriced!!,2,"Wow, this is so overpriced! The items inside the basket are about what you would find in a wal-mart gift basket. …",15 out of 15 users found this review helpful
 Great stuff,5,"I love this salt - it has all the minerals in it, no aftertaste, lasts a long time... and is a great texture. …",14 out of 14 users found this review helpful
 Best Popcorn I've ever eaten!,5,"I could not disagree more with the other reviewer! I think that this is the best popcorn. Purple, Red and Baby Whites are my favorites. I can't even eat Orville since having this. There is just no comparison. Worth every penny and then some! …",19 out of 20 users found this review helpful
 Bubba Fett doesn't know so much...,5,"Lard, not hydrogenated, is FAR better for you then Crisco, margerine, Canola oil or any other Hydrogenated poison you may encounter. So yes...lard! …",10 out of 12 users found this review helpful
 Very Good Source of Magnesium,4,"If you're taking a lot of calcium, you'll need additional magnesium. This Natural Calm powder is a very good source of that magnesium. My wife is taking calcium and was suffering from severe feet and leg cramps (especially at night). A little research pointed to magnesium to help with this. As with calcium, the citrate form is best for absorption and that's what this Natural Calm provides (magnesium citrate). After just a couple of days of use, the cramping seems to have disappeared. One additional benefit is that certain digestive end processes seem to have smoothed out, too. I have only two problems with the product. First, this particular flavor of Natural Calm neither tastes nor smells all that great: it's sickly sweet. However, there is a non-flavored variety which is great ( Vitality - Natural Calm, oz, 16 powder ). Also, it would have been very nice if the bottle had included a little plastic teaspoon scoop for measuring the dosage. I've subtracted one star from my rating for those. But, still, I rate this at a Very Good four stars out of five. …",13 out of 15 users found this review helpful
 A favorite protein source staple in our diet!,5,"After first trying this great product from small package bought in health food store, I quickly realized we need to stock up and save. Here comes Superstore with the great auto-ship feature which keeps our stock perfectly replenished each 6 months. The seeds come fresh and tasty. I love them, my 7 year old daughter loves them too, we take several teaspoons straight every day, I wouldn't want to loose any tossed over the salad. Taste is better than hemp oil. Perfect protein and EFA source without sacrifice to the taste! …",28 out of 28 users found this review helpful
 ick,1,I love Larabars. I love pistachios. Pistachio Larabars are awful. horrid fruitcake taste and not enough pistachios. back to cashew cookie and cherry pie. …,5 out of 13 users found this review helpful
" Ahh, finally!",5,"I wondered when Superstore might get around to offering this product. I've loved eating these basic fried and dehydrated noodles for decades, and will be glad to order them by the case. These simple noodles are great with tons of Tabasco--quick and satisfying. The instructions are plain silly, though. My family has always prepared these noodles this way: 1. boil water in a pot, 2. add in the soup base, 3. add in the noodles, and then cook them together till the noodles are soft enough to eat (I like them slightly undercooked). Cooking the noodles in the soup base makes them taste better. Do not overcook, and do not let noodles sit in soup for too long while eating (e.g., longer than half an hour), or noodles will become too soft and fat. Then I pull the noodles out first and douse them with hot sauce--so the hot sauce will cling to the noodles as well as the soup--and then pour in the soup. That vinegary Tabasco taste mixed with the salty noodles and soup is very good. The noodles are also good with an egg--cracked into the pot after the soup base, and cooked together with the noodles. …",24 out of 28 users found this review helpful
 Gluten free,4,I purchased this product for my sister who has Celiac disease. She seemed to really like the food that we made from it. …,18 out of 22 users found this review helpful
 This is not the real thing,2,"This is not the original Swiss Muesli that made this company famous and I've found that in a lot of the stores in this area this is now the only Familia Swiss Meusli available. In my opinion, what they've done is an attempt to make a less costly product ( for them that is} by adding large volume puffed type cereals to the mix. This makes for a lighter product , but with the same size box. The original box weighs 32 ounces, compared to 21 ounces for this new product. Unfortunately, this results in an inferior product, both in taste and nutrition. The real original product is still available in a red box , but I fear they might phase it out if they can get people to go for this cheap imitation. …",13 out of 15 users found this review helpful
 My fave of wheat-free cookies!,5,"Summary: Peanut butter, plain: A bit ""rubbery"". I cooked them a little longer in microwave and added chips. ;^) Peanut butter, choc. chip: Crispy, crunchy, crumbly, rich and VERY addictive! (Yes, they always arrive broken up somewhat, but you won't care.)(Like other chip one, only 5 oz. box) Swirl shortbread: Too heavy and buttery for me. Nice texture. Choc. Chip shortbread: If you like shortbread, this will taste decadent! Rich choc. chips. Crispy and yes, also addictive! (Note: only 5 oz instead of 7 oz. box) Butter shortbread: Couldn't really eat these. Too heavy and buttery. Least favorite. Haven't tried others yet. I have a wheat allergy and never tasted shortbread again until I found these wonderful delights at the store in the health-food section! The shortbread choc chip I tried first has not only the unique taste of shortbread, but has chocolate chunks also! They are crunchy and light. In comparison, they weigh less than some other Pamela products. They are not as ""buttery"" as the Butter Shortbread or Swirl (a good thing in my opinion). I love the pecans also! Recommend to any wheat-allergy sufferer, or gluten intolerant person. :^) …",15 out of 18 users found this review helpful
 Save yourself some money,1,"Use a saucepan -- cut up the fruit, add a bit of water, cover. Steam for about 10 min. Use the immersion blender right in the saucepan or in a tall cup. Voila. Baby food! for about $20. I was worried too, but just gave it a shot, and it was a breeze and baby loves his applesauce! If you are doing sweet potato, just bake it for an hour first. It should be nice and soft. And about the same amount of dishes to clean as this thing. Plus it takes up less space. …",16 out of 38 users found this review helpful
 Wonderful Gift idea!!,5,I purchased this as a gift for my Son-in-Law..He loved it! The candy was not old or disgusting as another review stated. Wonderful product. …,11 out of 16 users found this review helpful
 Shipping was outrageous!!!,1,"Shipping was outrageous, $16.98 for the Rice Flour $16.33 for Shipping You got me once, NEVER AGAIN!! …",2 out of 27 users found this review helpful
 Truly great coffee,5,The Keurig system is marvelous--and the Dark Magic coffee is delicious. But Superstore is falling down on the job a bit with this price--you can buy a box of 24 K cups from the Keurig site for $13.95--and get a discount as muc as 15% if you are a repeat buyer. …,34 out of 36 users found this review helpful
 So disappointed........,1,"I am so disappointed with my candy boxes. I bought 4 boxes 40, 80, and two 90s. Each box had pretty much the same candy with the exception of maybe three different ones. One of my boxes arrived with a torn handle. I will never order these candy boxes again, and I really wish that I could return them without paying a mountain load of money for the shipping and handling. I give the boxes two thumbs down. …",23 out of 24 users found this review helpful
 Wish I read reviews before ordering,1,Very dissappointed to find out I only get 1 box of 24 KCups. Almost $1 a cup. I usually get 2 boxes for this price. CRAZY!!! I buy these online because they are much cheaper than stores. I did not receive the right flavor and shipping seemed to take very long. Not happy!!! …,9 out of 16 users found this review helpful
