Title,Star Rating,Review,Helpfulness
 Dogswell Happy Hips - Made in China,1,"I had bought this product last year my dog loved them, but... I subscribe to a couple of Bichon Frise newsgroup and they are saying not to feed these to your dog as they come from China I threw out what I had left for the outside critters in the forest. I called Dogswell today and they verified that even though they say U.S. on them they are still coming from China. …",77 out of 85 users found this review helpful
 Olive Oil,5,"I hesitated purchasing this olive oil fearing it would not be like my usual brand. Although it was dark in color, the performance was the same as my usual brand. The price is what I really liked. Quart for quart it was a more economical product to use. …",14 out of 14 users found this review helpful
 Great consistent product,5,"I've been using Nopalina for over 3 years and it is great at regulating the digestive tract and keeping down those intestinal bulges that show in the stomach area. It is not a weight loss product per se, you will lose weight with initial 2 week use because you are flushing your intestinal tract and you will maintain weight by keeping your tract flowing. In addition to balanced food intake and moderate exercise, you can lose weight. …",12 out of 13 users found this review helpful
 Best Cat Food!,4,"When we adopted our cat, she had spent 9 months in a cage at the humane society. She was scrawny, cranky, and not happy. We went to an all natural pet store, and the woman suggested this type of food. At that store, we paid nearly $30 for a small bag that lasted maybe a month or two. But, this food was like a miricle! Our cat perked up, started playing, was curious and happy. Her coat was shining. She was like a new cat. Something else awesome? Her poop doesn't smell nearly as bad as it did with regular, ****-filled food. This stuff is amazing. Why only 4 stars, then? The price. This is one of the best prices I've found for this type of cat food, but the brand itself is very expensive. But, our cat is part of our family, it's worth it. …",15 out of 15 users found this review helpful
 next best thing to homemade,5,Imagine Chicken broth is as close to homemade stock as I can find. Cooks Illustrated rates it very high also. My only complaint is I am unable to get it in a larger size. A 1 Qt. box would be nice. Having family members with MSG allergies is what prompted me to start making my own stock. Slowly I started finding stocks/broths with no MSG added but the taste was not always true. I re-order this often so I can always have it on hand in my pantry. …,14 out of 15 users found this review helpful
 woah baby,5,":: English Toffee Flavored Liquid Stevia :: Amazing how intensely rich this is! It totally tastes like sweet english toffee. How thay accomplish so much flavor in these zero cal little droplets, that's a voodoo mystery to me. My one complaint is that they don't give any hints of their tricks to get the english toffee flavor. I know that stevia is already magic in itself for its sweetness power, but wondered about how they managed to get the strong english toffee swing in there. On package label, all they have to say, basically, is ""Natuarl flavors"". Unfortunately staying more secretive than I'd have preferred. But I can forgive them that one decision. Since overall: this stuff is a great treat, while leaving your conscience clean on matters of substances in the body. Ultimate Summertime Cappuccino: - Good quality roast coffee, chilled - Soy milk (frothed, if frother handy) - Liquid stevia. English toffee flavor for total indulgence! - Serve over ice …",40 out of 40 users found this review helpful
 Why would anyone pay $65 for something that costs $25???,1,To any buyer out there!!! Please go to Nespresso directly and pay $5 per sleeve (each sleeve contains 10 capsules) Why they think to charge that much is an absolute craziness. Please take this product off Superstore I have never thought anyone should worry about being ripped off on Superstore This makes me very sad. …,446 out of 452 users found this review helpful
 My favorite so far!,5,"I'm really a white rice kinda person - raised on it, like it. As my tastes matured I learned how much more flavor there is to be had -- basmati, jasmine...in white rice, jasmine is my favorite. I started trying to eat better several years ago, but never truly learned to appreciate brown rice. Instead, I ended up mostly cutting rice from my diet. Now that I have found Lundberg Wild Blend, rice is back in the lineup. I look forward to the nights when this is one of the sides. It has a nutty taste, yes, but also a bit of sweetness. We love it! …",35 out of 36 users found this review helpful
 Just like at the movies!,5,"I'll never eat microwave popcorn again! This is quick and delicious and looks and tastes like movie theater popcorn, only better! It's hard to believe, but true. …",11 out of 13 users found this review helpful
 dangerous dog food,1,After 1 1/2 months on this food all three of my dogs had dangerous liver readings. After 3 weeks all three went back to normal. this is a dangerous food and can kill your dog be careful. I would not recommend feeding it unless you are willing to pay very high vet bills and lose your dog. the company never responded to my emails or phone calls. …,1 out of 29 users found this review helpful
 great product,5,Too bad i didn't know about this stuff sooner. It has done wonders for my skin hair and nails. I don't know about cooking with it because I rarely cook but maybe in the future. I love this stuff!! …,11 out of 12 users found this review helpful
 A Slacker Mom's dream,5,"I love this gadget. Compact, all-in-one, easy to use, FOOL PROOF, and ... gives me the CONFIDENCE to make my baby's food. I've read tons of web reviews and blogs about this product, and detractors seem to miss/misunderstand my 'category' of mom. I cook when I can. I bake when I get the chance but... mostly, I dont have the time or confidence to pull it off anything 'new'... AND clean up multiple utensils! So many blogs out there chastise the Beaba buyers for wasting money--telling us to buy cheap steamer inserts and dust off our blenders, food processors and food mills... For my first baby, I listened to these moms (and the Beaba wasnt in the USA yet). I bought the food mill; I pulled out the steamer insert... and.. I froze. My baby ate NOTHING BUT JARRED (organic) FOOD! till she could chew the foods in my comfort zone. Baby food, all the prep and the coordination of all these tools was all so daunting. I was terrified I'd get it wrong... or couldnt keep sterile enough... or would get lost in all the piles of things I'd have to clean after each prep!! THEN THE BEABA! Little to clean, nothing to get wrong, no digging through drawers and juggling appliances in my limited space! I LOVE IT! Call me a slacker mom! But dont call me frivolous with money!! Organic Baby food is $1.10 a jar and my baby would go through 4-6 a day. I've had my Beaba for 6 weeks, and it's already paid for itself. BTW, you can adjust the consistency to your baby's taste as he grows. I figure soon I'll just be using it to steam, not blend. And... I doubt it will be a permanent fixture in my kitchen! But ... its paid for itself! Carrots smell like carrots!!! and ... its given me a confidence that I hope extends to other culinary projects! Slacker moms, buy it. PS Careful if you're reading those blogs re: Beaba and BPA. Read ALL the blogs. The most uptodate will lead you to the latest info promising this product IS BPA free. There are blogs that appear current but have not updated this info. …",488 out of 496 users found this review helpful
" Tuna Salad & crackers are nice, but I don't care for the peaches",3,"I ordered this without looking at the reviews - I wish I had; the tuna salad and crackers are just fine, but I don't care for peaches . . . if I had known the package included a cup of peaches, I wouldn't have ordered the item. I know now that all three reviews in existence on May 11, 2011 mentioned the peaches, but I feel I shouldn't have to look at the reviews in order to know what the contents of the package I'm ordering are going to be. …",1 out of 12 users found this review helpful
" Cracklin' Oat Bran, nectar of the gods.",5,"Crackin' Oat Bran is a cereal of legendary status. It can cure the most distressing problems with a single morsel. The taste is like no other food known to man; as a result of eating this cereal, you will not have taste for other foods. It stays crunchy in milk. …",12 out of 13 users found this review helpful
 Please avoid!!,1,"Please do your research on pet foods and what is actually good for your cats. Hills science diet is a horrible food filled with horrible ingredients. They charge an outrageous price because it's the #1 vet recommended food. This is a joke and the only reason why it's rated #1 buy vets is because Hills gives money to soon to be vets to help them go through school. Then they sell the cat food to them cheap so they can jack up the price and make a nice profit off of your marketing foolishness. Read the back of the labels of Hills brand and you will see that most of the top ingredients are grains or cheap meat by products which are the feathers, bones, unwanted organs from animals, basically all of the stuff we wouldn't eat. Please try another brand like orijen or evo. your cat will thank you. …",8 out of 14 users found this review helpful
 Impressed again,5,"I first tried the Pineapple flavor and was waiting to try the Original to cast my final rating. I'm still very impressed. While nothing beats a fresh coconut, this is a great alternative. I'm a coconut water addict and consume anywhere from 1-3 cans a day. This adds up in $$$. For people like me, who drink coconut water everyday and use electrolyte replacement mixes in my water bottle when i'm biking, this is a dream come true. My kid actually loves eating the powder straight! I recommend this product for people who love coconut water as much as I do, are aware of the environmental impact shipping coconut water around the world, packaging waste, want it all the time (like me) and like the convenience of the powder. For purists, stick with the fresh coconut. But for price, flavor, environmental impact and convenience, CocoHydro is awesome! Thanks CocoHydro for making this product! It's a great creation! …",21 out of 21 users found this review helpful
 Once a great product,1,"My dogs loved this product and I was happy to spend the money on it, but now that it's made in China- thumbs down, what were they thinking? I'll never buy it again. There are better products made in the USA. If you care about the well being of your dog, you will avoid products made in China. …",13 out of 14 users found this review helpful
 It's a win win thing.  And I even like the smell!,5,"The skin is a great delivery system for absorbing things into your body. So what are you putting on your skin? Read the ingredients on your handcream or body lotion. Are they good for you? Don't know? Can you even pronounce them? Let's keep it simple. Virgin organic coconut oil. Snowy white, unrefined, heavenly smell - this stuff is terrific!! Solid at room temperature, smooth and buttery and melts at 76 degrees; cook/fry with it on low heat for a healthy and fragrant alternative to all those ulgy refined oils and hydrogenated trans fats (YUCK!), use as a lighter butter or shortening alternative (there's not a lot of flavor and the smell is intoxicating); use as hand cream (rub it on - only gets greasy if you really over load the area) I use it as a body lotion all over my body (my skin feels soft and smooth like it did when I was a child), hair conditioner (a light deep conditioner); anti-fungal properties (put it between your toes for goodness sake!) make-up remover - voila! ear wax? I put a tiny bit of this on a q-tip; moist toilette wipes? ssshh... try a touch of this on your t.p. - and I could go on and on... It must be organic and virgin coconut oil - anything else is something else and unexceptable. I understand that it is fine for diets, and speeds up the metabolism (its those little medium fatty acid chains). Don't take my word for it - read all about it for yourself! And yes, I feed it to my dog and cat, my cat loves it - and he won't eat anything! Actually, I don't think that he can resist the smell, I can't! Another one of those items that I out on my favorite things list! …",105 out of 108 users found this review helpful
 terminally mediocre (in my hands),2,"My experience is quite different to most other reviewers, so perhaps it will be a helpful counterpoint. I used Droste to make a test cake for my son's birthday, and it had no detectable chocolate flavor. I then just tasted the Droste cocoa and found it awfully bland. I picked up a can of Pernigotti cocoa from Williams-Sonoma: horribly expensive, but produced quite a good chocolate cake from the same recipe. For baking, if you are a foodie, Droste will be disappointing. If you are limited to supermarket selections I would look for a recipe that calls for melted chocolate, perhaps in addition to cocoa, and use Lindt chocolate: the result should be more chocolate-tasting. If you have more money and/or resources, Callebaut cocoa (from Superstore or another mail-order place) is terrific, Green & Black also performs well and is popular with pastry chefs (it is organic, so look for it at organic shops or at Whole Foods), and as mentioned I found Pernigotti to perform well (find at Williams-Sonoma or a gourmet shop). Hope this is helpful. An earlier reviewer commented that Dutched cocoas will produce more flavor: Dutching is an alkalizing treatment used to bring the cocoa taste forward. All Dutch-processed cocoas are not the same, however, and have different pH levels as well as dramatically different flavors. For more on this see Rose Levenbaum's ""Cake Bible"" or hit the Cook's Illustrated website. Rose recommends Green & Black's on her blog, and Cook's Illustrated recommends Callebaut as the best cocoa they reviewed (they did find Droste to be the best supermarket brand), although of the three cocoas I suggest only Callebaut was included in the Cook's Illustrated taste test. …",93 out of 108 users found this review helpful
 Very beautiful!,5,I sent them to my cousin and she could not get over how beautiful they were. People from thoughout the hospital came to admire them. I highly recommend these flowers. …,9 out of 12 users found this review helpful
 Old out of date item,1,"I called the number on the package and was told the case of Oh Henry bars I bought from Superstore was out of date and that I should return them for a refund. When I find what looks like a deal it's NOT, Superstore is trying top dispose of old stock passing it on to the customer. Is this any way to treat good customers? I spend hundreds of dollars at Superstore and most of the time am happy but this is uncalled for. I also ordered some batteries and they too were at the end of the 6 year freshness date. …",9 out of 14 users found this review helpful
 French Mayonnaise - Delouis Fils,4,"I was disappointed to find sunflower oil in this mayonnaise, as I had ordered it based on a recommendation in the book ""Eat Fat, Lose Fat,"" which advises to avoid sunflower oil. I e-mailed the author, who informed me that this mayonnaise had olive oil in it when the book was written. As for taste, it's OK, but I wouldn't go out of my way to get it. And my husband objects to the taste and the oolor, which don't match the Best Foods Mayonnaise he's used to. …",13 out of 17 users found this review helpful
 Playing With Fire,5,"I've been experimenting with ways to give my guacamole an extra kick. After receiving this industrial solvent in the mail, I called some buddies over for burritos, beer and baseball. Cut to fifteen minutes later: four men are sitting around, watching baseball and drinking beer as it dawns on them that there is an angry dragon writhing about in each of their stomachs. The dragons breathe white hot fire that scorches their mouths and ravages their tongues. Ever men, they remain erect and try to soothe the dragon's temper with gifts of alcohol. Quickly, though, the supply dwindles and furtive glances dart around the room. Who will break first? As sweat drips down their foreheads and stings their eyes, they try to think about baseball...think about baseball...think about baseball...and then one makes a break for it! In an instant there is a stampede for the kitchen. They fling open the refrigerator and, snorting like wild bulls, rip open another case and chug like Dionysus reborn--but to no avail. This alcohol is fueling the fire and not dousing it. With choked and gasping breath one whispers ""milk"". Upending the kitchen they can find none of the sweet elixir. With tears streaming down their faces they tear outside, but in the rush of flailing limbs they fall into a heap on the pavement. ""Oh no"" they say, realizing the horrible truth. In their haste to quench this insatiable heat they made a fatal mistake: they are way too drunk to drive. Rising from the ground, they take off on foot for the nearest corner store. Soon, none can bear to breathe through their mouths; the dragon's flames lick at their lips unbearably. As they breathe heavily through their noses, their sinuses are soon aflame from the intense heat and begin their own form of self defense. What a spectacle! Four grown men with red faces, streaming eyes and snot flying into the wind as they gasp and wheeze down the road, driven by the fires of hell itself. Soon, the fat one falls, hitting the ground hard but stretching his hands out for help. Through the sneezing and wheezing no words can escape his ruined lips. Onward the three friends push with nary a backward glance. ""We will remember you fondly, fat one"" they say to themselves, hearts roasted free of compassion. They burst into the corner store as one drunken, moaning entity of pure thirst and claw their way to the milk. With wild abandon, they forego such modern niceties as payment and immediately pour gallons of soothing white mana into their gaping, flaming maws. They sink to the floor in the silent thanks of men spared the gallows. One thought lingers in their minds: ""that guac sure was tasty."" …",20 out of 20 users found this review helpful
 the worst of the three,1,"I bought these, and while I'm glad I tried them, I wouldn't ever buy them again. I'm serious about my bacon, and I've tried all three of the available maple bacon lollipops: Man Bait, Lollyphile, and Roni Sue, and of the three these are the last ones you should buy. They're tiny, taste nasty (both of the other two brands are delicious), and it's clear as to why they're the cheapest option. Google Roni Sue, a small company out of New York that infuses their maple bacon lollipops with tea, or Lollyphile, who makes giant lollipops that taste like maple and bacon. Both of them are more expensive, but real bacon freaks will be glad they went with quality. …",40 out of 41 users found this review helpful
" Great, inexpensive oat bran",5,"This is a really good oat bran, and less expensive that most. It has good texture and creamy flavor. We prefer it even to Red Mill or McCann's. And, did I mention it is less expensive? …",31 out of 31 users found this review helpful
 Great all purpose olive oil.,5,"I have tried a lot of olive oils in the past, and being on a tight budget, I try to stay in the lower price range category. As you can imagine, I've ended up with some really lacking oils. Not so with Zoe Organic! This olive oil is light and mild with an excellent clean taste that doesn't overpower the flavor of what you're cooking (I like that in an olive oil!). Perfect for salad dressings, sauteing, baking, etc. There's nothing I wont use this oil in. Another plus is the size, no more trying to find a cabinet space tall enough for a tall bottle of oil. I've finally found an affordable winner! …",27 out of 29 users found this review helpful
 1 box of 5 cookies at an offensive price,1,"Buyers beware that this sale is for 1 box of 5 cookies NOT five, 5-Count Boxes as what seems to be advertised here. I thought I was buying ""in bulk"" - five, 5-piece boxes - at what is competitive, albeit slightly more expensive than several retailers that sell the same cookies; the few cents more was not an issue since free delivery is a plus. Surprisingly, I received one box of 5 cookies for the outrageous price of $18.85. Hopefully, the Superstore webmaster will correct the description so that the next buyer knows exactly what he/she is paying for - 1 box of cookies. The Superstore rep was very helpful in rectifying situation which was the only saving grace here. I'd be happy to buy again in the future and give 4 stars if this does indeed become a five, 5-count box offer. …",12 out of 14 users found this review helpful
 Great Coffee,5,"Great coffee. Rich, robust. A coffee-lovers choice. If you like French roast or Italian roast, you will like this coffee. …",15 out of 17 users found this review helpful
 Only buy if made in USA,3,"I have bought this particular xylitol gum but never questioned as to where it was made. If it is made in China, I give it zero stars because one has to be concerned about poisons they have found in many other things made in China like dog food, cat food, jewelry, tooth paste, baby formula, and more. I avoid anything made in China as China manufacturers only care about profits. They have no regard at all for people as long as they make money. I suspect this may be garbage made in China because the price is awfully low, which is a tell-tale sign it was made in China. …",5 out of 19 users found this review helpful
" Not as healthy as plain raisin bran, but sure tastes good!",4,"A quick glance at the nutrition panel will show that this has less fiber but more sugar than regular raisin bran. But, the taste makes it worth it - very crunchy, plump raisins, a real treat! My only criticism is that it is a bit too sweet. To balance the sweetness, I mix it with regular raisin bran (or other bran-heavy cereals). Makes for that comfortable middle ground. Great price when it goes on sale on Superstore. The regular price is far more than what you'd pay in a grocery store. I keep it in my cart and purchase only when the price dips way down. …",12 out of 13 users found this review helpful
 Excellent Stuff!,5,"Although the Sun Brand Madras curry powder tastes a little different from other brands that were listed on Superstore a couple of years ago, this stuff is still excellent! It has a slightly deeper orange hue than other Madras curries I've come across, so don't be too surprised if your curry isn't as yellow. If you purchased the Roland curries (red, cylindrical container; also in 1 pound lots), be aware that the Sun Brand is a little saltier and spicier so you won't need to use as much! I love making curried chicken legs with an apple jelly-based sauce, and this brand of powder goes just as well as the others I've tried. If you plan on following recipes from Cuisine at Home and other similar publications, you're going to need a *lot* of curry, and purchasing through Superstore is the best (and cheapest) method available. I typically purchase between 4 and 8 pounds every year or two from Superstore, and nothing makes for a better method of entertaining guests than an exotic (but not quite Indian) dish with an American twist! Edit: It seems some other reviews mention the strong, salty flavor of this curry. I don't notice it so much for what I use it for, but if you're trying to watch your sodium intake, be aware that this curry might contain FAR more sodium than you'd expect. I'd strongly recommend looking for the Roland Madras curry (you can search for that exact term--but be aware that it isn't often listed because it's VERY popular stuff) as it is of superior quality and flavor. This stuff makes an excellent substitute, though. Also, I neglected to notice a comment to my review some one year ago requesting the recipe I mentioned. Assuming I don't get slapped with a DMCA take down by the magazine I borrowed it from (and modified), I've attached it in the comments to this review. Enjoy! …",15 out of 15 users found this review helpful
 Good Stuff!!,5,"It smells just like the theater stuff & adds color too. We use this with our Stir Crazy popper -makes great tasting buttery, fluffy & crunchy popcorn. It's also canola oil, so it's healthy; and it's natural too I'm guessing as it's produced by the Amish. I would definitely recommend! …",12 out of 13 users found this review helpful
