Title,Star Rating,Review,Helpfulness
 It's a Cherry Jubilee !,5,"Being a person with almost no patience, I had to open the Superstore package that arrived today within seconds of it's delivery. Inside was the box of cherries, that box was opened too as was the package of dried cherries inside. Plucked a cherry from the package just to have a quick taste before running off to work for the day. The taste stopped me dead in my tracks !! Really, it did. I just had to grab a sandwich bag and fill it with cherries to take with me. These cherries are absolutely delicious, fresh, soft and chewy, sweet but not too sweet, a little firm and not at all hard and they are full flavored. No kidding, I ate a herd of them today. Can't wait to have a day off to try cooking with them... imagine the possibilities: Cherry Scones, biscuits, NY Cheesecake with dried cherries stirred in the recipe, on cereal in the morning, Oh! what about cherry pancakes or waffles? Maybe add a few crushed walnuts or pecans. In a salad with cherry vinaigrette dressing maybe add a few pine nuts and a few grates of cheddar cheese. Trail mix with dried cherries? Cherry cobbler, cherry oatmeal cookies, chicken in cherry sauce. Yep, I'm going to be doing some cooking. …",14 out of 14 users found this review helpful
 It's Dead!,1,"I bought this for my kids since they wanted a bunny for Easter. I remember getting a bunny when I was their age. So I typed ""Rabbit"" into the search function here on Superstore and ordered this and opted for the optional gift wrapping. Imagine the look on the faces of little Jimmy and Suzie when they opened this up on Easter morning. They cried the whole day and it really made the Easter Egg hunt a downer. If you buy this product please understand that it is dead. It may have been alive when it was first packed but the box didn't have any holes in it. …",64 out of 72 users found this review helpful
 That's a lot of breadsticks.,4,"I read this wrong, I guess. I thought I was going to get a box of 12 breadsticks so I put ""2"" in for quantity. Well, turns out I was really ordering 2 CASES of 12 boxes EACH. Funny. That explains why it cost me more than $50. I guess I just thought they were that special. They're good. And they are approved on my ""diet"" so I love them. Just, if you are going to order 2...make sure you want 2 cases. lol …",45 out of 48 users found this review helpful
 Good Tree,4,"I bought this bonsai as a gift. It came within a week, and was well packaged. I'm posting this review on the second day, so I'm waiting to see how it survives. It came in a rectangular pot instead of a circle like the one in the picture. That I don't mind. It was also very healthy. Wish it had a drainage tray. I see people saying that theirs is nothing like the picture. I guess the style of tree will vary depending on who you buy it from, since there are different buying choices. I got mine from Sheryl Shop. Update Check your bonsai for spider mites. Mine got infected before I knew what they were, and died within a year and a half after buying. Was still a nice tree though. …",12 out of 14 users found this review helpful
 My Favorite K-Cup,5,"My favorite K-Cup flavor! A mild rather than a strong coffee strength, it really has a flavor reminiscent of a local donut shop or Denny's cup of coffee. Highly recommended! …",48 out of 50 users found this review helpful
 My dog is an addict!,5,"We have a 126 lb Bernese Mountain Dog. He is addicted to Checkups. He will sell his soul for a ""white bone."" I buy them at Costco for approximately $12 for the 24-count bag. Your prices are a bit steep. …",18 out of 18 users found this review helpful
 Plain & simple: THIS STUFF WORKS,4,"I originally found out about this product because it was given out as a 1 ounce sample on a flight from San Juan, Puerto Rico to New York JFK in January. Genius marketing on the part of Dove - whoever thought to hand out a sample size lotion to a flight of sun-drenched dry-skinned passengers should be given a raise because I'm positive I wasn't the only one to go out and buy a full size when I got home. The lotion worked perfectly to calm and moisturize my VERY dry and itchy sun dried skin. And everyone else on the plane seemed to feel the same way. I bought a full size as soon as the sample size ran out, and I'm still loving it - it goes on silky smooth, absorbs very quickly, and really helps combat winter dryness. The best moisturizer I've ever used, hands down - except for one thing - the smell. I wish they would make an unscented or fragrance free version. The scent is very perfume-y and will clash with any perfume or other fragrance you may be wearing. DOVE - please make an unscented version. Other than the scent, this lotion works great and I will buy it again and would recommend it to anyone who has dry winter skin. …",12 out of 12 users found this review helpful
 Natural calm Plus,5,"I have been taking Natural Calm Plus for about 2 years. I have a milk intolerance and IBS. this gives me calcium and vitamin D, Plus helps my IBS constipation problem. . I helps to relax and make you sleep better. …",20 out of 24 users found this review helpful
 Amazingly Good!,5,"I do not like pre-cooked pork rinds, not even made fresh in the Mexican Carnecerias, but hubby likes them, so I decided to buy these. I was shocked to find that they were light, airy and crispy. Some bags were saltier than others, but we've cooked up about 5 so far and the majority aren't overly salty. Another reviewer mentioned watching them to figure out how long the cooking time should be. In our 1100 watt oven 40-43 seconds seems to be just right. The key is to take them out the moment the bag has fully inflated. Leave them in too long and you end up with charcoal and not enough time will make them gummy. Since I follow a fairly low carb regimen for health and weight reasons, I like the fact that these can be a perfect vehicle for guacamole and salsa without the carbs. I'm still trying to come up with more dip ideas that will go well with the flavoring. I wish they'd put out a version that didn't have seasoned salt as I'd like them with just salt and/or garlic. …",17 out of 18 users found this review helpful
 Best cheese curls - UPDATED: overpriced and poor quality,5,"I won't say I'm an expert in cheese curls, but these sure taste great. Slightly milky flavor, and a touch of blue cheese give these an edge (literally and figuratively) over the competition. It's great that part of the ingredients are organic (I wish of course that they were all organic at this price). Don't be surprised when you open the bag, they fill just under a third of it. I guess the empty space keeps them in shape! Now the bad part, when you buy 12 at once you expect a discount. The Superstore price of $2.58 each is the same as at my local high priced natural food store. Still, nobody comes close flavor wise, although flavor is, of course, subjective. UPDATE December 11, 2009 Could I have been more disappointed with the makers of Cheese Curls? I stopped buying the baked cheese puffs from the same brand because the quality varies from one batch (by the expiration date) to another, and the last batch had too many puffs without cheese. Back to the curls, the previous batch (November) was just excellent (good flavor and crispiness as reported by my wife), but then came the one I bought just a week ago...there is not a single curl with proper cheese flavor in the bags. So why not complain? I am complaining, but the company doesn't care. I told them last year that the quality of the puffs varied from one batch to another, and it only got worse. The retail price has increased to $2.95 since then. At that price I expect a very good product, especially when I buy 12 at a time. Notice that it says on the back of the bag ""freshness guaranteed."" That's right, they don't care whether we're happy with the product, just that it's fresh. Thanks Michael Seasons, I guess I'll have to start making my own cheese curls (there is no other product on the market that uses (partially) organic ingredients). I'd give this one star today if I could. …",13 out of 14 users found this review helpful
 Great Garbanzos,5,"Upon receiving the product, I started a batch soaking to get them ready to cook. I soaked the beans overnight and cooked them up in the pressure cooker (after watching Good Eats episode on garbanzos/chickpeas). I am very happy with the quality of the beans. The cooked up tender and tasty. I used some in a soup, added some to a couple of salads and blended the rest up to make hummus. Each time I reflected on how much better I liked them over canned beans (even when cooked unsalted) and the last batch of dried chick peas I bought in the store. The burlap bag is kind of cool and the beans are in a plastic bag inside of that. Out of four cups of measured uncooked beans, I only encountered two beans that did not cook up soft. I will buy these again. …",12 out of 12 users found this review helpful
" Very Pleased, as was gift recipient",5,"Very happy with product - shipped to myself to bring to a birthday party. This gift basket arrived on time and in perfect condition. All of the items looked very beautiful and sleek, which made for a great first impression. The recipient loved everything in the box, especially the chocolate truffles. Would purchase again. …",7 out of 12 users found this review helpful
 Save Money & Get great Coffee,5,"This coffee is exactly what you would get at a coffee shop. Sweet and aromatic, not bitter or too bold. I like the pack of 50 and it comes in one box, so there is no waste of packaging or more trash to throw away. If they only made a box of with 100... We love the K-Cups and get great consistent coffee every day without wasting half a pot. My favs are Timothy's German Chocolate (desert coffee!), Donut Shop (mid Morning) and Emeril's Big Bold Easy (first thing in the morning!). …",21 out of 21 users found this review helpful
 A VERY FINE GRAPE SEED OIL,5,"I use this oil for cosmetic purposes, mostly as a catalyst carrier oil for Ormus and essential oils, and it is of very high quality and fineness and absorbs quickly into the skin. It has no off smell or color, is a top shelf oil and no doubt would be a primo cooking oil if any were left over for me to use it. The deal with people having issues with dents in the containers is not an issue for me, there was a small indentation on one of the cans but I could have made it myself prying the cans out of the shrink wrap. As long as the oil is in the cans I am good. Again, these are not decorative items for me, but utilitarian containers. Love the oil. You will, too. …",12 out of 13 users found this review helpful
 Reboot your snack processors,5,"I wanted to give these soy crisps more justice than just the 5 stars (and ordering them all the time). I bought a bag of these Sea Salt flavor crisps and a bag of BBQ crisps about a month ago, in a bid to eat more healthy food. I've always loved BBQ chips, especially Ruffles and Lays K.C. Masterpiece chips, but they've got to be killing me slowly, right? So I busted open the BBQ soy crisps and gagged. How could this be BBQ? They tasted like cardboard, and I gave them to my friends who will eat anything. I begrudgingly opened the Sea Salt bag, and though more palatable, I was still disappointed. (I know...""I thought you said 5 stars."" It gets better.) Anyway, I had sworn off chips and midday snacking, so for two weeks I saw nothing on the counter but Genisoy Soy Crisps. I'd eat two or three here and there, and when I ran out, I bought 2 bags of the Sea Salt flavor again. What happened must be akin to rebooting your computer or defragging your hard drive--my body forgot what those strong BBQ flavored chips were like, and I started craving Soy Crisps. I began to taste a delicious roasted soybean flavor, like those roasted and salted soy beans they sell in jars, which I had completely missed before, apparently because it wasn't a sweet, red-crusted, overbearing BBQ powder. I polished the next bags off in three days. Now, I'm ordering 12 here on Superstore ($1 cheaper per bag than my local grocery store which seems to want to punish my wallet for trying to eat healthy food). My advice is this--give these soy crisps a chance, but don't mix them in with your regular Doritos and BBQ Ruffles or you'll think they're awful. Stop eating, for a month, the oily BBQ chips that have deadened your taste buds for years and reboot your taste buds with these markedly healthier chips. You'll feel better about snacking! …",15 out of 15 users found this review helpful
 Over Powering,3,It comes in a plastic jar. The toasty taste and smell are to over powering for me. Leaves me feeling a little queasy. Otherwise its a nice oil and I can buy it at the local Martians grocery store. I can't eat it alone and even in my morning oatmeal its still to much. If you love an over powering taste and smell of coconut you will probably love this product if you don't then pass on this one. …,9 out of 20 users found this review helpful
 It's Helping Clear my Acne/ I wrote a lot but its worth reading if u suffer from acne,4,"The Manuka Honey 12+ In my opinion is really good for clearing bad acne. I use it as a cleanser for my face. Starting after the Holidays of last year 2009, after New Years My skin broke out really bad. So i was beginning 2010 with skin that was going out of control. I started using Acne free which contains 2.5 Benzoyl Peroxide which has helped clear my skin in the past but it actually made it worst. then I started using Herpanacine 100 vegicaps supplements and that really broke me out to the max. I had big acne cysts around my jaw line. so I realized the supplements is supposed to do that and it's because i had toxins in my body. Then I started using [...] products because they also use 2.5 BP which helped me before. But I noticed my skin looked dull and tho it was clearing i just hate the fact using chemicals for the rest of my life to help clear my acne. then I used mario Badescu products. i was just willing to find anything to help... so I wanted a natural alternative. i was sick of using chemicals. I found a youtube page where this lady cleared her acne with organic raw honey and a aloe vera plant. so I first bought the 365 Organic Raw Honey from wholefoods which is AWESOME!! which i still use. then she mentioned the manuka raw organic 12+.. so i had to try it.. within three weeks my skin was glowing. So I wash my face with either honey, the 365 organic wildflower Raw honey or wedderspoon raw organic manuka honey 12+.. then pat dry. then at night I use the gel from a aloe vera plant. not aloe vera juice or gels they sell in stores in a container. it's best to use the actual plant and use the gel it has. rub it on your face everynight. it helps with the redness and complexion. it really help make my skin glow. another thing i do as a skin regimen is add 3 tsp of 365 organic raw honey with 1 tsp of cinnamon powder and mix as a paste. i use that as a face mask. put it where u have acne for two weeks! it really works.. i still use it and it helps clear really fast.wash it off after 30 min to 2hrs. another thing that really HELPS!!! is juicing cucumber with apple or pears.. but the main ingredient is the CUCUMBER..to making ur own juice using a blender or a juicer. it's really helping clear my acne. hope it helps u! i added the links below that is saving my skin! good luck! [...] …",27 out of 27 users found this review helpful
 tasty Maybe beneficial,5,"My midwife recommended this product, and I drank it throughout my second and third trimesters. My labor was slow, but I experienced nothing you might really call pain (pressure and some discomfort) all the way to 9 centimeters. Then I pushed 3 times and my son was born. I'm not saying for sure that it was the tea...but I didn't have labors like this with my other two. At any rate, it's tasty and not harmful. Just remember to tell your midwife or doctor that you're using it. I still drink it just cause I like it. …",18 out of 18 users found this review helpful
" There were 87, NOT 100",3,"Okay, yes, they are good. However, when my package arrived, the box had been opened and didn't look full. So, I counted them. There were 87, not 100. (and there were none loose in the box among the other items.) I guess the ""box packer"" got hungry and decided to eat a few. not cool. Follow up: Superstore was great about my complaint about the number! They sent a new box right away. thanks! and I would order again. …",20 out of 36 users found this review helpful
 Terrible,1,These chips (all flavors of the variety pack) are really terrible. I have thrown away a lot of them and suffered through eating some of them. They are over spiced and nasty. …,4 out of 16 users found this review helpful
" Great Album,Too bad You cant buy it from Superstore :( :(",5,"My wife tried ordering this item thru a Superstore listed seller (caiman) December the 10th it was due to ship out in 3 days (for a x-mas present nonetheless), by end of January it had not shipped. I cancelled our order with caiman and tried to order thru Superstore itself the same day Feb 3rd i believe. Here it is March the 20th. No nothing , just an endless extending wait. Apparently Superstore & their sellers feel they can list items they dont , wont and cant stock. Dont waste your time. I just cancelled my order and bought it on E-BAY , it will ship tommorow. Forget Superstore, or unless you like being blown off endlessly by email with no LIVE person to talk to, then by all means order this thru Superstore (or Caiman!). I prefer to spend my money else-where, this has really soured me. …",2 out of 12 users found this review helpful
 BEWARE!,1,There was a piece of a different formula label underneath the Earth's Best Formula label!! Even the bottom of the can had a different look than the Earth's Best Soy formula that is sold in the store. We contacted the manufacturer about this issue and they have yet to respond. …,16 out of 16 users found this review helpful
 They increased the price!!,1,"it use to be 4 boxes of Special K Red Berries Cereal, 16.7 Ounce Box for $11-13. now it's 3 boxes for $14-15! outrageous!! ~_~!! now this isnt any cheaper than the stores. …",11 out of 15 users found this review helpful
 Save Money & Get great Coffee,5,"This coffee is exactly what you would get at a coffee shop. Sweet and aromatic, not bitter or too bold. I like the pack of 50 and it comes in one box, so there is no waste of packaging or more trash to throw away. If they only made a box of with 100... We love the K-Cups and get great consistent coffee every day without wasting half a pot. My favs are Timothy's German Chocolate (desert coffee!), Donut Shop (mid Morning) and Emeril's Big Bold Easy (first thing in the morning!). …",21 out of 21 users found this review helpful
" Probably Great for Food, The Smell, Not So Much for Body or Hair",3,"I was a little surprised at the size of the bottles (a little smaller than I would have liked). I use this as a moisturizer for my hair and skin. I will likely get the raw version of this because I feel like I walk around smelling like food (HORRIBLE!!). My brother bought the raw version and it smells like paradise compared to the cooking oil version. If you want to spread this over bread or use it as a cooking aid, then this is the product for you. Look into something else for hair and skin care. …",14 out of 26 users found this review helpful
 Nice cinnamon taste,5,"I snack a lot, and I don't always have time to brush my teeth afterwards, so I'm trying to chew this gum after eating. It has a nice flavor, not too sweet. I'm not chewing it for long periods of time, but the flavor lasts long enough for me. The larger size is more cost effective, and I'm keeping one at my desk and one in my car. …",12 out of 13 users found this review helpful
 Healthy and tasty!,5,This product has much more health value than the regular old-fashioned rolled oats with a much better taste. The only drawback is the time it takes to cook on the stove. I have tried to microwave it but it still is crunchy or overflows even in large containers. This is definitely work the time though to cook on the stove. High in fiber! …,12 out of 13 users found this review helpful
 Fun for Lego Party,5,Great product. No broken pieces. Tasty. You can really build with it. My 7yo son had Lego-themed party. I used this for decoration on table and as filler for treat bags. I had a hard time visualizing what 2lbs would be but I would guess it was about 4 cups of candy - if that helps anyone. …,44 out of 44 users found this review helpful
 I just adore my Vegemite!,5,"I was a little leery about trying Vegemite...it has such bad press outside of Australia, but I find I absolutely love it. It is extremely salty, slightly beerish and very savoury. So far I have mostly consumed it with bread and butter...but I have already started taking tastes straight from the jar. I also find I like it better with whole wheat bread than white. I think the main challenge for the uninitiated is that it looks like it might be sweet. It is not sweet at all and you should use it very sparingly mixed with plenty of butter, at least at first. Sadly, my husband also likes it and my supply is dwindling rapidly. I wish they sold it in a larger size. …",12 out of 12 users found this review helpful
 NOT all Extra Bold,1,"I wanted to get a variety pack of K-Cups so I thought I'd try this out even though it was a bit pricey (I thought it would be worth the extra bucks to get to try 20+ different flavors). The only reason why I purchased from this buyer specifically was because I wanted ONLY Extra Bold K-Cups. I knew there would be double of flavors, etc but I was disappointed to find that almost half of them were not extra bold. But, I was glad that it arrived much earlier than the expected delivery date.... …",16 out of 17 users found this review helpful
 munch and be healthy,5,"Usually, healthy food is hard to swallow. Not these, fresh, crunchy, delicious pumpkin seeds. I switched from potato chips and my wife tells me they are good for the prostate. What do I know? I'm taking her word for it. …",15 out of 16 users found this review helpful
 Melted Chocolate,1,The chocolate is great but it was supposed to be mailed with a cool pack and showed up completely deformed and melted. :-( …,31 out of 37 users found this review helpful
 Delicious!,5,"These are, the MOST delicious, dried cranberries we've ever bought! They are sweetened just enough, don't stick together in a lump, are just slightly juicy, have no preservatives AND taste great refrigerated! For those who are wondering, 4# just fits in a 1-gallon zip lock bag. On the box, it says a serving size is 1/3 cup and there are 45 servings. I will buy these again! …",28 out of 30 users found this review helpful
 If I could I would give it a negative billion stars...,1,"The food was rotten/old. Not sure if that's amazons fault but thank god they gave me a refund. It smelled absolutely horrible. I tried to give her a can, or let her 'sniff' it, that looked and smelled normal and she looked at me like I was crazy. I would say almost clawed my eyeball out. I would've never let her actually eat it but I heard cats can smell **** food. Maybe I was just unlucky but based on that I'm never purchasing this **** again. …",2 out of 12 users found this review helpful
 DENTED CAN ALERT,1,"I just ordered a case of these and was horrified to see HUGE dents in all 6 cans. It looks as though someone banged the side of each can with a hammer. The shipping box, however, was in perfect shape. Hmmm... What a waste of my time and money. From now on, I'm going to buy my canned food at the local grocery store. …",9 out of 12 users found this review helpful
 Zevia Cola - My second experience with stevia sweetened soda,4,"Zevia Ginger Ale was my first experience with a soda sweetened with the natural sweetner Stevia. As a result of my good experience, I bought a six-pack of Zevia Cola from my local natural foods store. The associate told me they sell out very quickly. I will be purchasing other flavors to try as well. Taste: 3 stars - I used to be a huge fan of Diet Coke. There is a definite after-taste created by Stevia, and it will take a little getting used to. However, this is the case for any diet drink. Someone that is not used to diet sodas might not immediately enjoy them. After continuing to drink Zevia, the after taste becomes less noticeable. This soda seems a tad bit sweeter than a regular Coke and not quite a sweet as a Diet Coke. The cola flavor could definitely be stronger. Calories: 5 stars - No calories! Can't argue with that. Ingredients: 5 stars - It's all natural. If you aren't familiar with Stevia, look it up on your favorite search engine. The sweetner has no calories and is natural, unlike the Aspartame found in a Diet Coke. Overall Rating: 4 stars - When it comes to no calories and natural ingredients, I'm willing to accept a slight decrease in taste. That's why I'm giving Zevia Cola 4 stars. Unfortunately in this case, the cola taste is not quite as strong as it should be, and the Stevia seems to overpower the cola flavor. The only way to know if you'll like it is to give it a try. Superstore sells these for a better price than you will find in stores, but if you want to try it first, you can probably purchase these in smaller quantity at a natural foods store. …",17 out of 18 users found this review helpful
 Crappy Pumpkin,1,I bought this last year-threw it out-I would not buy this for 1 cent-why is Superstore selling such an inferior product?? …,2 out of 13 users found this review helpful
