Title,Star Rating,Review,Helpfulness
 So Good why isn't it Bad???,5,"After a couple of days to try out these 2 Peanut butter substitutes (the regular and chocolate versions) I can say I'm a convert. I LOVE peanut butter, for me it's a trigger food. If I eat it, I tend to want to eat half the jar at once and it can lead to wanting to eat other things I know I shouldn't. I've worked **** hard to shed 170lb this past year and half and indulging in PB is something I very rarely do anymore. I'd all but given it up. So actually finding something like this, which will allow me to enjoy the occasional PB&J sandwich without the feelings of guilt and remorse is a godsend! The reg. version of PB2 does have a roasted peanut taste to it, so it's not quite like regular PB, you don't get the salty sweeter taste of Jiff or Skippy. JUST the roasted peanut taste. But it's quickly adapted to. And the Chocolate version (which I was more skeptical of) was even better! You can eat either one right after you mix them with water, but I think they're best when added to something else. First of all I like to mix a base of reg PB2 with the chocolate version since I prefer a bit more of the nutty flavor to the chocolate. When just eating the chocolate my first thought was this would be great on whole wheat with a smear of marshmallow creme. And I don't even like marshmallow creme. But I will probably try it out one day to see if I'm right. Either spread works great on fruit. I've tried apples and bananas so far. I also tried a PB&J with reduced calorie jelly and it worked very well. Good enough to replace the high calorie reg. PB&J sandwiches. It might sound strange but one combo I REALLY like is to scoop a bit of the powdered PB onto a fat free potato chip (I use Pringles fat free sour cream) and no there wasn't a taste clash or anything. I'm sure you could use the reg Pringles fat free, I just happen to think the sour cream ones taste better. Anyway turn the chip upside down and scoop a bit of powder into the ""bowl"" of the underside and eat. The salt of the chip is the first thing that hits your tongue and then the PB powered crumbs. And the combo is just....yumm!!!! Like that, it really does taste like any PB you could buy. I tried it with the chocolate version too, and there it's really like eating a peanut butter cup. And surprisingly the salty chip and powered PB isn't dry in the mouth. Quite the opposite actually. Now on the other hand, I tried adding the powdered PB2 as a topping to my skinny cow ice cream as I do on occasion like some melted PB on my ice cream, but there it DID dry out my mouth completely. Very strange. So I decided to try and mix the PB2 with water then heat it up in the microwave to see if it would melt like reg PB. It didn't. It got hot, but ended up dry like the cookie dough for peanut butter cookies where you can basically ball it up in your hands. I guess without all the fat the PB2 can't melt like standard peanut butter. So as for ice cream topping, at least so far, it hasn't worked. I am looking forward to seeing what else these 2 powdered products would work with and am already planning on ordering the larger sizes as I'd like to try some baking with them too. All in all, I highly recommend them! Edit; Okay so it DOES work as a melted peanut butter substitute on ice cream. The key is to start with a base of water and gradually add powder to it until you get a very creamy consistency that will run off a spoon, just like melted pb *then* heat it up in the microwave. My first attempt with this method I used far too much water so be careful there. I kept adding bits of powder including the chocolate version for fear I'd use all my pb2 up. But it was so much water I couldn't thicken it up enough and decided to start over. However, rather than just throw it all out, I decided to try it out as a drink. And you know, heated up, it was like a super rich cup of cocoa....delish! Even with no added sweetener it was sweet enough. And as a plus, since it's just water you can save those calories there. Not to mention, if you're lactose intolerant like me, regular hot chocolate is out anyway. Now even though this stuff is 85% less than regular peanut butter it does have some calories and fat, so I wouldn't over do it. But as an occasional indulgence, I'm so happy I found this! PS: I just want to add since purchasing PB2 from Superstore I've found a site called ""netrition "" and I highly recommend buying food stuffs from them. Superstore is great for pretty much everything else, but they are way over priced on their food. I bought the large 16oz pack of PB2 from netrition for only 7.99 per bag. the same price Superstore charges for the small 6.5oz size! They don't have free shipping like Superstore, but they only charge $4.95 flat shipping fee no matter how much you buy. So it's not bad. Maybe because I bought so much, or it was my first time ordering but they also sent me a free low cal. quick cook cake mix. They were also way WAY cheaper on PB2 peanut butter crackers and everything else I ordered from them. So like I said, Superstore is great for most things, but when it comes to food, Netrition is a whole lot better! …",26 out of 27 users found this review helpful
 Cracker? Cookie? Either Way -- Delicious.,5,"CRACKER COOKIE BISCUIT BLISS I'd call these tiny snacks cookies rather than crackers, based on sheer yumminess, but they aren't especially sweet, and I suppose if they want to call them crackers, that is their prerogative. PACKAGING Kudos for putting them in a bag rather than in a bag inside an unnecessary box as is usual for products in this segment. TASTE & TEXTURE The taste is appropriately peanutty, somewhat salty and slightly sweet. It brought back childhood memories of Cap'n Crunch Peanut Butter Crunch Cereal. The texture is somewhat similar to shortbread -- crumbly with the slightest hint of (pleasant) buttery oiliness, which I imagine is coming from peanut ingredients and not from dairy butter (since it doesn't contain butter). INGREDIENTS & HEALTH CLAIMS The ingredients are all pronounceable and recognizable as food. Things you may actually have in your home. Phenomenal. They don't really make any health claims, sticking with 'all natural' and 'no additives', neither of which I would disagree with on the basis of the extremely short ingredient list. Calorically you could do much worse in the prepackaged snack cookie/cracker segment, but this is still a snack food. RECIPE POSSIBILITIES I can see creative cooks using these treats in all sorts of interesting ways -- as a pie crust, in lieu of graham crackers perhaps? As part of a trail mix or dessert bar? If you have used these treats in your cooking I'd love to hear about it in the comments section. :) IT'S FOR YOU IF... - You love peanuts/peanut butter - You prefer products with ingredients you don't need to look up on wikipedia - You like some salty with your sweet (or sweet with your salty) THINK TWICE IF... - You have a peanut allergy (sorry, I know sort of obvious) - You are expecting tiny, soft, peanut butter cookies - You honestly think you can stop eating after 27 very tiny crackers (1 serving) …",45 out of 45 users found this review helpful
 Are You Kidding Me??,1,"I just finished watching this train wreck and I had to warn anyone who's considering buying this to stay far far away. I read every review just like you're doing now, looking for something different and was fooled into thinking this film would be something special. After viewing this I was left disappointed and frustrated. I have one question for all the glowing reviewers...What the hell were you watching?? It's not quality moviemaking! The script was weak, the plot was dragged out way too long, it took 52 minutes before anyone was killed. Factor in a poor musical score and sound transfer, topped off by sub-par to mediocre acting and you have an amatuer film. As far as special effects go, just fast forward to the last 15 minutes for what little this movie this has offer. This movie reminds me of a college student film gone wrong. To put it bluntly, if this film scared you, you're a P@$$Y! If Superstore offered this for free and just charged you shipping, you paid too much. Go check out something else. …",6 out of 17 users found this review helpful
 Yummy!,5,"For those that have negative comments about the product...please check out the Betty Crocker website...it would take you less time to get all the information you are looking for than to write the negative reviews. By the way, yes, these products are made in a gluten free facility...Betty Crocker has a whole website dedicated to their new gluten free products and definitely worth checking out. Now - I've given up on trying to make a gluten free yellow cake - I haven't liked any of my recipes or any mixes...Until the new Betty Crocker mix. It really is yummy and has GREAT texture - very smooth and moist. will buy over and over again!!! Thanks Betty Crocker! …",78 out of 79 users found this review helpful
" Horizon Organic Reduced Fat Milk is a Favorite, but pricy on Superstore",4,"My kids love this milk. Admit it is on the expensive side, but it travels well and the kids will drink it (they won't drink other milk.) Note: Just went to BJs wholesale and paid 12.99 for the 18 pk. Won't buy from Superstore again when there's such a price difference. …",17 out of 19 users found this review helpful
 They are THIS good!,5,"I was really glad to receive this case of cans of black beans from Superstore, because the cold winter is starting out here in the desert, especially over night, and I thought it would be great to have some warm black beans for lunch at work. So far this warm year I have been eating for lunch cold Organic Garbanzo Beans, 15-Ounce Unit (Pack of 12) mixed with Mori-Nu Silken Extra Firm Tofu, 24 pack and other stuff at hand, but the cold nights and days make me want something warm instead. When I lived in Guatemala back a quarter century ago, we had black beans and tortilla, hand made, so this sounded really nice. As soon as the case came, I got out a can at night to simmer with diced onion, garlic and a few cumin seeds, to warm to work the next day. Round midnight, I got up to check the beans, still warming,and smelling great. I decided to try half a spoonful to see if they were all right. They smelled way too fresh. One half spoonful led to another, and soon the whole pot was gone. They were THAT good! So anyway, next day I had the usual garbanzo and tofu salad, with fresh lemon juice, and will go now to see if I get some black beans ready for lunch tomorrow! They really are great: good texture, very fresh, and the taste very fresh. After using this brand name for so long, I can trust its uniformity, with no surprises from batch to batch, all of the highest quality. I know some people might say, dude, it's black beans, bake your own, dried from a bag! But the freshness of these apparently never dried beans is something ""to die for!"" or rather, to live for . . . Great beans. Won't let you down. Will fill you up! And good for you too in every kind of way. Soul food as well as food for the body. Highly recommended! …",28 out of 31 users found this review helpful
 Misleading Price,1,"This looks like a better deal than it REALLY is, and I wonder how many people who actually did the math for themselves would truly be pleased. This product is listed as 64 ounces, for a cost of $39.75, and they break it down as $0.41 per ounce. This would be a fantastic deal. HOWEVER, $39.75 for 64 ounces means this costs over $0.62 per ounce! This is not cool. I'm not sure if this was done intentionally, but it's bad business. …",11 out of 18 users found this review helpful
 Best nonfat dry milk powder ever consumed,5,"When one reconstitutes this milk powder with purified water to remove the herbicides and other pest controls building up from Genetically Modified herbicide tolerant crops, they will find this tastes just like the fresh milk from Organic Valley's family of small farmers across the country. Reconstitution means a good job blending in a blender, not just stirred, because this is non instant powdered milk. It will take a bit longer to prepare, but the taste is worth it. I will not purchase herbicide tolerant crops for my family. Yet, the USDA and the Obama Monsanto Administration has deregulated soy, corn, cotton, canola, sugar beets, and alfalfa (the latter of which needed no herbicides previously) to be incessantly sprayed with Roundup and other dangerous weed killers. This means that the crop fed to dairy cows, horses, and other livestock will be contaminated with foreign organisms (not plants unlike hybrids) to make a patentable plant which Monsanto owns for the purpose of forcing farmers to spray more Roundup, so more money can be made by Monsanto. Less than 7 percent of all alfalfa had been sprayed with herbicides previously. But, all that will change if the dairy industry purchases GMO seeds for alfalfa. Our potable water supplies all over the country are becoming contaminated, although studies have been blocked by Monsanto. Where studies were done in other countries, like Denmark, it was found that extremely high levels of Roundup (or Glyphosate, the trademark for the active ingredient) were building up in the potable groundwater. AND, they are not planting GMO seeds, unlike the USA. Because of their studies, they have instructed the Danish farmers not to spray with Roundup for at least 3 years. But, in the USA, farmers are instructed to read labels and are taught to use chemical intensive agriculture; studies are blocked from being published, and even physicians are not given the right to know. In Taiwan, a study was done on 93 persons who tried to commit suicide by ingesting Roundup. The symptoms were very much like gastrointestinal reflux disease that has affected people all over the USA who have consumed heavily sprayed Roundup Ready (and GMO) crops. Even babies have GERD and the causes are unknown because studies have been blocked by Monsanto. Monsanto's presence has been at the USDA, and Michael Taylor, first a lobbyist, then the company's Vice President, was appointed to the US-FDA by the first President Bush and has been there ever since. Myriad Monsanto employees are at the FDA and EPA making policy and their policy only benefits their company, not our health or the health of our children. Where studies have been done outside the USA, researchers and physicians have found growing levels of new allergens, toxins, new diseases, and nutritional problems with GMO plants. Organic Valley is committed to growing the best alfalfa for their cows and for that reason, and since organic agriculture prohibits use of GMO seeds, I'm buying all the Organic Valley powdered nonfat dry skim milk I can find with its long shelf life. I will not give my family GMO milk. We will stop drinking and eating dairy products, once all milk contains GMO's because pollinators carry them from crop to crop or the wind blows the pollen well beyond the six mile limit claimed by the USDA. We will buy Organic Valley but not heavily sprayed herbicide tolerant GMO alfafa fed dairy products. …",14 out of 19 users found this review helpful
 Simply the best tea I ever drank,5,"I just received this tea after waiting only 2 days, that is amazing. I could not wait to try it so I followed the other reviewers' advice and washed it first. Etc. Etc. Now I am not saying anyone is wrong by any means but I tried it both ways, washing and not washing and I cannot tell the difference. To me I believe it is a waste of tea to wash it, in fact I found a lovely video that may be very interesting to some of you it is only 5 minutes this man is Dr. Tea he has written a book and has a shop and sells teas. He is basically an expert and he does not wash his tea. [...] I did however make a nice ritual out of the making of the tea. I had the opportunity to purchase an authentic tea pot along with all the extras that I found is needed to make a good tea, I got it from China Town in California, and I used it the proper way for the first time today, it was relaxing and fun. I was not aware of all the health properties in this particular tea, the list is impressive, heart problems, high blood pressure, cholesterol, it helps with teeth and gum problems and promotes its healing, it is also a weight reduction tea, but what I needed it for is the Theanine that is in this tea, I have an autoimmune disease that causes inner tremors and I take L-theanine to calm me down but this tea is doing that in a more natural way. I will no longer be needing to purchase this supplement. This also is a tea that has very little caffeine and it did not make me nervous like the average teas do. I do recommend this tea to everyone especially if you have any of these problems, but for me I enjoyed a very restful day without any jitters. As for the cost, this morning I cut off 2 grams of the tea and I am just finishing it, you can brew this tea many many times as you can see in the video, this makes it, for me, a very inexpensive tea. It will last forever even if I use it on a daily basis which I now intend to do. …",24 out of 25 users found this review helpful
 Grains from GoldBeachBooks are NOT Cultures for Health grains!,1,"These are not the authentic Cultures for Health product. They are sold wet, shipped in a baggie, and perishable. Cultures for Health stands behind its product 100% and has GREAT customer service. This product has no customer service, and is just capitalizing on CFH's good name. Buy the real deal. …",14 out of 14 users found this review helpful
 Something's Changed with Canidae food,1,"I fed and recommended this food for several years as one of the best dry foods available. However, over the last few months (late 2007) something has changed. My dogs experienced chronic digestive upset on the food and refused to eat it. Upon switching to another quality food, the problems stopped. I tried another bag last week-- same results. Other dog owners/breeders/vets/handlers have also reported problems with Canidae foods over the past few months. No one, including myself, has been successful in getting any sort of satisfactory reply from Canidae when asked if they had changed formulas, ingredient suppliers, etc. I'm disappointed-- Canidae was one of the few 'quality foods' that had not raised prices significantly over the past year and was still affordable for most dog owners. Apparently that has also led to changes that the company has not been willing to address. I'm very disappointed that a food I recommended so highly in the past has had these problems. I've changed my dogs to Eagle Pack Holistic Selects. It's more expensive, but they are back to their old selves-- healthy, no digestive troubles, and great coats. …",15 out of 18 users found this review helpful
" Delicious Cookies, But Way Overpriced",4,"Every year we pick up several tins of these cookies to give as Christmas gifts. This is a large tin which features a nice variety of cookies covered in both white and dark chocolate. I especially love the taste of the white Belgian chocolate coupled with the cookies. Yummy cookies, but these are way overpriced here. Last year around Christmas time we purchased approximately ten tins of these cookies at our local Costco and they only cost us $10 per tin, so please check prices locally before purchasing them here. …",12 out of 14 users found this review helpful
" No meat by-products, good and safe, Turkey & Chicken Dog Food",5,"Everyone knows about tainted pet food from China. Newman's Own is a branding that I can trust, and this one is a real winner. Newman's is what I would make if I were making it for my own family, as in you can trust that it is great tasting, good for you and safe to eat. I'm very pleased that the Newman's line was extended from people food to pet food. When it comes to moist dog food every single choice on the market has meat by-products except Newman's Own. My 3-month old puppy goes crazy for this, as well as for the Chicken-only Newman's canned dog food variety. In fairness he would probably go crazy over meat by-products too. While they *may* never hurt his health, I won't give him any, that lucky dog. One other finding: When you open almost any moist dog food you smell ""dog food"". When you open Newman's Chicken or Chicken & Turkey you smell meat. It actually smells good. Imagine that. …",29 out of 29 users found this review helpful
 MM runs on CLICK,5,"Espresso, chocolate, and, PROTEIN, 15 grams in one serving. It can be made hot or cold, I tried it both ways about eight times now, and I love it. (You know I don't just throw that out there, I am a tough cookie.) For the sake of a simple review, I tasted it AS THE PACKAGE DIRECTED and it was just perfect. I prepared it cold, and look, I sucked this down, and then I cleaned the bathroom in a single bound, I did! As a hot drink, it's also delightful - you literally just mix it as you would any hot powdered drink like a cocoa. I highly suggest a whisk, and do it well, and you get the best results. This mix really has a smooth mocha flavor. I've been drinking it hot in my morning cappuccino - I whisk one or two scoop into some hot water to mix, then a shot of espresso and then top it off with steamed unsweetened soy milk, and it makes an AMAZING morning cup. I've already thrown it into protein shake concoctions in the blender, and it's OMG!? DELICIOUS with blended ice and additional flavors. (THINK ABOUT THE OPTIONS HERE PEOPLE!) The nutrition: * 2 scoops contain: * 120 calories * 1.5 grams of fat * 115 mg sodium * 290 mg potassium * 12 carbohydrate * 1 fiber * 7 sugar (fructose) * 15 protein Overall, I am very impressed with Click Protein. There is NO telltale protein-y taste, you that icky tongue-feel and after taste you might get with other protein products? I don't know how it's possible, but it's true - you cannot tell that this is a protein drink by any stretch. Add that to the fact that it contains my two main food groups, espresso and chocolate? It's a clear winner, and my new thing. [...] …",61 out of 83 users found this review helpful
 The Best!,5,"You simply can't make real Ma Po Tofu without this sauce. It's absolutely fantastic, the #1 best. Twenty years ago, I would scour Chinatown and Japantown for this stuff, and buy every jar I could find. Now it's much easier to locate, but I still tend to stock up because it's just that precious. …",12 out of 12 users found this review helpful
 great stuff,5,i guss this for my bro he liked it alot and it came pretty fast will buy again …,6 out of 12 users found this review helpful
 Good Product and Excellent Customer Service,5,"At first, we did not get along. It spit and spewed in our B60 and made me mad that I had paid full price for two of these new K-cup replacements. Good coarse grind, check. No grounds around lid before closing, check. Not too full, check. Seated properly in Keurig, check. My best guess was that the lid was not sealing properly because there was a little wiggle room when closed, so I contacted the company by email and asked if a replacement seal would help. I was delighted when they offered to send replacement Ekobrews. The next morning, we tried something different. We removed, cleaned and replaced the rubber piece that surrounds the needle that inserts into K-cups in the top of the machine. That helped, a lot. The next cup we decided to try turning the Ekobrew around so that the hinge was at the front of the machine. Perfection! I cannot explain why, but it worked. I did let them know right away that replacements were not necessary, but they were already in the mail! We now have an alternative to K-cups that makes a great tasting cup of coffee, can handle enough to brew a nice strong travel mug full and is easy to fill and clean. We will continue buy K-cups when the price is right, but when it isn't we can still have great, single cup coffee without breaking the bank. Just as a note, we tried the Solofill, which is a good product, but it just did not hold quite enough coffee for a happy mug. …",88 out of 88 users found this review helpful
 GOOD FOR DIGESTION & METABOLISM OF CARBS,5,"This is a good supplement for digestion and metabolism of carbsNow Foods - Apple Cider Vinegar, 450 mg, 180 capsules …",19 out of 23 users found this review helpful
 Poor Plastic,1,"I have purchased this as well. The plastic is so thin that when I drink from the bottle, and of course I drink it fast when i'm thirsty, the plastic practically gives out. It crushes as more water excapes and unlike the other bottles, when you pause from drinking to let the air go back into the bottle, it stays crushed. It doesn't matter if I even try to mold it back to it's normal ""bottle"" form with my hands. Useless! So you have to drink it all in one sitting so that you may recycle the bottle right away. Otherwise, your left with a deformed bottle you have to lay down flat in the fridge. Which ends up taking more space and it looks ridiculous. …",9 out of 12 users found this review helpful
