Title,Star Rating,Review,Helpfulness
 Bad for My Dog,1,"My dog was on a bland diet (boiled chicken & rice) so his poop was usually solid but a few days after eating 1 Greenie a day, his poop became more liquid-y and green. Not sure if Greenies was actually the cause until I googled and read on various dog forums about how Greenies have affected other dogs. Stopped giving out my dog Greenies and have thrown them away. BEWARE, Greenies CAN be bad, so watch your dog after giving them out. …",10 out of 16 users found this review helpful
 Golden Torpedos of Deliciousness!,5,"How can you not love the Twinkie? It's compact, delicious, and aerodynamic. If you actually look at the ingredients, Twinkies are made of flour, water, shortening, eggs, sugar... sound familiar? It's cake. There are some preservatives added to increase shelf life, but they make up a very small percentage of the overall treat. The air we breathe probably contains more dangerous 'additives' than a twinkie. Let us face facts; if one were to eat slice after slice of chocolate cake baked using organic ingredients, that person is going to end up in coronary bypass land just as quickly as if one gorged on Twinkies. Twinkies, like anything, in moderation are just fine. …",12 out of 15 users found this review helpful
 Poor Quality,1,"[[ASIN:I purchase these probably 1 year ago. I was very disappointed with the quality. I was unable to eat these sardines. They had scales and hard bones along with a tough texture. Sorry product. I'm giving them to the cats. B000EEWZF0 Crown Prince Natural Skinless & Boneless Sardines in Pure Olive Oil, 3.75-Ounce Cans (Pack of 12)]] …",3 out of 13 users found this review helpful
 Heavenly!,5,"The vanilla beans arrived still moist, and plump. They're so much better in appearance than the kinds you can buy at Whole Foods or Wild Oats, which are very dry and shriveled by comparison, not to mention overpriced. The fragrance is overpowering, and the shipment comes with a nice recipe for creme brulee. Don't throw away your used vanilla pods! Save them to flavor your sugar. …",45 out of 45 users found this review helpful
 BEWARE - Superstore LIMITS THE TOTAL AMOUNT YOU CAN BUY,1,"The food is GREAT. The cats have gotten completely addicted to it. BUT....what Superstore doesn't bother to mention is that ""quantities are limited"". I have been buying this food for my 3 cats for about 6 months. It comprises roughly half their diet (or 3 cats/day). I just went to re-order and was repeatedly told ""there's a problem"". Long story, and 2 phone calls plus 2 emails later, I was told I have bought the LIFETIME MAXIMUM of this product. I ordered it for almost twice the price via the marketplace, but I am furious with Superstore. NOWHERE on this page do they tell you there's a limit. So I'm here to tell you there is. The food is great, but don't get used to buying it here. …",16 out of 26 users found this review helpful
 great price point,4,"GOOD POINTS: - great pricing (I got the Roland sale + subscription discounts) - well packed (heavy plastic bag inside thin metal ""paint can""-like tin - fresh & tender AMBIVALENT ISSUES: - the label says, ""baby ginger"", which I find hard to believe. First, the ginger has quite a lot of heat when eaten on its own. [It's now 1/2 hour after eating one slice with millky tea; my mouth still feels the heat and I am NOT sensitive to spice.] Second, about 20% is moderately to extremely fibrous. Third, the slices are medium to large, which would be alright if lengthwise, but one can see that they are crosswise (large rhizomes). None of these are qualities I associate with baby ginger. The reason I'm ""ambivalent"" is that while I think the label is incorrect, the Superstore product description does not include this, so it wasn't a factor in my purchase. - the sugar used is much coarser than usual (about 3-4x the size of US white sugar). The Australian and US candied ginger I've enjoyed in the past used extra fine sugar (US ""baking sugar""). My issue is that the coarser sugar doesn't cling and make a crust to protect the ginger, the way extra fine does. Also, about 1/3 of the pieces have unsightly clumps of sugar on them, which I remove before serving or using for baking. NEGATIVE: - the fiber issue mentioned above is something I never encountered with Australian or US candied ginger. Unpleasant to eat and embarrassing for the hostess. Also slows down baking prep. - the big crystals are mostly an esthetic issue, but there is the safety issue of one's blade catching on a crystal and the blade bouncing a little as the sugar shatters. Still trying to find a work-around for chopping and mincing. - The ""paint can"" is difficult to work with. Obviously, I can remove some ginger and finesse the rest of the bag out of the can, to store as I like; but this is a 6 lb quantity packed in a resealable container: the container should be easy to re-seal and re-open. This container needs a tool to be opened; and each use renders the container harder to use--the thin metal dents and bents, so the lid is more and more misshapened. Actually, I'd prefer the packer please just seal the very sturdy plastic bag, label it for sale, and pass the savings on to the consumer. TO SUM UP: A generally good product with great price point, but you have to invest considerable effort to get the best results. (Unless you don't mind a bunch of spiky slivers in your mouth, or your knife slipping again & again.) I love candied ginger as a snack, as a baking ingredient and as a ""food pharmaceutical"", so I'll be purchasing again. If this were a seasonal purchase (e.g., just for holiday baking), I'd pass and look for an easier-to-use product with more consistent quality. …",13 out of 14 users found this review helpful
 Great Stuff :),5,"NOT so sweet as Newman's own!! Glad I cancel to otto order, it would be nice if Superstore would do his! Side note Superstore STOP Using DHL PPPPP I'm better now, I'll have a bit more of the Cranberries, Less sugar & more Fiber :)) Get some you wont go wrong!! …",3 out of 15 users found this review helpful
 Wonderful glasses,5,"I bought these as a gift for my a friend of my husband. His favorite drink is single malt scotch (he usually drinks McCallum.) My husband and he often have a glass together at the end of the day and we thought the glasses would be better than the coffee mugs they sometimes use! I wasn't sure why this glass was specific to whiskey or scotch. I did look for information about the Riedel types and shapes. According to the manufacturer, the company did research with the help of master distillers in Scotland. This resulted the design of a glass that is an elongated thistle shape on a truncated stem. The design incorporates a small, slightly out-turned lip which directs the spirit onto the tip of the tongue, where sweetness is perceived, and serves to emphasize the elegant creaminess of top quality single malt whiskey. There are two lines of this glass, the Sommelier and the Vinum. The Sommeliers Series Single Malt Whiskey Glass is also available here at Superstore. The Sommelier items are more expensive as the upper part is blown into a mold and the the stem and base are hand-crafted. The Vinum is machine made and more reasonably priced. The Vinum looks very lovely and is very nice and thin, there are no seams on the bowl, stem or base. (The Reidel name is etched on the bottom of the base.) It is made of over 24% lead crystal. The glass is 4 1/2 inches tall. There are 2 glasses per box, they are hand wash only. The box is sturdy and was in perfect condition when they arrived (I worried about this a little bit with such thin glasses.) My husband feels the glasses indeed improve the taste of the scotch, but he isn't sure why. He also said it also makes you appreciate the whiskey more and pay attention to it when you are drinking with the special glasses. They made a beautiful gift with a bottle of his favorite drink. You won't be disappointed in these. …",18 out of 20 users found this review helpful
 Can't live without it,5,"Having suffered from Chronic Candida Albicans for over 10 years, I finally came to terms with the idea that I CANNOT have any type of sugars or sweeteners, not even natural sugars from fruits. Being a fruit lover who used to eat lots of fruits on a daily basis, I started looking for a safe way to have sweet stuff without feeding the microorganisms that have been for so long attacking my system. After a lengthy research of more than a year, I found out that though most sweeterners FEED bacteria and Candida Albicans, Xylitol DOES NOT. I started using Xylitol regularly and found out, to my surprise, that my worst Candida symptoms were GONE. The symptoms would recur every time I had fruits (darn!)or something made with refined sugar or other sweeteners like Splenda or Stevia, or even the Aspartame that is used on Diet Drinks. Whether I liked it or not, it became clear to me that I could not eat or drink anything sweet, that I could neither have any fruits and that I could not drink any diet sodas. I have intensely and extensively ""tested"" Xylitol for over a year and I can AFFIRM without a doubt that it is the ONLY sweetener I can use without getting my symptoms back. I buy chocolates made with Xylitol on a regular basis and I use this brand of Xylitol to make chocolate bread and all kinds of cookies. I also make healthy chocolate ice cream with Xylitol, unsweetened cocoa powder and soy milk. If it were not for Xylitol, I would not be able to put anything sweet in my mouth. One of the most recognizable and annoying Candida Albicans symptoms was that I had to get up every one or two hours every night to urinate (!!). It was a nightmare, but it helped immensely when it came to ""testing"" what was good or bad for me. Conclusion: If I stay away from all types of sugars, natural fruits, fruit juices and sweeteners, and only use Xylitol-sweetened stuff, I feel much better in every respect and, very importantly, I can sleep 6 or more hours in a row without waking up to go to the bathroom. …",30 out of 30 users found this review helpful
 Wake Up To Caffienated Perfection!,5,"We purchased a Keurig brewing system early this year, so we've been trying out as many different varieties of coffee as possible. This coffee is -- BAR NONE -- the best of the bunch. It is rich, syrupy and just a bit sweet. My experience, thus far, has been that the K-Cups listed as ""extra bold"" produce the best cups of coffee, but many of those are only available in dark roasts, while I prefer a medium roast. If you're a fan of a good, old fashioned diner-style cup of coffee (like what you can get if you go to Dunkin Donuts or somewhere like that), then this is the brew for you. We love it and make sure we always have some on hand. …",53 out of 54 users found this review helpful
" Not the greatest, but not the worst either.",3,"I drink espresso (moka) daily, and go through a 250g/8.8oz brick in about 2 weeks. In my opinion, this isn't the greatest blend from Lavazza that I've had, but it's not the worst coffee I've had either (it definitely beats the drip coffee I'd otherwise get at work). It's a 70/30 robusta/arabica blend, a dark roast with a fruity though noticeably bitter finish (but not as bad as Starbucks or Peet's coffee). The Lavazza Espresso (black tin, 100% arabica claimed) tastes better than this blend, but after having tried Illy's moka grind, the different blends from Lavazza, Kimbo, Segafredo, and also blends from the local coffee roasters, I actually think that a robusta/arabica blend works best for a moka pot; just not this one. Overall, I'd say that I got what I paid for, but I didn't get what I wanted and I was seduced by the 93 or so 4/5 star reviews for this coffee. I'd really give it a 2.5 or 3 but then again, all taste is subjective, That being said, this is a reasonable coffee (considering taste vs. price), but I'll probably switch back to my regular (and unfortunately more expensive) blend. …",16 out of 19 users found this review helpful
 good but not great,2,"I have been cooking with the Babycook for 6 weeks now, it works fine but not great. CONS: - You can only make small amounts at the time. - The blender is weak. - The steamer-basket can only be filled half for most vegetables for proper steaming-result. PROS: - Heats, steams, blends all in one handy tool. - Easy to use. - Takes up little space. - Can easily be taken on a trip. On some of the issues people wrote. ""MOLD"": Water is never completely pure so there will be buildup in the water compartment. SOLUTION: Always open the lid as soon as the cycle is done and store without the lid on. Once buildup occurs, which will happen eventually, put 2-3 teaspoons of baking powder into the water compartment, fill up with water, and let stand for a few minutes. Poor out. Put an other 2-3 teaspoons of baking powder into the water compartment, fill up with water, and let stand over night. In the morning rinse out well until the water is clear. If you have hard water you will have lime buildup. Poor some vinegar into the compartment, shake around and let stand for a few minutes, repeat until clean, then rinse well with hot water. ""Steamer-light going on and off"": When you steam the water will evaporate, when the compartment is empty the light will go off indicating that the steam-cycle is done. If you leave the lid on the water compartment on, condense water will gather on the bottom starting a new cycle, the light will go on again, this water will evaporate, the light goes off, and so on and on. SOLUTION: Open the lid on the water compartment as soon as the light goes of the first time. This will also help to dry up the compartment better, creating less buildup. OVERALL: It is a nice tool to have if you cook fresh on a daily basis or have limited counter space. It is easy to use and does a good job on small amounts. If you have a large kitchen or prefer to cook in larger batches and then freeze, buy separate machines (steamer, blender), the babycook can't handle larger amounts. I can recommend for people who have a small kitchen, for people who are planning a trip with baby. I can't recommend for people who cook larger amounts or for more than one baby. …",13 out of 14 users found this review helpful
 The best substitute coffee I have tried.,5,"I have never really thought much of substitute coffee. Actually I am pretty picky even with real coffee, unless it's really good fresh roasted organic espresso. But the Ayurvedic Roast is something else. It has a rich round flavor that is significantly better than anything else i have tried. Thanks for creating such a great product …",15 out of 15 users found this review helpful
 100% high-fructose sweetner anyone?,2,"Up until yesterday, my family and I enjoyed this product versus raw sugar or any other sweetener. We even got past the extra liquidity of our oatmeal once we added blue agave. Alas, having been informed of yet other feat of ingenious marketing, I am tossing out two unopened and one partially finished bottles. Before consuming another drop, take a look at this recently published article: [...] ""Agave syrup (nectar) is basically high-fructose corn syrup masquerading as a health food. Sorry. Don't kill the messenger..."" and goes on to say: ""Agave nectar has a low-glycemic index for one reason only: it's largely made of fructose, which although it has a low-glycemic index, is probably the single most damaging form of sugar when used as a sweetener. With the exception of pure liquid fructose, agave nectar has the highest fructose content of any commercial sweetener. All sugar -- from table sugar to HFCS (high-fructose corn syrup) to honey -- contains some mixture of fructose and glucose. Table sugar is 50/50, HFCS is 55/45. Agave nectar is a whopping 90 percent fructose, almost -- but not quite -- twice as high as HFCS. In the agave plant, most of the sweetness comes from a particular kind of fructose called inulin, which actually has some health benefits -- it's considered a fiber. But there's not much inulin left in the actual syrup. In the manufacturing process, enzymes are added to the inulin to break it down into digestible sugar (fructose), resulting in a syrup that has a fructose content that is, at best, 57 percent and -- much more commonly -- as high as 90 percent. Agave nectar syrup is a triumph of marketing over science. True, it has a low-glycemic index, but so does gasoline -- that doesn't mean it's good for you. If you simply must have some sweets, a small amount of agave nectar every once in a while isn't going to kill you. Just don't buy into the idea that it's any better for you than plain old sugar or HFCS."" If anyone is interested in purchasing my unopened bottles, let me know before the end of the week! …",10 out of 14 users found this review helpful
 Ugh....never had grounds in my coffee until I bought this brand,1,"I have had a keurig for over 4 years. Never have I had grounds in my coffee until I bought a fifty pack of Jet fuel. As I work my way through the box, I am throwing out about every third cup. I ""believe"" the problem is a thinner than usual foil top, a larger hole is created, during the punch, and the water is not regulated at the same percentage. I called to talk to ""the coffee people"", 2x - never got a human, left my phone number both times, and have never gotten a call back in since the orginal call 10 days ago. I am done with jet fuel and coffee people, Timothy's - you have my k-cup money! …",37 out of 44 users found this review helpful
 Excellent product for the price.,5,"I bought the madagascar vanilla beans for a creme brulee recipe that I wanted to make. I was skeptical before buying them because of how affordable they were compared to the vanilla beans I found at grocery stores like whole foods & fresh market ($10 for 2 vanilla beans!). However, once they arrived I was more than satisfied with my purchase. They came in an sealed airless bag but the vanilla smell was so strong you could even smell it before opening the bag. I'm very satisfied with the super fast shipping thanks to Superstore and the excellent quality and price of the vanilla beans. …",12 out of 12 users found this review helpful
 melted,1,I received my package with every piece of candy melted. The chocolate that did not melt to the wrapper crumbled once the wrapper was opened. I have ordered this product from another vendor in the past and had no issues with the candy melting. None of the candy could be eaten. I will not order from this vendor again. …,14 out of 16 users found this review helpful
 Excellent but price jumped from $36 for 5lbs,2,"Last year I bought this same product when it cost $36 for a 5lb bag using subscribe and save. Now, it's nearly $60 for a 5lb bag which is why I gave it just a 2 star rating. Would've gave it a 1 star, but it is an excellent product. Too bad the price doubled. …",4 out of 14 users found this review helpful
" Good deal, but consider freshness",3,"This is a great price for some good beans, and the awesome Superstore prime shipping is just icing on the cake. However, one important thing to consider: When you buy direct from the roaster's website, the beans are roasted fresh and shipped within a day or two. When you buy from Superstore, though, the beans come from a stack of bags that have been sitting in an Superstore warehouse somewhere. The date code is printed on the bags, and mine was over 6 months old! Anyway, this roaster does make a great product, but I would recommend buying direct from their website. Prices are comparable, so the only downside is you'll have to pay for shipping yourself. …",25 out of 26 users found this review helpful
 Made in China,3,My dogs love this but it is made in China. Had I known I would not have purchased them. They need to reveal this in the product description …,14 out of 15 users found this review helpful
" Perfect Product, Perfect Price",5,"This is my favorite coconut oil for eating and moisturizing both. It is unrefined virgin coconut oil and has that great coconut smell (and taste!). If you want odorless / tasteless coconut oil - make sure you purchase the REFINED coconut oil. Coconut oil has never made me nauseous and this one is no different - it's one of the best, highest quality oils I've ever had and I highly recommend from everything from cooking (does not degrade at high heat like olive oil) to moisturizing (coconut glow and super shiny hair!). Bought a smaller size initially and went through it in no time flat. The gallon size lasts me a good 3-4 months (cooking and moisturizing). Editing this on 05/19/2012: ""perfect price"" at the time, by the way, was $56.15 shipped via Superstore Prime. Hello inflation? …",24 out of 24 users found this review helpful
 Fantastic Food for Good Cat Health,5,"The pet food industry can be one of the most infuriating as you start doing research and discovering what trash manufacturers (and the vets who get paid off by the manufacturers) push onto the unsuspecting public. For reference, don't ask your vet - do some Internet research at sites like, for example, petfoodratings.net. What you'll find is that even the supposed ""high-end"" lines from basically every major supermarket label are horrible for your fuzzy friends. People who trust the marketing or trust their vets overpay and feed their cats foods that are full of carcinogens, cheap ingredients that are inappropriate for a cat's digestive system, and byproducts that provide nothing of value and are basically a way to make cheap profit off of literal garbage. It's a tragedy, as these same cats end up with shorter lifespans, kidney problems, UTIs, cancer, and a host of other issues, all of which could have been avoided by a high quality food. This is an A-Grade food. What you'll find here is very high protein content, many meat meals, potatoes, salmon oil, flax seed, and no grains, which is great as a cat is not an omnivore, it's a carnivore, and it simply does not need grains. It has 50 percent protein, which is among the highest you'll see in cat food. The first 4 ingredients are all meats. What you will NOT find here is the kind of junk you'll see in things like Purina One and Science Diet - byproducts (aka beaks, feathers, bird feet), brewers rice (aka the waste product from making beer), wheat flour (a leading cause of pet allergies), corn gluten (a cheap waste of space), and things like ""liver flavor"" (because they don't want to pay for the real thing). I didn't just pull those ingredients out of the air - I was reading the ingredients list of Purina One. It's pathetic. Don't feed your cats trash. Pay a little more to feed them good food now, and they'll lead longer, healthier, more satisfied lives as a result. It's worth it. …",19 out of 23 users found this review helpful
 Rush Limbaugh? Really?,1,Women love flowers but not PROflowers. Women also vote-with their ballots and with their dollars. Proflowers continues to advertise with Rush Limbaugh and advertisements are endorsements. …,6 out of 15 users found this review helpful
 Great taste - poor packaging wastes k-cups,3,"I love the taste of this coffee. But apparently they have poor quality control. These K-cups come too full and they tend to not brew properly. You can always tell when you got a bad cup, because the grounds are so packed in the cup that the water doesn't come out completely and your cup of coffee will have less liquid than you are used to. Sure enough, when you go to lift the K-cup out of the Keurig for disposal, you will find it is very heavy compared to others. We also know this is a problem with Coffee People DOnut Shop k-cups only, because my husband drinks a different brand and never has this problem. It doesn't happen all the time, and I have found if I shake the k-cup before putting it in the Keurig, it happens less frequently, but it still happens. I've tried ordering from Coffee People multiple times to see if it was a one time manufacturing glitch, but it appears every time I buy a box of their K-cups I have a problem with 10-15% of them. Fortunately, another brand is offering a donut shop coffee which I tried with this last order and I find it just as pleasing. …",116 out of 128 users found this review helpful
 Best Tasting,5,Bragg vinegar is by far the best vinegar you can buy and it's everything they say it is. It's absolutely delicious! It makes all my dishes that call for vinegar taste even better. …,21 out of 25 users found this review helpful
 Not Kobe Beef,1,"It has been illegal for the last 10 years to import Kobe beef to US. SO this cannot be Kobe Beef, and it's not Kobe beef when the restaurant says kobe beef... …",2 out of 12 users found this review helpful
 Not really necessary,3,"I tried a couple packets of this and it works fine, but so does a tablespoon of plain yogurt. In fact, I like the regular yogurt as a starter a little better. This stuff makes a really sour yogurt. …",13 out of 15 users found this review helpful
 This is one great deal.,5,"If you are new to ESE Pods, this is a great way to find the brands of pods you like best. Get this package and keep careful tasting notes - and remember, your machine will also work better with some pods than others. The idea is to experiment as much as you can for as little cost as possble and this sampler makes it easy. On my Francis! Francis! X3, the Espressione, Lavazza, and Caffe Mako seem to be the better of the bunch so far. But I'll probably be able reach a final consensus after my next sampler. …",19 out of 20 users found this review helpful
