Title,Star Rating,Review,Helpfulness
 Warning: may contain arsenic,1,"I used to eat a lot of Tinkyada pasta until I read that rice grown in the US South may contain high levels of arsenic. According to Tinkyada, their rice is grown in Arkansas. I emailed them to find out if they had tested their rice for arsenic. I never received a reply. Their website does not address the issue either. Until they print assurances that their rice is safe, I plan to avoid all their products. Lundberg rice, which is grown in California, is safe from arsenic according to the company. …",10 out of 14 users found this review helpful
 Over-priced,1,"Superstore maintains that review should focus on specific features of the product, and my experience with it. Price is an integral part of a product feature, and I think in that respect this product is terribly over-priced. You can get the same thing offered by Superstore at half of this price ($20 vs. $41). And Costco does it even better, a 12lb bag of Lundberg organic short grain brown rice costs a little less than $14. So if you want to eat healthy, there are better options than this one. …",10 out of 19 users found this review helpful
 popcorn,3,"Taste like popcorn, less husky but not worth the money. Won't be ordering again. …",9 out of 15 users found this review helpful
 High Qaulity at an Excellent price,5,"I am a professional chef and specialize mostly in pastry, cakes, and desserts. It plays hell with my diabetes but I just love creating some delicious dessert for friends when we have small gatherings. I usually buy vanilla beans in Tijuana, Mexico because I can get good quality at a decent price. By that I mean the beans tend to be supple, shiny, and aromatic. By ""decent price"" I mean it usually costs me around $1.50 to $2.00 per piece. When I saw this half-pound package at such a low price I was skeptical but I figured the $25 would not be a big risk and if they were bad I can always return them. I ordered on Jan 11 and got them Jan 13. Free two-day shipping being another great feature of my Superstore Prime membership which I now believe is an excellent value. The beans are very high quality. They are ""Gourmet Bourbon"" which means about 30% moisture (a good thing) and they are shiny and nicely oily (you want the oily surface as that is one part where a lot of flavor is located. The other part is in the seeds and that is the reason the bean is split and the seeds scrapped when used). These beans are very fresh as shown by their flexibility (as beans grow old they dry out and get brittle- still usable but not as good). They come sealed in a vacuum bag and that is inside a zip bag. Even through the double packaging the scent is very noticeable and complex. This is a large quantity of beans. If you are not going to use them rapidly I recommend separating into two or three bean lots and vacuum packing those. For optimal shelf-life I keep mine in a wine refrigerator (it gets cool but not cold) where I keep my 20 or 30 pounds of various chocolates. This is an excellent deal on good quality. I just can't figure out how they manage to make a buck on this one! …",36 out of 36 users found this review helpful
 GREAT PRODUCT AND COMPANY!,5,"When you've tried the rest get the best! Tons of info is available on the internet about this miracle root. I've been in the health and fitness all my life and believe that the all natural route is the best. I've been taking Maca Root for years and I'm convinced this company is the best source of the best quality product available. And no, I don't work for or represent the company; I just believe it is best to channel your energy in praising great products rather than crushing the bad ones who no one cares about anyway. There seems to be a misconception on what is healthy in the nutritional supplement realm, so I would like to help enlightened those in search of truly natural ways of health. For example, L-Arginine HCL, Acetyl L-Carnitine HCL and other branch chain aminos, synthetic hormones enhancers, etc... are widely sold as supplements by the most well-known commercial nutritional brands (won't mention names here), and are believed to be excellent nutritional sources. These are synthetically made in labs and are substances your body naturally produces. If you consume these regularly, your body gets lazy and will eventually stop reproducing them. Maca Root on the other end, is a natural source of whole food, which contains essential amino-acids, fatty acids and other great nutrients necessary for optimum health. I would also recommend throwing away all those weight gainers in your vitamin cabinet too. Raw Organic Hemp Protein is the best, with nothing added. For my sex drive, I'd say Maca Root gives a gentle boost, but I'd recommend alternating it or taking it with Tribulus Raw Power , 200 pills, 200,000 mg. High Potency, concentrated, Tribulus Terrestris muscle volumizer, male enhancement, for long term results and for immediate all natural results, I'd recommend Red Sex Dragon - Male Enhancement Pills - Male Performance. Those who expect an immediate and drastic sexual boost from Maca Root Raw Powder have an unrealistic approach. You may eventually see results with long term use and an overall healthy lifestyle, if want to feel the bang, get it at 100:1 Extract Ratio or higher, but it can get pretty costly. …",10 out of 12 users found this review helpful
 Overpriced,1,You can buy the same bag of chocolate at any Michaels store for $2.99. I got a ton of bags on sale for $1.99 there! Don't waste your money or your time waiting for this bag …,7 out of 12 users found this review helpful
" Some are good, some are not so much.",4,"Some of the flavors we have tried: Diet Cola I do not like diet cola. I don't like diet Coke, diet Pepsi or diet other drinks. We bought this flavor so we could make diet drinks for someone who might like a diet cola when we were making our own soda. However, this is really one of the better diet drinks that I have tried. If you make your own soda, this is a good one to try. Orange This is the best one by far of all of the flavors we have tried. This flavor tastes just like the fanta orange soda. We love this one. Cola This cola flavoring is ok. It's not great. You can easily make simple syrups that will not be a cola flavor but will taste much better than this flavor. This is the equivalent of RC Cola. Ok but it's not near as good as other name brand colas. …",14 out of 17 users found this review helpful
 farmer's market organic butternut squash,1,"I HAVE BEEN ORDERING THIS PRODUCT FOR OVER 6 MONTHS NOW. WHEN I RECEIVED THIS PRODUCT FROM THE US POST OFFICE, THE CANS WERE ALL CRUSHED. I WAS VERY DISAPPOINTED. USUALLY MY SHIPMENT COMES VIA UPS AND THE CONDITION IS ALWAYS GOOD. WHEN I OPENED THE ONE OF THE CANS I CUT THE SKIN INSIDE MY THUMBNAIL. I WAS BLEEDING FOR AT LEAST 30 MINUTES. I FEEL THAT Superstore SHOULD COMPENSATE FOR THIS INJURY. …",4 out of 20 users found this review helpful
 Menopause Relief,5,I wanted a natural product to help with hot flashes and night sweats. This makes an INCREDIBLE difference in my quality of life and sleep. I had significant decrease in symptoms almost immediately. I let it steep in my cup for about 5 minutes. I had trouble with the taste so I add sugar and a little peppermint extract and it is a very pleasant drink. I have a cup morning and evening and now am able to sleep much better. I also find I am not exhausted and dont have that anxious feeling. I would advise anyone to try this as it has helped me so much. …,16 out of 16 users found this review helpful
 OMG!!  I will be buying more.,5,"This is wonderful. If I could have given the honey granules a 10 I would have. It tastes great, no sticky mess. My grandkids say that the taste is ""magic"" in their hot cereals. …",14 out of 14 users found this review helpful
 taste good but ACAI berry amount NOT listed!!!!,4,taste is good and only reason i bought is because of the ACAI berry which is a super fruit but sadly they dont display in any way or format how much ACAI berry are in each glass. SO I WOULD LIKE MORE ACAI IN SIDE AND A LISTING OF HOW MUCH PER GLASS until then this drink can never ever be 5 stars …,7 out of 14 users found this review helpful
 never received this order,1,I think they would have been good... really wish I could have experienced them. They've never arrived. …,1 out of 26 users found this review helpful
 Don't buy it!,1,This was a 2 pack. One of the jars had obviously been opened before. The shipping box was slimy from whatever amount of oil seeped out. So my great deal on a 2 pack turned into an OK deal for a one pack. I will not purchase a Nutiva product again. Beware that all grocery items are not able to be returned. …,1 out of 16 users found this review helpful
 1960-s Guang Yun Beeng,4,"I haven't tried this tea yet, but the description is a little misleading. When it is said that this cake can make 75 servings, what they really mean is that you can have 75 ""Gong-fu"" sessions with this tea. This type of Chinese tea is typically put into very small Yixing teapots (approx 5-7gr of tea into a 110-120 ml teapot), rinsed once or twice (probably once for this expensive tea), and then poured into teacups. A very high-quality Puerh (aged ""raw"", not aged ""cooked"") can make anywhere from 5-10 teapots-full of the tea before running out of leaf. Sometimes even more. Usually the desired effect of these very-old teas is not exactly how they taste, because often-times they won't taste like much more than flavored water, but instead the ""Cha-Chi"", which is a type of energy or feeling that your body feels when/after drinking these teas. The feelings can be anything from quite stimulating, to very soothing (almost narcotic). There are many fakes in the market-place, due to extremely rare occurences of any REALLY good, old raw Puerh tea being found outside of Asia. Any that are found will definitely command very high prices because this type of tea is usually hoarded in China, Taiwan, and anywhere else that anyone can find any of it available for purchase. Also, when someone states ""60's Puerh tea"", that is a whole decade of variance to deal with. Before taking the plunge with Puerh tea, start doing your research. Puerh tea has really been taking hold of the West in recent years, and now the East is capitalizing on our desires for really good Puerh teas. There are some very good reliable sources out there, but it usually incurs a monetary learning-curve before you get the hang of who you can trust, and what Puerh teas may be right for you. BUYER BEWARE! I hope I am not overstepping any bounds by saying this, but a good place to start learning about Puerh tea would be ""Puerh Tea- A Westerner's Quest"" website. Good luck, and Good health! …",24 out of 28 users found this review helpful
 very soothing tea!,5,"Rooibos (Roy-boss) tea is surely an acquired taste but once you get use to it it's really quite good! This one brews up a very nice deep dark reddish color. The taste is not easy to describe, it is deep and earthy. This tea does not have caffeine so it is a great tea for those that can't have or don't like the feeling you get from caffeine. This is a very nice soothing tea I find myself reaching for more and more! …",13 out of 13 users found this review helpful
" Awesome, hard to believe it is instant...",5,"I saw an article on MSNBC regarding a taste test on a large number of brewed and instant coffee's- ranging from standard brands to exotic restaurant blends. This coffee came out on top, even beating brewed coffee's. Thought I would give a try and found them on Superstore here- this 4 jar package. I am on my 3rd order! Not only do I love this coffee, I ended up giving several as gifts, and everyone so far loves the stuff. Highly recommend! …",13 out of 13 users found this review helpful
 Love it!,5,"I have a 8.5 month old Aussie mix. She's about 42 lbs now. This food is magic!! I love it! She's never been ""food motivated"" and so she's always been a little reluctant to eat her kibble, but she honestly LIKES this stuff. She'll do tricks for it like it is a treat. More importantly, her poop is GREAT on this kibble. Finally, it's easy to pick up! This food is a godsend. We've previously tried Innova EVO, California Natural Lamb and Rice Puppy and Adult, and Canidae All Life Stages. Innova EVO gave her the runs, but she was a new puppy. (The pet food store said EVO was rich enough for puppies. My vet disagreed.) California Natural seemed better, but her poop was always so soft that it was messy to pick up, and she never really liked it. She liked the taste of Canidae better - so much so that she would pick it out when I mixed it with the Lamb and Rice. However, her poop didn't really improve until we shifted to Orijen. Magic. This stuff is magic, I say. Besides being the magic food for my dog, it's also made in Canada with almost all Canadian ingredients. From what I've read, they get rice from California and Lamb from New Zealand, but otherwise -- everything comes from farms in and around Alberta. No food recalls on this brand! One word of advice: like with all good dog foods, it's best to keep the bag tightly closed. It goes stale. …",23 out of 25 users found this review helpful
 Ingredients,5,"After reading the review about the change of ingredients, I contacted Holistic Select to double check the information and they clearly state that there are no pork products in this food. The only change they made was to add canola oil as a secondary fat source. Here is the list of ingredients that they sent to me: Anchovy, Sardine & Salmon Meal, Oatmeal, Ground Brown Rice, Ground White Rice, Canola Oil (Preserved with Natural Mixed Tocopherols), Dried Beet Pulp, Menhaden Fish Oil, Flaxseed, Dried Egg Product, Carrots, Sun-Cured Alfalfa, Peas, Potassium Chloride, Organic Quinoa, Apples, Blueberries, Cranberries, Dried Kelp, Yucca Schidigera Extract, DL-Methionine, Vitamins [Beta-Carotene, Vitamin A Supplement, Vitamin D3 Supplement, Vitamin E Supplement, Riboflavin Supplement, Vitamin B12 Supplement, d-Calcium Pantothenate, Niacin Supplement, Pyridoxine Hydrochloride, Thiamine Mononitrate, Folic Acid, Ascorbic Acid (Vitamin C), Biotin], Minerals [Polysaccharide Complexes of Zinc, Iron, Manganese and Copper, Cobalt Carbonate, Potassium Iodate, Sodium Selenite], Choline Chloride, Lecithin, Rosemary Extract, Glucosamine Hydrochloride, Inulin, Dried Lactobacillus acidophilus, Lactobacillus casei, Enterococcus faecium, Bacillus subtilis, Bacillus licheniformis, Aspergillus oryzae and Aspergillus ni ger Fermentation Products, Mixed Tocopherols (a natural preservative). Select Radiant Adult Health, Anchovy, Sardine, and Salmon Dry Dog Food, 30-Pound Bag …",13 out of 14 users found this review helpful
 lower quality food--  not recommended,2,"This isn't the worst quality food you could feed, but it isn't a high quality product, either. Yet the price is comparable to premium quality holistic foods-- probably a marketing decision related to Rachel Ray's starpower? I purchased this during an emergency- an ice storm had begun and I was out of dog food, so I grabbed a small bag at a convenient store on the way home from work. My dogs ate it willingly, although they didn't love it. Nutrish foods (both the chicken and beef options) have lots of indigestible corn, artificial dyes, and gluten. Corn seems to pass through most dogs nearly undigested, leading to large stools and wasted money. Gluten was the ingredient implicated in the tainted pet food scandals over the last couple of years-- it just isn't a wholesome ingredient, and it's one I tend to avoid. The good things I can say about this food are that it doesn't use yucky slaughterhouse ""by-products"", and that it includes great vegetable ingredients. Overall, there are worse options on the grocery store shelves, but this is an overpriced, less-than-great food choice for your best pal. ~~~~~~~~~~~~ Ingredients list, so you can make up your own mind: Chicken, Chicken Meal, Brewers Rice, Corn Meal, Soybean Meal, Animal Fat (Preserved with Mixed Tocopherols), Corn Gluten Meal, Brown Rice, Oatmeal, Dried Beet Pulp, Natural Flavor, Dicalcium Phosphate, Salt, Calcium Carbonate, Dehydrated Alfalfa, Dried Peas, Dried Tomatoes, Dried Carrots, Potassium Chloride, Choline Chloride, Olive Oil, Vitamin E Supplement, Zinc Sulfate, Ferrous Sulfate, Iron Oxide, Dried Parsley, L-Ascorbyl-2-Polyphosphate (Source of Vitamin C), Mixed Tocopherols,plus the expected vitamins. `````````````````` Here are a couple of alternatives you might want to check out: Nutro Natural Choice Ultra Adult Dog Food- net wt. 35 lbs., Blue Buffalo Chicken & Brown Rice Adult Dog Food, 30 lbs., Wellness Super5Mix Chicken Dry Dog Food (30-lb bag)or Buffalo Lamb & Brown Rice Adult Dog Food, 30 lbs. . …",26 out of 27 users found this review helpful
 Way too salty,2,"This may be better than a bouillon cube, but it's still not great. This Better Than Bouillon isn't absolutely terrible for straight stock but if you try to then use that stock to make sauces or demi-glazes, instead of getting a richer flavor, ugh, they just get saltier and saltier and saltier as the reduction occurs. Do yourself a favor and pay a little more for Minor's. …",13 out of 14 users found this review helpful
 NO CUSTOMER SERVICE AT ALL!!!! IGNORE MY CANCEL REQUEST!!,1,IDIOT. I TOLD YOU TWICE I WANT TO CANCEL THE ORDER. YOU BASICALLY JUST IGNORED MY REQUEST AND SENT ME THE ITEM. …,1 out of 19 users found this review helpful
 COSTCO 54 for $34,4,"Taste is GREAT! but it is very expensive. It is the best K-cup coffee that I have ever had! So dark and rich, but not bitter. …",21 out of 22 users found this review helpful
 Misleading - not made in USA,1,"We bought this product because it celarly stated that is was MADE IN THE USA. When the product arrived, it was clearly labeled MADE IN CHINA. This is beyond misleading - it is fraud. I will not be purchasing Smokehouse products again. …",52 out of 52 users found this review helpful
 Outstanding Cherries,5,"Who would know that dried cherries can vary so much in quality? These cherries are exquisite. They are sweet yet tart, soft yet firm, and have fantastic cherry taste. I bought the 4lb box. You can pour them into a large jar and keep them in your kitchen. Note that these are much better than another brand of dried cherries sold here. All the positive reviews are perfectly deserved. …",43 out of 46 users found this review helpful
 Trio is my favorite snack/energy bar,5,"Mrs. May's Trio bars are my favorite snack/energy bars. I love them. They come in four flavors. Strawberry is second only to blueberry for my favorite of those flavors; the strawberry ones, like the blueberry ones seem a little sweeter but the sugars content is the same so it may just be my imagination. The name comes from the ingredients. The bars have a trio of trios: 3 nuts, 3 seeds and 3 fruits. The nuts, seeds and 2 of the fruits are the same in all the flavors. The nuts are cashews, almonds & pistachios. The seeds are sesame, pumpkin, & sunflower. The two fruits that are in all the flavors are dates and raisins, but you don't really see or taste them so I wonder if they are cooked down into the ""glue"" that holds all the other ingredients together. Dried strawberries are the third fruit in the strawberry flavor. The only other ingredients are rice malt, natural flavors, cane juice and sea salt. These are great bars for anyone who has issues with wheat or dairy. The label says they are wheat free, gluten free, dairy free and kosher. They also have no preservatives. If you have peanut allergies, the label says they are packaged in a peanut free facility that processes other nuts. Because of the nuts, they have 12 grams of fat per bar, but I've been reading articles that say nuts are a great snack and the fat in nuts is ""good"" fat. The label says there is 1.5 grams of saturated fat which surprised me but I guess some of the fat in nuts must be saturated. To round out the rest of the nutrition facts: calories, 170; total carbs, 14g; dietary fiber, 2g; sugars, 6g; protein, 5g; cholesterol, 0g; trans fat, 0g; and sodium, 45mg. I love the nuts and seeds and the bars don't have the mealy texture that a lot of energy/snack bars have. They are low sodium but high in taste and they are really satisfying. I used to get granola bars but these are so much better. …",33 out of 34 users found this review helpful
 Check the ingredients,1,"Guys, Check the sucrose content on this one. Very unhealthy. My baby started having green poop as soon as she got on this formula. After 2 months of guessing we shifted her to another brand -- lactose free and it turned yellow in 2 days. Stay away from this stuff. …",2 out of 14 users found this review helpful
 A wonderful and delicious product!,5,"My only complaint with this product is that other animals don't come in this form. Please, PLEASE start marketing other fresh, whole food animals, such as deer, elk, water buffalo, and angels! …",13 out of 20 users found this review helpful
 Some things do change,1,"I grew up making Appian Way pizza's. For 50 years I enjoyed them. After moving to an area where they are not available in the local stores and not being able to get them from Dial Corp anymore, I sorta gave up enjoying them again. Then I FOUND them on Superstore. With great anticipation I awaited the arrival of part of my childhood. Ripping open the carton and seeing the the package brought back memories of Mom and I making pizza on a saturday night. Mixing, spreading adding cheese and toppings I could hardly wait. Then ""the moment"" arrived, the pizza was golden brown and smelled oh so yummy. I excitedly took my first bite only to be hugely disappointed. After a few more bites it was obvious, someone messed with MY pizza. The sauce is not what it was just a few years ago, let alone what it was 50 years ago. Its nothing more than ketchup with some gook added... what a disappointment. A good product and once again, someone, probably to save a few pennies, ruined a good product. The only thing similar to what Appian Way use to be is the box, and perhaps, the box is the better than whats inside. One more disappointment from the corporate world. I must recommend NOT to purchase this product if you have ever eaten pizza before, you will be totally disappointed. …",14 out of 14 users found this review helpful
 Great Taste and Smell,4,"I love the taste and smell of this product. However, I wish it came in a glass jar rather than a *cheap* plastic that may be leaching in the product. …",39 out of 45 users found this review helpful
 Confident giving this to my dog,5,"After careful research on the best dry food for my dog's diet, I chose Wellness Core Reduced Fat. My mixed breed dog is low energy and has a tendency to put weight on easily. It was very difficult to find a dog food that does not compromise quality ingredients to make a food low fat. Since my dog is low energy (by no means a sled dog), her diet does not require her to have extreme protein intake. This food is the prefect balance of protein, quality meat sources, fat content, as well as important sources of fruits and vegetables and fish oils. Her eyes are bright and coat is shiny. While she hasn't lost any weight, she hasn't gained any either, which is a good thing! You get what you pay for when it comes to dog food. When purchasing this brand, one is paying for high quality food (meat content, veggies, fruits) without fillers or extreme levels of protein. For a more comprehensive analysis of dog food, check out [...]. …",14 out of 14 users found this review helpful
 Diabetics Beware,2,"Since the total carbs are what is important for diabetics, this should not be recommended. It has 42 grams of carbs and only 4 grams of fiber per 1/2 cup of cooked pasta. This is almost the total amount of carbs allowed diabetics for a complete meal. Only 1/2 cup is the maximum of carbs for a meal. Who can eat just one cup of pasta? It is very misleading to diabetics as ""digestible carbs"" has no meaning to them. Total carbs less fiber is what counts to a diabetic. Thus diabetics beware. If you want to eat it remember, 1/2 cup is a complete meal of carbs. …",10 out of 28 users found this review helpful
 Disgusting!,1,This tea tastes nasty. Maybe I just dont like sage but it made me gag! …,1 out of 13 users found this review helpful
 good value for good matcha,5,"Four of us did a blind taste-test of the 2nd Harvest against the 1.06-ounce premium. We were split down the middle as to which tasted better. If there is any astringency to the 2nd Harvest, it is very slight! Since that time we've ordered more, and are thoroughly enjoying it. …",15 out of 15 users found this review helpful
 I really wanted to love this for our boy,2,"We were unhappy with the food our breeder used. High percentage of corn. After reading lots of labels, in theory this seemed to be just what we were looking for. We went through a careful, slow transition, but this turned out to be way too harsh on our Havanese's GI tract. He ate it just fine, but we would see a progression to larger and more greenish stool, then loss of form until he had a true liquid event. That was the end of that! For anyone with a toy breed, if you would like another option, we eventually transitioned over to Wellness Small Breed Super5Mix Adult Health Small Breed Formula Dry Dog Food . This turned out to be both a food he loves and the transition was effortless. He is behaving very puppy-like @ 3 years old which I feel is a good thing. The Wellness food brand was never part of the 2007 animal food recall list for melamine (rice gluten) and is corn, soy and wheat free. …",12 out of 14 users found this review helpful
